"WO No.","Part Name","Part Drg No.","Req. Qty","Type","BOM Upload Dt","Design Eng","Approved By","Dwg Rls Dt"
"AL-1444-01","10-09-00-GUIDE ROD DIA 25","AL1444.01-10-09-00","2","","28-11-2021","Sunil","PPRAJ","2021-11-29"
"AL-1444-01","06-01-00-EI HOLDING BLK","AL1444.01-06-01-00","2","","28-11-2021","Sunil","PPRAJ","2021-11-29"
"AL-1444-01","02-04-R1-CYLINDER COUPLER","AL1444.01-02-04-R1","1","","31-01-2022","Sunil","PPRAJ","2022-01-31"
"AL-1444-01","11-02-00-HINGE CHUTE MTTG BLK","AL1444.01-11-02-00","1","","28-11-2021","Sunil","PPRAJ","2021-11-29"
"AL-1444-01","07-04-00-PAWL","AL1444.01-07-04-00","2","","28-11-2021","Sunil","PPRAJ","2021-11-29"
"AL-1444-01","03-06-00-BUTTON","AL1444.01-03-06-00","1","","27-11-2021","Sunil","PPRAJ","2021-11-29"
"AL-1444-01","10-28-00-GRIPPER MTG PIN","AL1444.01-10-28-00","1","","04-03-2022","Sunil","PPRAJ","2022-03-04"
"AL-1444-01","01-04-00-STOPPER","AL1444.01-01-04-00","1","","28-11-2021","Sunil","PPRAJ","2021-11-30"
"AL-1444-01","03-201-00-COMP HOLDING BLK","AL1444.01-03-201-00","1","","20-06-2022","Sunil","PPRAJ","2022-06-20"
"AL-1444-01","08-01-00-LM BLOCK MTG PLATE LH","AL1444.01-08-01-00","2","","28-11-2021","Sunil","PPRAJ","2021-11-29"
"AL-1444-01","05-10-00-FEEDER GUIDE MTG BRKT","AL1444.01-05-10-00","1","","28-11-2021","Sunil","PPRAJ","2021-11-29"
"AL-1444-01","08-062-00-SUPPORT PLT FOR CYL MOUNTING PLT","AL1444.01-08-062-00","1","","04-06-2022","Sunil","PPRAJ","2022-06-04"
"AL-1444-01","08-18-00-LOAD CELL","AL1444.01-08-18-00","1","","03-06-2022","Nitish","PPRAJ","2022-06-03"
"AL-1444-01","10-06-00-GRIPPER PLATE RH","AL1444.01-10-06-00","2","","28-11-2021","Sunil","PPRAJ","2021-11-29"
"AL-1444-01","06-16-00-CYL CPLR","AL1444.01-06-16-00","1","","28-11-2021","Sunil","PPRAJ","2021-11-29"
"AL-1444-01","11-07-00-EXIT CHUTE","AL1444.01-11-07-00","1","","28-11-2021","Sunil","PPRAJ","2021-11-29"
"AL-1444-01","07-11-00-INDEXER MTG BASE","AL1444.01-07-11-00","2","","28-11-2021","Sunil","PPRAJ","2021-11-29"
"AL-1444-01","03-03-00-PRESSING SHAFT","AL1444.01-03-03-00","1","","27-11-2021","Sunil","PPRAJ","2021-11-29"
"AL-1444-01","10-25-00-TOP SLIDE LM BLOCK MTG PLT","AL1444.01-10-25-00","1","","04-03-2022","Sunil","PPRAJ","2022-03-04"
"AL-1444-01","08-020-00-CYL STOPER","AL1444.01-08-020-00","1","","18-06-2022","Sunil","PPRAJ","2022-06-18"
"AL-1444-01","08-13-00-COM HLDR LOCKING SPACER","AL1444.01-08-13-00","1","","28-11-2021","Sunil","PPRAJ","2021-11-29"
"AL-1444-01","05-06-00-JOB LOADER CYLINDER CONNECTOR","AL1444.01-05-06-00","1","","28-11-2021","Sunil","PPRAJ","2021-11-29"
"AL-1444-01","06-046-00-STOPER BRKT","AL1444.01-06-046-00","2","","04-06-2022","Sunil","PPRAJ","2022-06-04"
"AL-1444-01","10-02-00-BOTTOM LM BLOCK SLIDE BRACKET","AL1444.01-10-02-00","1","","28-11-2021","Sunil","PPRAJ","2021-11-29"
"AL-1444-01","05-21-00-BEARING HOUSING","AL1444.01-05-21-00","1","","28-11-2021","Sunil","PPRAJ","2021-11-29"
"AL-1444-01","11-06-00-PIN","AL1444.01-11-06-00","3","","28-11-2021","Sunil","PPRAJ","2021-11-29"
"AL-1444-01","06-13-00- BEARING RETAINER PLATE","AL1444.01-06-13-00","3","","28-11-2021","Sunil","PPRAJ","2021-11-29"
"AL-1444-01","03-09-00-STOPPER PAD","AL1444.01-03-09-00","2","","27-11-2021","Sunil","PPRAJ","2021-11-29"
"AL-1444-01","03-13-00-POTENTIOMETER COUPLER","AL1444.01-03-13-00","2","","04-03-2022","Sunil","PPRAJ","2022-03-04"
"AL-1444-01","10-38-00-GRIPPER BOTTOM","AL1444.01-10-38-00","2","","18-06-2022","Sunil","PPRAJ","2022-06-18"
"AL-1444-01","08-02-00-COM LOCATOR","AL1444.01-08-02-00","1","","28-11-2021","Sunil","PPRAJ","2021-11-29"
"AL-1444-01","05-01-00-GUIDED COMPONENT HOLDER","AL1444.01-05-01-00","1","","27-11-2021","Sunil","PPRAJ","2021-11-29"
"AL-1444-01","06-048-00-LOCATOR","AL1444.01-06-048-00","2","","04-06-2022","Sunil","PPRAJ","2022-06-04"
"AL-1444-01","03-240-00-STACK LOCATING PIN-1","AL-1444-01-03-240-00","4","","31-08-2021","Pavithra","Chandru","2021-08-31"
"AL-1444-01","10-20-00-WASHER","AL1444.01-10-20-00","2","","28-11-2021","Sunil","PPRAJ","2021-11-29"
"AL-1444-01","06-08-00-CYLINDER CONTR BKT.","AL1444.01-06-08-00","2","","28-11-2021","Sunil","PPRAJ","2021-11-29"
"AL-1444-01","02-04-00-CYLINDER COUPLER","AL1444.01-02-04-00","1","","27-11-2021","Sunil","PPRAJ","2021-11-29"
"AL-1444-01","03-260-00-STACK LOCATING PIN-3","AL-1444-01-03-260-00","4","","26-10-2021","Pavithra","Chandru","2021-10-26"
"AL-1444-01","03-12-00-POTENTIOMETER STOPER PLATE","AL1444.01-03-12-00","1","","04-03-2022","Sunil","PPRAJ","2022-03-04"
"AL-1444-01","06-20-00-STOPPER","AL1444.01-06-20-00","4","","03-03-2022","Sunil","PPRAJ","2022-03-03"
"AL-1444-01","07-13-00-INDEXER SLIDING PIN","AL1444.01-07-13-00","2","","28-11-2021","Sunil","PPRAJ","2021-11-29"
"AL-1444-01","04-08-00-STIFFER TOP PLATE","AL1444.01-04-08-00","1","","27-11-2021","Sunil","PPRAJ","2021-11-29"
"AL-1444-01","03-210-00-EI HOLDING BLK","AL-1444-01-03-210-00","1","","31-08-2021","Pavithra","Chandru","2021-08-31"
"AL-1444-01","07-110-00-COMP HOLDER","AL1444.01-07-110-00","1","","24-01-2022","Sunil","PPRAJ","2022-01-24"
"AL-1444-01","10-24-00-MTG BLOCK RH","AL1444.01-10-24-00","1","","28-11-2021","Sunil","PPRAJ","2021-11-29"
"AL-1444-01","05-22-00-MOTOR MTNG PLT","AL1444.01-05-22-00","1","","28-11-2021","Sunil","PPRAJ","2021-11-29"
"AL-1444-01","10-21-00-CYLINER MTG PLATE","AL1444.01-10-21-00","1","","28-11-2021","Sunil","PPRAJ","2021-11-29"
"AL-1444-01","06-05-00-COM PRESSING BLK","AL1444.01-06-05-00","1","","28-11-2021","Sunil","PPRAJ","2021-11-29"
"AL-1444-01","02-01-00-TOP SUPPORT WASHER","AL1444.01-02-01-00","2","","27-11-2021","Sunil","PPRAJ","2021-11-29"
"AL-1444-01","02-300-00-STOPPER FOR STIFFNER-2","AL-1444-01-02-300-00","2","","26-10-2021","Pavithra","Chandru","2021-10-26"
"AL-1444-01","01-062-00-BASE FRONT COVER","AL1444.01-01-062-00","3","","03-12-2021","Sunil","PPRAJ","2021-12-03"
"AL-1444-01","07-07-00-DEFORMER MTG BKT","AL1444.01-07-07-00","2","","28-11-2021","Sunil","PPRAJ","2021-11-29"
"AL-1444-01","04-04-00-DIA 30 GUIDE ROD","AL1444.01-04-04-00","2","","27-11-2021","Sunil","PPRAJ","2021-11-29"
"AL-1444-01","02-260-00-SHAFT PRESS TOOL-1","AL-1444-01-02-260-00","1","","31-08-2021","Pavithra","Chandru","2021-08-31"
"AL-1444-01","01-A01-00-BASE FRAME ASSY","AL1444.01-01-A01-00","1","","28-11-2021","Sunil","PPRAJ","2021-11-30"
"AL-1444-01","09-01-00-CYL CONNTR","AL1444.01-09-01-00","2","","28-11-2021","Sunil","PPRAJ","2021-11-29"
"AL-1444-01","05-15-00-BEARING HOUSING","AL1444.01-05-15-00","1","","28-11-2021","Sunil","PPRAJ","2021-11-29"
"AL-1444-01","03-241-00-STACK LOCATING PIN-1","AL1444.01-03-241-00","4","","03-06-2022","Nitish","PPRAJ","2022-06-03"
"AL-1444-01","04-02-00-COUPLER BLOCK","AL1444.01-04-02-00","1","","05-03-2022","Sunil","PPRAJ","2022-03-05"
"AL-1444-01","10-11-00-GRIPPER MTG PIN","AL1444.01-10-11-00","1","","28-11-2021","Sunil","PPRAJ","2021-11-29"
"AL-1444-01","06-02-00-COM HOLDER HINGE PIN","AL1444.01-06-02-00","6","","28-11-2021","Sunil","PPRAJ","2021-11-29"
"AL-1444-01","01-170-00-PNEUMATIC PLATE","AL1444.01-01-170-00","1","","03-12-2021","Sunil","PPRAJ","2021-12-03"
"AL-1444-01","11-03-00-CHUTE HINGE PIN BLK.","AL1444.01-11-03-00","1","","28-11-2021","Sunil","PPRAJ","2021-11-29"
"AL-1444-01","07-05-00-TOP PLATE","AL1444.01-07-05-00","2","","28-11-2021","Sunil","PPRAJ","2021-11-29"
"AL-1444-01","03-07-00-WASHER","AL1444.01-03-07-00","4","","27-11-2021","Sunil","PPRAJ","2021-11-29"
"AL-1444-01","10-29-00-GRIPPER PAD","AL1444.01-10-29-00","4","","04-03-2022","Sunil","PPRAJ","2022-03-04"
"AL-1444-01","01-05-00-SUPORT BKT","AL1444.01-01-05-00","1","","28-11-2021","Sunil","PPRAJ","2021-11-30"
"AL-1444-01","08-03-00-COM HOLDER","AL1444.01-08-03-00","1","","28-11-2021","Sunil","PPRAJ","2021-11-29"
"AL-1444-01","05-11-00-GUIDE ROD","AL1444.01-05-11-00","2","","28-11-2021","Sunil","PPRAJ","2021-11-29"
"AL-1444-01","02-261-00-SHAFT PRESS TOOL-1","AL1444.01-02-261-00","1","","11-06-2022","Sunil","PPRAJ","2022-06-11"
"AL-1444-01","08-19-00-PAN CAKE LOAD CELL","AL1444.01-08-19-00","1","","03-06-2022","Nitish","PPRAJ","2022-06-03"
"AL-1444-01","10-18-00-GRIPPER MTG BKT","AL1444.01-10-18-00","2","","28-11-2021","Sunil","PPRAJ","2021-11-29"
"AL-1444-01","06-17-00-BEARING SPACER","AL1444.01-06-17-00","3","","28-11-2021","Sunil","PPRAJ","2021-11-29"
"AL-1444-01","11-08-00-HINGE CHUTE MTTG BLK","AL1444.01-11-08-00","1","","28-11-2021","Sunil","PPRAJ","2021-11-29"
"AL-1444-01","07-02-00-SPRING FOR BALLS","AL1444.01-07-02-00","2","","28-11-2021","Sunil","PPRAJ","2021-11-29"
"AL-1444-01","03-04-00-SHAFT MTG PLATE","AL1444.01-03-04-00","1","","27-11-2021","Sunil","PPRAJ","2021-11-29"
"AL-1444-01","10-26-00-ROTORY UNIT SIDE PLATE","AL1444.01-10-26-00","1","","04-03-2022","Sunil","PPRAJ","2022-03-04"
"AL-1444-01","08-14-00-COM HLDR LOCKING SPACER LH","AL1444.01-08-14-00","1","","28-11-2021","Sunil","PPRAJ","2021-11-29"
"AL-1444-01","05-07-00-JOB LOADING CLAW","AL1444.01-05-07-00","1","","28-11-2021","Sunil","PPRAJ","2021-11-29"
"AL-1444-01","08-022-00-COMMUTATOR STOPER","AL1444.01-08-022-00","1","","04-06-2022","Sunil","PPRAJ","2022-06-04"
"AL-1444-01","10-03-00-TOP SLIDE LM BLOCK MTG PLT","AL1444.01-10-03-00","1","","28-11-2021","Sunil","PPRAJ","2021-11-29"
"AL-1444-01","06-14-00- BEARING RETAINER PLATE","AL1444.01-06-14-00","3","","28-11-2021","Sunil","PPRAJ","2021-11-29"
"AL-1444-01","11-09-00-HINGE CHUTE MTTG BLK","AL1444.01-11-09-00","1","","28-11-2021","Sunil","PPRAJ","2021-11-29"
"AL-1444-01","07-01-00-COMPONENT HOLDER","AL1444.01-07-01-00","2","","28-11-2021","Sunil","PPRAJ","2021-11-29"
"AL-1444-01","03-01-00-TOOL HOLDER PLATE","AL1444.01-03-01-00","1","","27-11-2021","Sunil","PPRAJ","2021-11-29"
"AL-1444-01","05-14-00-LOCKING PIN","AL1444.01-05-14-00","1","","04-03-2022","Sunil","PPRAJ","2022-03-04"
"AL-1444-01","10-034-00-LH GRIPPER","AL1444.01-10-034-00","1","","18-06-2022","Sunil","PPRAJ","2022-06-18"
"AL-1444-01","08-05-00-COM HOLDER","AL1444.01-08-05-00","1","","28-11-2021","Sunil","PPRAJ","2021-11-29"
"AL-1444-01","05-03-00-FEEDER SUPORT BKT","AL1444.01-05-03-00","1","","27-11-2021","Sunil","PPRAJ","2021-11-29"
"AL-1444-01","06-053-00 SHAFT STOPER","AL1444.01-06-053-00","1","","04-06-2022","Sunil","PPRAJ","2022-06-04"
"AL-1444-01","10-04-00-GRIPPER PLATE","AL1444.01-10-04-00","2","","28-11-2021","Sunil","PPRAJ","2021-11-29"
"AL-1444-01","05-18-00-SHAFT SPCR","AL1444.01-05-18-00","2","","28-11-2021","Sunil","PPRAJ","2021-11-29"
"AL-1444-01","10-22-00-CYLINER CONNECTING BRKT","AL1444.01-10-22-00","1","","28-11-2021","Sunil","PPRAJ","2021-11-29"
"AL-1444-01","06-09-00-EP CYL MTG PLT","AL1444.01-06-09-00","1","","28-11-2021","Sunil","PPRAJ","2021-11-29"
"AL-1444-01","02-05-00-COUPLER BLOCK","AL1444.01-02-05-00","1","","27-11-2021","Sunil","PPRAJ","2021-11-29"
"AL-1444-01","02-07-00-SEN BRKT-BOTTOM","AL1444.01-02-07-00","1","","04-03-2022","Sunil","PPRAJ","2022-03-04"
"AL-1444-01","10-036-00-CYL SPACER","AL1444.01-10-036-00","1","","18-06-2022","Sunil","PPRAJ","2022-06-18"
"AL-1444-01","08-06-00-COM SWING SUPPORT-LH","AL1444.01-08-06-00","2","","28-11-2021","Sunil","PPRAJ","2021-11-29"
"AL-1444-01","05-04-00-DIA16 GUIDE ROD","AL1444.01-05-04-00","2","","28-11-2021","Sunil","PPRAJ","2021-11-29"
"AL-1444-01","03-220-00-COMMUTATOR HOLDER","AL-1444-01-03-220-00","1","","31-08-2021","Pavithra","Chandru","2021-08-31"
"AL-1444-01","07-120-00-ROTARY CYLINER MTG PLATE","AL1444.01-07-120-00","1","","24-01-2022","Sunil","PPRAJ","2022-01-24"
"AL-1444-01","10-16-00-ROTORY UNIT SIDE PLATE","AL1444.01-10-16-00","1","","28-11-2021","Sunil","PPRAJ","2021-11-29"
"AL-1444-01","06-06-00-COM SWING SUPPORT","AL1444.01-06-06-00","1","","28-11-2021","Sunil","PPRAJ","2021-11-29"
"AL-1444-01","02-02-00-GUIDE ROD","AL1444.01-02-02-00","2","","27-11-2021","Sunil","PPRAJ","2021-11-29"
"AL-1444-01","02-310-00-STOPPER FOR STIFFNER-3","AL-1444-01-02-310-00","2","","26-10-2021","Pavithra","Chandru","2021-10-26"
"AL-1444-01","03-10-00-POTENTIOMETER STOPER PLATE","AL1444.01-03-10-00","1","","04-03-2022","Sunil","PPRAJ","2022-03-04"
"AL-1444-01","01-063-00-WELDING BUSH FOR BASE COVERS","AL1444.01-01-063-00","21","","03-12-2021","Sunil","PPRAJ","2021-12-03"
"AL-1444-01","07-08-00-INDEXER JAW","AL1444.01-07-08-00","2","","28-11-2021","Sunil","PPRAJ","2021-11-29"
"AL-1444-01","04-05-00-STIFFER PLATE","AL1444.01-04-05-00","1","","27-11-2021","Sunil","PPRAJ","2021-11-29"
"AL-1444-01","02-290-00-STOPPER FOR STIFFNER-1","AL-1444-01-02-290-00","2","","31-08-2021","Pavithra","Chandru","2021-08-31"
"AL-1444-01","05-24-00-30X30 SQUARE TUBE","AL1444.01-05-24-00","1","","01-12-2021","Sunil","PPRAJ","2021-12-01"
"AL-1444-01","09-02-00-DIA16 GUIDE ROD","AL1444.01-09-02-00","4","","28-11-2021","Sunil","PPRAJ","2021-11-29"
"AL-1444-01","05-16-00-BEARING RETAINER","AL1444.01-05-16-00","1","","28-11-2021","Sunil","PPRAJ","2021-11-29"
"AL-1444-01","03-201-00-COMP HOLDING BLK","AL1444.01-03-201-00","1","","03-06-2022","Nitish","PPRAJ","2022-06-03"
"AL-1444-01","05-25-00-JOB LOCATOR BASE","AL1444.01-05-25-00","1","","05-03-2022","Sunil","PPRAJ","2022-03-05"
"AL-1444-01","10-12-00-LM BLOCK SLIDE","AL1444.01-10-12-00","1","","28-11-2021","Sunil","PPRAJ","2021-11-29"
"AL-1444-01","06-03-00-COM HOLDER","AL1444.01-06-03-00","1","","28-11-2021","Sunil","PPRAJ","2021-11-29"
"AL-1444-01","02-270-00-SHAFT PRESS TOOL-2","AL-1444-01-02-270-00","1","","26-10-2021","Pavithra","Chandru","2021-10-26"
"AL-1444-01","01-057-00-BASE FRONT DOOR","AL1444.01-01-057-00","1","","03-12-2021","Sunil","PPRAJ","2021-12-03"
"AL-1444-01","11-04-00-CHUTE HINGE CYL MTG BLK","AL1444.01-11-04-00","1","","28-11-2021","Sunil","PPRAJ","2021-11-29"
"AL-1444-01","07-06-00-IXR CYL CONNTR","AL1444.01-07-06-00","2","","28-11-2021","Sunil","PPRAJ","2021-11-29"
"AL-1444-01","04-01-00-CYLINDER COUPLER BOTTOM","AL1444.01-04-01-00","1","","27-11-2021","Sunil","PPRAJ","2021-11-29"
"AL-1444-01","01-06-00-SUPORT BKT","AL1444.01-01-06-00","1","","28-11-2021","Sunil","PPRAJ","2021-11-30"
"AL-1444-01","09-04-00-EP CRADLE","AL1444.01-09-04-00","2","","28-11-2021","Sunil","PPRAJ","2021-11-29"
"AL-1444-01","05-12-00-COMP FEEDER LEVER","AL1444.01-05-12-00","1","","28-11-2021","Sunil","PPRAJ","2021-11-29"
"AL-1444-01","02-231-00-TOP EI HOLDER","AL1444.01-02-231-00","1","","03-06-2022","Nitish","PPRAJ","2022-06-03"
"AL-1444-01","10-08-00-CYLINER MTG PLATE","AL1444.01-10-08-00","1","","28-11-2021","Sunil","PPRAJ","2021-11-29"
"AL-1444-01","06-18-00-COM HLDR  LOCKING SPACER","AL1444.01-06-18-00","2","","28-11-2021","Sunil","PPRAJ","2021-11-29"
"AL-1444-01","11-01-00-EXIT CHUTE","AL1444.01-11-01-00","1","","28-11-2021","Sunil","PPRAJ","2021-11-29"
"AL-1444-01","07-03-00-PAWL HOLDER","AL1444.01-07-03-00","2","","28-11-2021","Sunil","PPRAJ","2021-11-29"
"AL-1444-01","03-05-00-GUIDE ROD","AL1444.01-03-05-00","4","","27-11-2021","Sunil","PPRAJ","2021-11-29"
"AL-1444-01","10-27-00-ROTORY UNIT PLT","AL1444.01-10-27-00","1","","04-03-2022","Sunil","PPRAJ","2022-03-04"
"AL-1444-01","01-03-00-STOPPER MTG PLATE","AL1444.01-01-03-00","1","","28-11-2021","Sunil","PPRAJ","2021-11-30"
"AL-1444-01","03-06-R1-BUTTON","AL1444.01-03-06-R1","1","","20-06-2022","Sunil","PPRAJ","2022-06-20"
"AL-1444-01","08-16-00-LOAD CELL MTNG PLT","AL1444.01-08-16-00","1","","28-11-2021","Sunil","PPRAJ","2021-11-29"
"AL-1444-01","05-09-00-COMP FEEDER LEVER","AL1444.01-05-09-00","1","","28-11-2021","Sunil","PPRAJ","2021-11-29"
"AL-1444-01","08-045-00-BRKT","AL1444.01-08-045-00","2","","04-06-2022","Sunil","PPRAJ","2022-06-04"
"AL-1444-01","01-190-00-CRADLE MTNG PLT","AL1444.01-01-190-00","1","","03-06-2022","Nitish","PPRAJ","2022-06-03"
"AL-1444-01","10-07-00-ROTORY UNIT PLT","AL1444.01-10-07-00","1","","28-11-2021","Sunil","PPRAJ","2021-11-29"
"AL-1444-01","06-15-00-COM PRESS SLIDE RAIL MTG BASE","AL1444.01-06-15-00","1","","28-11-2021","Sunil","PPRAJ","2021-11-29"
"AL-1444-01","11-12-00-PIN","AL1444.01-11-12-00","1","","28-11-2021","Sunil","PPRAJ","2021-11-29"
"AL-1444-01","07-10-00-INDEXER COVER PLT","AL1444.01-07-10-00","2","","28-11-2021","Sunil","PPRAJ","2021-11-29"
"AL-1444-01","03-02-00-GUIDE BUSH HOLDER","AL1444.01-03-02-00","2","","27-11-2021","Sunil","PPRAJ","2021-11-29"
"AL-1444-01","08-17-00-COM HLDR LOCKING SPACER","AL1444.01-08-17-00","4","","04-03-2022","Sunil","PPRAJ","2022-03-04"
"AL-1444-01","10-035-00-RH GRIPPER","AL1444.01-10-035-00","1","","18-06-2022","Sunil","PPRAJ","2022-06-18"
"AL-1444-01","08-12-00-COM PRESS CYL MTG BKT","AL1444.01-08-12-00","1","","28-11-2021","Sunil","PPRAJ","2021-11-29"
"AL-1444-01","05-08-00-JOB LOCATOR BASE","AL1444.01-05-08-00","1","","27-11-2021","Sunil","PPRAJ","2021-11-29"
"AL-1444-01","06-045-00-BRKT","AL1444.01-06-045-00","1","","04-06-2022","Sunil","PPRAJ","2022-06-04"
"AL-1444-01","10-05-00-GRIPPER PAD","AL1444.01-10-05-00","4","","28-11-2021","Sunil","PPRAJ","2021-11-29"
"AL-1444-01","05-20-00- BRG HSG SPACER","AL1444.01-05-20-00","1","","28-11-2021","Sunil","PPRAJ","2021-11-29"
"AL-1444-01","11-05-00-CHUTE HINGE PIN BLK SLDPRT","AL1444.01-11-05-00","3","","28-11-2021","Sunil","PPRAJ","2021-11-29"
"AL-1444-01","06-12-00-BEARING MTG PLATE","AL1444.01-06-12-00","3","","28-11-2021","Sunil","PPRAJ","2021-11-29"
"AL-1444-01","02-06-00-ROD HOUSING BOTTOM","AL1444.01-02-06-00","2","","27-11-2021","Sunil","PPRAJ","2021-11-29"
"AL-1444-01","02-08-00-SEN BRKT","AL1444.01-02-08-00","1","","04-03-2022","Sunil","PPRAJ","2022-03-04"
"AL-1444-01","10-037-00-SECONDRR CYL CNTR","AL1444.01-10-037-00","1","","18-06-2022","Sunil","PPRAJ","2022-06-18"
"AL-1444-01","08-09-00-EP CYL MTG PLT","AL1444.01-08-09-00","1","","28-11-2021","Sunil","PPRAJ","2021-11-29"
"AL-1444-01","05-05-00-JOB LOADER CYL MTG PLT","AL1444.01-05-05-00","1","","28-11-2021","Sunil","PPRAJ","2021-11-29"
"AL-1444-01","06-047-00-HINCH BLOCK","AL1444.01-06-047-00","3","","04-06-2022","Sunil","PPRAJ","2022-06-04"
"AL-1444-01","03-230-00-COM STOPPER PAD","AL-1444-01-03-230-00","2","","31-08-2021","Pavithra","Chandru","2021-08-31"
"AL-1444-01","07-130-00-ROTARY PLATE","AL1444.01-07-130-00","1","","24-01-2022","Sunil","PPRAJ","2022-01-24"
"AL-1444-01","10-19-00-CYLINER MTG PLATE","AL1444.01-10-19-00","1","","28-11-2021","Sunil","PPRAJ","2021-11-29"
"AL-1444-01","06-07-00-CYL CPLR","AL1444.01-06-07-00","4","","28-11-2021","Sunil","PPRAJ","2021-11-29"
"AL-1444-01","02-03-00-CYLINDER HOLDER PLATE","AL1444.01-02-03-00","1","","27-11-2021","Sunil","PPRAJ","2021-11-29"
"AL-1444-01","03-250-00-STACK LOCATING PIN-2","AL-1444-01-03-250-00","4","","26-10-2021","Pavithra","Chandru","2021-10-26"
"AL-1444-01","03-11-00-POTENTIOMETER MTG PLT","AL1444.01-03-11-00","2","","04-03-2022","Sunil","PPRAJ","2022-03-04"
"AL-1444-01","06-19-00-STPR MTNG PLT","AL1444.01-06-19-00","4","","03-03-2022","Sunil","PPRAJ","2022-03-03"
"AL-1444-01","07-09-00-DEFORMER INSERTION","AL1444.01-07-09-00","2","","28-11-2021","Sunil","PPRAJ","2021-11-29"
"AL-1444-01","04-06-00-STOPPER FOR STIFFNER","AL1444.01-04-06-00","2","","27-11-2021","Sunil","PPRAJ","2021-11-29"
"AL-1444-01","03-200-00-COMP HOLDING BLK - Copy","AL-1444-01-03-200-00","1","","31-08-2021","Pavithra","Chandru","2021-08-31"
"AL-1444-01","07-100-00-COUPLER HOLDING PLATE","AL1444.01-07-100-00","1","","24-01-2022","Sunil","PPRAJ","2022-01-24"
"AL-1444-01","09-03-00-EP CRADLE  CYL MTG PLT","AL1444.01-09-03-00","2","","28-11-2021","Sunil","PPRAJ","2021-11-29"
"AL-1444-01","05-17-00-BEARING SPACER","AL1444.01-05-17-00","1","","28-11-2021","Sunil","PPRAJ","2021-11-29"
"AL-1444-01","03-211-00-EI HOLDING BLK","AL1444.01-03-211-00","1","","03-06-2022","Nitish","PPRAJ","2022-06-03"
"AL-1444-01","11-12-R1-PIN","AL1444.01-11-12-R1","1","","05-03-2022","Sunil","PPRAJ","2022-03-05"
"AL-1444-01","10-10-00-MTG BLOCK","AL1444.01-10-10-00","1","","28-11-2021","Sunil","PPRAJ","2021-11-29"
"AL-1444-01","06-04-00-COM PRESS SLIDE RAIL MTG BASE","AL1444.01-06-04-00","2","","28-11-2021","Sunil","PPRAJ","2021-11-29"
"AL-1444-01","02-280-00-SHAFT PRESS TOOL-3","AL-1444-01-02-280-00","1","","26-10-2021","Pavithra","Chandru","2021-10-26"
"AL-1444-01","01-180-00- TRANSFORMER MOUNTING PLATE","AL1444.01-01-180-00","2","","14-02-2022","Sunil","PPRAJ","2022-02-14"
"AL-1444-01","01-061-00-BASE SIDE COVER RH","AL1444.01-01-061-00","1","","03-12-2021","Sunil","PPRAJ","2021-12-03"
"AL-1444-01","07-12-00-HINGE PIN","AL1444.01-07-12-00","2","","28-11-2021","Sunil","PPRAJ","2021-11-29"
"AL-1444-01","04-03-00-WASHER","AL1444.01-04-03-00","4","","27-11-2021","Sunil","PPRAJ","2021-11-29"
"AL-1444-01","02-230-00-TOP EI HOLDER","AL-1444-01-02-230-00","1","","31-08-2021","Pavithra","Chandru","2021-08-31"
"AL-1444-01","01-113-00-ELECTRICAL CABINET MTG PLT","AL1444.01-01-113-00","2","","30-11-2021","Sunil","PPRAJ","2021-11-30"
"AL-1444-01","09-05-00-EP LOADING CLAW","AL1444..01-09-05-00","2","","28-11-2021","Sunil","PPRAJ","2021-11-29"
"AL-1444-01","05-13-00-FEEDER MOTOR MTG PLT","AL1444.01-05-13-00","1","","28-11-2021","Sunil","PPRAJ","2021-11-29"
"AL-1444-01","02-260-00-SHAFT PRESS TOOL-1","AL1444.01-02-260-00","1","","03-06-2022","Nitish","PPRAJ","2022-06-03"
"AL-1474-01","03-190-00-DIA 40 STACK LOCATING PIN","AL-1474-01-03-190-00","2","","30-10-2021","Pavithra","Chandru","2021-10-30"
"AL-1474-01","02-010-00-GUIDE ROD","AL-1474-01-02-010-00","2","","13-10-2021","Pavithra","Chandru","2021-10-13"
"AL-1474-01","03-350-00-STOPPER PAD-BLUE LEAF BEARING","AL-1474-01-03-350-00","2","","30-10-2021","Pavithra","Chandru","2021-10-30"
"AL-1474-01","02-180-00-LOCKNUT SPACER","AL-1474-01-02-180-00","1","","13-10-2021","Pavithra","Chandru","2021-10-13"
"AL-1474-01","03-120-00-L-FRAME","AL-1474-01-03-120-00","1","","13-10-2021","Pavithra","Chandru","2021-10-13"
"AL-1474-01","03-320-00-STOPPER PAD-M-PERFECT,GX-10","AL-1474-01-03-320-00","2","","30-10-2021","Pavithra","Chandru","2021-10-30"
"AL-1474-01","02-150-00-BEARING SPACER","AL-1474-01-02-150-00","1","","13-10-2021","Pavithra","Chandru","2021-10-13"
"AL-1474-01","03-090-00-COUPLER BLOCK","AL-1474-01-03-090-00","1","","13-10-2021","Pavithra","Chandru","2021-10-13"
"AL-1474-01","02-140-00-SHAFT PRESS TOOL","AL-1474-01-02-140-00","1","","20-10-2021","Pavithra","Chandru","2021-10-20"
"AL-1474-01","03-290-00-STOPPER PAD-INDIAN NATIONAL","AL-1474-01-03-290-00","2","","30-10-2021","Pavithra","Chandru","2021-10-30"
"AL-1474-01","02-110-00-BEARING HSG","AL-1474-01-02-110-00","1","","13-10-2021","Pavithra","Chandru","2021-10-13"
"AL-1474-01","03-060-00-COM GUIDE ROD","AL-1474-01-03-060-00","4","","13-10-2021","Pavithra","Chandru","2021-10-13"
"AL-1474-01","04-030-00-LVDT MTG PLT","AL-1474-01-04-030-00","1","","06-11-2021","Pavithra","Chandru","2021-11-06"
"AL-1474-01","03-260-00-STOPPER PAD-P,M-CHMP,K-SEN,UNI","AL-1474-01-03-260-00","2","","30-10-2021","Pavithra","Chandru","2021-10-30"
"AL-1474-01","02-080-00- GUIDE ROD DIA 20","AL-1474-01-02-080-00","4","","13-10-2021","Pavithra","Chandru","2021-10-13"
"AL-1474-01","01-020-00-TUBE STRUCTURE","AL-1474-01-01-020-00","1","","10-11-2021","Pavithra","Chandru","2021-11-10"
"AL-1474-01","03-030-00-COMMUTATOR PRESSBUTTON","AL-1474-01-03-030-00","1","","13-10-2021","Pavithra","Chandru","2021-10-13"
"AL-1474-01","03-170-00-WASHER","AL-1474-01-03-170-00","4","","13-10-2021","Pavithra","Chandru","2021-10-13"
"AL-1474-01","03-230-00- STOPPER PAD-GX-7,1618","AL-1474-01-03-230-00","2","","30-10-2021","Pavithra","Chandru","2021-10-30"
"AL-1474-01","02-050-00-TOOL HOLDER PLATE","AL-1474-01-02-050-00","1","","13-10-2021","Pavithra","Chandru","2021-10-13"
"AL-1474-01","02-240-00-STOPPER FOR STIFFNER-1","AL-1474-01-02-240-00","2","","13-10-2021","Pavithra","Chandru","2021-10-13"
"AL-1474-01","03-200-00- STOPPER PAD-1616","AL-1474-01-03-200-00","2","","30-10-2021","Pavithra","Chandru","2021-10-30"
"AL-1474-01","02-020-00-PULLEY HOLDER PLATE","AL-1474-01-02-020-00","1","","13-10-2021","Pavithra","Chandru","2021-10-13"
"AL-1474-01","03-360-00-STOPPER PAD-BL","AL-1474-01-03-360-00","2","","30-10-2021","Pavithra","Chandru","2021-10-30"
"AL-1474-01","02-190-00-GEAR BOX MTG BKT","AL-1474-01-02-190-00","1","","13-10-2021","Pavithra","Chandru","2021-10-13"
"AL-1474-01","03-130-00-EI HOLDING BLK","AL-1474-01-03-130-00","1","","13-10-2021","Pavithra","Chandru","2021-10-13"
"AL-1474-01","03-330-00-STOPPER PAD-S-38,S-48,S-45","AL-1474-01-03-330-00","2","","30-10-2021","Pavithra","Chandru","2021-10-30"
"AL-1474-01","02-160-00-DRIVEN PULLEY","AL-1474-01-02-160-00","1","","13-10-2021","Pavithra","Chandru","2021-10-13"
"AL-1474-01","03-100-00-TOOL HOLDER PLATE","AL-1474-01-03-100-00","1","","13-10-2021","Pavithra","Chandru","2021-10-13"
"AL-1474-01","02-220-00-TOP EI HOLDER","AL-1474-01-02-220-00","1","","20-10-2021","Pavithra","Chandru","2021-10-20"
"AL-1474-01","03-300-00-STOPPER PAD-VDM-165","AL-1474-01-03-300-00","2","","30-10-2021","Pavithra","Chandru","2021-10-30"
"AL-1474-01","02-120-00-BEARING BUTTING PLATE","AL-1474-01-02-120-00","2","","13-10-2021","Pavithra","Chandru","2021-10-13"
"AL-1474-01","03-070-00-COM PRESS TOOL MTG PLATE","AL-1474-01-03-070-00","1","","13-10-2021","Pavithra","Chandru","2021-10-13"
"AL-1474-01","04-040-00-LVDT STOPPER PLATE","AL-1474-01-04-040-00","2","","06-11-2021","Pavithra","Chandru","2021-11-06"
"AL-1474-01","03-270-00-STOPPER PAD-GX-11,BHEEMA,KO-048","AL-1474-01-03-270-00","2","","30-10-2021","Pavithra","Chandru","2021-10-30"
"AL-1474-01","02-090-00-HOLDER PLATE","AL-1474-01-02-090-00","1","","13-10-2021","Pavithra","Chandru","2021-10-13"
"AL-1474-01","03-040-00-WASHER","AL-1474-01-03-040-00","12","","13-10-2021","Pavithra","Chandru","2021-10-13"
"AL-1474-01","04-010-00-L BKT","AL-1474-01-04-010-00","1","","06-11-2021","Pavithra","Chandru","2021-11-06"
"AL-1474-01","03-240-00- STOPPER PAD-EC0-35,P-STEEL,ECO-048","AL-1474-01-03-240-00","2","","30-10-2021","Pavithra","Chandru","2021-10-30"
"AL-1474-01","02-060-00-PRESS BUTTON","AL-1474-01-02-060-00","1","","13-10-2021","Pavithra","Chandru","2021-10-13"
"AL-1474-01","03-010-00-BOTTOM U PLATE","AL-1474-01-03-010-00","1","","13-10-2021","Pavithra","Chandru","2021-10-13"
"AL-1474-01","03-210-00- STOPPER PAD-1606","AL-1474-01-03-210-00","2","","30-10-2021","Pavithra","Chandru","2021-10-30"
"AL-1474-01","02-030-00-ROD HOUSING BOTTOM","AL-1474-01-02-030-00","4","","13-10-2021","Pavithra","Chandru","2021-10-13"
"AL-1474-01","02-200-00-PULLEY LOCKING SPIGOT","AL-1474-01-02-200-00","1","","13-10-2021","Pavithra","Chandru","2021-10-13"
"AL-1474-01","03-140-00-COMP HOLDING BLK - Copy","AL-1474-01-03-140-00","1","","13-10-2021","Pavithra","Chandru","2021-10-13"
"AL-1474-01","03-180-00-STACK LOCATING PIN","AL-1474-01-03-180-00","2","","30-10-2021","Pavithra","Chandru","2021-10-30"
"AL-1474-01","01-010-00-CP BASE PLATE","AL-1474-01-01-010-00","1","","13-10-2021","Pavithra","Chandru","2021-10-13"
"AL-1474-01","03-340-00-STOPPER PAD-S-42","AL-1474-01-03-340-00","2","","30-10-2021","Pavithra","Chandru","2021-10-30"
"AL-1474-01","02-170-00-CYLINDER COUPLER BOTTOM","AL-1474-01-02-170-00","1","","13-10-2021","Pavithra","Chandru","2021-10-13"
"AL-1474-01","03-110-00-COM COUPLER BOTTOM","AL-1474-01-03-110-00","1","","13-10-2021","Pavithra","Chandru","2021-10-13"
"AL-1474-01","02-230-00-SHAFT PRESS","AL-1474-01-02-230-00","1","","20-10-2021","Pavithra","Chandru","2021-10-20"
"AL-1474-01","03-310-00-STOPPER PAD-BBC","AL-1474-01-03-310-00","2","","30-10-2021","Pavithra","Chandru","2021-10-30"
"AL-1474-01","02-130-00-INDEXER SHAFT","AL-1474-01-02-130-00","1","","13-10-2021","Pavithra","Chandru","2021-10-13"
"AL-1474-01","03-080-00-COM STOPPER PAD","AL-1474-01-03-080-00","2","","13-10-2021","Pavithra","Chandru","2021-10-13"
"AL-1474-01","03-370-00-PUSH SPRING","AL-1474-01-03-370-00","2","","06-11-2021","Pavithra","Chandru","2021-11-06"
"AL-1474-01","03-280-00-STOPPER PAD-GX-5,ECO LATEST,POPULAR","AL-1474-01-03-280-00","2","","30-10-2021","Pavithra","Chandru","2021-10-30"
"AL-1474-01","02-100-00-JACKING PLATE","AL-1474-01-02-100-00","1","","13-10-2021","Pavithra","Chandru","2021-10-13"
"AL-1474-01","03-050-00-COMMUTATOR HOLDER","AL-1474-01-03-050-00","1","","13-10-2021","Pavithra","Chandru","2021-10-13"
"AL-1474-01","04-020-00-LVDT COUPLER","AL-1474-01-04-020-00","2","","06-11-2021","Pavithra","Chandru","2021-11-06"
"AL-1474-01","03-250-00- STOPPER PAD-DESIRE PLUS.TBA-LATEST","AL-1474-01-03-250-00","2","","30-10-2021","Pavithra","Chandru","2021-10-30"
"AL-1474-01","02-070-00-GUIDE BUSH HOLDER","AL-1474-01-02-070-00","2","","13-10-2021","Pavithra","Chandru","2021-10-13"
"AL-1474-01","03-020-00-GUIDE ROD DIA 25","AL-1474-01-03-020-00","2","","13-10-2021","Pavithra","Chandru","2021-10-13"
"AL-1474-01","03-220-00- STOPPER PAD-DESIRE","AL-1474-01-03-220-00","2","","30-10-2021","Pavithra","Chandru","2021-10-30"
"AL-1474-01","02-040-00-TOP SUPPORT WASHER","AL-1474-01-02-040-00","2","","13-10-2021","Pavithra","Chandru","2021-10-13"
"AL-1474-01","02-210-00-DRIVER PULLEY","AL-1474-01-02-210-00","1","","13-10-2021","Pavithra","Chandru","2021-10-13"
"AL-1474-01","03-150-00-STOPPER SUPPORT SHAFT","AL-1474-01-03-150-00","2","","13-10-2021","Pavithra","Chandru","2021-10-13"
"AL1345.04","10-391-00-SUPPORT GUIDE PLATE LH","AL1345.04-10-391-00-SUPPORT GUIDE PLATE LH","4","","07-09-2021","Dayanand","PPRAJ","2021-09-07"
"AL1373.01","06-041-00-ROLL HOLDER SPACER","AL1373.01-06-041-00","6","","16-06-2022","Amar","PPRAJ","2022-06-16"
"AL1373.01","09-010-00-PAPER TENTIONER PLATE","AL1373.01-09-010-00","3","","07-03-2022","Amar","PPRAJ","2022-03-09"
"AL1373.01","02-030-00-SIDE GUIDE PLT RH","AL1373.01-02-030-00","3","","05-03-2022","Amar","PPRAJ","2022-03-09"
"AL1373.01","06-042-00-ROLL HOLDER SPACER","AL1373.01-06-042-00","6","","12-07-2022","Amar","PPRAJ","2022-07-12"
"AL1373.01","06-050-00-SHEET MTG PLT","AL1373.01-06-050-00","6","","12-03-2022","Amar","PPRAJ","2022-03-12"
"AL1373.01","11-70-00-V BLOCK ADJUSTABLE BLOCK","AL1373.01-11-70-00","3","","07-03-2022","Amar","PPRAJ","2022-03-09"
"AL1373.01","03-080-00-INSERTING PUNCH","AL1373.01-03-080-00","8","","05-03-2022","Amar","PPRAJ","2022-03-09"
"AL1373.01","11-120-00-COUPLER HOLDER PLATE","AL1373.01-11-120-00","3","","07-03-2022","Amar","PPRAJ","2022-03-09"
"AL1373.01","07-018-00 DRIVER GEAR","AL1373.01-07-018-00","3","","07-03-2022","Amar","PPRAJ","2022-03-09"
"AL1373.01","10-070-00-INSERTR CYL MTG PLT","AL1373.01-10-070-00","3","","07-03-2022","Amar","PPRAJ","2022-03-09"
"AL1373.01","02-161-00-PROXIMITY SENSOR CLAMP","AL1373.01-02-161-00","3","","05-03-2022","Amar","PPRAJ","2022-03-09"
"AL1373.01","11-010-00 RIB PLT","AL1373.01-11-010-00","6","","07-03-2022","Amar","PPRAJ","2022-03-09"
"AL1373.01","03-010-00-SUPPORT BLOCK","AL1373.01-03-010-00","3","","05-03-2022","Amar","PPRAJ","2022-03-09"
"AL1373.01","11-280-00-STD GUIDE ROD Ø8","AL1373.01-11-280-00","6","","07-03-2022","Amar","PPRAJ","2022-03-09"
"AL1373.01","07-220-00 RH RETAINER","AL1373.01-07-220-00","3","","07-03-2022","Amar","PPRAJ","2022-03-09"
"AL1373.01","01-214-00-PAPER GUIDE STRIP","AL1373.01-01-214-00","6","","16-07-2022","Amar","PPRAJ","2022-07-16"
"AL1373.01","10-079-00-INSERTER ROD CONN PLT","AL1373.01-10-079-00","4","","07-03-2022","Amar","PPRAJ","2022-03-09"
"AL1373.01","01-180-00-GUIDED COMPONENT HOLDER","AL1373.01-01-180-00","3","","04-03-2022","Amar","PPRAJ","2022-03-09"
"AL1373.01","11-50-00-GUIDE BUSH MTG PLATE","AL1373.01-11-50-00","3","","09-03-2022","Amar","PPRAJ","2022-03-09"
"AL1373.01","02-130-00-BLADE","AL1373.01-02-130-00","3","","05-03-2022","Amar","PPRAJ","2022-03-09"
"AL1373.01","11-80-00-V BLOCK GUIDE PLATE","AL1373.01-11-80-00","6","","07-03-2022","Amar","PPRAJ","2022-03-09"
"AL1373.01","05-070-00- LOCKING STOPPER","AL1373.01-05-070-00","3","","05-03-2022","Amar","PPRAJ","2022-03-09"
"AL1373.01","07-190-00 SUPRTNG BRKT 4 RLR","AL1373.01-07-190-00","3","","07-03-2022","Amar","PPRAJ","2022-03-09"
"AL1373.01","01-030-00-TOP PLATE","AL1373.01-01-030-00","3","","04-03-2022","Amar","PPRAJ","2022-03-09"
"AL1373.01","06-010-00-ROLL HOLDER L PLT","AL1373.01-06-010-00","3","","07-03-2022","Amar","PPRAJ","2022-03-09"
"AL1373.01","02-107-00-CYL CONN PLT","AL1373.01-02-107-00","3","","05-03-2022","Amar","PPRAJ","2022-03-09"
"AL1373.01","11-13-00-CRADLE V-BLOCK HOLDER","AL1373.01-11-13-00","1","","08-07-2022","Amar","PPRAJ","2022-07-08"
"AL1373.01","11-42-00-TIE SPACER PLT","AL1373.01-11-42-00","12","","07-03-2022","Amar","PPRAJ","2022-03-09"
"AL1373.01","05-030-00-STOPPER BUSH","AL1373.01-05-030-00","3","","05-03-2022","Amar","PPRAJ","2022-03-09"
"AL1373.01","11-22-00-CONVER LOCKING PLT","AL1373.01-11-22-00","12","","07-03-2022","Amar","PPRAJ","2022-03-09"
"AL1373.01","07-091-00-TENSTIONER PLATE","AL1373.01-07-091-00","3","","07-03-2022","Amar","PPRAJ","2022-03-09"
"AL1373.01","01-210-00-PAPER GUIDE STRIP","AL1474.02-01-210-00","6","","04-03-2022","Amar","PPRAJ","2022-03-09"
"AL1373.01","06-070-00-LOCKING BUSH","AL1373.01-06-070-00","6","","07-03-2022","Amar","PPRAJ","2022-03-09"
"AL1373.01","02-090-00-STRIPPER HOLDER PLATE","AL1373.01-02-090-00","3","","05-03-2022","Amar","PPRAJ","2022-03-09"
"AL1373.01","11-12-00-CRADLE GUIDE ROD","AL1373.01-11-12-00","3","","07-03-2022","Amar","PPRAJ","2022-03-09"
"AL1373.01","04-020-00-IND CYL MTG PLT","AL1373.01-04-020-00","3","","05-03-2022","Amar","PPRAJ","2022-03-09"
"AL1373.01","09-020-00-BACK PLATE","AL1373.01-09-020-00","3","","07-03-2022","Amar","PPRAJ","2022-03-09"
"AL1373.01","02-040-00-SIDE GUIDE PLT","AL1373.01-02-040-00","3","","05-03-2022","Amar","PPRAJ","2022-03-09"
"AL1373.01","11-31-00-CRADLE CYL CONNECTOR","AL1373.01-11-31-00","3","","07-03-2022","Amar","PPRAJ","2022-03-09"
"AL1373.01","03-110-00-CYLINDER COUPLER","AL1373.01-03-110-00","3","","05-03-2022","Amar","PPRAJ","2022-03-09"
"AL1373.01","11-140-00-MOVING FRAME HOLDER","AL1373.01-11-140-00","6","","07-03-2022","Amar","PPRAJ","2022-03-09"
"AL1373.01","07-021-00-FEMALE ROLLER","AL1373.01-07-021-00","3","","07-03-2022","Amar","PPRAJ","2022-03-09"
"AL1373.01","10-040-00-GUIDE ROD DIA 10","AL1373.01-10-040-00","6","","07-03-2022","Amar","PPRAJ","2022-03-09"
"AL1373.01","02-010-00-SLIDER PLT FRONT SIDE","AL1373.01-02-010-00","3","","05-03-2022","Amar","PPRAJ","2022-03-09"
"AL1373.01","11-29-00-FIXED  BEAM-FRONT","AL1373.01-11-29-00","3","","07-03-2022","Amar","PPRAJ","2022-03-09"
"AL1373.01","03-020-00-CYL CONN PLT","AL1373.01-03-020-00","3","","05-03-2022","Amar","PPRAJ","2022-03-09"
"AL1373.01","11-150-00-VERTICAL CYL MTG BLOCK","AL1373.01-11-150-00","6","","07-03-2022","Amar","PPRAJ","2022-03-09"
"AL1373.01","07-011-00-ROLLER MTG ASSY","AL1373.01-07-011-00","3","","07-03-2022","Amar","PPRAJ","2022-03-09"
"AL1373.01","10-082-00 COUPLER HOLDER","AL1373.01-10-082-00","3","","07-03-2022","Amar","PPRAJ","2022-03-09"
"AL1373.01","01-190-00-SINGLE BLOCK FEEDER PLATE","AL1373.01-01-190-00","6","","04-03-2022","Amar","PPRAJ","2022-03-09"
"AL1373.01","11-41-00-COMP HOLDER.SLDPRT (28MM)","AL1373.01-11-41-00","6","","09-03-2022","Amar","PPRAJ","2022-03-09"
"AL1373.01","02-140-00-CUTTER HOLDING PLATE","AL1373.01-02-140-00","3","","05-03-2022","Amar","PPRAJ","2022-03-09"
"AL1373.01","11-101-00- CYLINER COUPLER","AL1373.01-11-101-00","6","","07-03-2022","Amar","PPRAJ","2022-03-09"
"AL1373.01","07-200-00 RETAINER","AL1373.01-07-200-00","3","","07-03-2022","Amar","PPRAJ","2022-03-09"
"AL1373.01","08-01-00-BASE PLATE","AL1373.01-08-01-00","3","","07-03-2022","Amar","PPRAJ","2022-03-09"
"AL1373.01","01-130-00-PAWL HOLDER","AL1373.01-01-130-00","3","","04-03-2022","Amar","PPRAJ","2022-03-09"
"AL1373.01","06-030-00-SUPPORT ROD","AL1373.01-06-030-00","3","","07-03-2022","Amar","PPRAJ","2022-03-09"
"AL1373.01","02-110-00-BLADE CONNECTOR PLT","AL1373.01-02-110-00","3","","05-03-2022","Amar","PPRAJ","2022-03-09"
"AL1373.01","11-061-00-COMP HOLDER.SLDPRT","AL1373.01-11-061-00","2","","08-07-2022","Amar","PPRAJ","2022-07-08"
"AL1373.01","11-90-00-CYLINDER STOPER PLT","AL1373.01-11-90-00","6","","07-03-2022","Amar","PPRAJ","2022-03-09"
"AL1373.01","05-040-00-CYLINDER HOLDING SHAFT","AL1373.01-05-040-00","3","","05-03-2022","Amar","PPRAJ","2022-03-09"
"AL1373.01","01-140-R1-PAWL","AL1373.01-01-140-R1","8","","30-06-2022","Amar","PPRAJ","2022-06-30"
"AL1373.01","11-60-00-STD GUIDE ROD","AL1373.01-11-60-00","12","","07-03-2022","Amar","PPRAJ","2022-03-09"
"AL1373.01","07-101-00-SHAFT FOR REMOVABLE ROLLER","AL1373.01-07-101-00","3","","07-03-2022","Amar","PPRAJ","2022-03-09"
"AL1373.01","01-220-00-GUIDE PLATE 22 PAPER","AL1373.01-01-220-00","3","","04-03-2022","Amar","PPRAJ","2022-03-09"
"AL1373.01","06-080-00-PAPER ROLLER BUSH","AL1373.01-06-080-00","3","","07-03-2022","Amar","PPRAJ","2022-03-09"
"AL1373.01","02-100-00-BLADE CONNECTING PIN","AL1373.01-02-100-00","3","","05-03-2022","Amar","PPRAJ","2022-03-09"
"AL1373.01","11-020-00 BASE PLATE SUPPORT","AL1373.01-11-020-00","3","","07-03-2022","Amar","PPRAJ","2022-03-09"
"AL1373.01","05-010-00- STOPPER HOLDING SHAFT","AL1373.01-05-010-00","3","","05-03-2022","Amar","PPRAJ","2022-03-09"
"AL1373.01","11-01-00-FIXED  BEAM BACK","AL1373.01-11-01-00","3","","07-03-2022","Amar","PPRAJ","2022-03-09"
"AL1373.01","07-031-00-MALE ROLLER","AL1373.01-07-031-00","3","","07-03-2022","Amar","PPRAJ","2022-03-09"
"AL1373.01","09-030-00-PAPER TENTIONER TOP PLATE","AL1373.01-09-030-00","3","","07-03-2022","Amar","PPRAJ","2022-03-09"
"AL1373.01","02-060-00-INSERTER BLADE SUPPORT PLATE","AL1373.01-02-060-00","6","","05-03-2022","Amar","PPRAJ","2022-03-09"
"AL1373.01","11-110-00-DIA 12 GUIDE ROD","AL1373.01-11-110-00","12","","07-03-2022","Amar","PPRAJ","2022-03-09"
"AL1373.01","03-120-00-GUIDE ROD","AL1373.01-03-120-00","6","","05-03-2022","Amar","PPRAJ","2022-03-09"
"AL1373.01","10-061-00-INSERTER BLADE","AL1373.01-10-061-00","16","","07-03-2022","Amar","PPRAJ","2022-03-09"
"AL1373.01","02-020-00-SUPPORT BRACKET","AL1373.01-02-020-00","3","","05-03-2022","Amar","PPRAJ","2022-03-09"
"AL1373.01","11-030-00-NEW CONVEYOR BASE PLATE","AL1373.01-11-030-00","3","","07-03-2022","Amar","PPRAJ","2022-03-09"
"AL1373.01","03-070-00-INSERTER HOLDINIG PLATE","AL1373.01-03-070-00","3","","05-03-2022","Amar","PPRAJ","2022-03-09"
"AL1373.01","11-161-00-MAIN CYL MTG PLATE","AL1373.01-11-161-00","3","","07-03-2022","Amar","PPRAJ","2022-03-09"
"AL1373.01","07-017-00 DRIVEN GEAR","AL1373.01-07-017-00","3","","07-03-2022","Amar","PPRAJ","2022-03-09"
"AL1373.01","10-011-00-CYLINDER COUPLER","AL1373.01-10-011-00","3","","07-03-2022","Amar","PPRAJ","2022-03-09"
"AL1373.01","02-150-00-GUIDE ROD","AL1373.01-02-150-00","6","","05-03-2022","Amar","PPRAJ","2022-03-09"
"AL1373.01","11-04-00-WALKING BEAM-BACK SIDE PLT","AL1373.01-11-04-00","3","","07-03-2022","Amar","PPRAJ","2022-03-09"
"AL1373.01","02-171-00 L-PATE FOR RAIL MTG","AL1373.01-02-171-00","3","","05-03-2022","Amar","PPRAJ","2022-03-09"
"AL1373.01","11-270-00-BRACKET GUIDE PLATE","AL1474.01-11-270-00","6","","07-03-2022","Amar","PPRAJ","2022-03-09"
"AL1373.01","07-210-00 TOP MTG BRKT","AL1373.01-07-210-00","3","","07-03-2022","Amar","PPRAJ","2022-03-09"
"AL1373.01","08-02-00-BASE GUIDE","AL1373.01-08-02-00","3","","07-03-2022","Amar","PPRAJ","2022-03-09"
"AL1373.01","01-140-00-PAWL","AL1373.01-01-140-00","6","","04-03-2022","Amar","PPRAJ","2022-03-09"
"AL1373.01","11-27-00-FIXED BEAM MTG HSG","AL1373.01-11-27-00","12","","07-03-2022","Amar","PPRAJ","2022-03-09"
"AL1373.01","02-120-00-CUTTER GIDE PLTE","AL1373.01-02-120-00","6","","05-03-2022","Amar","PPRAJ","2022-03-09"
"AL1373.01","11-130-00-MAIN COUPLER","AL1373.01-11-130-00","3","","07-03-2022","Amar","PPRAJ","2022-03-09"
"AL1373.01","05-060-00-PART SENSOR MTG PLATE","AL1373.01-05-060-00","3","","05-03-2022","Amar","PPRAJ","2022-03-09"
"AL1373.01","07-155-00 INNER SPACER","AL1373.01-07-155-00","3","","09-03-2022","Amar","PPRAJ","2022-03-09"
"AL1373.01","07-140-00-GUIDE ROD DIA 8","AL1373.01-07-140-00","6","","07-03-2022","Amar","PPRAJ","2022-03-09"
"AL1373.01","01-222-00-GUIDE PLATE 22 PAPER","AL1373.01-01-222-00","3","","04-03-2022","Amar","PPRAJ","2022-03-09"
"AL1373.01","06-060-00-SIDE PLT FOR ROLL HOLDER","AL1373.01-06-060-00","6","","09-03-2022","Amar","PPRAJ","2022-03-09"
"AL1373.01","02-106-00-CYLINDER COUPLER","AL1373.01-02-106-00","3","","05-03-2022","Amar","PPRAJ","2022-03-09"
"AL1373.01","11-40-00-COMP HOLDER","AL1373.01-11-40-00","6","","07-03-2022","Amar","PPRAJ","2022-03-09"
"AL1373.01","05-020-00-SHAFT  MTG BLOCK","AL1373.01-05-020-00","3","","05-03-2022","Amar","PPRAJ","2022-03-09"
"AL1373.01","11-03-00-WALKING BEAM-FRONT  SIDE PLT","AL1373.01-11-03-00","3","","07-03-2022","Amar","PPRAJ","2022-03-09"
"AL1373.01","07-080-00-PAPER SUPPORTER PIN","AL1373.01-07-080-00","6","","07-03-2022","Amar","PPRAJ","2022-03-09"
"AL1373.01","09-040-00-TENSIONER RELIEF PIN","AL1373.01-09-040-00","3","","07-03-2022","Amar","PPRAJ","2022-03-09"
"AL1373.01","02-070-00-PAPER SUPPORT CONVEAR","AL1373.01-02-070-00","3","","05-03-2022","Amar","PPRAJ","2022-03-09"
"AL1373.01","11-11-00 SENSOR MTG BRKT","AL1474.01-11-11-00","6","","07-03-2022","Amar","PPRAJ","2022-03-09"
"AL1373.01","04-010-00-IXR CYL CONNTR","AL1373.01-04-010-00","3","","05-03-2022","Amar","PPRAJ","2022-03-09"
"AL1400.01","06-10-00-PIN FOR DOWEL","AL1400.01-06-10-00","2","","11-02-2022","Nitish","PPRAJ","2022-02-11"
"AL1400.01","06-09-R1-COMP HOLDING BLK 220","AL1400.01-06-09-R1","1","","10-12-2021","Nitish","PPRAJ","2021-12-10"
"AL1400.01","08-010-00-COMPONENT HOLDING BKT","AL1400.04-08-010-00","35","","30-08-2021","Nitish","PPRAJ","2021-08-30"
"AL1400.01","02-04-R1-CYLINDER HOLDER PLATE","AL1400.01-02-04-R1","1","","19-05-2022","Amar","PPRAJ","2022-05-19"
"AL1400.01","06-08-00-PRESSING SHAFT","AL1400.01-06-08-00","1","","03-11-2021","Sunil","PPRAJ","2021-11-03"
"AL1400.01","02-11-00-L -PLATE","AL1400.01-02-11-00","2","","21-09-2021","Amar","PPRAJ","2021-09-21"
"AL1400.01","08-020-00-PART LOACATING AFTER COM PRESS","AL1400.04-08-020-00","36","","30-08-2021","Nitish","PPRAJ","2021-08-30"
"AL1400.01","06-09-00-COMP HOLDING BLK 220","AL1400.01-06-09-00","1","","01-12-2021","Nitish","PPRAJ","2021-12-01"
"AL1400.01","02-12-00-SIDE L PLATE","AL1400.01-02-12-00","2","","21-09-2021","Amar","PPRAJ","2021-09-21"
"AL1400.01","08-030-00-PART LOACATING","AL1400.04-08-030-00","30","","30-08-2021","Nitish","PPRAJ","2021-08-30"
"AL1400.01","03-13-00-STOPPER PAD-220","AL1400.01-03-13-00","2","","09-11-2021","Amar","PPRAJ","2021-11-09"
"AL1400.01","06-020-00-REJECTION CHUTE ASSY","AL1400.01-06-020-00-REJECTION CHUTE ASSY","18","","27-10-2021","Kiran","PPRAJ","2021-10-27"
"AL1400.01","02-02-R1-TOP SUPPORT WASHER","AL1400.01-02-02-R1","2","","19-05-2022","Amar","PPRAJ","2022-05-19"
"AL1400.02","21-150-00-SHAFT","AL1400.02-21-150-00","2","","17-05-2022","Amar","PPRAJ","2022-07-28"
"AL1400.02","24-120-00-CYL MOVEMENT PLT","AL1400.02-24-120-00","1","","17-05-2022","Amar","PPRAJ","2022-07-28"
"AL1400.02","30-160-00-COUPLER","AL1400.02-30-160-00","1","","18-05-2022","Amar","PPRAJ","2022-07-28"
"AL1400.02","19-219-00-SUPPORT FOR SPRING PLUNGER","AL1400.02-19-211-00","1","","17-05-2022","Amar","PPRAJ","2022-07-28"
"AL1400.02","24-30-00-CYLINDER COUPLER","AL1400.02-24-30-00","1","","17-05-2022","Amar","PPRAJ","2022-07-28"
"AL1400.02","28-011-00 STOPPER GUIDE BASE","AL1400.02-28-011-00","1","","18-05-2022","Amar","PPRAJ","2022-07-28"
"AL1400.02","19-010-00-INDEXER BASE PLATE","AL1400.02-19-010-00","1","","17-05-2022","Amar","PPRAJ","2022-07-28"
"AL1400.02","21-040-00-ROLLER MOUNTING  PLATE FOR FRONT","AL1400.02-13-040-00","1","","17-05-2022","Amar","PPRAJ","2022-07-28"
"AL1400.02","23-02-00-BASE GUIDE","AL1400.02-23-02-00","1","","17-05-2022","Amar","PPRAJ","2022-07-28"
"AL1400.02","28-015-00 COUPLER","AL1400.02-28-015-00","1","","18-05-2022","Amar","PPRAJ","2022-07-28"
"AL1400.02","19-130-00-PAWL HOLDER","AL1400.02-19-130-00","1","","17-05-2022","Amar","PPRAJ","2022-07-28"
"AL1400.02","31-290-R1-GUIDE ROD","AL1400.02-31-290-R1","4","","18-03-2022","Amar","PPRAJ","2022-03-18"
"AL1400.02","60-080-00-PAPER ROLLER BUSH","AL1400.02-60-080-00","1","","18-05-2022","Amar","PPRAJ","2022-07-28"
"AL1400.02","20-050-R1-PAPER PUNCH","AL1400.02-20-050-00","1","","17-05-2022","Amar","PPRAJ","2022-07-28"
"AL1400.02","22-150-00-SHAFT","AL1400.02-22-150-00","2","","17-05-2022","Amar","PPRAJ","2022-07-28"
"AL1400.02","02-190-00-CYLINDER MTG PLATE","AL1400.02-02-190-00","1","","22-04-2022","Amar","PPRAJ","2022-04-22"
"AL1400.02","27-012-00-PAPER GUIDE BLOCK","AL1400.02-27-012-00","1","","17-05-2022","Amar","PPRAJ","2022-07-28"
"AL1400.02","60-050-00-SHEET MTG PLT","AL1400.02-60-050-00","2","","18-05-2022","Amar","PPRAJ","2022-07-28"
"AL1400.02","19-020-00-INDEXER HOUSING","AL1400.02-11-020-00","1","","17-05-2022","Amar","PPRAJ","2022-07-28"
"AL1400.02","22-050-00-SHAFT FOR REMOVABLE ROLLER","AL1400.02-22-050-00","1","","17-05-2022","Amar","PPRAJ","2022-07-28"
"AL1400.02","25-030-00-PAPER TENTIONER TOP PLATE","AL1400.02-25-030-00","1","","17-05-2022","Amar","PPRAJ","2022-07-28"
"AL1400.02","30-320-00-GILLETIN CLAMP PLT","AL1400.02-30-320-00","1","","18-05-2022","Amar","PPRAJ","2022-07-28"
"AL1400.02","19-310-00-SUPPORT WASHER","AL1400.02-19-310-00","1","","17-05-2022","Amar","PPRAJ","2022-07-28"
"AL1400.02","21-200-00-HLDR FOR REMOVABLE ROLLER","AL1400.02-21-200-00","1","","17-05-2022","Amar","PPRAJ","2022-07-28"
"AL1400.02","25-060-00-EXTENSION PLATE","AL1400.02-25-060-00","1","","17-05-2022","Amar","PPRAJ","2022-07-28"
"AL1400.02","30-170-00-BLADE HOLDING PLATE","AL1400.02-30-170-00","1","","18-05-2022","Amar","PPRAJ","2022-07-28"
"AL1400.02","19-250-00-SPACER","AL1400.02-19-250-00","1","","17-05-2022","Amar","PPRAJ","2022-07-28"
"AL1400.02","24-070-00-PUNCH SLIDE  CYLINDER COUPLER","AL1400.02-24-070-00","1","","17-05-2022","Amar","PPRAJ","2022-07-28"
"AL1400.02","28-012-00 STOPPER MOUNTING PLATE","AL1400.02-28-012-00","1","","18-05-2022","Amar","PPRAJ","2022-07-28"
"AL1400.02","19-200-00-INDEXER LOCATER","AL1400.02-19-200-00","1","","17-05-2022","Amar","PPRAJ","2022-07-28"
"AL1400.02","14-060-R1-ROLLER PUSHING SPRING","AL1400.02-14-060-R1","6","","16-03-2022","Amar","PPRAJ","2022-03-16"
"AL1400.02","21-051-00-SHAFT FOR REMOVABLE ROLLER","AL1400.02-21-051-00","1","","17-05-2022","Amar","PPRAJ","2022-07-28"
"AL1400.02","23-03-00-BASE GUIDE","AL1400.02-23-03-00","1","","17-05-2022","Amar","PPRAJ","2022-07-28"
"AL1400.02","28-001-00 STOPPER GUIDE BASE RH","AL1400.02-28-001-00","1","","18-05-2022","Amar","PPRAJ","2022-07-28"
"AL1400.02","19-140-00-PAWL","AL1400.02-19-140-00","1","","17-05-2022","Amar","PPRAJ","2022-07-28"
"AL1400.02","60-081-00-SENSOR MTG BRKT","AL1400.02-60-081-00","6","","18-05-2022","Amar","PPRAJ","2022-07-28"
"AL1400.02","20-60-00-PUNCH CYL MTG BKT","AL1400.02-20-60-00","1","","17-05-2022","Amar","PPRAJ","2022-07-28"
"AL1400.02","22-160-00-ROLLER HOLDING PLATE","AL1400.02-22-160-00","1","","17-05-2022","Amar","PPRAJ","2022-07-28"
"AL1400.02","28-013-00 L BRACKET","AL1400.02-28-013-00","1","","28-07-2022","Amar","PPRAJ","2022-07-28"
"AL1400.02","19-030-00-INDEXER ADAPTER","AL1400.02-19-030-00","1","","17-05-2022","Amar","PPRAJ","2022-07-28"
"AL1400.02","60-060-00-SIDE PLT FOR ROLL HOLDER","AL1400.02-60-060-00","2","","18-05-2022","Amar","PPRAJ","2022-07-28"
"AL1400.02","20-010-00-PUNCH MTG BKT","AL1400.02-20-010-00","1","","17-05-2022","Amar","PPRAJ","2022-07-28"
"AL1400.02","22-110-00-TENSTIONER PLATE","AL1400.02-22-110-00","2","","17-05-2022","Amar","PPRAJ","2022-07-28"
"AL1400.02","25-040-00-TENSIONER RELIEF PIN","AL1400.02-25-040-00","1","","17-05-2022","Amar","PPRAJ","2022-07-28"
"AL1400.02","60-010-00 ROLL HOLDER L PLATE","AL1400.02-60-010-00","1","","18-05-2022","Amar","PPRAJ","2022-07-28"
"AL1400.02","19-340-00-T BOLT","AL1400.02-19-340-00","1","","17-05-2022","Amar","PPRAJ","2022-07-28"
"AL1400.02","31-160-00-COUPLER","AL1400.02-31-160-00","1","","22-02-2022","Amar","PPRAJ","2022-02-22"
"AL1400.02","21-210-00 GUIDE ROD","AL1400.02-21-210-00","2","","17-05-2022","Amar","PPRAJ","2022-07-28"
"AL1400.02","25-010-00-PAPER TENTIONER PLATE","AL1400.02-25-010-00","1","","17-05-2022","Amar","PPRAJ","2022-07-28"
"AL1400.02","30-180-000-CUTTER CYLINDER MTG PLATE","AL1400.02-30-180-00","1","","18-05-2022","Amar","PPRAJ","2022-07-28"
"AL1400.02","19-270-00-PAWL SLIDE PLATE","AL1400.02-19-270-00","1","","17-05-2022","Amar","PPRAJ","2022-07-28"
"AL1400.02","21-110-00-TENSTIONER PLATE","AL1400.02-21-110-00","2","","17-05-2022","Amar","PPRAJ","2022-07-28"
"AL1400.02","24-090-00-PUNCH SLIDER CYL MTG BKT","AL1400.02-24-090-00","1","","17-05-2022","Amar","PPRAJ","2022-07-28"
"AL1400.02","28-111-00 T SLOT","AL1400.02-28-111-00","1","","18-05-2022","Amar","PPRAJ","2022-07-28"
"AL1400.02","19-210-00-COMPONENT GUIDE","AL1400.02-19-210-00","2","","17-05-2022","Amar","PPRAJ","2022-07-28"
"AL1400.02","16-30-R1-CYLINDER COUPLER","AL1400.02-16-30-R1","1","","16-03-2022","Amar","PPRAJ","2022-03-16"
"AL1400.02","23-330-00-BASE PLATE","AL1400.02-23-330-00","1","","17-05-2022","Amar","PPRAJ","2022-07-28"
"AL1400.02","28-010-00 GUIDE ROD","AL1400.02-28-010-00","2","","18-05-2022","Amar","PPRAJ","2022-07-28"
"AL1400.02","19-190-00-CYLINDER MTG PLATE","AL1400.02-19-190-00","1","","17-05-2022","Amar","PPRAJ","2022-07-28"
"AL1400.02","60-110-00- L PLATE FOR ROLLER HLDNG MTG","AL1400.02-60-110-00","1","","18-05-2022","Amar","PPRAJ","2022-07-28"
"AL1400.02","20-110-00-CYL COUPLER","AL1400.02-20-110-00","1","","17-05-2022","Amar","PPRAJ","2022-07-28"
"AL1400.02","22-170-00-GUIDE ROD","AL1400.02-22-170-00","2","","17-05-2022","Amar","PPRAJ","2022-07-28"
"AL1400.02","28-014-00 COUPLER MTG PLATE","AL1400.02-28-014-00","1","","18-05-2022","Amar","PPRAJ","2022-07-28"
"AL1400.02","19-061-00-PAPER FORMER PLATE","AL1400.02-19-061-00","1","","17-05-2022","Amar","PPRAJ","2022-07-28"
"AL1400.02","60-070-00-LOCKING BUSH","AL1400.02-60-070-00","2","","18-05-2022","Amar","PPRAJ","2022-07-28"
"AL1400.02","20-040-00-PAPER CLAMP PLT","AL1400.02-20-040-00","1","","17-05-2022","Amar","PPRAJ","2022-07-28"
"AL1400.02","22-180-00-CLAMP LOCK","AL1400.02-22-180-00","2","","28-07-2022","Amar","PPRAJ","2022-07-28"
"AL1400.02","27-010-00-PAPER FEEDER J-BLOCK","AL1400.02-27-010-00","1","","17-05-2022","Amar","PPRAJ","2022-07-28"
"AL1400.02","60-030-00-SUPPORT ROD","AL1400.02-60-030-00","1","","18-05-2022","Amar","PPRAJ","2022-07-28"
"AL1400.02","19-019-00-SENSOR MTG PLT","AL1400.02-19-019-00","2","","17-05-2022","Amar","PPRAJ","2022-07-28"
"AL1400.02","31-320-00-GILLETIN CLAMP PLT","AL1400.02-31-320-00","1","","22-02-2022","Amar","PPRAJ","2022-02-22"
"AL1400.02","22-010-00-ROLLER MOUNTING  PLATE","AL1400.02-22-010-00","1","","17-05-2022","Amar","PPRAJ","2022-07-28"
"AL1400.02","25-020-00-BACK PLATE","AL1400.02-25-020-00","1","","17-05-2022","Amar","PPRAJ","2022-07-28"
"AL1400.02","30-290-00-GUIDE ROD","AL1400.02-30-290-00","2","","18-05-2022","Amar","PPRAJ","2022-07-28"
"AL1400.02","19-300-00-PAPER SUPPORT BKT","AL1400.02-19-300-00","1","","17-05-2022","Amar","PPRAJ","2022-07-28"
"AL1400.03","04-210-R1-EXPANDER PIN-220","AL1400.03-04-210-R1","35","","26-08-2021","Pavithra","Chandru","2021-08-26"
"AL1400.03","01-060-00- STOPPER PAD-220","AL1400.03-01-060-00","2","","10-11-2021","Pavithra","Chandru","2021-11-10"
"AL1400.04","01-062-00-BASE SIDE COVERS LH","AL1400.04-01-062-00","1","","30-08-2021","Amar","PPRAJ","2021-08-30"
"AL1400.04","03-042-00-NOTCHER WIRE GUIDE","AL1400.04-03-042-00","1","","20-08-2021","Pavithra","Chandru","2021-08-20"
"AL1400.04","02-053-R1-V-TOP CLAMP","AL1400.04-02-053-R1","1","","18-09-2021","Nitish","PPRAJ","2021-09-18"
"AL1400.04","02-071-R1-FEMALE Z-PUNCH","AL1400.04-02-071-R1","1","","26-11-2021","Nitish","PPRAJ","2021-11-26"
"AL1400.04","06-010-00-PIN SLIDER HOLDER","AL1400.04-06-010-00","4","","13-09-2021","Nitish","PPRAJ","2021-09-13"
"AL1400.04","02-086-R1-Z PUNCH HOLDER-220","AL1400.04-02-086-R1","2","","26-11-2021","Nitish","PPRAJ","2021-11-26"
"AL1400.04","06-070-00-PIPE FRONT MOUNTING PLATE","AL1400.04-06-070-00","4","","13-09-2021","Nitish","PPRAJ","2021-09-13"
"AL1400.04","03-025-R1-SWING BAR","AL1400.04-03-025-R1","1","","21-02-2022","Nitish","PPRAJ","2022-02-21"
"AL1400.04","01-059-00-BASE FRONT COVER","AL1400.04-01-059-00","1","","30-08-2021","Amar","PPRAJ","2021-08-30"
"AL1400.04","02-086-R2-Z PUNCH HOLDER-220","AL1400.04-02-086-R2","1","","28-01-2022","Nitish","PPRAJ","2022-01-28"
"AL1400.04","01-018-00-BOTTOM CENTRE PLATE","AL1400.04-01-018-00","2","","30-08-2021","Amar","PPRAJ","2021-08-30"
"AL1400.04","08-020-00-FIXTURE BASE","AL1400.04-08-020-00","2","","30-08-2021","Nitish","PPRAJ","2021-08-30"
"AL1400.04","01-064-00-ON AND OFF SWITCH PLATE","AL1400.04-01-064-00","1","","30-08-2021","Amar","PPRAJ","2021-08-30"
"AL1400.04","03-020-R1-PIN-1","AL1400.04-03-020-R1","4","","04-03-2022","Nitish","PPRAJ","2022-03-04"
"AL1400.04","02-075-R1-TOOL HOLDER SPACER","AL1400.04-02-075-R1","2","","26-11-2021","Nitish","PPRAJ","2021-11-26"
"AL1400.04","06-020-00-PIN SLIDER","AL1400.04-06-020-00","4","","13-09-2021","Nitish","PPRAJ","2021-09-13"
"AL1400.04","02-072-R2-V-TOP CLAMP","AL1400.04-02-072-R2","1","","19-01-2022","Nitish","PPRAJ","2022-01-19"
"AL1400.04","02-06-R1-MALE Z PUNCH-085","AL1400.04-02-06-R1","1","","20-09-2021","Amar","PPRAJ","2021-09-20"
"AL1400.04","02-072-R1-V-TOP CLAMP","AL1400.04-02-072-R1","1","","26-11-2021","Nitish","PPRAJ","2021-11-26"
"AL1400.04","01-060-00-BASE FRONT SIDE COVERS","AL1400.04-01-060-00","3","","30-08-2021","Amar","PPRAJ","2021-08-30"
"AL1400.04","08-023-00-STACK SEAT-220","AL1400.04-08-023-00","3","","28-09-2021","Nitish","PPRAJ","2021-09-28"
"AL1400.04","02-055-R1-FORMING FORK-LH","AL1400.04-02-055-R1","1","","18-09-2021","Nitish","PPRAJ","2021-09-18"
"AL1400.04","02-045-R1-WIRE CLAMPING STICK","AL1400.04-02-045-R1","1","","26-11-2021","Nitish","PPRAJ","2021-11-26"
"AL1400.04","06-A01-00-HAIRPIN CONVEYOR ASSY","AL1400.04-06-A01-00","1","","13-09-2021","Nitish","PPRAJ","2021-09-13"
"AL1400.04","01-065-00-SENSOR CLAMP","AL1400.04-01-065-00","10","","11-11-2021","Nitish","PPRAJ","2021-11-11"
"AL1400.04","02-084-R1-V BENDING TOOL","AL1400.04-02-084-R1","1","","26-11-2021","Nitish","PPRAJ","2021-11-26"
"AL1400.04","04-A06-00-DE ENAMEL SUCTION  ASSY","AL1400.04-04-A06-00","6","","28-03-2022","Nitish","PPRAJ","2022-03-28"
"AL1400.04","06-030-00-PIN SLIDER ASSY HOLDER RH","AL1400.04-06-030-00","8","","13-09-2021","Nitish","PPRAJ","2021-09-13"
"AL1400.04","01-057-00-BASE FRONT DOOR","AL1400.04-01-057-00","1","","30-08-2021","Amar","PPRAJ","2021-08-30"
"AL1400.04","02-085-R2-Z MALE PUNCH - 220","AL1400.04-02-085-R2","1","","14-01-2022","Nitish","PPRAJ","2022-01-14"
"AL1400.04","02-071-R2-FEMALE Z-PUNCH","AL1400.04-02-071-R2","1","","28-01-2022","Nitish","PPRAJ","2022-01-28"
"AL1400.04","08-021-00-SWIVEL BAR","AL1400.04-08-021-00","2","","30-08-2021","Nitish","PPRAJ","2021-08-30"
"AL1400.04","05-022-00-ST.ROLLER Ø4","AL1400.04-05-022-00","30","","10-11-2021","Nitish","PPRAJ","2021-11-10"
"AL1400.04","01-016-00-BOTTOM SIDE PLATE","A;L1400.04-01-016-00","1","","30-08-2021","Amar","PPRAJ","2021-08-30"
"AL1400.04","03-037-R1-NOTCHER LEVER","AL1400.04-03-037-R1","7","","24-09-2021","Nitish","PPRAJ","2021-09-24"
"AL1400.04","02-073-R1-FORMING FORK-RH","AL1400.04-02-073-R1","1","","26-11-2021","Nitish","PPRAJ","2021-11-26"
"AL1400.04","01-061-00-BASE SIDE COVER RH","AL1400.04-01-061-00","1","","30-08-2021","Amar","PPRAJ","2021-08-30"
"AL1400.04","02-052-R1-FEMALE Z-PUNCH","AL1400.04-02-052-R1","1","","18-09-2021","Nitish","PPRAJ","2021-09-18"
"AL1400.04","02-070-R1-TOOL HOLDER BLOCK","AL1400.04-02-070-R1","1","","26-11-2021","Nitish","PPRAJ","2021-11-26"
"AL1400.04","06-060-00-PIPE BACK MOUNTING PLATE","AL1400.04-06-060-00","4","","13-09-2021","Nitish","PPRAJ","2021-09-13"
"AL1400.04","08-010-R2-STACK SEAT-085","AL1400.04-08-010-R2","3","","03-01-2022","Nitish","PPRAJ","2022-01-03"
"AL1400.04","02-085-R1-Z MALE PUNCH - 220","AL1400.04-02-085-R1","1","","26-11-2021","Nitish","PPRAJ","2021-11-26"
"AL1400.04","04-A06-00-DE ENAMEL SUCTION ASSY","AL1400.04-04-A06-00","1","","28-03-2022","Nitish","PPRAJ","2022-03-28"
"AL1400.04","06-050-00-SECOND PIN SLIDER","AL1400.04-06-050-00","4","","13-09-2021","Nitish","PPRAJ","2021-09-13"
"AL1400.04","01-058-00-BASE SIDE FRONT DOOR","AL1400.04-01-058-00","1","","30-08-2021","Amar","PPRAJ","2021-08-30"
"AL1400.04","02-085-R3-Z MALE PUNCH - 220","AL1400.04-02-085-R3","1","","28-01-2022","Nitish","PPRAJ","2022-01-28"
"AL1400.04","08-022-00-BASKET TAPPING CUP","AL1400.04-08-022-00","3","","30-08-2021","Nitish","PPRAJ","2021-08-30"
"AL1400.04","01-017-00-BOTTOM SIDE PLATE LH","AL1400.04-01-017-00","1","","30-08-2021","Amar","PPRAJ","2021-08-30"
"AL1400.04","01-063-00-WELDING BUSH FOR BASE COVERS","AL1400.04-01-063-00","70","","30-08-2021","Amar","PPRAJ","2021-08-30"
"AL1400.04","02-074-R1-FORMING FORK-LH","AL1400.04-02-074-R1","1","","26-11-2021","Nitish","PPRAJ","2021-11-26"
"AL1400.05","02-395-00-PIVOT PIN","AL1400.05-02-395-00","1","","20-09-2021","Sunil","PPRAJ","2021-09-20"
"AL1400.05","02-294-00-TOOL CYL COUPLER","AL1400.05-02-294-00","1","","20-09-2021","Sunil","PPRAJ","2021-09-20"
"AL1400.05","03-070-00-INNER PIN HOLDER","AL1400.05-03-070-00","1","","20-09-2021","Sunil","PPRAJ","2021-09-20"
"AL1400.05","01-160-00-STOPPER HOLDER","AL1400.05-01-160-00","2","","20-09-2021","Sunil","PPRAJ","2021-09-20"
"AL1400.05","02-110-00-PRESS ASSY TENON","AL1400.05-02-110-00","1","","20-09-2021","Sunil","PPRAJ","2021-09-20"
"AL1400.05","02-410-00-CYL MTG WELD PLATE","AL1400.05-02-410-00","1","","20-09-2021","Sunil","PPRAJ","2021-09-20"
"AL1400.05","03-110-00-OUTER HOUSING GUIDE","AL1400.05-03-110-00","1","","20-09-2021","Sunil","PPRAJ","2021-09-20"
"AL1400.05","01-100-00-CYL MTG PLATE","AL1400.05-01-100-00","2","","20-09-2021","Sunil","PPRAJ","2021-09-20"
"AL1400.05","02-070-00-LM BUTTING BAR","AL1400.05-02-070-00","2","","20-09-2021","Sunil","PPRAJ","2021-09-20"
"AL1400.05","02-161-00-GUIDE ROD STOPPER","AL1400.05-02-161-00","2","","20-09-2021","Sunil","PPRAJ","2021-09-20"
"AL1400.05","02-392-00-CYL PIVOT","AL1400.05-02-392-00","2","","20-09-2021","Sunil","PPRAJ","2021-09-20"
"AL1400.05","01-090-00-EJECTOR PIN-1","AL1400.05-01-090-00","4","","20-09-2021","Sunil","PPRAJ","2021-09-20"
"AL1400.05","02-051-00-OUTER WEDGE-S","AL1400.05-05-02-051-00","3","","20-09-2021","Sunil","PPRAJ","2021-09-20"
"AL1400.05","02-300-00-IRIS PIN HOLDER PLATE","AL1400.05-02-300-00","1","","20-09-2021","Sunil","PPRAJ","2021-09-20"
"AL1400.05","02-030-00-BASE PLATE FOR SLIDE","AL1400.05-02-030-00","1","","20-09-2021","Sunil","PPRAJ","2021-09-20"
"AL1400.05","01-058-00-BOTTOM SHEET-1","AL1400.05-01-058-00","1","","20-09-2021","Sunil","PPRAJ","2021-09-20"
"AL1400.05","01-040-00-DRIVING SPUR GEAR","AL1400.05-01-040-00","1","","20-09-2021","Sunil","PPRAJ","2021-09-20"
"AL1400.05","02-157-00-DOOMNUT FOR PRESS SLIDE","AL1400.05-02-157-00","1","","20-09-2021","Sunil","PPRAJ","2021-09-20"
"AL1400.05","02-010-00-SLIDE PILLAR","AL1400.05-02-010-00","1","","20-09-2021","Sunil","PPRAJ","2021-09-20"
"AL1400.05","01-055-00-BOTTOM SHEET","AL1400.05-01-055-00","1","","20-09-2021","Sunil","PPRAJ","2021-09-20"
"AL1400.05","01-170-00-STOPPER L PLATE","AL1400.05-01-170-00","2","","20-09-2021","Sunil","PPRAJ","2021-09-20"
"AL1400.05","02-396-00-WASHER FOR PIVOT PIN","AL1400.05-02-396-00","1","","20-09-2021","Sunil","PPRAJ","2021-09-20"
"AL1400.05","02-430-00-COUPLER","AL1400.05-02-430-00","1","","20-09-2021","Sunil","PPRAJ","2021-09-20"
"AL1400.05","03-080-00-BASE PLATE","AL1400.05-03-080-00","1","","20-09-2021","Sunil","PPRAJ","2021-09-20"
"AL1400.05","02-155-00-CYL MTG L PLATE","AL1400.05-02-155-00","1","","20-09-2021","Sunil","PPRAJ","2021-09-20"
"AL1400.05","02-420-00-PIN PUSHER","AL1400.05-02-420-00","1","","20-09-2021","Sunil","PPRAJ","2021-09-20"
"AL1400.05","03-050-00-PINION GEAR","AL1400.05-03-050-00","1","","20-09-2021","Sunil","PPRAJ","2021-09-20"
"AL1400.05","01-140-00-STACK EJECTOR","AL1400.05-01-140-00","1","","20-09-2021","Sunil","PPRAJ","2021-09-20"
"AL1400.05","02-080-00-LM JACKING BAR","AL1400.05-02-080-00","2","","20-09-2021","Sunil","PPRAJ","2021-09-20"
"AL1400.05","02-170-00-PRESS TOOL MTG PLATE","AL1400.05-02-170-00","1","","20-09-2021","Sunil","PPRAJ","2021-09-20"
"AL1400.05","02-393-00-CYL MTG PLATE","AL1400.05-02-393-00","1","","20-09-2021","Sunil","PPRAJ","2021-09-20"
"AL1400.05","01-120-00-STACK HOLDER","AL1400.05-01-120-00","1","","20-09-2021","Sunil","PPRAJ","2021-09-20"
"AL1400.05","02-060-00-SLIDE PLATE","AL1400.05-02-060-00","3","","20-09-2021","Sunil","PPRAJ","2021-09-20"
"AL1400.05","02-310-00-IRIS PIN","AL1400.05-02-310-00","30","","20-09-2021","Sunil","PPRAJ","2021-09-20"
"AL1400.05","02-040-00-INNER WEDGE","AL1400.05-02-040-00","3","","20-09-2021","Sunil","PPRAJ","2021-09-20"
"AL1400.05","01-050-00-LOCKING BUSH","AL1400.05-01-050-00","1","","20-09-2021","Sunil","PPRAJ","2021-09-20"
"AL1400.05","02-050-00-OUTER WEDGE","AL1400.05-02-050-00","3","","20-09-2021","Sunil","PPRAJ","2021-09-20"
"AL1400.05","02-160-00-GUIDE ROD - DIA 20","AL1400.05-02-160-00","2","","20-09-2021","Sunil","PPRAJ","2021-09-20"
"AL1400.05","02-011-00-SLIDE PILLAR RH","AL1400.05-02-011-00","1","","20-09-2021","Sunil","PPRAJ","2021-09-20"
"AL1400.05","01-056-00-BASE COVER","AL1400.05-01-056-00","3","","20-09-2021","Sunil","PPRAJ","2021-09-20"
"AL1400.05","01-180-00-STOPPER SPRING","AL1400.05-01-180-00","10","","20-09-2021","Sunil","PPRAJ","2021-09-20"
"AL1400.05","02-330-00-IRIS HOUSING","AL1400.05-02-330-00","1","","20-09-2021","Sunil","PPRAJ","2021-09-20"
"AL1400.05","02-295-00-COUPLER HOLDER","AL1400.05-02-295-00","1","","20-09-2021","Sunil","PPRAJ","2021-09-20"
"AL1400.05","02-156-00-SPACER FOR LM UNIT","AL1400.05-02-156-00","4","","20-09-2021","Sunil","PPRAJ","2021-09-20"
"AL1400.05","02-255-00-B-TOOLING BASE","AL1400.05-02-255-00","1","","20-09-2021","Sunil","PPRAJ","2021-09-20"
"AL1400.05","03-060-00-OUTER PIN HOLDER","AL1400.05-03-060-00","1","","20-09-2021","Sunil","PPRAJ","2021-09-20"
"AL1400.05","01-150-00-GEAR STOPPER","AL1400.05-01-150-00","2","","20-09-2021","Sunil","PPRAJ","2021-09-20"
"AL1400.05","02-090-00-CONNECTOR BLOCK","AL1400.05-02-090-00","2","","20-09-2021","Sunil","PPRAJ","2021-09-20"
"AL1400.05","02-200-00-PIN PRESS FOR G20-946","AL1400.05-02-200-00","1","","20-09-2021","Sunil","PPRAJ","2021-09-20"
"AL1400.05","03-100-00-LINK PLATE","AL1400.05-03-100-00","1","","20-09-2021","Sunil","PPRAJ","2021-09-20"
"AL1400.05","01-095-00-EJECTOR DISC","AL1400.05-01-095-00","1","","20-09-2021","Sunil","PPRAJ","2021-09-20"
"AL1400.05","02-065-00-TOOL SLIDE CYL MTG PLATE","AL1400.05-02-065-00","1","","20-09-2021","Sunil","PPRAJ","2021-09-20"
"AL1400.05","02-320-00-IRIS SLIDE COVER","AL1400.05-02-320-00","1","","20-09-2021","Sunil","PPRAJ","2021-09-20"
"AL1400.05","02-041-00-INNER WEDGE-S","AL1400.05-02-041-00","3","","20-09-2021","Sunil","PPRAJ","2021-09-20"
"AL1400.05","01-080-00-EJECTOR PIN HOLDER","AL1400.05-01-080-00","1","","20-09-2021","Sunil","PPRAJ","2021-09-20"
"AL1400.05","02-394-00-IRIS COUPLER","AL1400.05-02-394-00","1","","20-09-2021","Sunil","PPRAJ","2021-09-20"
"AL1400.05","02-180-00-PRESS CYL COUPLER","AL1400.05-02-180-00","1","","20-09-2021","Sunil","PPRAJ","2021-09-20"
"AL1400.05","02-020-00-PILLAR SPACER","AL1400.05-02-020-00","2","","20-09-2021","Sunil","PPRAJ","2021-09-20"
"AL1400.05","01-057-00-SIDE BASE COVER","AL1400.05-01-057-00","2","","20-09-2021","Sunil","PPRAJ","2021-09-20"
"AL1400.05","01-030-00-GEAR BOX MTG PLATE","AL1400.05-01-030-00","1","","20-09-2021","Sunil","PPRAJ","2021-09-20"
"AL1400.05","02-360-00-IRIS LEVER","AL1400.05-02-360-00","1","","20-09-2021","Sunil","PPRAJ","2021-09-20"
"AL1400.05","02-391-00-IRIS CYL PIVOT HOLDER","AL1400.05-02-391-00","2","","20-09-2021","Sunil","PPRAJ","2021-09-20"
"AL1400.05","01-010-00-BASE STRUCTURE","AL1400.05-01-010-00","1","","20-09-2021","Sunil","PPRAJ","2021-09-20"
"AL1400.07","03-311-00-CUP TOP L BRKT","AL1400.07-03-311-00","1","","11-03-2022","Nitish","PPRAJ","2022-03-11"
"AL1400.07","03-312-00-CUP BOTTOM L BRKT","AL1400.07-03-312-00","1","","11-03-2022","Nitish","PPRAJ","2022-03-11"
"AL1400.08","03-55-R1-IRIS ARM","AL1400.08-03-55-R1","1","","21-01-2022","Nitish","PPRAJ","2022-01-21"
"AL1400.08","03-56-R1-SLOT PLATE COVER","AL1400.08-03-56-R1","1","","24-01-2022","Nitish","PPRAJ","2022-01-24"
"AL1400.08","03-23-R1-IRIS PIN","AL1400.08-03-23-R1","30","","21-01-2022","Nitish","PPRAJ","2022-01-21"
"AL1400.08","03-55-R2-IRIS ARM","AL1400.08-03-55-R2","1","","05-03-2022","Nitish","PPRAJ","2022-03-05"
"AL1400.08","03-26-R1-SLOT PLATE COVER","AL1400.08-03-26-R1","1","","24-01-2022","Nitish","PPRAJ","2022-01-24"
"AL1400.08","03-11-R1-TWISTER ARM FOR OUTER TOOL","AL1400.08-03-11-R1","1","","24-05-2022","Nitish","PPRAJ","2022-05-24"
"AL1400.08","03-53-R1-IRIS PIN","AL1400.08-03-53-R1","30","","21-01-2022","Nitish","PPRAJ","2022-01-21"
"AL1400.08","03-25-R1-IRIS ARM","AL1400.08-03-25-R1","1","","27-12-2021","Nitish","PPRAJ","2021-12-27"
"AL1400.09","04-13-R1- GAUGE LOCATOR","AL1400.09-04-13-R1","2","","21-01-2022","Nitish","PPRAJ","2022-01-21"
"AL1400.09","04-08-00- BRACKET","AL1400.09-04-08-00","1","","17-12-2021","Nitish","PPRAJ","2021-12-17"
"AL1400.09","04-14-00- GAUGE PIN","AL1400.09-04-14-00","1","","29-01-2022","Nitish","PPRAJ","2022-01-29"
"AL1400.09","04-16-00-BASE PLATE","AL1400.09-04-16-00","1","","28-02-2022","Nitish","PPRAJ","2022-02-28"
"AL1400.09","04-18-00- GAUGE LOCATOR","AL1400.09-04-18-00","1","","28-02-2022","Nitish","PPRAJ","2022-02-28"
"AL1400.09","04-19-00-CYLINDER CLAMP","AL1400.09-04-19-00","1","","12-03-2022","Nitish","PPRAJ","2022-03-12"
"AL1400.09","04-09-00- GEAR END GAUGE BLOCK","AL1400.09-04-09-00","1","","17-12-2021","Nitish","PPRAJ","2021-12-17"
"AL1400.09","04-15-00- L BRCKET MOUNT","AL1400.09-04-15-00","1","","29-01-2022","Nitish","PPRAJ","2022-01-29"
"AL1400.09","04-02-00- V BLOCK","AL1400.09-04-02-00","1","","17-12-2021","Nitish","PPRAJ","2021-12-17"
"AL1400.09","04-17-00-CYLINDER CLAMP","AL1400.09-04-17-00","1","","28-02-2022","Nitish","PPRAJ","2022-02-28"
"AL1400.09","04-12-00- L BRCKET","AL1400.09-04-12-00","1","","29-01-2022","Nitish","PPRAJ","2022-01-29"
"AL1400.09","04-05-00- BRACKET","AL1400.09-04-05-00","1","","28-02-2022","Nitish","PPRAJ","2022-02-28"
"AL1400.09","04-10-00- STOPPER","AL1400.09-04-10-00","1","","17-12-2021","Nitish","PPRAJ","2021-12-17"
"AL1400.09","04-07-00- GUIDE","AL1400.09-04-07-00","1","","17-12-2021","Nitish","PPRAJ","2021-12-17"
"AL1400.09","04-06-00- LOCATOR","AL1400.09-04-06-00","1","","24-02-2022","Nitish","PPRAJ","2022-02-24"
"AL1400.09","04-13-00- GAUGE LOCATOR","AL1400.09-04-13-00","1","","29-01-2022","Nitish","PPRAJ","2022-01-29"
"AL1400.09","04-06-R1- LOCATOR","AL1400.09-04-06-R1","1","","28-02-2022","Nitish","PPRAJ","2022-02-28"
"AL1400.09","04-11-00- SPRING","AL1400.09-04-11-00","4","","17-12-2021","Nitish","PPRAJ","2021-12-17"
"AL1400.10","01-161-R1-BASKET FOR 085","AL1400.10-01-161-R1","1","","21-03-2022","Nitish","PPRAJ","2022-03-21"
"AL1400.10","01-161-00-BASKET FOR 085","AL1400.10-01-0161-00","2","","01-10-2021","Nitish","PPRAJ","2021-10-01"
"AL1400.10","01-163-00-BASKET FOR 220","AL1400.10-01-163-00","1","","21-03-2022","Nitish","PPRAJ","2022-03-21"
"AL1400.10","01-162-00-SUPPORTING BLOCK - 085","AL1400.10-01-162-00","2","","06-10-2021","Sunil","PPRAJ","2021-10-06"
"AL1400.10","01-170-00-DRAW BAR","AL1400.10-01-170-00","1","","04-07-2022","Nitish","PPRAJ","2022-07-04"
"AL1400.11","04-210-00-SPACER FOR STOPPER","AL1400.11-04-210-00","1","","06-10-2021","Pavithra","Chandru","2021-10-06"
"AL1400.11","04-290-00-GUIDE PIN-220","AL1400.11-04-290-00","2","","16-03-2022","Nitish","PPRAJ","2022-03-16"
"AL1400.11","04-190-00-CYL SUPPORT","AL1400.11-04-190-00","1","","30-09-2021","Pavithra","Chandru","2021-09-30"
"AL1400.11","04-200-00-PUSHER COUPLER","AL1400.11-04-200-00","1","","30-09-2021","Pavithra","Chandru","2021-09-30"
"AL1400.12","11-140-00-ADJUSTABLE COVER SHEET","AL1400.12-11-140-00-ADJUSTABLE COVER SHEET","4","","01-12-2021","Dayanand","PPRAJ","2021-12-01"
"AL1400.12","04-150-00-SPACER BUSH","AL1400.12-04-150-00-SPACER BUSH","3","","26-08-2021","Dayanand","PPRAJ","2021-08-26"
"AL1400.12","11-110-00-SUCTION CUP-085","AL1400.12-11-110-00-SUCTION CUP-085","1","","01-12-2021","Dayanand","PPRAJ","2021-12-01"
"AL1400.12","04-050-R1-CENTERING SHAFT","AL1400.12-04-050-R1-CENTERING SHAFT","2","","31-03-2022","Dayanand","PPRAJ","2022-03-31"
"AL1400.12","05-070-R1-SPACER PLATE","AL1400.12-05-070-R1-SPACER PLATE","1","","06-09-2021","Kiran","PPRAJ","2021-09-06"
"AL1400.12","11-120-00-TOP CUP SUCTION","AL1400.12-11-120-00-TOP CUP SUCTION","1","","01-12-2021","Dayanand","PPRAJ","2021-12-01"
"AL1400.12","03-140-R1-DEAD CENTER","AL1400.12-03-140-R1-DEAD CENTER","2","","01-04-2022","Dayanand","PPRAJ","2022-04-01"
"AL1400.12","05-570-00-COMPONENT HOLDER","AL1400.12-05-570-00-COMPONENT HOLDER","1","","28-07-2022","Dayanand","PPRAJ","2022-07-28"
"AL1400.12","05-530-R1-CRADLE BASE PLATE","AL1400.12-05-530-R1","1","","04-09-2021","Kiran","PPRAJ","2021-09-04"
"AL1400.12","11-130-00-SUCTION CUP-220","AL1400.12-11-130-00-SUCTION CUP-220","1","","01-12-2021","Dayanand","PPRAJ","2021-12-01"
"AL1400.12","11-100-00-CUP MTG PIPE","AL1400.12-11-100-00-CUP MTG PIPE","1","","01-12-2021","Dayanand","PPRAJ","2021-12-01"
"AL1400.13","07-04-00-HOUSING LOCATOR DISC","AL1400.13-07-04-00","1","","13-09-2021","Amar","PPRAJ","2021-09-13"
"AL1400.13","03-04-00-BUSH","AL1400.13-03-04-00","1","","23-11-2021","Amar","PPRAJ","2021-11-23"
"AL1400.13","07-02-00-RING LOCATOR HOUSING","AL1400.13-07-02-00","1","","13-09-2021","Amar","PPRAJ","2021-09-13"
"AL1435.02","15-200-R2-SPACER PLT RH","AL1435.02-15-200-R2","4","","18-04-2022","Amar","PPRAJ","2022-04-18"
"AL1435.02","15-181-R1-FRONT FIXED FRAME","AL1435.02-15-181-R1","1","","07-09-2021","Nirmal","PPRAJ","2021-09-07"
"AL1435.02","17-181-00-FRONT FIXED FRAME","AL1435.02-17-181-00","1","","30-12-2021","Amar","PPRAJ","2021-12-30"
"AL1435.02","15-02-R1-WALKING BEAM-BACK SIDE PLT","AL1435.02-15-02-R1","1","","07-09-2021","Nirmal","PPRAJ","2021-09-07"
"AL1435.02","17-02-00-WALKING BEAM-BACK SIDE PLT","AL1435.02-17-02-00","1","","30-12-2021","Amar","PPRAJ","2021-12-30"
"AL1435.02","01-220-R1-GUIDE PLATE 22 PAPER","AL1435.02-01-220-R1 (23 paper)","2","","07-09-2021","Nirmal","PPRAJ","2021-09-07"
"AL1435.02","15-200-R1-SPACER PLT RH","AL1435.02-15-200-R1","2","","07-09-2021","Nirmal","PPRAJ","2021-09-07"
"AL1435.02","15-03-R1-WALKING BEAM-FRONT  SIDE PLT","AL1435.02-15-03-R1","1","","07-09-2021","Nirmal","PPRAJ","2021-09-07"
"AL1435.02","17-03-00-WALKING BEAM-FRONT  SIDE PLT","AL1435.02-17-03-00","1","","30-12-2021","Amar","PPRAJ","2021-12-30"
"AL1435.02","02-030-R1-SIDE GUIDE PLT RH","AL1435.02-02-030-R1","1","","07-09-2021","Nirmal","PPRAJ","2021-09-07"
"AL1435.02","15-180-R1-FRONT FIXED FRAME","AL1435.02-15-180-R1","1","","07-09-2021","Nirmal","PPRAJ","2021-09-07"
"AL1435.02","15-210-R1-GUIDE ROD","AL1435.02-15-210-R1","4","","07-09-2021","Nirmal","PPRAJ","2021-09-07"
"AL1435.02","17-180-00-FRONT FIXED FRAME","AL1435.02-17-180-00","1","","30-12-2021","Amar","PPRAJ","2021-12-30"
"AL1435.02","02-040-R1-SIDE GUIDE PLT","AL1435.02-02-040-R1","1","","07-09-2021","Nirmal","PPRAJ","2021-09-07"
"AL1435.02A","01-100-00-COMPONENT LOCATOR","AL1435.02A-01-100-00","1","","18-10-2021","Amar","PPRAJ","2021-10-18"
"AL1435.02A","01-150-00-NYLON BUSH","AL1435.02A-01-150-00","1","","09-02-2022","Amar","PPRAJ","2022-02-09"
"AL1435.02A","01-110-00-COMP GUIDE","VCPM1435.02A-01-110-00","1","","18-10-2021","Amar","PPRAJ","2021-10-18"
"AL1435.02A","01-160-00-COM LOCATOR","AL1435.02A-01-160-00","1","","09-02-2022","Amar","PPRAJ","2022-02-09"
"AL1435.02A","01-120-00-COM LOCATOR","AL1435.02A-01-120-00","1","","18-10-2021","Amar","PPRAJ","2021-10-18"
"AL1435.02A","01-140-00-JACKING PLT","VCPM1435.02A-01-140-00","1","","18-10-2021","Amar","PPRAJ","2021-10-18"
"AL1435.02A","01-170-00-NYLON BUSH","AL1435.02A-01-170-00","1","","09-02-2022","Amar","PPRAJ","2022-02-09"
"AL1435.02A","01-130-00-COMP GUIDE PIN","AL1435.02A-01-130-00","1","","18-10-2021","Amar","PPRAJ","2021-10-18"
"AL1435.03","10-67-R1-COMP.CLAMPING PLT","AL1435.03-10-67-R1","2","","23-11-2021","Amar","PPRAJ","2021-11-23"
"AL1435.03","11-11-R1-COLLET","AL1435.03-11-11-R1","10","","14-05-2022","Amar","PPRAJ","2022-05-14"
"AL1435.03","11-01-00-COLLET SLEEVE","AL1435.03-11-01-00","2","","28-03-2022","Amar","PPRAJ","2022-03-28"
"AL1435.03","05-07-00-COLLET-Ø8.5","AL1435.03-05-07-00","2","","15-11-2021","Amar","PPRAJ","2021-11-15"
"AL1435.03","07-01-00-ARMATURE GAUGE","AL1435.03-07-01-00","1","","12-11-2021","Amar","PPRAJ","2021-11-12"
"AL1435.03","10-70-00-PART PRESENCE SNSR MTG BLK","AL1435.03-10-70-00","2","","23-11-2021","Amar","PPRAJ","2021-11-23"
"AL1435.03","05-10-00-GRIPPER SLEEVE","AL1435.03-05-10-00","1","","15-11-2021","Amar","PPRAJ","2021-11-15"
"AL1435.03","11-11-00-COLLET","AL1435.03-11-11-00","4","","28-03-2022","Amar","PPRAJ","2022-03-28"
"AL1435.03","12-43-00-CENTRE BLOCK","AL1435.03-12-43-00","2","","31-12-2021","Gnaneshwari","PPRAJ","2021-12-31"
"AL1435.03","04-44-00-COIL FORMING SIDE PLATE","AL1435.03-04-44-00","4","","30-08-2021","Amar","PPRAJ","2021-08-30"
"AL1435.03","07-02-00-ARMATURE GAUGE","AL1435.03-07-02-00","3","","12-11-2021","Amar","PPRAJ","2021-11-12"
"AL1435.03","11-06-R1-DRAW BAR","AL1435.03-11-06-R1","10","","14-05-2022","Amar","PPRAJ","2022-05-14"
"AL1435.03","11-06-00-DRAW BAR","AL1435.03-11-06-00","4","","28-03-2022","Amar","PPRAJ","2022-03-28"
"AL1435.03","05-06-R1-DRAW BAR","AL1435.03-05-06-R1","2","","15-11-2021","Amar","PPRAJ","2021-11-15"
"AL1435.03","04-43-00-COIL FORMING GAUGE","AL1435.03-04-43-00","2","","30-08-2021","Amar","PPRAJ","2021-08-30"
"AL1435.05","03-96-00-COLLET","AL1435.05-03-96-00-COLLET","2","","07-04-2022","Dayanand","PPRAJ","2022-04-07"
"AL1435.05","05-230-00-SHAFT SPACER","AL1435.05-05-230-00-SHAFT SPACER","3","","23-04-2022","Dayanand","PPRAJ","2022-04-23"
"AL1435.05","05-39-00-TIE SPACER PLT","AL1435.05-05-39-00-TIE SPACER PLT","16","","20-11-2021","Dayanand","PPRAJ","2021-11-20"
"AL1435.05","05-86-00-SUPPORT GUID EROD","AL1435.05-05-86-00-SUPPORT GUID EROD","36","","25-08-2021","Kiran","PPRAJ","2021-08-25"
"AL1435.05","06-010-00-V BLOCK","AL1435.05-06-010-00-V BLOCK","1","","07-04-2022","Dayanand","PPRAJ","2022-04-07"
"AL1435.05","06-190-00-SPACER BUSH","AL1435.05-06-190-00-SPACER BUSH","1","","29-01-2022","Dayanand","PPRAJ","2022-01-29"
"AL1435.05","03-140-00-CYLINDER COUPLER","AL1435.05-03-140-00-CYLINDER COUPLER","1","","07-04-2022","Dayanand","PPRAJ","2022-04-07"
"AL1435.05","06-130-00-SETTING MANDRAL","AL1435.05-06-130-00-SETTING MANDRAL","1","","08-04-2022","Dayanand","PPRAJ","2022-04-08"
"AL1435.05","02-120-00-GUIDE ROD HOLDER PLATE","AL1435.05-02-120-00-GUIDE ROD HOLDER PLATE","4","","23-04-2022","Dayanand","PPRAJ","2022-04-23"
"AL1435.05","08-020-00-U BLOCK","AL1435.05-08-020-00-U BLOCK","1","","06-06-2022","Dayanand","PPRAJ","2022-06-06"
"AL1435.05","06-160-00-SPACER BLOCK","AL1435.05-06-160-00-SPACER BLOCK","1","","07-04-2022","Dayanand","PPRAJ","2022-04-07"
"AL1435.05","05-16-00-CYLINDER STOPER PLT","AL1435.05-05-16-00-CYLINDER STOPER PLT","18","","18-09-2021","Kiran","PPRAJ","2021-09-18"
"AL1435.05","05-070-00-GRIPPER PAD","AL1435.05-05-070-00-GRIPPER PAD","4","","07-04-2022","Dayanand","PPRAJ","2022-04-07"
"AL1435.05","05-19-00-STOPPER PLT","AL1435.05-05-19-00-STOPPER PLT","19","","17-11-2021","Dayanand","PPRAJ","2021-11-17"
"AL1435.05","02-390-00-FINE ADJUSTMENT THREAD","AL1435.05-02-390-00-FINE ADJUSTMENT THREAD","4","","23-04-2022","Dayanand","PPRAJ","2022-04-23"
"AL1435.05","06-170-00-NYLON STOPPER","AL1435.05-06-170-00-NYLON STOPPER","1","","07-04-2022","Dayanand","PPRAJ","2022-04-07"
"AL1435.06","01-120-00-SHAFT MOUNT PLATE","01-120-00-SHAFT MOUNT PLATE","2","","27-05-2022","Nitish","PPRAJ","2022-05-27"
"AL1435.07","02-06-00-V-BLOCK","AL1435.07-02-06-00","6","","27-08-2021","Amar","PPRAJ","2021-08-28"
"AL1435.07","05-19-00-PISTON ROD PLATE","AL1435.07-05-19-00","3","","27-08-2021","Amar","PPRAJ","2021-08-28"
"AL1435.07","05-10-00-MOTOR PULLEY","AL1435.07-05-10-00","3","","27-08-2021","Amar","PPRAJ","2021-08-28"
"AL1435.07","05-09-00-SPACER FOR DRIVEN PULLEY","AL1435.07-05-09-00","3","","27-08-2021","Amar","PPRAJ","2021-08-28"
"AL1435.07","05-23-00-ACRYLIC MTG PLATE","AL1435.07-05-23-00","2","","11-09-2021","Amar","PPRAJ","2021-09-11"
"AL1435.07","05-12-00-MOTOR SUPPORT","AL1435.07-05-12-00","3","","27-08-2021","Amar","PPRAJ","2021-08-28"
"AL1435.07","05-06-00-DRIVEN PULLEY","AL1435.07-05-06-00","3","","27-08-2021","Amar","PPRAJ","2021-08-28"
"AL1435.07","02-02-00-GUIDE STRIP","AL1435.07-02-02-00","3","","27-08-2021","Amar","PPRAJ","2021-08-28"
"AL1435.07","05-02-00-PLATE","AL1435.07-05-02-00","3","","27-08-2021","Amar","PPRAJ","2021-08-28"
"AL1435.07","04-12-00-FRONT DOOR","AL1435.07-04-12-00","2","","12-03-2022","Sunil","PPRAJ","2022-03-12"
"AL1435.07","02-09-00-BUTTING CAP","AL1435.07-02-09-00","3","","27-08-2021","Amar","PPRAJ","2021-08-28"
"AL1435.07","05-24-00-SPACER","AL1435.07-05-24-00","1","","17-06-2022","Amar","PPRAJ","2022-06-17"
"AL1435.07","02-06-R1-V-BLOCK","AL1435.07-02-06-R1","6","","21-04-2022","Amar","PPRAJ","2022-04-21"
"AL1435.07","05-21-00-BELT ARM COVER PLATE","AL1435.07-05-21-00","3","","27-08-2021","Amar","PPRAJ","2021-08-28"
"AL1435.07","02-05-00-V-BLOCK HSG PLATE-RH","AL1435.07-02-05-00","6","","27-08-2021","Amar","PPRAJ","2021-08-28"
"AL1435.07","05-18-00-PIN-PISTON ROD LINK","AL1435.07-05-18-00","3","","27-08-2021","Amar","PPRAJ","2021-08-28"
"AL1435.07","02-03-00-PROBE GUIDE STRIP","AL1435.07-02-03-00","3","","27-08-2021","Amar","PPRAJ","2021-08-28"
"AL1435.07","05-15-00-SHOULDER SCREW","AL1435.07-05-15-00","3","","27-08-2021","Amar","PPRAJ","2021-08-28"
"AL1435.07","05-13-00-BELT SHAFT","AL1435.07-05-13-00","3","","27-08-2021","Amar","PPRAJ","2021-08-28"
"AL1435.07","05-08-00-CLAMPING PLT","AL1435.07-05-08-00","3","","27-08-2021","Amar","PPRAJ","2021-08-28"
"AL1435.07","05-05-00-ADJUSTING KNOB","AL1435.07-05-05-00","3","","27-08-2021","Amar","PPRAJ","2021-08-28"
"AL1435.07","05-03-00-M10 SCREW BAR","AL1435.07-05-03-00","3","","27-08-2021","Amar","PPRAJ","2021-08-28"
"AL1435.07","02-08-00-END STOPPER SHAFT","AL1435.07-02-08-00","3","","27-08-2021","Amar","PPRAJ","2021-08-28"
"AL1435.07","01-20-00-BUSH FOR FIXTURE","AL1435.07-01-20-00","4","","10-03-2022","Sunil","PPRAJ","2022-03-10"
"AL1435.07","05-22-00-BELT ARM FRAME PLATE","AL1435.07-05-22-00","3","","27-08-2021","Amar","PPRAJ","2021-08-28"
"AL1435.07","04-10-00-SIDE DOOR","AL1435.07-04-10-00","2","","12-03-2022","Sunil","PPRAJ","2022-03-12"
"AL1435.07","02-10-00-PROBE SLIDING PLT","AL1435.07-02-10-00","5","","27-08-2021","Amar","PPRAJ","2021-08-28"
"AL1435.07","05-20-00-CYL PIN","AL1435.07-05-20-00","3","","27-08-2021","Amar","PPRAJ","2021-08-28"
"AL1435.07","02-04-00-V-BLOCK HSG PLATE-LH","AL1435.07-02-04-00","3","","27-08-2021","Amar","PPRAJ","2021-08-28"
"AL1435.07","01-030-00-BASE CLAMP","AL1435.07-01-030-00","3","","14-09-2021","Amar","PPRAJ","2021-09-14"
"AL1435.07","05-16-00-BEARING SPACER","AL1435.07-05-16-00","3","","27-08-2021","Amar","PPRAJ","2021-08-28"
"AL1435.07","05-14-00-BELT JOINT","AL1435.07-05-14-00","3","","27-08-2021","Amar","PPRAJ","2021-08-28"
"AL1435.07","05-07-00-PULLEY PIN","AL1435.07-05-07-00","3","","27-08-2021","Amar","PPRAJ","2021-08-28"
"AL1435.07","02-11-00-ACRYLIC MTG PLATE","AL1435.07-02-11-00","2","","11-09-2021","Amar","PPRAJ","2021-09-11"
"AL1435.07","05-11-00-MOTOR PLATE","AL1435.07-05-11-00","3","","27-08-2021","Amar","PPRAJ","2021-08-28"
"AL1435.07","05-04-00-STOPPER SLEEVE","AL1435.07-05-04-00","3","","27-08-2021","Amar","PPRAJ","2021-08-28"
"AL1435.07","02-01-00-BASE MTG PLATE","AL1435.07-02-01-00","3","","27-08-2021","Amar","PPRAJ","2021-08-28"
"AL1435.07","05-01-00-GUIDE ROD","AL1435.07-05-01-00","3","","27-08-2021","Amar","PPRAJ","2021-08-28"
"AL1435.07","04-11-00-BACK DOOR","AL1435.07-04-11-00","1","","12-03-2022","Sunil","PPRAJ","2022-03-12"
"AL1435.07","02-07-00-PROBE HOLDER","AL1435.07-02-07-00","10","","27-08-2021","Amar","PPRAJ","2021-08-28"
"AL1435.07","02-08-R1-END STOPPER SHAFT","AL1435.07-02-08-R1","3","","21-04-2022","Amar","PPRAJ","2022-04-21"
"AL1435.07","05-17-00-CYL SUPPORT FRAME","AL1435.07-05-17-00","3","","27-08-2021","Amar","PPRAJ","2021-08-28"
"AL1436.01","04-050-00-TABLE","AL1436.01-04-050-00","2","","30-08-2021","Pavithra","Chandru","2021-08-30"
"AL1436.01","04-060-00-MOP BOX","AL1436.01-04-060-00","1","","30-08-2021","Pavithra","Chandru","2021-08-30"
"AL1436.02","31-157-00 OUTER SPACER","AL1436.02-31-157-00","1","","09-07-2022","Amar","PPRAJ","2022-07-09"
"AL1436.02","01-001-00-PAPER FORMING PLT","AL1436.02-01-001-00","1","","15-09-2021","Amar","PPRAJ","2021-09-15"
"AL1436.02","15-03-R1-WALKING BEAM-FRONT  SIDE PLT","AL1436.02-15-03-R1","1","","07-06-2022","Amar","PPRAJ","2022-06-07"
"AL1436.02","02-040-R1-SIDE GUIDE PLT","AL1436.02-02-040-R1","2","","18-05-2022","Amar","PPRAJ","2022-05-18"
"AL1436.02","31-191-00- BOTTOM ROLLER MOUNTING  BRKT","AL1436.02-31-191-00","1","","04-01-2022","Amar","PPRAJ","2022-01-04"
"AL1436.02","16-061-R1-INSERTER BLADE","AL1436.02-16-061-R1","2","","18-05-2022","Amar","PPRAJ","2022-05-18"
"AL1436.02","01-002-00-PAPER FORMING PLT","AL1436.02-01-002-00","3","","22-10-2021","Amar","PPRAJ","2021-10-22"
"AL1436.02","31-002-00 SHAFT FOR FEMALE ROLLER","AL1436.02-31-002-00","1","","09-07-2022","Amar","PPRAJ","2022-07-09"
"AL1436.02","12-008-00 PROFILE SUPPORT TUBE","AL1436.02-12-008-00","8","","27-11-2021","Amar","PPRAJ","2021-11-27"
"AL1436.02","15-02-R1-WALKING BEAM-BACK SIDE PLT","AL1436.02-15-02-R1","1","","07-06-2022","Amar","PPRAJ","2022-06-07"
"AL1436.02","02-030-R1-SIDE GUIDE PLT RH","AL1436.02-02-030-R1","2","","18-05-2022","Amar","PPRAJ","2022-05-18"
"AL1436.03","18-120-00-COM LOCATOR","AL1436.03-18-120-00","1","","18-07-2022","Amar","PPRAJ","2022-07-18"
"AL1436.03","04-250-00-COMPONENT HOLDER JAW","AL1436.03-04-250-00","7","","30-12-2021","Amar","PPRAJ","2021-12-30"
"AL1436.03","10-57-00-PART PRS SEN","AL1436.03-10-57-00","8","","06-06-2022","Amar","PPRAJ","2022-06-06"
"AL1436.03","08-21-00-CENTRE BLOCK","AL1436.03-08-21-00","2","","09-06-2022","Amar","PPRAJ","2022-06-09"
"AL1436.03","18-100-00-COMPONENT LOCATOR","AL1436.03-18-100-00","1","","18-07-2022","Amar","PPRAJ","2022-07-18"
"AL1436.03","10-70-00-PART PRESENCE SNSR MTG BLK","AL1436.03-10-70-00","5","","17-11-2021","Amar","PPRAJ","2021-11-17"
"AL1436.03","05-11-R1-COLLET","AL1436.03-05-11-R1","10","","14-05-2022","Amar","PPRAJ","2022-05-14"
"AL1436.03","18-110-00-COMP GUIDE","AL1436.03-18-110-00","1","","18-07-2022","Amar","PPRAJ","2022-07-18"
"AL1436.03","10-55-00 SENSOR MTG BRKT","AL1436.03-10-55-00","30","","24-05-2022","Amar","PPRAJ","2022-05-26"
"AL1436.03","06-34-00-RUBBER WHEEL-Ø95","AL1436.03-06-34-00","20","","28-12-2021","Amar","PPRAJ","2021-12-28"
"AL1436.03","08-22-00-BALANCING WEDGE","AL1436.03-08-22-00","4","","09-06-2022","Amar","PPRAJ","2022-06-09"
"AL1436.03","18-130-00-COMP GUIDE PIN","AL1436.03-18-130-00","1","","18-07-2022","Amar","PPRAJ","2022-07-18"
"AL1436.03","18-140-00-JACKING PLT","AL1436.03-18-140-00","1","","18-07-2022","Amar","PPRAJ","2022-07-18"
"AL1436.03","04-240-00- SPACER PLATE","AL1436.03-04-240-00","2","","30-12-2021","Amar","PPRAJ","2021-12-30"
"AL1436.03","03-72-00-BUSH FOR GRIPPER SHAFT","AL1436.03-03-72-00","8","","30-11-2021","Amar","PPRAJ","2021-12-13"
"AL1436.03","10-56-00 SENSOR MTG BRKT","AL1436.03-10-56-00","8","","06-06-2022","Amar","PPRAJ","2022-06-06"
"AL1436.03","08-20-00-CENTRE BLOCK","AL1436.03-08-20-00","2","","09-06-2022","Amar","PPRAJ","2022-06-09"
"AL1436.05","02-040-00-LM BLOCK STOPPER","AL1436.05-02-040-00-LM BLOCK STOPPER","12","","30-08-2021","Dayanand","PPRAJ","2021-08-30"
"AL1436.05","01-075-00-PNEUMATIC PLATE","AL1436.05-01-075-00-PNEUMATIC PLATE","1","","14-09-2021","Kiran","PPRAJ","2021-09-14"
"AL1436.05","02-064-00-CYLINDER CONNECTING PLATE","AL1436.05-02-064-00-CYLINDER CONNECTING PLATE","12","","30-08-2021","Dayanand","PPRAJ","2021-08-30"
"AL1436.05","03-17-00-DRAW BAR","AL1436.05-03-17-00-DRAW BAR","12","","25-08-2021","Dayanand","PPRAJ","2021-08-25"
"AL1436.05","02-085-00-ACTUATOR PULLEY","AL1436.05-02-085-00-ACTUATOR PULLEY","2","","05-01-2022","Dayanand","PPRAJ","2022-01-05"
"AL1436.05","03-250-00-HOSE PIPE","AL1436.05-03-250-00-HOSE PIPE","2","","08-11-2021","Kiran","PPRAJ","2021-11-08"
"AL1436.05","01-042-00-CABINET MOUNTING BRACKET","AL1436.05-01-042-00-CABINET MOUNTING BRACKET","6","","23-10-2021","Kiran","PPRAJ","2021-10-23"
"AL1436.05","02-170-00-ANODE & CATHODE CONNECTING BLK","AL1436.05-02-170-00-ANODE & CATHODE CONNECTING BLK","30","","30-08-2021","Dayanand","PPRAJ","2021-08-30"
"AL1436.05","05-110-00-CYLINDER MGT PLATE","AL1436.05-05-110-00-CYLINDER MGT PLATE","7","","25-08-2021","Dayanand","PPRAJ","2021-08-25"
"AL1436.05","05-250-00-SENSOR PLATE","AL1436.05-05-250-00-SENSOR PLATE","1","","28-12-2021","Dayanand","PPRAJ","2021-12-28"
"AL1436.05","06-040-00-SPACER PLATE","AL1436.05-06-040-00-SPACER PLATE","7","","16-11-2021","Dayanand","PPRAJ","2021-11-16"
"AL1436.05","05-200-00-PULLEY SPACER","AL1436.05-05-200-00-PULLEY SPACER","6","","10-12-2021","Dayanand","PPRAJ","2021-12-10"
"AL1436.05","03-320-00-SUPPORT PLATE","AL1436.05-03-320-00-SUPPORT PLATE","1","","22-06-2022","Dayanand","PPRAJ","2022-06-22"
"AL1436.05","02-240-00-CLAMPING BUSH TOP","AL1436.05-02-240-00-CLAMPING BUSH TOP","60","","30-08-2021","Dayanand","PPRAJ","2021-08-30"
"AL1436.05","03-11-HOLLOW  CYLINDER  SHAFT SPACER","AL1436.05-03-11-HOLLOW  CYLINDER  SHAFT SPACER","6","","25-08-2021","Dayanand","PPRAJ","2021-08-25"
"AL1436.05","02-461-00-ELECTRICAL BUS BAR LH","AL1436.05-02-461-00-ELECTRICAL BUS BAR LH","7","","18-09-2021","Dayanand","PPRAJ","2021-09-18"
"AL1436.05","02-070-00-TOP SLIDE LM BLOCK MTG PLT","AL1436.05-02-070-00-TOP SLIDE LM BLOCK MTG PLT","12","","30-08-2021","Dayanand","PPRAJ","2021-08-30"
"AL1436.05","03-180-00-BACK FACE COVER","AL1436.05-03-180-00-BACK FACE COVER","1","","25-08-2021","Dayanand","PPRAJ","2021-08-25"
"AL1436.05","04-34-00-SENSOR MTG BKT","AL1436.05-04-34-00-SENSOR MTG BKT","2","","28-12-2021","Dayanand","PPRAJ","2021-12-28"
"AL1436.05","02-150-R1-BUSH","AL1436.05-02-150-R1-BUSH","50","","10-12-2021","Dayanand","PPRAJ","2021-12-10"
"AL1436.05","03-290-00-JACKING PLATE","AL1436.05-03-290-00-JACKING PLATE","1","","22-06-2022","Dayanand","PPRAJ","2022-06-22"
"AL1436.05","08-020-00-SENSOR MTG PLATE","AL1436.05-08-020-00-SENSOR MTG PLATE","20","","16-11-2021","Dayanand","PPRAJ","2021-11-16"
"AL1436.05","02-062-00-LM BLOCK MTG PLATE","AL1436.05-02-062-00-LM BLOCK MTG PLATE","12","","30-08-2021","Dayanand","PPRAJ","2021-08-30"
"AL1436.05","02-550-00-PULLEY HOLDER","AL1436.05-02-550-00-PULLEY HOLDER","2","","29-06-2022","Dayanand","PPRAJ","2022-06-29"
"AL1436.05","03-08-00-HOLLOW CYL END COVER","AL1436.05-03-08-00-HOLLOW CYL END COVER","6","","25-08-2021","Dayanand","PPRAJ","2021-08-25"
"AL1436.05","02-240-R1-CLAMPING BUSH TOP","AL1436.05-02-240-R1-CLAMPING BUSH TOP","4","","11-12-2021","Dayanand","PPRAJ","2021-12-11"
"AL1436.05","02-270-00-ANODE ROD","AL1436.05-02-270-00","3","","25-09-2021","Dayanand","PPRAJ","2021-09-25"
"AL1436.05","02-450-00-ELECTRICAL BUS BAR","AL1436.05-02-450-00-ELECTRICAL BUS BAR","8","","18-09-2021","Dayanand","PPRAJ","2021-09-18"
"AL1436.05","01-162-00-BASE WIRE SLT COVER","AL1436.05-01-162-00-BASE WIRE SLT COVER","2","","02-02-2022","Dayanand","PPRAJ","2022-02-02"
"AL1436.05","02-330-00-RAIL BUTTING CLAMP","AL1436.05-02-330-00-RAIL BUTTING CLAMP","36","","30-08-2021","Dayanand","PPRAJ","2021-08-30"
"AL1436.05","03-150-00-SLIDE GUIDE PLATE","AL1436.05-03-150-00-SLIDE GUIDE PLATE","12","","25-08-2021","Dayanand","PPRAJ","2021-08-25"
"AL1436.05","01-163-R1-PAD FOR TRANSFORMER PLT","AL1436.05-01-163-R1-PAD FOR TRANSFORMER PLT","24","","03-12-2021","Dayanand","PPRAJ","2021-12-03"
"AL1436.05","01-164-00-TRANCERFORMER BOTTOM SHEET","AL1436.05-01-164-00-TRANCERFORMER BOTTOM SHEET","1","","26-11-2021","Dayanand","PPRAJ","2021-11-26"
"AL1436.05","06-010-00-V BLOCK","AL1436.05-06-010-00-V BLOCK","1","","16-11-2021","Dayanand","PPRAJ","2021-11-16"
"AL1436.05","02-110-00-STD GUIDE ROD","AL1436.05-02-110-00-STD GUIDE ROD","8","","30-08-2021","Dayanand","PPRAJ","2021-08-30"
"AL1436.05","03-05-00-INDEXER SLDNG SHAFT","AL1436.05-03-05-00-INDEXER SLDNG SHAFT","6","","25-08-2021","Dayanand","PPRAJ","2021-08-25"
"AL1436.05","02-340-00-COPPER SPACER","AL1436.05-02-340-00-COPPER SPACER","12","","18-09-2021","Dayanand","PPRAJ","2021-09-18"
"AL1436.05","02-067-00-SPING SPACER","AL1436.05-02-067-00-SPING SPACER","24","","30-08-2021","Dayanand","PPRAJ","2021-08-30"
"AL1436.05","03-120-00-MOTOR SUPPORT PLATE","AL1436.05-03-120-00-MOTOR SUPPORT PLATE","12","","25-08-2021","Dayanand","PPRAJ","2021-08-25"
"AL1436.05","02-020-R1CYLINDER MTG PLATE LH & RH","AL1436.05-02-020-R1CYLINDER MTG PLATE LH & RH","2","","05-01-2022","Dayanand","PPRAJ","2022-01-05"
"AL1436.05","02-510-00-SCREW SLOT WASHER","AL1436.05-02-510-00-SCREW SLOT WASHER","30","","15-12-2021","Dayanand","PPRAJ","2021-12-15"
"AL1436.05","05-121-00-SUPPORT BLOCK SPACER","AL1436.05-05-121-00-SUPPORT BLOCK SPACER","7","","09-10-2021","Kiran","PPRAJ","2021-10-09"
"AL1436.05","02-220-00-SPRING CONNECTING BUSH","AL1436.05-02-220-00-SPRING CONNECTING BUSH","24","","30-08-2021","Dayanand","PPRAJ","2021-08-30"
"AL1436.05","03-100-00-LM RAIL MTG PLATE","AL1436.05-03-100-00-LM RAIL MTG PLATE","6","","25-08-2021","Dayanand","PPRAJ","2021-08-25"
"AL1436.05","01-167-00-CLAMP","AL1436.05-01-167-00-CLAMP","2","","14-06-2022","Dayanand","PPRAJ","2022-06-14"
"AL1436.05","02-310-00-COUPLER PLATE","AL1436.05-02-310-00-COUPLER PLATE","12","","30-08-2021","Dayanand","PPRAJ","2021-08-30"
"AL1436.05","03-44-00-INDEXER  MOTOR MTG PLT","AL1436.05-03-44-00-INDEXER  MOTOR MTG PLT","6","","25-08-2021","Dayanand","PPRAJ","2021-08-25"
"AL1436.05","02-512-00-MOTOR MTG PLATE","AL1436.05-02-512-00-MOTOR MTG PLATE","2","","05-01-2022","Dayanand","PPRAJ","2022-01-05"
"AL1436.05","02-410-00-RETAINER","AL1436.05-02-410-00-RETAINER","24","","30-08-2021","Dayanand","PPRAJ","2021-08-30"
"AL1436.05","06-120-00-COMPONENT END STOPPER PLT","AL1436.05-06-120-00-COMPONENT END STOPPER PLT","7","","16-11-2021","Dayanand","PPRAJ","2021-11-16"
"AL1436.05","02-085-R1-ACTUATOR PULLEY","AL1436.05-02-085-R1-ACTUATOR PULLEY","4","","12-07-2022","Dayanand","PPRAJ","2022-07-12"
"AL1436.05","02-080-00-SPACER PLATE","AL1436.05-02-080-00-SPACER PLATE","12","","30-08-2021","Dayanand","PPRAJ","2021-08-30"
"AL1436.05","03-47-00-SPRING","AL1436.05-03-47-00-SPRING","10","","25-08-2021","Dayanand","PPRAJ","2021-08-25"
"AL1436.05","02-480-00-SPRING","AL1436.05-02-480-00-SPRING","12","","22-10-2021","Kiran","PPRAJ","2021-10-22"
"AL1436.05","01-163-00-PAD FOR TRANSFORMER PLT","AL1436.05-01-163-00-PAD FOR TRANSFORMER PLT","48","","14-09-2021","Kiran","PPRAJ","2021-09-14"
"AL1436.05","02-065-00-GUIDE STIP","AL1436.05-02-065-00-GUIDE STIP","12","","30-08-2021","Dayanand","PPRAJ","2021-08-30"
"AL1436.05","03-18-00-INEXER MOTOR MTG PLT","AL1436.05-03-18-00-INEXER MOTOR MTG PLT","6","","25-08-2021","Dayanand","PPRAJ","2021-08-25"
"AL1436.05","02-086-00-ACTUATOR PULLEY","AL1436.05-02-086-00-ACTUATOR PULLEY","2","","05-01-2022","Dayanand","PPRAJ","2022-01-05"
"AL1436.05","02-180-00-CATHODE HOLDER BLOCK","AL1436.05-02-180-00-CATHODE HOLDER BLOCK","14","","30-08-2021","Dayanand","PPRAJ","2021-08-30"
"AL1436.05","05-061-00-BOTTOM PLATE","AL1436.05-05-061-00-BOTTOM PLATE","32","","25-08-2021","Dayanand","PPRAJ","2021-08-25"
"AL1436.05","06-050-00-STOPPER PAD","AL1436.05-06-050-00-STOPPER PAD","7","","16-11-2021","Dayanand","PPRAJ","2021-11-16"
"AL1436.05","05-220-00-ADITIONAL SPACER","AL1436.05-05-220-00-ADITIONAL SPACER","7","","10-12-2021","Dayanand","PPRAJ","2021-12-10"
"AL1436.05","02-090-00-SUPPORT PLATE","AL1436.05-02-090-00-SUPPORT PLATE","24","","30-08-2021","Dayanand","PPRAJ","2021-08-30"
"AL1436.05","03-14-00-THRUST BEARING SHAFT","AL1436.05-03-14-00-THRUST BEARING SHAFT","6","","25-08-2021","Dayanand","PPRAJ","2021-08-25"
"AL1436.05","02-71-00-REATAINER WASHER","AL1436.05-02-71-00-REATAINER WASHER","60","","30-08-2021","Dayanand","PPRAJ","2021-08-30"
"AL1436.05","03-200-00-COUPLER PLATE","AL1436.05-03-200-00-COUPLER PLATE","6","","25-08-2021","Dayanand","PPRAJ","2021-08-25"
"AL1436.05","04-35-00-PART PRASENT SENSOR BKT","AL1436.05-04-35-00-PART PRASENT SENSOR BKT","1","","28-12-2021","Dayanand","PPRAJ","2021-12-28"
"AL1436.05","03-220-00-SPLIT BUSH","AL1436.05-03-220-00-SPLIT BUSH","6","","10-12-2021","Dayanand","PPRAJ","2021-12-10"
"AL1436.05","03-300-00-JACKING THREAD","AL1436.05-03-300-00-JACKING THREAD","1","","22-06-2022","Dayanand","PPRAJ","2022-06-22"
"AL1436.05","02-063-00-CYLINDER MTG PLATE","AL1436.05-02-063-00-CYLINDER MTG PLATE","12","","30-08-2021","Dayanand","PPRAJ","2021-08-30"
"AL1436.05","02-560-00-SLIT BUSH","AL1436.05-02-560-00-SLIT BUSH","2","","29-06-2022","Dayanand","PPRAJ","2022-06-29"
"AL1436.05","03-09-00-HOLLOW CYL HSG","AL1436.05-03-09-00-HOLLOW CYL HSG","6","","25-08-2021","Dayanand","PPRAJ","2021-08-25"
"AL1436.05","03-270-00-SCREW PLATE","AL1436.05-03-270-00-SCREW PLATE","2","","11-12-2021","Dayanand","PPRAJ","2021-12-11"
"AL1436.05","02-460-00-ELECTRICAL BUS BAR RH","AL1436.05-02-460-00-ELECTRICAL BUS BAR RH","11","","18-09-2021","Dayanand","PPRAJ","2021-09-18"
"AL1436.05","02-010-00-LM RAIL MTG PLATE","AL1436.05-02-010-00-LM RAIL MTG PLATE","6","","30-08-2021","Dayanand","PPRAJ","2021-08-30"
"AL1436.05","03-160-00-SIDE COVER","AL1436.05-03-160-00-SIDE COVER","2","","25-08-2021","Dayanand","PPRAJ","2021-08-25"
"AL1436.05","01-A05-00-TUBE STRUCTURE BASE ASSY","AL1436.05-01-A05-00-TUBE STRUCTURE BASE ASSY","3","","09-09-2021","Kiran","PPRAJ","2021-09-09"
"AL1436.05","06-020-00-V BLOCK HODER","AL1436.05-06-020-00-V BLOCK HODER","7","","16-11-2021","Dayanand","PPRAJ","2021-11-16"
"AL1436.05","02-120-00-GUIDE ROD HOLDER PLATE","AL1436.05-02-120-00-GUIDE ROD HOLDER PLATE","24","","30-08-2021","Dayanand","PPRAJ","2021-08-30"
"AL1436.05","03-06-00-SPUR GEAR 2M-75T 20PA 20FW","AL1436.05-03-06-00-SPUR GEAR 2M-75T 20PA 20FW","6","","25-08-2021","Dayanand","PPRAJ","2021-08-25"
"AL1436.05","02-230-R2-CLAMPING BUSH BOTTOM","AL1436.05-02-230-R2-CLAMPING BUSH BOTTOM","50","","20-12-2021","Dayanand","PPRAJ","2021-12-20"
"AL1436.05","02-280-00-CATHODE PLATE","AL1436.05-02-280-00-CATHODE PLATE","12","","18-09-2021","Dayanand","PPRAJ","2021-09-18"
"AL1436.05","02-068-00-GUIDE PLATE","AL1436.05-02-068-00-GUIDE PLATE","24","","30-08-2021","Dayanand","PPRAJ","2021-08-30"
"AL1436.05","03-130-00-CYLINDER MTG PLATE","AL1436.05-03-130-00-CYLINDER MTG PLATE","6","","25-08-2021","Dayanand","PPRAJ","2021-08-25"
"AL1436.05","02-050-R1-CYLINDER COUPLER","AL1436.05-02-050-R1-CYLINDER COUPLER","2","","05-01-2022","Dayanand","PPRAJ","2022-01-05"
"AL1436.05","05-122-00-SUPPORT BLOCK SPACER","AL1436.05-05-122-00-SUPPORT BLOCK SPACER","7","","09-10-2021","Kiran","PPRAJ","2021-10-09"
"AL1436.05","02-390-00-FINE ADJUSTMENT THREAD","AL1436.05-02-390-00-FINE ADJUSTMENT THREAD","24","","30-08-2021","Dayanand","PPRAJ","2021-08-30"
"AL1436.05","03-01-00-INDEXER HSG PLT","AL1436.05-03-01-00-INDEXER HSG PLT","6","","25-08-2021","Dayanand","PPRAJ","2021-08-25"
"AL1436.05","02-150-00-BUSH","AL1436.05-02-150-00-BUSH","60","","30-08-2021","Dayanand","PPRAJ","2021-08-30"
"AL1436.05","03-46-00-EJECTOR PIN","AL1436.05-03-46-00-EJECTOR PIN","12","","25-08-2021","Dayanand","PPRAJ","2021-08-25"
"AL1436.05","02-530-00-JACKING PLATE","AL1436.05-02-530-00-JACKING PLATE","2","","05-01-2022","Dayanand","PPRAJ","2022-01-05"
"AL1436.05","02-440-00-SAFTY COVER","AL1436.05-02-440-00-SAFTY COVER","2","","30-08-2021","Dayanand","PPRAJ","2021-08-30"
"AL1436.05","06-07-00-PAWL","AL1436.05-06-07-00-PAWL","14","","16-11-2021","Dayanand","PPRAJ","2021-11-16"
"AL1436.05","02-086-R1-ACTUATOR PULLEY","AL1436.05-02-086-R1-ACTUATOR PULLEY","4","","12-07-2022","Dayanand","PPRAJ","2022-07-12"
"AL1436.05","02-190-00-ANODE HOLDER BLOCK","AL1436.05-02-190-00-ANODE HOLDER BLOCK","15","","30-08-2021","Dayanand","PPRAJ","2021-08-30"
"AL1436.05","03-87-00-MOTOR HSG COVER","AL1436.05-03-87-00-MOTOR HSG COVER","6","","25-08-2021","Dayanand","PPRAJ","2021-08-25"
"AL1436.05","01-021-00-TRANSFORMER BOTTOM PLT","AL1436.05-01-021-00-TRANSFORMER BOTTOM PLT","2","","14-09-2021","Kiran","PPRAJ","2021-09-14"
"AL1436.05","01-165-00-AIR BLOWER MTG BLOCK","AL1436.05-01-165-00-AIR BLOWER MTG BLOCK","6","","05-02-2022","Dayanand","PPRAJ","2022-02-05"
"AL1436.05","02-066-00-LM BLOCK COVER SHEET","AL1436.05-02-066-00-LM BLOCK COVER SHEET","2","","30-08-2021","Dayanand","PPRAJ","2021-08-30"
"AL1436.05","03-19-00-ADJUSTABLE DRIVING GEAR","AL1436.05-03-19-00-ADJUSTABLE DRIVING GEAR","6","","25-08-2021","Dayanand","PPRAJ","2021-08-25"
"AL1436.05","02-490-00-MOTOR MTG PLATE","AL1436.05-02-490-00-MOTOR MTG PLATE","2","","05-01-2022","Dayanand","PPRAJ","2022-01-05"
"AL1436.05","02-350-00-STOPPER PLATE","AL1436.05-02-350-00-STOPPER PLATE","12","","30-08-2021","Dayanand","PPRAJ","2021-08-30"
"AL1436.05","05-062-00-GRIPPER","AL1436.05-05-062-00-GRIPPER","28","","25-08-2021","Dayanand","PPRAJ","2021-08-25"
"AL1436.05","06-130-00-SETTING MANDRAL","AL1436.05-06-130-00-SETTING MANDRAL","1","","30-12-2021","Dayanand","PPRAJ","2021-12-30"
"AL1436.05","06-060-00-BOTTOM PLATE","AL1436.05-06-060-00-BOTTOM PLATE","7","","16-11-2021","Dayanand","PPRAJ","2021-11-16"
"AL1436.05","02-030-00-COUPLER HOLDER","AL1436.05-02-030-00-COUPLER HOLDER","12","","30-08-2021","Dayanand","PPRAJ","2021-08-30"
"AL1436.05","05-230-00-SHAFT SPACER","AL1436.05-05-230-00-SHAFT SPACER","1","","10-12-2021","Dayanand","PPRAJ","2021-12-10"
"AL1436.05","02-100-00-GUIDE BLOCK","AL1436.05-02-100-00-GUIDE BLOCK","24","","30-08-2021","Dayanand","PPRAJ","2021-08-30"
"AL1436.05","03-16-00-FIXED DRIVING GEAR","AL1436.05-03-16-00-FIXED DRIVING GEAR","6","","25-08-2021","Dayanand","PPRAJ","2021-08-25"
"AL1436.05","03-210-00-AIR BLOWER CLAMP","AL1436.05-03-210-00-AIR BLOWER CLAMP","1","","08-11-2021","Kiran","PPRAJ","2021-11-08"
"AL1436.05","02-72-00-WIPER SHEET","AL1436.05-02-72-00-WIPER SHEET","2","","30-08-2021","Dayanand","PPRAJ","2021-08-30"
"AL1436.05","05-070-00-GRIPPER PAD","AL1436.05-05-070-00-GRIPPER PAD","18","","25-08-2021","Dayanand","PPRAJ","2021-08-25"
"AL1436.05","03-280-00-PROXIMITY SENSOR PLATE","AL1436.05-03-280-00-PROXIMITY SENSOR PLATE","1","","28-12-2021","Dayanand","PPRAJ","2021-12-28"
"AL1436.05","06-030-00-PAWL RETAINER PLATE","AL1436.05-06-030-00-PAWL RETAINER PLATE","7","","16-11-2021","Dayanand","PPRAJ","2021-11-16"
"AL1436.05","05-190-00-SPACER PLATE","AL1436.05-05-190-00-SPACER PLATE","12","","10-12-2021","Dayanand","PPRAJ","2021-12-10"
"AL1436.05","03-310-00-THREAD ROD MTG PLATE","AL1436.05-03-310-00-THREAD ROD MTG PLATE","1","","22-06-2022","Dayanand","PPRAJ","2022-06-22"
"AL1436.05","02-230-00-CLAMPING BUSH BOTTOM","AL1436.05-02-230-00-CLAMPING BUSH BOTTOM","48","","30-08-2021","Dayanand","PPRAJ","2021-08-30"
"AL1436.05","02-570-00-SLIT BUSH","AL1436.05-02-570-00-SLIT BUSH","2","","29-06-2022","Dayanand","PPRAJ","2022-06-29"
"AL1436.05","03-10-00-HALLOW CYL PISTON","AL1436.05-03-10-00-HALLOW CYL PISTON","6","","25-08-2021","Dayanand","PPRAJ","2021-08-25"
"AL1436.05","02-451-00-ELECTRICAL BUS BAR LH","AL1436.05-02-451-00-ELECTRICAL BUS BAR LH","6","","18-09-2021","Dayanand","PPRAJ","2021-09-18"
"AL1436.05","02-020-00-CYLINDER MTG PLATE LH & RH","AL1436.05-02-020-00-CYLINDER MTG PLATE LH & RH","12","","30-08-2021","Dayanand","PPRAJ","2021-08-30"
"AL1436.05","03-170-00-FRONT FACE COVER","AL1436.05-03-170-00-FRONT FACE COVER","1","","25-08-2021","Dayanand","PPRAJ","2021-08-25"
"AL1436.05","04-33-00-SENSOR MTG PLATE","AL1436.05-04-33-00-SENSOR MTG PLATE","40","","28-12-2021","Dayanand","PPRAJ","2021-12-28"
"AL1436.05","08-010-00-SENSOR HOLDER ROD","AL1436.05-08-010-00-SENSOR HOLDER ROD","20","","16-11-2021","Dayanand","PPRAJ","2021-11-16"
"AL1436.05","02-050-00-CYLINDER COUPLER","AL1436.05-02-050-00-CYLINDER COUPLER","12","","30-08-2021","Dayanand","PPRAJ","2021-08-30"
"AL1436.05","03-07-00-INEXER SLIDE SHAFT SPACER","AL1436.05-03-07-00-INEXER SLIDE SHAFT SPACER","6","","25-08-2021","Dayanand","PPRAJ","2021-08-25"
"AL1436.05","02-520-00-CLAMP PLATE","AL1436.05-02-520-00-CLAMP PLATE","24","","20-12-2021","Dayanand","PPRAJ","2021-12-20"
"AL1436.05","02-230-R1-CLAMPING BUSH BOTTOM","AL1436.05-02-230-R1-CLAMPING BUSH BOTTOM","4","","11-12-2021","Dayanand","PPRAJ","2021-12-11"
"AL1436.05","02-260-00-CATHODE ROD","AL1436.05-02-260-00","5","","25-09-2021","Dayanand","PPRAJ","2021-09-25"
"AL1436.05","02-290-00-ANODE PLATE","AL1436.05-02-290-00-ANODE PLATE","17","","18-09-2021","Dayanand","PPRAJ","2021-09-18"
"AL1436.05","02-320-00-CYLINDER COUPLER","AL1436.05-02-320-00-CYLINDER COUPLER","12","","30-08-2021","Dayanand","PPRAJ","2021-08-30"
"AL1436.05","03-140-00-CYLINDER COUPLER","AL1436.05-03-140-00-CYLINDER COUPLER","6","","25-08-2021","Dayanand","PPRAJ","2021-08-25"
"AL1436.05","02-400-00-HAND KNOB","AL1436.05-02-400-00-HAND KNOB","24","","30-08-2021","Dayanand","PPRAJ","2021-08-30"
"AL1436.05","03-04-00-COLLET SLEEVE","AL1436.05-03-04-00-COLLET SLEEVE","6","","25-08-2021","Dayanand","PPRAJ","2021-08-25"
"AL1436.05","01-120-00-BUS BAR SUPPORT","AL1436.05-01-120-00-BUS BAR SUPPORT","24","","18-09-2021","Dayanand","PPRAJ","2021-09-18"
"AL1436.05","02-160-00-SHOULDER BUSH","AL1436.05-02-160-00-SHOULDER BUSH","60","","30-08-2021","Dayanand","PPRAJ","2021-08-30"
"AL1436.05","03-110-00-LM BLOCK MTG PLATE","AL1436.05-03-110-00-LM BLOCK MTG PLATE","6","","25-08-2021","Dayanand","PPRAJ","2021-08-25"
"AL1436.05","02-540-00-BELT SAFTY COVER","AL1436.05-02-540-00-BELT SAFTY COVER","2","","05-01-2022","Dayanand","PPRAJ","2022-01-05"
"AL1436.05","02-500-00-SCREW SLOT WASHER","AL1436.05-02-500-00-SCREW SLOT WASHER","75","","15-12-2021","Dayanand","PPRAJ","2021-12-15"
"AL1436.05","06-08-00-PAWL HOLDER","AL1436.05-06-08-00-PAWL HOLDER","7","","16-11-2021","Dayanand","PPRAJ","2021-11-16"
"AL1436.05","02-200-00-ADJUSTABLE ANODE HOLDER CLAMP","AL1436.05-02-200-00-ADJUSTABLE ANODE HOLDER CLAMP","24","","30-08-2021","Dayanand","PPRAJ","2021-08-30"
"AL1436.05","03-96-00-COLLET","AL1436.05-03-96-00-COLLET","12","","25-08-2021","Dayanand","PPRAJ","2021-08-25"
"AL1436.05","01-166-00-CONTROLER CLAMP","AL1436.05-01-166-00-CONTROLER CLAMP","4","","14-06-2022","Dayanand","PPRAJ","2022-06-14"
"AL1436.05","01-040-00-CABINET MOUNTING BRACKET","AL1436.05-01-040-00-CABINET MOUNTING BRACKET","12","","14-09-2021","Kiran","PPRAJ","2021-09-14"
"AL1436.05","02-140-00-RETAINER WASHER","AL1436.05-02-140-00-RETAINER WASHER","24","","30-08-2021","Dayanand","PPRAJ","2021-08-30"
"AL1436.05","03-43-00-CYLINDER PISTON GUIDE BUSH","AL1436.05-03-43-00-CYLINDER PISTON GUIDE BUSH","6","","25-08-2021","Dayanand","PPRAJ","2021-08-25"
"AL1436.05","02-511-00-FIXED SERVO MTG PLATE","AL1436.05-02-511-00-FIXED SERVO MTG PLATE","2","","05-01-2022","Dayanand","PPRAJ","2022-01-05"
"AL1436.05","02-380-00-SPRING GUIDE BUSH","AL1436.05-02-380-00-SPRING GUIDE BUSH","24","","30-08-2021","Dayanand","PPRAJ","2021-08-30"
"AL1436.05","05-120-00-SUPPORT BLOCK","AL1436.05-05-120-00-SUPPORT BLOCK","14","","25-08-2021","Dayanand","PPRAJ","2021-08-25"
"AL1436.05","06-110-00-CLAMPING BLOCK","AL1436.05-06-110-00-CLAMPING BLOCK","28","","16-11-2021","Dayanand","PPRAJ","2021-11-16"
"AL1436.06","07-009-00 MALE ROLLER SPACER","AL1436.06-07-009-00","1","","18-06-2022","Amar","PPRAJ","2022-06-18"
"AL1436.06","01-107-R1 PLUNGER HSG","AL1436.06-01-107-R1","2","","19-03-2022","Amar","PPRAJ","2022-03-19"
"AL1436.06","07-004-00 GUIDE SPACER","AL1436.06-07-004-00","1","","12-03-2022","Amar","PPRAJ","2022-03-12"
"AL1436.06","07-020-R1-FEMALE ROLLER","AL1436.06-07-020-R1","1","","16-05-2022","Amar","PPRAJ","2022-05-16"
"AL1436.06","16-011-R1- U PROFILE GUIDE BOTTOM","AL1436.06-16-011-R1","3","","31-05-2022","Amar","PPRAJ","2022-05-31"
"AL1436.06","01-040-R1 COUPLER HOLDER","AL1436.06-01-040-R1","1","","10-05-2022","Amar","PPRAJ","2022-05-10"
"AL1436.06","20-101-00-COMPONENT STOPPER BEAM","AL1436.06-20-101-00","4","","11-07-2022","Amar","PPRAJ","2022-07-11"
"AL1436.06","07-180-00-CLAMP LOCK","AL1436.06-07-180-00","2","","11-07-2022","Amar","PPRAJ","2022-07-11"
"AL1436.06","10-030-00 CUTTER BLADE GUIDE-LH","AL1436.06-10-030-00","1","","04-06-2022","Amar","PPRAJ","2022-06-04"
"AL1436.06","07-020-R2-FEMALE ROLLER","AL1436.06-07-020-R2","1","","29-06-2022","Amar","PPRAJ","2022-06-29"
"AL1436.06","10-040-00 COUPLER HOLDER","AL1436.06-10-040-00","1","","04-06-2022","Amar","PPRAJ","2022-06-04"
"AL1436.06","07-030-R1-MALE ROLLER","AL1436.06-07-030-R1","1","","16-05-2022","Amar","PPRAJ","2022-05-16"
"AL1436.06","16-030-R1-PAPER GUIDE","AL1436.06-16-030-R1","3","","31-05-2022","Amar","PPRAJ","2022-05-31"
"AL1436.06","01-052-R1-COUPLER","AL1436.06-01-052-R1","1","","16-03-2022","Amar","PPRAJ","2022-03-19"
"AL1436.06","07-018-00 DRIVER GEAR","AL1436.06-07-018-00","2","","16-05-2022","Amar","PPRAJ","2022-05-16"
"AL1436.06","24-184-R1 WEDGE GUIDE","AL1436.06-07-184-R1","1","","11-07-2022","Amar","PPRAJ","2022-07-11"
"AL1436.06","15-161-00-MAIN CYL MTG PLATE","AL1436.06-15-161-00","1","","25-11-2021","Amar","PPRAJ","2021-11-25"
"AL1436.06","13-040-00 HEATER TOP COVER","AL1436.06-13-040-00","2","","30-11-2021","Amar","PPRAJ","2021-11-30"
"AL1436.06","10-108-00-COMPONENT STOPPER","AL1436.06-10-108-00","1","","04-06-2022","Amar","PPRAJ","2022-06-04"
"AL1436.06","07-003-00 FEMALE ROLLER SPACER","AL1436.06-07-003-00","1","","18-06-2022","Amar","PPRAJ","2022-06-18"
"AL1436.06","01-106-R1 GUIDE PLUNGER","AL1436.06-01-106-R1","2","","19-03-2022","Amar","PPRAJ","2022-03-19"
"AL1436.06","01-040-00 COUPLER HOLDER","AL1436.06-01-040-R1","1","","12-03-2022","Amar","PPRAJ","2022-03-12"
"AL1436.06","07-017-00 DRIVEN GEAR","AL1436.06-07-017-00","2","","16-05-2022","Amar","PPRAJ","2022-05-16"
"AL1436.06","07-012-00-INDEXER ROLLER ASSY MTG BRKT","AL1436.06-07-012-00","1","","28-09-2021","Nirmal","Chandru","2021-09-28"
"AL1436.06","10-109-00-COMPONENT STOPPER","AL1436.06-10-109-00","1","","11-07-2022","Amar","PPRAJ","2022-07-11"
"AL1436.06","20-240-00-GUIDE PLATE","AL1436.06-20-240-00","2","","25-11-2021","Amar","PPRAJ","2021-11-25"
"AL1436.06","01-140-00-PAWL","AL1436.06-01-140-00","2","","29-10-2021","Amar","PPRAJ","2021-10-29"
"AL1436.06","14-09-00-BASE GUIDE","AL1436.06-14-09-00","1","","30-11-2021","Amar","PPRAJ","2021-11-30"
"AL1436.06","01-061-00 CUTTING BLADE","AL1436.06-01-061-00","10","","04-06-2022","Amar","PPRAJ","2022-06-04"
"AL1436.06","07-030-R2-MALE ROLLER","AL1436.06-07-030-R2","1","","29-06-2022","Amar","PPRAJ","2022-06-29"
"AL1436.06","10-031-00 CUTTER BLADE GUIDE-RH","AL1436.06-10-031-00","1","","04-06-2022","Amar","PPRAJ","2022-06-04"
"AL1436.07","03-170-00-V BLOCK -RH","AL1436.07-03-170-00-V BLOCK -RH","2","","30-11-2021","Dayanand","PPRAJ","2021-11-30"
"AL1436.07","02-510-00-TOOL HOLDER","AL1436.07-02-510-00-TOOL HOLDER","2","","07-07-2022","Dayanand","PPRAJ","2022-07-07"
"AL1436.07","03-570-00-GUAGE SHEET","AL1436.07-03-570-00-GUAGE SHEET","2","","24-03-2022","Dayanand","PPRAJ","2022-03-24"
"AL1436.07","03-171-00-V BLOCK -LH","AL1436.07-03-171-00-V BLOCK -LH","2","","30-11-2021","Dayanand","PPRAJ","2021-11-30"
"AL1436.07","03-172-00-V BLOCK -RH","AL1436.07-03-172-00-V BLOCK -RH","2","","30-11-2021","Dayanand","PPRAJ","2021-11-30"
"AL1436.07","03-040-00-V BLOCK -LH","AL1436.07-03-040-00-V BLOCK -LH","2","","30-11-2021","Dayanand","PPRAJ","2021-11-30"
"AL1436.08","10-380-00-SUPPORT GUIDE PLATE","AL1436.08-10-380-00-SUPPORT GUIDE PLATE","2","","16-11-2021","Dayanand","PPRAJ","2021-11-16"
"AL1436.08","02-550-00- SPRING SUP STOPPER","AL1436.08-02-550-00- SPRING SUP STOPPER","2","","31-10-2021","Kiran","PPRAJ","2021-10-31"
"AL1436.08","02-520-00-CAM LIFTING","AL1436.08-02-520-00-CAM LIFTING","1","","31-10-2021","Kiran","PPRAJ","2021-10-31"
"AL1436.08","02-460-R1-TENSIONER COUPLER PLATE","AL1436.08-02-460-R1-TENSIONER COUPLER PLATE","1","","05-11-2021","Kiran","PPRAJ","2021-11-05"
"AL1436.08","02-500-00-LIFTING CAM HOLDER","AL1436.08-02-500-00-LIFTING CAM HOLDER","1","","31-10-2021","Kiran","PPRAJ","2021-10-31"
"AL1436.08","02-450-R1-TENSIONER COUPLER","AL1436.08-02-450-R1-TENSIONER COUPLER","1","","06-06-2022","Dayanand","PPRAJ","2022-06-06"
"AL1436.08","02-360-00-GEAR BOX SUPPORT PLATE","AL1436.05-02-360-00-GEAR BOX SUPPORT PLATE","1","","22-12-2021","Dayanand","PPRAJ","2021-12-22"
"AL1436.08","02-590-00-CAM TENSTIONER SPRING","AL1436.08-02-590-00-CAM TENSTIONER SPRING","4","","31-10-2021","Kiran","PPRAJ","2021-10-31"
"AL1436.08","02-530-00- GUIDE PLR MTG PLT","AL1436.08-02-530-00- GUIDE PLR MTG PLT","1","","31-10-2021","Kiran","PPRAJ","2021-10-31"
"AL1436.08","02-510-00-SPACER FOR LFT CAM","AL1436.08-02-510-00-SPACER FOR LFT CAM","1","","31-10-2021","Kiran","PPRAJ","2021-10-31"
"AL1436.08","02-510-R1-SPACER FOR LFT CAM","AL1436.08-02-510-R1-SPACER FOR LFT CAM","1","","06-06-2022","Dayanand","PPRAJ","2022-06-06"
"AL1436.08","02-600-00-SLIDE MOTOR CNT PLT","AL1436.08-02-600-00-SLIDE MOTOR CNT PLT","1","","03-11-2021","Kiran","PPRAJ","2021-11-03"
"AL1436.08","10-390-00-SUPPORT GUIDE PLATE","AL1436.08-10-390-00-SUPPORT GUIDE PLATE","2","","16-11-2021","Dayanand","PPRAJ","2021-11-16"
"AL1436.08","02-540-00- SPRING SUP SPACER","AL1436.08-02-540-00- SPRING SUP SPACER","2","","31-10-2021","Kiran","PPRAJ","2021-10-31"
"AL1436.08","02-490-00-DIA 16 GUIDE ROD","AL1436.08-02-490-00-DIA 16 GUIDE ROD","2","","31-10-2021","Kiran","PPRAJ","2021-10-31"
"AL1436.08","02-520-R1-CAM LIFTING","AL1436.08-02-520-R1-CAM LIFTING","1","","06-06-2022","Dayanand","PPRAJ","2022-06-06"
"AL1436.08","02-340-R1-OSCILATION DISC","AL1436.08-02-340-R1-OSCILATION DISC","1","","06-06-2022","Dayanand","PPRAJ","2022-06-06"
"AL1444.02","01-220-00-GUIDE PLATE 22 PAPER LH","AL1444.02-01-220-00","4","","20-04-2022","Amar","PPRAJ","2022-04-20"
"AL1444.02","01-210-R1-PAPER GUIDE STRIP","AL1444.02-01-210-R1","5","","21-01-2022","Amar","PPRAJ","2022-01-21"
"AL1444.02","02-070-00-PAPER SUPPORT CONVEAR","AL1444.02-02-070-00","6","","08-10-2021","Amar","PPRAJ","2021-10-08"
"AL1444.02","01-180-00-GUIDED COMPONENT HOLDER","AL1444.02-01-180-00","5","","07-10-2021","Nirmal","PPRAJ","2021-10-07"
"AL1444.02","01-221-00-GUIDE PLATE 22 PAPER","AL1444.02-01-221-00","4","","20-04-2022","Amar","PPRAJ","2022-04-20"
"AL1444.02","01-190-00-SINGLE BLOCK FEEDER PLATE","AL1444.02-01-190-00","10","","07-10-2021","Nirmal","PPRAJ","2021-10-07"
"AL1444.02","04-021-00-IND CYL MTG PLT","AL1444.02-04-021-00","1","","10-03-2022","Amar","PPRAJ","2022-03-10"
"AL1444.03","04-08-00-PAWL HOLDER","AL1444.03-04-08-00","3","","25-10-2021","Amar","PPRAJ","2021-10-25"
"AL1444.03","04-39-00-PAWL HOLDER","AL1444.03-04-39-00","3","","25-10-2021","Amar","PPRAJ","2021-10-25"
"AL1444.03","10-83-00-SETTING GAUGE BLOCK","AL1444.03-10-83-00","2","","12-05-2022","Amar","PPRAJ","2022-05-12"
"AL1444.03","04-03-00-HOOK HOLDER.","AL1444.03-04-03-00","6","","25-10-2021","Amar","PPRAJ","2021-10-25"
"AL1444.03","04-32-00-HOOK HOLDER.","AL1444.03-04-32-00","6","","25-10-2021","Amar","PPRAJ","2021-10-25"
"AL1444.03","10-32-00-SETTING GAUGE BLOCK FOR 152-SL","AL1444.03-10-32-00","2","","12-05-2022","Amar","PPRAJ","2022-05-12"
"AL1444.03","04-27-00-CENTRE BLOCK","AL1444.03-04-27-00","3","","25-10-2021","Amar","PPRAJ","2021-10-25"
"AL1444.03","04-13-00-BALANCING PLATE","AL1444.03-04-13-00","12","","25-10-2021","Amar","PPRAJ","2021-10-25"
"AL1444.03","04-10-00-HOOK GUDE MTG PLATE","AL1444.03-04-10-00","6","","25-10-2021","Amar","PPRAJ","2021-10-25"
"AL1444.03","04-40-00-BALANCING WEDGE","AL1444.03-04-40-00","6","","25-10-2021","Amar","PPRAJ","2021-10-25"
"AL1444.03","04-04-00-CENTRE BLOCK","AL1444.03-04-04-00","3","","25-10-2021","Amar","PPRAJ","2021-10-25"
"AL1444.03","04-33-00-HOOK SPRING REATINER","AL1444.03-04-33-00","6","","25-10-2021","Amar","PPRAJ","2021-10-25"
"AL1444.03","10-31-00-SETTING GAUGE BLOCK 162.3-SL","AL1444.03-10-31-00","2","","12-05-2022","Amar","PPRAJ","2022-05-12"
"AL1444.03","04-01-00-BACK PLATE","AL1444.03-04-01-00","6","","25-10-2021","Amar","PPRAJ","2021-10-25"
"AL1444.03","01-120-00-GRIPPER WIRE MTG PLATE","W1444.03-01-120-00","5","","12-03-2022","Amar","PPRAJ","2022-03-12"
"AL1444.03","04-30-00-BACK PLATE","AL1444.03-04-30-00","6","","25-10-2021","Amar","PPRAJ","2021-10-25"
"AL1444.03","04-14-00-HOOK SPRING REATINER","AL1444.03-04-14-00","6","","25-10-2021","Amar","PPRAJ","2021-10-25"
"AL1444.03","04-11-00- BOTTOM TO TOP  HOOKING PLATE","AL1444.03-04-11-00","6","","25-10-2021","Amar","PPRAJ","2021-10-25"
"AL1444.03","04-42-00- TOP TO BOTTOM  HOOKING PLATE","AL1444.03-04-42-00","6","","25-10-2021","Amar","PPRAJ","2021-10-25"
"AL1444.03","04-06-00-CENTRE BLOCK","AL1444.03-04-06-00","3","","25-10-2021","Amar","PPRAJ","2021-10-25"
"AL1444.03","04-35-00-HOOK GUDE MTG PLATE","AL1444.03-04-35-00","6","","25-10-2021","Amar","PPRAJ","2021-10-25"
"AL1444.03","10-73-00-STOPPER","AL1444.03-10-73-00","2","","12-05-2022","Amar","PPRAJ","2022-05-12"
"AL1444.03","04-02-00-HOOK GUIDE PLATE","AL1444.03-04-02-00","12","","25-10-2021","Amar","PPRAJ","2021-10-25"
"AL1444.03","04-31-00-HOOK GUIDE PLATE","AL1444.03-04-31-00","12","","25-10-2021","Amar","PPRAJ","2021-10-25"
"AL1444.03","04-26-00-CENTRE BLOCK","AL1444.03-04-26-00","3","","25-10-2021","Amar","PPRAJ","2021-10-25"
"AL1444.03","04-12-00-BALANCING WEDGE","AL1444.03-04-12-00","6","","25-10-2021","Amar","PPRAJ","2021-10-25"
"AL1444.05","06-200-00-PUSHER PAD","AL1444.05-06-200-00-PUSHER PAD","1","","28-06-2022","Dayanand","PPRAJ","2022-07-06"
"AL1444.05","04-31-00-SETTING GAUGE BLOCK 122-SL","AL1444.05-04-31-00-SETTING GAUGE BLOCK 122-SL","2","","27-06-2022","Dayanand","PPRAJ","2022-06-27"
"AL1444.05","06-220-00-STOPPER BUSH","AL1444.05-06-220-00-STOPPER BUSH","1","","06-07-2022","Dayanand","PPRAJ","2022-07-06"
"AL1444.05","03-96-00-COLLET","AL1444.05-03-96-00-COLLET","6","","09-03-2022","Dayanand","PPRAJ","2022-03-09"
"AL1444.05","06-210-00-GUAGE PLATE","AL1444.05-06-210-00-GUAGE PLATE","3","","28-06-2022","Dayanand","PPRAJ","2022-07-06"
"AL1444.05","06-230-00-GUIDE PLATE","AL1444.05-06-230-00-GUIDE PLATE","12","","13-07-2022","Dayanand","PPRAJ","2022-07-13"
"AL1444.05","06-010-00-V BLOCK","AL1444.05-06-010-00-V BLOCK","2","","11-01-2022","Dayanand","PPRAJ","2022-01-11"
"AL1444.05","06-130-00-SETTING MANDRAL","AL1444.05-06-130-00-SETTING MANDRAL","1","","04-04-2022","Dayanand","PPRAJ","2022-04-04"
"AL1444.05","06-120-R1-COMPONENT END STOPPER PLT","AL1444.05-06-120-R1-COMPONENT END STOPPER PLT","1","","28-06-2022","Dayanand","PPRAJ","2022-07-06"
"AL1444.08","04-011-00-FAN PUSHING CYL PLATE","AL1444.08-04-011-00","5","","28-12-2021","Sunil","PPRAJ","2022-01-10"
"AL1444.08","10-22-00-CONVER LOCKING PLT","AL1444.08-10-22-00","12","","28-12-2021","Sunil","PPRAJ","2022-01-10"
"AL1444.08","02-017-00-CRADLE CYL CONNECTOR","AL1444.08-02-017-00","3","","28-12-2021","Sunil","PPRAJ","2022-01-10"
"AL1444.08","03-013-00-TOP COMPONENT HOLDER","AL1444.08-03-013-00","3","","28-12-2021","Sunil","PPRAJ","2022-01-10"
"AL1444.08","03-038-00-DISPENSER COUPLER","AL1444.08-03-038-00","1","","11-06-2022","Nitish","PPRAJ","2022-06-11"
"AL1444.08","04-30-00-COVER FOR CYL","AL1444.08-04-30-00","3","","17-03-2022","Sunil","PPRAJ","2022-03-17"
"AL1444.08","04-26-00-SPR FOR  BTM BKT","AL1444.08-04-26-00","3","","28-12-2021","Sunil","PPRAJ","2022-01-10"
"AL1444.08","02-013-00-V BLOCK GUIDE PLATE","AL1444.08-02-013-00","6","","28-12-2021","Sunil","PPRAJ","2022-01-10"
"AL1444.08","03-010-00-CYLINDER HOLDER PLATE","AL1444.08-03-010-00","3","","28-12-2021","Sunil","PPRAJ","2022-01-10"
"AL1444.08","03-035-00-FAN DISPENSER BASE PLATE","AL1444.08-03-035-00","1","","11-06-2022","Nitish","PPRAJ","2022-06-11"
"AL1444.08","03-016-00-FAN SEPERATOR","AL1444.08-03-016-00","3","","10-01-2022","Sunil","PPRAJ","2022-01-10"
"AL1444.08","07-80-00-CYLINDER CPLR PLT","AL1444.08-07-80-00","3","","13-01-2022","Sunil","PPRAJ","2022-01-13"
"AL1444.08","04-23-00-BEARING SPACER","AL1444.08-04-23-00","3","","28-12-2021","Sunil","PPRAJ","2022-01-10"
"AL1444.08","02-010-00-CRADLE GUIDE ROD","AL1444.08-02-010-00","3","","28-12-2021","Sunil","PPRAJ","2022-01-10"
"AL1444.08","02-034-00-WALKING BEAM-FRONT  SIDE PLT","AL1444.08-02-034-00","3","","28-12-2021","Sunil","PPRAJ","2022-01-10"
"AL1444.08","04-33-00-FAN HOLDER","AL1444.08-04-33-00","2","","25-06-2022","Nitish","PPRAJ","2022-06-25"
"AL1444.08","03-27-00-STOPPER MTNG BKT","AL1444.08-03-27-00","3","","28-12-2021","Sunil","PPRAJ","2022-01-10"
"AL1444.08","07-50-00-ROD HOLDING PLATE","AL1444.08-07-50-00","3","","13-01-2022","Sunil","PPRAJ","2022-01-13"
"AL1444.08","04-020-00-COM SWING SUPPORT-LH","AL1444.08-04-020-00","3","","28-12-2021","Sunil","PPRAJ","2022-01-10"
"AL1444.08","07-30-00-COMP HOLDER","AL1444.08-07-30-00","3","","10-01-2022","Sunil","PPRAJ","2022-01-10"
"AL1444.08","02-025-00- CYLINER COUPLER","AL1444.08-02-025-00","6","","28-12-2021","Sunil","PPRAJ","2022-01-10"
"AL1444.08","03-23-00-5 GUID ROD","AL1444.08-03-23-00","3","","28-12-2021","Sunil","PPRAJ","2022-01-10"
"AL1444.08","03-054-00-GUIDE ROD BOLT","AL1444.08-03-054-00","4","","25-07-2022","Nitish","PPRAJ","2022-07-25"
"AL1444.08","04-017-00-BEARING MTG PLATE","AL1444.08-04-017-00","3","","28-12-2021","Sunil","PPRAJ","2022-01-10"
"AL1444.08","03-031-00-MULTI CYL MTG PLATE","AL1444.08-03-031-00","3","","29-01-2022","Sunil","PPRAJ","2022-01-29"
"AL1444.08","10-30-00-FIXED  BEAM SPACER PLT","AL1444.08-10-30-00","3","","28-12-2021","Sunil","PPRAJ","2022-01-10"
"AL1444.08","02-022-00-MAIN COUPLER","AL1444.08-02-022-00","3","","28-12-2021","Sunil","PPRAJ","2022-01-10"
"AL1444.08","03-20-00-PUSHER PLATE","AL1444.08-03-20-00","3","","28-12-2021","Sunil","PPRAJ","2022-01-10"
"AL1444.08","03-24-R1-TEN SPRING.","AL1444.08-03-24-R1","12","","23-07-2022","Nitish","PPRAJ","2022-07-23"
"AL1444.08","04-013-00-CYLINDER COUPLER HOLDER","AL1444.08-04-013-00","3","","28-12-2021","Sunil","PPRAJ","2022-01-10"
"AL1444.08","10-23-00-L PLATE","AL1444.08-10-23-00","12","","28-12-2021","Sunil","PPRAJ","2022-01-10"
"AL1444.08","02-019-00-VERTICAL CYL MTG BLOCK","AL1444.08-02-019-00","6","","28-12-2021","Sunil","PPRAJ","2022-01-10"
"AL1444.08","03-014-00-TOP COMP HOLDER","AL1444.08-03-014-00","3","","28-12-2021","Sunil","PPRAJ","2022-01-10"
"AL1444.08","04-31-00-CYLINDER ADAPTER","AL1444.08-04-31-00","3","","17-03-2022","Sunil","PPRAJ","2022-03-17"
"AL1444.08","03-029-00-FAN STOPPING PLATE RH","AL1444.08-03-029-00","3","","10-01-2022","Sunil","PPRAJ","2022-01-10"
"AL1444.08","04-27-00-LM BLOCK MTG PLATE","AL1444.08-04-27-00","3","","28-12-2021","Sunil","PPRAJ","2022-01-10"
"AL1444.08","02-014-00-STD GUIDE ROD Ø8","AL1444.08-02-014-00","6","","28-12-2021","Sunil","PPRAJ","2022-01-10"
"AL1444.08","03-011-00-VERTICAL PILLAR","AL1444.08-03-011-00","6","","28-12-2021","Sunil","PPRAJ","2022-01-10"
"AL1444.08","03-036-00-CYLINDER COUPLER HOLDER","AL1444.08-03-036-00","1","","11-06-2022","Nitish","PPRAJ","2022-06-11"
"AL1444.08","04-32-00-BACK SHEET","AL1444.08-04-32-00","3","","28-03-2022","Sunil","PPRAJ","2022-03-28"
"AL1444.08","07-90-00- CYLINER COUPLER","AL444.08-07-90-00","3","","13-01-2022","Sunil","PPRAJ","2022-01-13"
"AL1444.08","04-24-00-COM HLDR  LOCKING SPACER","AL14440.08-04-24-00","6","","28-12-2021","Sunil","PPRAJ","2022-01-10"
"AL1444.08","02-011-00-GUIDE BUSH MTG PLATE","AL1444.08-02-011-00","3","","28-12-2021","Sunil","PPRAJ","2022-01-10"
"AL1444.08","02-035-00-WALKING BEAM-BACK SIDE PLT","AL1444.08-02-035-00","3","","28-12-2021","Sunil","PPRAJ","2022-01-10"
"AL1444.08","03-047-00-FAN GUIDE FOR DISPENCER CANBERA","AL1444.08-03-047-00","4","","25-06-2022","Nitish","PPRAJ","2022-06-25"
"AL1444.08","03-28-00-STOPPER","AL1444.08-03-28-00","3","","28-12-2021","Sunil","PPRAJ","2022-01-10"
"AL1444.08","07-60-00-ROD HOLDING PLATE","AL1444.08-07-60-00","3","","13-01-2022","Sunil","PPRAJ","2022-01-13"
"AL1444.08","04-021-00- BEARING RETAINER PLATE","AL1444.08-04-021-00","3","","28-12-2021","Sunil","PPRAJ","2022-01-10"
"AL1444.08","07-40-00-ROTARY CYLINER MTG PLATE","AL1444.08-07-40-00","3","","10-01-2022","Sunil","PPRAJ","2022-01-10"
"AL1444.08","02-026-00-TIE SPACER PLT","AL1444.08-02-026-00","12","","28-12-2021","Sunil","PPRAJ","2022-01-10"
"AL1444.08","03-049-00-FAN GUIDE FOR DISPENCR","AL1444.08-03-049-00","4","","09-06-2022","Nitish","PPRAJ","2022-06-09"
"AL1444.08","03-24-00-TEN SPRING.","AL1444.08-03-24-00","6","","28-12-2021","Sunil","PPRAJ","2022-01-10"
"AL1444.08","04-018-00-COM HOLDER HINGE PIN","AL1444.08-04-018-00","3","","28-12-2021","Sunil","PPRAJ","2022-01-10"
"AL1444.08","03-033-00-NYLON BLOCK","AL1444.08-03-033-00","3","","29-01-2022","Sunil","PPRAJ","2022-01-29"
"AL1444.08","07-10-00-COUPLER HOLDING PLATE","AL1444.08-07-10-00","5","","10-01-2022","Sunil","PPRAJ","2022-01-10"
"AL1444.08","02-023-00-STD GUIDE ROD","AL1444.08-02-023-00","12","","28-12-2021","Sunil","PPRAJ","2022-01-10"
"AL1444.08","03-21-00-GUIDE ROD Ø8","AL1444.08-03-21-00","3","","28-12-2021","Sunil","PPRAJ","2022-01-10"
"AL1444.08","04-014-00-COUPLER","AL1444.08-04-014-00","4","","28-12-2021","Sunil","PPRAJ","2022-01-10"
"AL1444.08","01-20-00-RORARY MTG PLT","AL1444.08-01-20-00","3","","03-06-2022","Sunil","PPRAJ","2022-06-03"
"AL1444.08","10-27-00-FIXED BEAM MTG HSG","AL1444.08-10-27-00","12","","28-12-2021","Sunil","PPRAJ","2022-01-10"
"AL1444.08","02-020-00-DIA 12 GUIDE ROD","AL1444.08-02-020-00","12","","28-12-2021","Sunil","PPRAJ","2022-01-10"
"AL1444.08","03-018-00-CHUTE HLDING BKT","AL1444.08-03-018-00","5","","28-12-2021","Sunil","PPRAJ","2022-01-10"
"AL1444.08","03-30-00-FAN STOPPING PLATE LH","AL1444.08-03-30-00","3","","10-01-2022","Sunil","PPRAJ","2022-01-10"
"AL1444.08","10-01-00-FIXED  BEAM","AL1444.08-10-01-00","3","","28-12-2021","Sunil","PPRAJ","2022-01-10"
"AL1444.08","02-016-00-COMP HOLDER","AL1444.08-02-016-00","3","","28-12-2021","Sunil","PPRAJ","2022-01-10"
"AL1444.08","03-012-00-TOP V BLOCK","AL1444.08-03-012-00","3","","28-12-2021","Sunil","PPRAJ","2022-01-10"
"AL1444.08","03-037-00-DISPENSER ASSY CYL MTG PLATE","AL1444.08-03-037-00","1","","11-06-2022","Nitish","PPRAJ","2022-06-11"
"AL1444.08","04-25-00-FAN PRESING BOTT0M BRAKET","AL1444.08-04-25-00","3","","28-12-2021","Sunil","PPRAJ","2022-01-10"
"AL1444.08","02-012-00-V BLOCK ADJUSTABLE BLOCK","AL1444.08-02-012-00","4","","28-12-2021","Sunil","PPRAJ","2022-01-10"
"AL1444.08","02-037-00-MOVING FRAME HOLDER","AL1444.08-02-037-00","10","","28-12-2021","Sunil","PPRAJ","2022-01-10"
"AL1444.08","03-015-00-FAN STOPPING PLATE","AL1444.08-03-015-00","3","","10-01-2022","Sunil","PPRAJ","2022-01-10"
"AL1444.08","07-70-00-STD GUIDE ROD","AL1444.08-07-70-00","6","","13-01-2022","Sunil","PPRAJ","2022-01-13"
"AL1444.08","04-022-00-COM LOCATOR","AL1444.08-04-022-00","3","","28-12-2021","Sunil","PPRAJ","2022-01-10"
"AL1444.08","01-010-00- BASE PLATE","AL1444.08-01-010-00","3","","08-01-2022","Sunil","PPRAJ","2022-01-10"
"AL1444.08","02-027-00-MAIN CYL MTG PLATE","AL1444.08-02-027-00","5","","28-12-2021","Sunil","PPRAJ","2022-01-10"
"AL1444.08","03-053-00-GUIDE ROD BOLT","AL1444.08-03-053-00","4","","16-07-2022","Nitish","PPRAJ","2022-07-16"
"AL1444.08","03-25-00-CYL SPT PLT","AL1444.08-03-25-00","3","","28-12-2021","Sunil","PPRAJ","2022-01-10"
"AL1444.08","04-019-00- BEARING RETAINER PLATE","AL1444.08-04-019-00","3","","28-12-2021","Sunil","PPRAJ","2022-01-10"
"AL1444.08","04-028-00- CYL BACK SIDE COUPLER","AL1444.08-04-028-00","3","","29-01-2022","Sunil","PPRAJ","2022-01-29"
"AL1444.08","07-20-00-ROTARY PLATE","AL1444.08-07-20-00","3","","10-01-2022","Sunil","PPRAJ","2022-01-10"
"AL1444.08","02-024-00-CYLINDER STOPER PLT","AL1444.08-02-024-00","6","","28-12-2021","Sunil","PPRAJ","2022-01-10"
"AL1444.08","03-22-00-ROLLED SHEET FOR FAN","AL1444.08-03-22-00","3","","28-12-2021","Sunil","PPRAJ","2022-01-10"
"AL1444.08","04-016-00-COM HOLDER","AL1444.08-04-016-00","3","","28-12-2021","Sunil","PPRAJ","2022-01-10"
"AL1444.08","10-29-00-FIXED  BEAM-FRONT","AL1444.08-10-29-00","3","","28-12-2021","Sunil","PPRAJ","2022-01-10"
"AL1444.08","02-021-00-COUPLER HOLDER PLATE","AL1444.08-02-021-00","3","","28-12-2021","Sunil","PPRAJ","2022-01-10"
"AL1444.08","03-019-00-FAN CHUTE TOP CUP","AL1444.08-03-019-00","3","","28-12-2021","Sunil","PPRAJ","2022-01-10"
"AL1445.01","04-02-00- MANDREL TOP BUSH","AL1445.01-04-02-00","1","","11-07-2022","Amar","PPRAJ","2022-07-11"
"AL1445.01","02-09-00-ROD HOUSING BOTTOM","AL1445.01-02-09-00","10","","31-08-2021","Amar","PPRAJ","2021-08-31"
"AL1445.01","02-14-00-TOP EI HOLDER","AL1445.01-02-14-00","1","","30-06-2022","Amar","PPRAJ","2022-06-30"
"AL1445.01","02-04-00-CYLINDER HOLDER PLATE","AL1445.01-02-04-00","5","","31-08-2021","Amar","PPRAJ","2021-08-31"
"AL1445.01","02-19-00-EI HOLDING BLK","AL1445.01-02-19-00","1","","30-06-2022","Amar","PPRAJ","2022-06-30"
"AL1445.01","01-110-00-COMP GUIDE","AL1445.01-01-110-00","5","","31-08-2021","Amar","PPRAJ","2021-08-31"
"AL1445.01","02-20-00-STOPER PAD","AL1445.01-02-20-00","4","","30-06-2022","Amar","PPRAJ","2022-06-30"
"AL1445.01","03-04-00-STOPPER","AL1445.01-03-04-00","5","","31-08-2021","Amar","PPRAJ","2021-08-31"
"AL1445.01","01-04-00- STOPPER PAD","AL1445.01-01-04-00","4","","05-03-2022","Amar","PPRAJ","2022-03-05"
"AL1445.01","02-24-00-COMMUTATOR HOLDER-Ø28","AL1445.01-02-24-00","1","","30-06-2022","Amar","PPRAJ","2022-06-30"
"AL1445.01","02-04-00-CYLINDER HOLDER PLATE","AL1445.01-02-04-00","1","","08-07-2022","Amar","PPRAJ","2022-07-08"
"AL1445.01","03-02-00GUIDE BUSH HOLDER","AL1445.01-03-02-00","10","","31-08-2021","Amar","PPRAJ","2021-08-31"
"AL1445.01","02-03-R1-GUIDE ROD","AL1445.01-02-03-R1","2","","30-06-2022","Amar","PPRAJ","2022-06-30"
"AL1445.01","02-06-00-COUPLER BLOCK","AL1445.01-02-06-00","5","","31-08-2021","Amar","PPRAJ","2021-08-31"
"AL1445.01","02-15-00-SHAFT PRESS TOOL","AL1445.01-02-15-00","1","","30-06-2022","Amar","PPRAJ","2022-06-30"
"AL1445.01","02-02-00-TOP SUPPORT WASHER","AL1445.01-02-02-00","10","","31-08-2021","Amar","PPRAJ","2021-08-31"
"AL1445.01","02-25-00-CYLINDER COUPLER NUT","AL1445.01-02-25-00","4","","09-07-2022","Amar","PPRAJ","2022-07-09"
"AL1445.01","02-16-00-STACK LOCATOR","AL1445.01-02-16-00","1","","30-06-2022","Amar","PPRAJ","2022-06-30"
"AL1445.01","04-03-00- MANDREL BOTTOM BUSH","AL1445.01-04-03-00","1","","11-07-2022","Amar","PPRAJ","2022-07-11"
"AL1445.01","01-06-00-GUIDE STRIP","AL1445.01-01-06-00","6","","31-08-2021","Amar","PPRAJ","2021-08-31"
"AL1445.01","01-140-00-JACKING PLT","AL1445.01-01-140-00","5","","31-08-2021","Amar","PPRAJ","2021-08-31"
"AL1445.01","02-11-00-STRIPPER  PLATE","AL1445.01-02-11-00","1","","30-06-2022","Amar","PPRAJ","2022-06-30"
"AL1445.01","01-100-00-COMPONENT LOCATOR","AL1445.01-01-100-00","5","","31-08-2021","Amar","PPRAJ","2021-08-31"
"AL1445.01","01-05-00-STOPPER","AL1445.01-01-05-00","2","","30-06-2022","Amar","PPRAJ","2022-06-30"
"AL1445.01","03-06-00-TIMER ROLLER HOLDER","AL1445.01-03-06-00","5","","31-08-2021","Amar","PPRAJ","2021-08-31"
"AL1445.01","02-23-00-COMMUTATOR HOLDER","AL1445.01-02-23-00","1","","30-06-2022","Amar","PPRAJ","2022-06-30"
"AL1445.01","02-05-R1-CYLINDER COUPLER","AL1445.01-02-05-R1","5","","31-08-2021","Amar","PPRAJ","2021-08-31"
"AL1445.01","03-01-00-TOOL HOLDER PLATE","AL1445.01-03-01-00","1","","30-06-2022","Amar","PPRAJ","2022-06-30"
"AL1445.01","04-01-00-SETTING MANDREL","AL1445.01-4-01-00","1","","11-07-2022","Amar","PPRAJ","2022-07-11"
"AL1445.01","02-03-00-GUIDE ROD","AL1445.01-02-03-00","10","","31-08-2021","Amar","PPRAJ","2021-08-31"
"AL1445.01","02-21-00-STOPER PAD","AL1445.01-02-21-00","2","","30-06-2022","Amar","PPRAJ","2022-06-30"
"AL1445.01","03-08-00- STOPPER PAD","AL1445.01-03-08-00","8","","07-04-2022","Amar","PPRAJ","2022-04-07"
"AL1445.01","01-05-00-STOPPER","AL1445.01-01-05-00","10","","31-08-2021","Amar","PPRAJ","2021-08-31"
"AL1445.01","01-07-00- STOPPER PAD","AL1445.01-01-07-00","4","","23-03-2022","Amar","PPRAJ","2022-03-23"
"AL1445.01","01-120-00-COM LOCATOR","AL1445.01-01-120-00","5","","31-08-2021","Amar","PPRAJ","2021-08-31"
"AL1445.01","02-17-00-SPACER FOR GUIDE BUSH","AL1445.01-02-17-00","2","","30-06-2022","Amar","PPRAJ","2022-06-30"
"AL1445.01","01-130-00-COMP GUIDE PIN","AL1445.01-01-130-00","5","","31-08-2021","Amar","PPRAJ","2021-08-31"
"AL1445.01","01-04-00- STOPPER PAD","AL1445.01-01-04-00","6","","30-06-2022","Amar","PPRAJ","2022-06-30"
"AL1445.01","03-07-00-TIMER ROLLER HOLDER","AL1445.01-03-07-00","5","","31-08-2021","Amar","PPRAJ","2021-08-31"
"AL1445.01","02-22-00-SCREW STOPPER","AL1445.01-02-22-00","1","","30-06-2022","Amar","PPRAJ","2022-06-30"
"AL1445.01","03-01-00-TOOL HOLDER PLATE","AL1445.01-03-01-00","5","","31-08-2021","Amar","PPRAJ","2021-08-31"
"AL1445.01","02-05-R1-CYLINDER COUPLER","AL1445.01-02-05-R1","1","","30-06-2022","Amar","PPRAJ","2022-06-30"
"AL1445.02","04-021-00-IND CYL MTG PLT","AL1445.02-04-021-00","1","","10-03-2022","Amar","PPRAJ","2022-03-10"
"AL1445.02","08-020-00-GAUGE (26)","AL1445.02-08-020-00","2","","13-07-2022","Nirmal","PPRAJ","2022-07-13"
"AL1445.02","10-011-00-CYLINDER COUPLER","AL1445.02-10-011-00","5","","09-09-2021","Nirmal","PPRAJ","2021-09-09"
"AL1445.02","08-050-00-GAUGE (44)","AL1445.02-08-050-00","2","","13-07-2022","Nirmal","PPRAJ","2022-07-13"
"AL1445.02","03-110-00-CYLINDER COUPLER","AL1445.02-03-110-00","5","","09-09-2021","Nirmal","PPRAJ","2021-09-09"
"AL1445.02","23-12-00-CRADLE GUIDE ROD","AL1445.02-23-12-00","1","","08-06-2022","Amar","PPRAJ","2022-06-08"
"AL1445.02","23-31-00-CRADLE CYL CONNECTOR","AL1445.02-23-31-00","5","","09-09-2021","Nirmal","PPRAJ","2021-09-09"
"AL1445.02","08-060-00-GAUGE (49)","AL1445.02-08-060-00","2","","13-07-2022","Nirmal","PPRAJ","2022-07-13"
"AL1445.02","04-010-00-IXR CYL CONNTR","AL1445.02-04-010-00","6","","09-09-2021","Nirmal","PPRAJ","2021-09-09"
"AL1445.02","23-161-00-MAIN CYL MTG PLATE","AL1445.02-23-161-00","5","","17-09-2021","Amar","PPRAJ","2021-09-17"
"AL1445.02","08-030-00-GAUGE (30-34)","AL1445.02-08-030-00","4","","13-07-2022","Nirmal","PPRAJ","2022-07-13"
"AL1445.02","23-41-00-COMP HOLDER","AL1445.02-23-41-00","2","","08-06-2022","Amar","PPRAJ","2022-06-08"
"AL1445.02","23-101-00- CYLINER COUPLER","AL1445.02-23-101-00","10","","09-09-2021","Nirmal","PPRAJ","2021-09-09"
"AL1445.02","08-010-00-GAUGE (20-23)","AL1445.02-08-010-00","4","","13-07-2022","Nirmal","PPRAJ","2022-07-13"
"AL1445.02","05-030-00-STOPPER BUSH","AL1445.02-05-030-00","5","","09-09-2021","Nirmal","PPRAJ","2021-09-09"
"AL1445.02","08-040-00-GAUGE (38)","AL1445.02-08-040-00","2","","13-07-2022","Nirmal","PPRAJ","2022-07-13"
"AL1445.02","23-42-00-COMP HOLDER","AL1445.02-23-42-00","2","","08-06-2022","Amar","PPRAJ","2022-06-08"
"AL1445.02","02-106-00-CYLINDER COUPLER","AL1445.02-02-106-00","5","","09-09-2021","Nirmal","PPRAJ","2021-09-09"
"AL1445.03","04-35-00-HOOK GUDE MTG PLATE","AL1445.03-04-35-00","10","","04-09-2021","Amar","PPRAJ","2021-09-04"
"AL1445.03","09-05-00-COLLET SLEEVE","AL1445.03-09-05-00","18","","01-09-2021","Amar","PPRAJ","2021-09-04"
"AL1445.03","12-12-00-CYLINDER COUPLER","AL1445.03-12-12-00","5","","02-10-2021","Amar","PPRAJ","2021-10-02"
"AL1445.03","05-11-00-COLLET","AL1445.03-05-11-00","24","","04-09-2021","Amar","PPRAJ","2021-09-04"
"AL1445.03","09-25-00-INDEXER SHAFT","AL1445.03-09-25-00","9","","01-09-2021","Amar","PPRAJ","2021-09-04"
"AL1445.03","10-20-00-  COUPLER","AL1445.03-10-20-00","9","","02-09-2021","Amar","PPRAJ","2021-09-03"
"AL1445.03","10-67-00-COMP.CLAMPING PLT","AL1445.03-10-67-00","6","","03-09-2021","Amar","PPRAJ","2021-09-04"
"AL1445.03","10-81-00-COMPONENT  SEN PLT","AL1445.03-10-81-00","5","","02-09-2021","Amar","PPRAJ","2021-09-03"
"AL1445.03","10-32-00-SETTING GAUGE BLOCK FOR 158-SL","AL1445.03-10-32-00","2","","12-05-2022","Amar","PPRAJ","2022-05-12"
"AL1445.03","14-02-00-PROFILE L-PLATE","AL1445.03-14-02-00","4","","09-10-2021","Amar","PPRAJ","2021-10-09"
"AL1445.03","12-15-R2-COMPONENT HOLDER JAW","AL1445.03-12-15-R2","6","","30-12-2021","Amar","PPRAJ","2021-12-30"
"AL1445.03","15-06-00-BUFFER PLATE","AL1445.03-15-06-00","8","","09-10-2021","Amar","PPRAJ","2021-10-09"
"AL1445.03","12-15-00-COMPONENT HOLDER JAW","AL1445.03-12-15-00","10","","02-10-2021","Amar","PPRAJ","2021-10-02"
"AL1445.03","05-07-00-GRIPPER SLEEVE","AL1445.03-05-07-00","4","","04-09-2021","Amar","PPRAJ","2021-09-04"
"AL1445.03","09-27-00-INDEXER SHAFT PULLEY","AL1445.03-09-027-00","19","","01-09-2021","Amar","PPRAJ","2021-09-04"
"AL1445.03","10-37-R1-SETTING GAUGE BLOCK","AL1445.03-10-37-R1","2","","06-07-2022","Amar","PPRAJ","2022-07-06"
"AL1445.03","07-13-00-BALANCING PLATE","AL1445.03-07-13-00","8","","11-04-2022","Amar","PPRAJ","2022-04-11"
"AL1445.03","10-86-00-SI CONVER AND LODER SEN BRKT","AL1445.03-10-86-00","5","","03-09-2021","","PPRAJ","2021-09-04"
"AL1445.03","10-05-00-CYLINDER MTG PLT","AL1445.03-10-05-00","18","","02-09-2021","Amar","PPRAJ","2021-09-03"
"AL1445.03","15-04-00-SUPPORT BKT MTG PLT","AL1445.03-15-04-00","4","","29-12-2021","Amar","PPRAJ","2021-12-29"
"AL1445.03","04-41-00-BALANCING PLATE","AL1445.03-04-41-00","10","","04-09-2021","Amar","PPRAJ","2021-09-04"
"AL1445.03","15-07-00-L PLATE","AL1445.03-15-07-00","4","","09-10-2021","Amar","PPRAJ","2021-10-09"
"AL1445.03","04-14-00-HOOK SPRING REATINER","AL1445.03-04-14-00","10","","04-09-2021","Amar","PPRAJ","2021-09-04"
"AL1445.03","09-19-00-CYLINDER MTG PLT","AL1445.03-09-19-00","18","","01-09-2021","Amar","PPRAJ","2021-09-04"
"AL1445.03","07-10-00-HOOK GUDE MTG PLATE","AL1445.03-07-10-00","8","","11-04-2022","Amar","PPRAJ","2022-04-11"
"AL1445.03","12-01-00-TRAVELING PLATE","AL1445.03-12-01-00","5","","02-10-2021","Amar","PPRAJ","2021-10-02"
"AL1445.03","06-04-00-WIRE GUIDE PLT","AL1445.03-06-04-00","10","","06-09-2021","Amar","PPRAJ","2021-09-06"
"AL1445.03","09-04-00-CYLINDER MTG PLATE","AL1445.03-09-04-00","18","","01-09-2021","Amar","PPRAJ","2021-09-04"
"AL1445.03","10-09-00-CYL CONNECTOR","AL1445.03-10-09-00","9","","02-09-2021","Amar","PPRAJ","2021-09-03"
"AL1445.03","04-33-00-HOOK SPRING REATINER","AL1445.03-04-33-00","10","","04-09-2021","Amar","PPRAJ","2021-09-04"
"AL1445.03","10-24-00-STOPPER","AL1445.03-10-24-00","9","","02-09-2021","Amar","PPRAJ","2021-09-03"
"AL1445.03","15-10-00-MTG BRKT","AL1445.03-15-10-00","4","","09-10-2021","Amar","PPRAJ","2021-10-09"
"AL1445.03","04-12-00-BALANCING WEDGE","AL1445.03-04-12-00","10","","04-09-2021","Amar","PPRAJ","2021-09-04"
"AL1445.03","09-24-00-BEARING HSG","AL1445.03-09-24-00","9","","01-09-2021","Amar","PPRAJ","2021-09-04"
"AL1445.03","17-11-00-HINGE PLATE","AL1445.03-17-11-00","10","","18-07-2022","Amar","PPRAJ","2022-07-18"
"AL1445.03","10-84-00-SETTING GAUGE BLOCK","AL1445.03-10-84-00","2","","08-06-2022","Amar","PPRAJ","2022-06-08"
"AL1445.03","07-06-00-CENTRE BLOCK","AL1445.03-07-06-00","4","","11-04-2022","Amar","PPRAJ","2022-04-11"
"AL1445.03","12-04-00-GUIDE ROD","AL1445.03-12-04-00","20","","02-10-2021","Amar","PPRAJ","2021-10-02"
"AL1445.03","06-05-00-SUPPORT PIPE","AL1445.03-06-05-00","10","","06-09-2021","Amar","PPRAJ","2021-09-06"
"AL1445.03","09-15-00-LOCK PLATE PUSHER","AL1445.03-09-15-00","18","","01-09-2021","Amar","PPRAJ","2021-09-04"
"AL1445.03","10-14-00-DOME NUT","AL1445.03-10-14-00","9","","02-09-2021","Amar","PPRAJ","2021-09-03"
"AL1445.03","04-27-00-CENTRE BLOCK","AL1445.03-04-27-00","5","","04-09-2021","Amar","PPRAJ","2021-09-04"
"AL1445.03","10-35-00-CRADLE CYLINDER MTG SPACER","AL1445.03-10-35-00","9","","02-09-2021","Amar","PPRAJ","2021-09-03"
"AL1445.03","14-08-00-MTG BRKT","AL1445.03-14-08-00","4","","09-10-2021","Amar","PPRAJ","2021-10-09"
"AL1445.03","04-11-00- BOTTOM TO TOP  HOOKING PLATE","AL1445.03-04-11-00","10","","04-09-2021","Amar","PPRAJ","2021-09-04"
"AL1445.03","10-31-00-COLLET CLOSE SEN BRKT","AL1445.03-10-31-00","10","","01-09-2021","Amar","PPRAJ","2021-09-04"
"AL1445.03","17-06-00-BUFFER PLATE","AL1445.03-17-06-00","4","","18-07-2022","Amar","PPRAJ","2022-07-18"
"AL1445.03","07-01-00-BACK PLATE","AL1445.03-07-01-00","8","","11-04-2022","Amar","PPRAJ","2022-04-11"
"AL1445.03","12-08-00-GUIDE BUSH MTG PLATE","AL1445.03-12-08-00","5","","02-10-2021","Amar","PPRAJ","2021-10-02"
"AL1445.03","09-01-00-LM RAIL BASE PLT","AL1445.03-09-01-00","9","","01-09-2021","Amar","PPRAJ","2021-09-04"
"AL1445.03","10-17-00- CYLINER COUPLER","AL1445.03-10-17-00","18","","02-09-2021","Amar","PPRAJ","2021-09-03"
"AL1445.03","10-40-00-FIXED  BEAM SPACER PLT","AL1445.03-10-40-00","5","","03-09-2021","Amar","PPRAJ","2021-09-04"
"AL1445.03","10-51-00-BUTTING PLT","AL1445.03-10-51-00","18","","02-09-2021","Amar","PPRAJ","2021-09-03"
"AL1445.03","04-42-00- TOP TO BOTTOM  HOOKING PLATE","AL1445.03-04-42-00","10","","04-09-2021","Amar","PPRAJ","2021-09-04"
"AL1445.03","09-18-00-COUPLER LOCKING PIN","AL1445.03-09-18-00","18","","01-09-2021","Amar","PPRAJ","2021-09-04"
"AL1445.03","12-11-00-COUPLER MTG PLATE","AL1445.03-12-11-00","5","","02-10-2021","Amar","PPRAJ","2021-10-02"
"AL1445.03","05-12-00-DRAW BAR","AL1445.03-05-12-00","8","","04-09-2021","Amar","PPRAJ","2021-09-04"
"AL1445.03","09-02-00-BASE PLT","AL1445.03-09-02-00","9","","01-09-2021","Amar","PPRAJ","2021-09-04"
"AL1445.03","10-12-00-LOADER MTG  BACK SIDE BRKT","AL1445.03-10-12-00","9","","02-09-2021","Amar","PPRAJ","2021-09-03"
"AL1445.03","10-03-00-WALKING BEAM-FRONT  SIDE PLT","AL1445.03-10-03-00","7","","03-09-2021","Amar","PPRAJ","2021-09-04"
"AL1445.03","10-68-00-CRADLE MTG BASE","AL1445.03-10-68-00","9","","02-09-2021","Amar","PPRAJ","2021-09-03"
"AL1445.03","17-01-00-SUPPORT BKT MTG PLT","AL1445.03-17-01-00","6","","09-07-2022","Amar","PPRAJ","2022-07-09"
"AL1445.03","10-33-00-SETTING GAUGE BLOCK FOR 141.5-SL","AL1445.03-10-33-00","2","","12-05-2022","Amar","PPRAJ","2022-05-12"
"AL1445.03","14-01-00-SUPPORT BKT MTG PLT","AL1445.03-14-01-00","4","","09-10-2021","Amar","PPRAJ","2021-10-09"
"AL1445.03","12-18-00-CYLINDER SPACER PLATE","AL1445.03-12-18-00","1","","30-12-2021","Amar","PPRAJ","2021-12-30"
"AL1445.03","12-14-00-CYLINDER SPACER PLATE","AL1445.03-12-14-00","5","","02-10-2021","Amar","PPRAJ","2021-10-02"
"AL1445.03","05-08-00-THIMBLE","AL1445.03-05-08-00","4","","04-09-2021","Amar","PPRAJ","2021-09-04"
"AL1445.03","09-29-00-SPACER","AL1445.03-09-29-00","10","","01-09-2021","Amar","PPRAJ","2021-09-04"
"AL1445.03","12-16-00-CYLINDER SPACER PLATE","AL1445.03-12-16-00","3","","22-12-2021","Amar","PPRAJ","2021-12-22"
"AL1445.03","07-14-00-HOOK SPRING REATINER","AL1445.03-07-14-00","8","","11-04-2022","Amar","PPRAJ","2022-04-11"
"AL1445.03","10-29-00-FIXED  BEAM-FRONT","AL1445.03-10-29-00","7","","03-09-2021","Amar","PPRAJ","2021-09-04"
"AL1445.03","10-04-00-GUSSET FOR LOADER MTG BRKT","AL1445.03-10-04-00","42","","02-09-2021","Amar","PPRAJ","2021-09-03"
"AL1445.03","10-73-00-STOPPER","AL1445.03-10-73-00","2","","12-05-2022","Amar","PPRAJ","2022-05-12"
"AL1445.03","14-05-00-GUIDE ROD","AL1445.03-14-05-00","4","","09-10-2021","Amar","PPRAJ","2021-10-09"
"AL1445.03","04-30-00-BACK PLATE","AL1445.03-04-30-00","10","","04-09-2021","Amar","PPRAJ","2021-09-04"
"AL1445.03","04-01-00-BACK PLATE","AL1445.03-04-01-00","10","","01-12-2021","Amar","PPRAJ","2021-12-01"
"AL1445.03","15-03-00-CHUT SUPPORT PLATE","AL1445.03-15-03-00","4","","09-10-2021","Amar","PPRAJ","2021-10-09"
"AL1445.03","12-06-00-CYLINDER MTG PLATE","AL1445.03-12-06-00","5","","02-10-2021","Amar","PPRAJ","2021-10-02"
"AL1445.03","04-08-00-PAWL HOLDER","AL1445.03-04-08-00","5","","04-09-2021","Amar","PPRAJ","2021-09-04"
"AL1445.03","09-08-00-QCT BOTTOM COVER","AL1445.03-09-08-00","20","","01-09-2021","Amar","PPRAJ","2021-09-04"
"AL1445.03","07-11-00- BOTTOM TO TOP  HOOKING PLATE","AL1445.03-07-11-00","58","","11-04-2022","Amar","PPRAJ","2022-04-11"
"AL1445.03","17-07-00-BUFFER PLATE","AL1445.03-17-07-00","4","","22-03-2022","Amar","PPRAJ","2022-03-22"
"AL1445.03","10-26-00-ALLIGNMANT SLEEVE","AL1445.03-10-26-00","19","","03-09-2021","","PPRAJ","2021-09-04"
"AL1445.03","10-08-00-CYL MTG DISC","AL1445.03-10-08-00","9","","02-09-2021","Amar","PPRAJ","2021-09-03"
"AL1445.03","04-32-00-HOOK HOLDER.","AL1445.03-04-32-00","10","","04-09-2021","Amar","PPRAJ","2021-09-04"
"AL1445.03","10-22-00-CONVER LOCKING PLT","AL1445.03-10-22-00","36","","02-09-2021","Amar","PPRAJ","2021-09-03"
"AL1445.03","15-05-00- PROFILE SUPPORT  PLATE","AL1435.03-15-05-00","4","","09-10-2021","Amar","PPRAJ","2021-10-09"
"AL1445.03","04-02-00-HOOK GUIDE PLATE","AL1445.03-04-02-00","20","","04-09-2021","Amar","PPRAJ","2021-09-04"
"AL1445.03","09-28-00-HOUSING COVER","AL1445.03-09-28-00","18","","01-09-2021","Amar","PPRAJ","2021-09-04"
"AL1445.03","17-12-00-BUFFER SIDE RIB","AL1445.03-17-12-00","10","","18-07-2022","Amar","PPRAJ","2022-07-18"
"AL1445.03","07-07-00-CENTRE BLOCK","AL1445.03-07-07-00","4","","11-04-2022","Amar","PPRAJ","2022-04-11"
"AL1445.03","12-03-00-TOP CYLINDER COUPLER","AL1445.03-12-03-00","5","","02-10-2021","Amar","PPRAJ","2021-10-02"
"AL1445.03","06-03-00-TEN ARM SUPPROT","AL1445.03-06-03-00","10","","06-09-2021","Amar","PPRAJ","2021-09-06"
"AL1445.03","09-16-00-GEAR BOX CLAMPING PLT","AL1445.03-09-16-00","9","","01-09-2021","Amar","PPRAJ","2021-09-04"
"AL1445.03","10-13-00- CRADLE GUIDE PLATE","AL1445.03-10-13-00","14","","02-09-2021","Amar","PPRAJ","2021-09-03"
"AL1445.03","04-26-00-CENTRE BLOCK","AL1445.03-04-26-00","5","","04-09-2021","Amar","PPRAJ","2021-09-04"
"AL1445.03","10-28-00-DIA 12 GUIDE ROD","AL1445.03-10-28-00","36","","02-09-2021","Amar","PPRAJ","2021-09-03"
"AL1445.03","14-07-00-BUFFER PLATE","AL1445.03-14-07-00","8","","09-10-2021","Amar","PPRAJ","2021-10-09"
"AL1445.03","04-10-00-HOOK GUDE MTG PLATE","AL1445.03-04-10-00","10","","04-09-2021","Amar","PPRAJ","2021-09-04"
"AL1445.03","09-06-00-LOADER DRAW BAR","AL1445.03-09-06-00","18","","01-09-2021","Amar","PPRAJ","2021-09-04"
"AL1445.03","17-01-00-SUPPORT BKT MTG PLT","AL1445.03-17-01-00","10","","18-07-2022","Amar","PPRAJ","2022-07-18"
"AL1445.03","10-07-00-CRADLE CYLINDER MTG BAR","AL1445.03-10-07-00","9","","20-12-2021","Amar","PPRAJ","2021-12-20"
"AL1445.03","10-36-00-SETTING GAUGE BLOCK","AL1445.03-10-36-00","2","","08-06-2022","Amar","PPRAJ","2022-06-08"
"AL1445.03","07-02-00-HOOK GUIDE PLATE","AL1445.03-07-02-00","16","","11-04-2022","Amar","PPRAJ","2022-04-11"
"AL1445.03","12-07-00-GUIDE ROD","AL1445.03-12-07-00","10","","02-10-2021","Amar","PPRAJ","2021-10-02"
"AL1445.03","06-01-00-TEN ARM HOLDER HINGE","AL1445.03-06-01-00","10","","06-09-2021","Amar","PPRAJ","2021-09-06"
"AL1445.03","09-12-00-QCTSPRING RETAINER","AL1445.03-09-12-00","17","","01-09-2021","Amar","PPRAJ","2021-09-04"
"AL1445.03","10-16-00-CYLINDER STOPER PLT","AL1445.03-10-16-00","18","","02-09-2021","Amar","PPRAJ","2021-09-03"
"AL1445.03","10-23-00-L PLATE","AL1445.03-10-23-00","28","","03-09-2021","Amar","PPRAJ","2021-09-04"
"AL1445.03","10-41-00-TIE SPACER PLT","AL1445.03-10-41-00","36","","02-09-2021","Amar","PPRAJ","2021-09-03"
"AL1445.03","04-06-00-CENTRE BLOCK","AL1445.03-04-06-00","5","","04-09-2021","Amar","PPRAJ","2021-09-04"
"AL1445.03","09-42-00-LOADER COLLET CLAMP CYL MTG PLT","AL1445.03-09-42-00","18","","01-09-2021","Amar","PPRAJ","2021-09-04"
"AL1445.03","12-10-00-GUIDE ROD DIA 12","AL1445.03-12-10-00","10","","02-10-2021","Amar","PPRAJ","2021-10-02"
"AL1445.03","09-20-00-STOPPER BUTTING PLT","AL1445.03-09-20-00","9","","01-09-2021","Amar","PPRAJ","2021-09-04"
"AL1445.03","10-19-00-STOPPER PLT","AL1445.03-10-19-00","9","","02-09-2021","Amar","PPRAJ","2021-09-03"
"AL1445.03","10-02-00-WALKING BEAM-BACK SIDE PLT.","AL1445.03-10-02-00","7","","03-09-2021","Amar","PPRAJ","2021-09-04"
"AL1445.03","10-66-00-LOADER CONVER SPACER PLT","AL1445.03-10-66-00","18","","02-09-2021","Amar","PPRAJ","2021-09-03"
"AL1445.03","17-12-00-BUFFER SIDE RIB","AL1445.03-17-12-00","1","","09-07-2022","Amar","PPRAJ","2022-07-09"
"AL1445.03","10-82-00-LODER SETTING GAUGE BLOCK","AL1445.03-10-82-00","1","","12-05-2022","Amar","PPRAJ","2022-05-12"
"AL1445.03","14-11-00-HINGE PLATE","AL1445.03-14-11-00","32","","09-10-2021","Amar","PPRAJ","2021-10-09"
"AL1445.03","12-13-00-COMP LIFTING MTG BRKT","AL1445.03-12-13-00","5","","02-10-2021","Amar","PPRAJ","2021-10-02"
"AL1445.03","05-09-00-OUTER SHIELD","AL1445.03-05-09-00","4","","04-09-2021","Amar","PPRAJ","2021-09-04"
"AL1445.03","09-11-00-COLLCET LCK PLT","AL1445.03-09-11-00","28","","01-09-2021","Amar","PPRAJ","2021-09-04"
"AL1445.03","10-11-00-COMP HOLDER (V-BLK)","AL1445.03-10-11-00","6","","03-09-2021","Amar","PPRAJ","2021-09-04"
"AL1445.03","10-85-00-STOPER STRIP","AL1445.03-10-85-00","9","","02-09-2021","Amar","PPRAJ","2021-09-03"
"AL1445.03","10-31-00-SETTING GAUGE BLOCK 175-SL","AL1445.03-10-31-00","2","","12-05-2022","Amar","PPRAJ","2022-05-12"
"AL1445.03","14-03-00-TIE  ROD","AL1445.03-14-03-00","4","","09-10-2021","Amar","PPRAJ","2021-10-09"
"AL1445.03","04-31-00-HOOK GUIDE PLATE","AL1445.03-04-31-00","20","","04-09-2021","Amar","PPRAJ","2021-09-04"
"AL1445.03","09-45-00-LOADER SPACER PLT","AL1445.03-09-45-00","2","","11-11-2021","Amar","PPRAJ","2021-11-11"
"AL1445.03","15-09-00-TIE  ROD","AL1445.03-15-09-00","4","","09-10-2021","Amar","PPRAJ","2021-10-09"
"AL1445.03","12-17-00-CYLINDER SPACER PLATE","AL1445.03-12-17-00","5","","02-10-2021","Amar","PPRAJ","2021-10-02"
"AL1445.03","05-10-00-COLLET SLEEVE","AL1445.03-05-10-00","4","","04-09-2021","Amar","PPRAJ","2021-09-04"
"AL1445.03","09-10-00-CYL COUPLER","AL1445.03-09-10-00","18","","01-09-2021","Amar","PPRAJ","2021-09-04"
"AL1445.03","10-86-00-LODER SETTING GAUGE BLOCK","AL1445.03-10-86-00","2","","06-07-2022","Amar","PPRAJ","2022-07-06"
"AL1445.03","07-12-00-BALANCING WEDGE","AL1445.03-07-12-00","8","","11-04-2022","Amar","PPRAJ","2022-04-11"
"AL1445.03","10-87-00-LOADER SEN BRKT","AL1445.03-10-87-00","5","","03-09-2021","","PPRAJ","2021-09-04"
"AL1445.03","10-06-00-LOADER MTG BKT","AL1445.03-10-06-00","9","","02-09-2021","Amar","PPRAJ","2021-09-03"
"AL1445.03","04-40-00-BALANCING WEDGE","AL1445.03-04-40-00","10","","04-09-2021","Amar","PPRAJ","2021-09-04"
"AL1445.03","15-11-00-GUIDE ROD","AL1445.03-15-11-00","4","","09-10-2021","Amar","PPRAJ","2021-10-09"
"AL1445.03","04-13-00-BALANCING PLATE","AL1445.03-04-13-00","10","","04-09-2021","Amar","PPRAJ","2021-09-04"
"AL1445.03","09-44-00-LOADER COVER  PLATE","AL1445.03-09-44-00","5","","01-09-2021","Amar","PPRAJ","2021-09-04"
"AL1445.03","07-08-00-PAWL HOLDER","AL1445.03-07-08-00","4","","11-04-2022","Amar","PPRAJ","2022-04-11"
"AL1445.03","12-02-00-TOP CYLINDER MTG BRKT","AL1445.03-12-02-00","5","","02-10-2021","Amar","PPRAJ","2021-10-02"
"AL1445.03","06-06-00-MS ROD","AL1445.03-06-06-00","10","","06-09-2021","Amar","PPRAJ","2021-09-06"
"AL1445.03","09-30-00-TIMER PULLEY","AL1445.03-09-30-00","19","","01-09-2021","Amar","PPRAJ","2021-09-04"
"AL1445.03","10-10-00-CRADLE GUIDE ROD","AL1445.03-10-10-00","9","","02-09-2021","Amar","PPRAJ","2021-09-03"
"AL1445.03","04-39-00-PAWL HOLDER","AL1445.03-04-39-00","5","","04-09-2021","Amar","PPRAJ","2021-09-04"
"AL1445.03","10-27-00-FIXED BEAM MTG HSG","AL1445.03-10-27-00","36","","02-09-2021","Amar","PPRAJ","2021-09-03"
"AL1445.03","14-06-00- PROFILE SUPPORT  PLATE","AL1445.03-14-06-00","4","","09-10-2021","Amar","PPRAJ","2021-10-09"
"AL1445.03","04-03-00-HOOK HOLDER.","AL1445.03-04-03-00","10","","04-09-2021","Amar","PPRAJ","2021-09-04"
"AL1445.03","09-09-00-QCT COVER KNOB SIDE","AL1445.03-09-09-00","20","","01-09-2021","Amar","PPRAJ","2021-09-04"
"AL1445.03","17-06-00-BUFFER PLATE","AL1445.03-17-06-00","4","","18-07-2022","Amar","PPRAJ","2022-07-18"
"AL1445.03","10-37-00-SETTING GAUGE BLOCK","AL1445.03-10-37-00","2","","08-06-2022","Amar","PPRAJ","2022-06-08"
"AL1445.03","07-03-00-HOOK HOLDER.","AL1445.03-07-03-00","8","","11-04-2022","Amar","PPRAJ","2022-04-11"
"AL1445.03","12-05-00- SPACER PLATE","AL1445.03-12-05-00","10","","02-10-2021","Amar","PPRAJ","2021-10-02"
"AL1445.03","06-110-00-TEN STOPPER","AL1445.03-06-110-00","10","","06-09-2021","Amar","PPRAJ","2021-09-06"
"AL1445.03","09-13-00-QCT PUSHER GUIDE","AL1445.03-09-13-00","17","","01-09-2021","Amar","PPRAJ","2021-09-04"
"AL1445.03","10-15-00-L-PLATE","AL1445.03-10-15-00","18","","02-09-2021","Amar","PPRAJ","2021-09-03"
"AL1445.03","10-30-00-FIXED  BEAM SPACER PLT","AL1445.03-10-30-00","7","","03-09-2021","Amar","PPRAJ","2021-09-04"
"AL1445.03","10-39-00-TIE SPACER PLT","AL1445.03-10-39-00","18","","02-09-2021","Amar","PPRAJ","2021-09-03"
"AL1445.03","12-19-00-COMPONENT HOLDER JAW","AL1445.03-12-19-00","2","","30-12-2021","Amar","PPRAJ","2021-12-30"
"AL1445.03","04-04-00-CENTRE BLOCK","AL1445.03-04-04-00","5","","04-09-2021","Amar","PPRAJ","2021-09-04"
"AL1445.03","09-17-00-COUPLER CLAMING PLT","AL1445.03-09-17-00","18","","01-09-2021","Amar","PPRAJ","2021-09-04"
"AL1445.03","17-11-00-HINGE PLATE","AL1445.03-17-11-00","10","","18-07-2022","Amar","PPRAJ","2022-07-18"
"AL1445.03","12-09-00-DOVTAIL PLATE","AL1445.03-12-09-00","5","","02-10-2021","Amar","PPRAJ","2021-10-02"
"AL1445.03","10-70-00-PART PRESENCE SNSR MTG BLK","AL1445.03-10-70-00","6","","04-09-2021","Amar","PPRAJ","2021-09-04"
"AL1445.03","09-39-00-BELT JACKING PLT","AL1445.03-09-39-00","9","","01-09-2021","Amar","PPRAJ","2021-09-04"
"AL1445.03","10-18-00-CYLINDER MTG PLT","AL1445.03-10-18-00","9","","02-09-2021","Amar","PPRAJ","2021-09-03"
"AL1445.03","10-01-00-FIXED  BEAM","AL1445.03-10-01-00","7","","03-09-2021","Amar","PPRAJ","2021-09-04"
"AL1445.03","10-52-00-CUTTER STOPPER","AL1445.03-10-52-00","9","","02-09-2021","Amar","PPRAJ","2021-09-03"
"AL1445.03","17-13-00-BUFFER SIDE RIB RH","AL1445.03-17-13-00","2","","09-07-2022","Amar","PPRAJ","2022-07-09"
"AL1445.03","10-83-00-SETTING GAUGE BLOCK","AL1445.02-10-83-00","2","","12-05-2022","Amar","PPRAJ","2022-05-12"
"AL1445.03","14-09-00-PROFILE L-PLATE","AL1445.03-14-09-00","4","","09-10-2021","Amar","PPRAJ","2021-10-09"
"AL1445.06","04-211-ROLLER CAP INSIDE","AL1445.06-04-211-ROLLER CAP INSIDE","20","","09-10-2021","Kiran","PPRAJ","2021-10-09"
"AL1445.06","02-041-00-SLIDE BLOCK","AL1445.06-02-041-00-SLIDE BLOCK","5","","09-10-2021","Kiran","PPRAJ","2021-10-09"
"AL1445.06","04-470-00-TENSIONER Z BRACKET","AL1445.06-04-470-00-TENSIONER Z BRACKET","5","","09-10-2021","Kiran","PPRAJ","2021-10-09"
"AL1445.06","02-240-00-HYDROLIC PUSHER PLATE","AL1445.06-02-240-00-HYDROLIC PUSHER PLATE","5","","09-10-2021","Kiran","PPRAJ","2021-10-09"
"AL1445.06","10-170-00-FIXED FRAME MTG PLATE","AL1445.06-10-170-00-FIXED FRAME MTG PLATE","20","","09-10-2021","Kiran","PPRAJ","2021-10-09"
"AL1445.06","05-110-00-BEARING RETAINER PLATE","AL1445.06-05-110-00-BEARING RETAINER PLATE","20","","09-10-2021","Kiran","PPRAJ","2021-10-09"
"AL1445.06","04-140-TENSIONER SPACER","AL1445.06-04-140-TENSIONER SPACER","10","","09-10-2021","Kiran","PPRAJ","2021-10-09"
"AL1445.06","05-060-00-RUBBER ROLLER","AL1445.06-05-060-00-RUBBER ROLLER","5","","09-10-2021","Kiran","PPRAJ","2021-10-09"
"AL1445.06","04-013-00-VERTICAL PILLER","AL1445.06-04-013-00-VERTICAL PILLER","5","","09-10-2021","Kiran","PPRAJ","2021-10-09"
"AL1445.06","02-128-00-BACK COVER BACK","AL1445.06-02-128-00-BACK COVER BACK","5","","09-10-2021","Kiran","PPRAJ","2021-10-09"
"AL1445.06","10-202-00-CYLINDER MTG BLOCK","AL1445.06-10-202-00-CYLINDER MTG BLOCK","5","","09-10-2021","Kiran","PPRAJ","2021-10-09"
"AL1445.06","04-500-00-BEARING DUST COVER","AL1445.06-04-500-00-BEARING DUST COVER","45","","09-10-2021","Kiran","PPRAJ","2021-10-09"
"AL1445.06","02-180-00-FINE ADJUSTABLE NUT","AL1445.06-02-180-00-FINE ADJUSTABLE NUT","5","","09-10-2021","Kiran","PPRAJ","2021-10-09"
"AL1445.06","06-020-00-HORIZONTAL ADJUSTABLE PLATE","AL1445.06-06-020-00-HORIZONTAL ADJUSTABLE PLATE","5","","09-10-2021","Kiran","PPRAJ","2021-10-09"
"AL1445.06","04-040-00-CYLINDER COUPLER","AL1445.06-04-040-00-CYLINDER COUPLER","5","","09-10-2021","Kiran","PPRAJ","2021-10-09"
"AL1445.06","02-760-00-GUAGE BLOCK","AL1445.06-02-760-00-GUAGE BLOCK","6","","28-04-2022","Dayanand","PPRAJ","2022-04-28"
"AL1445.06","10-350-00-TRAVELLING CYL MTG PLT","AL1445.06-10-350-00-TRAVELLING CYL MTG PLT","5","","09-10-2021","Kiran","PPRAJ","2021-10-09"
"AL1445.06","05-230-00-BRUSH PULLYSHAFT","AL1445.06-05-230-00-BRUSH PULLYSHAFT","5","","09-10-2021","Kiran","PPRAJ","2021-10-09"
"AL1445.06","04-240-00-BEARING SPACER","AL1445.06-04-240-00-BEARING SPACER","5","","09-10-2021","Kiran","PPRAJ","2021-10-09"
"AL1445.06","02-590-00-TOOL BUTTING PLATE","AL1445.06-02-590-00-TOOL BUTTING PLATE","10","","09-10-2021","Kiran","PPRAJ","2021-10-09"
"AL1445.06","04-280-00-DOOM NUT BUTTING BLOCK","AL1445.06-04-280-00-DOOM NUT BUTTING BLOCK","5","","09-10-2021","Kiran","PPRAJ","2021-10-09"
"AL1445.06","02-160-00-THIMBLE HOLDING PLATE","AL1445.06-02-160-00-THIMBLE HOLDING PLATE","5","","09-10-2021","Kiran","PPRAJ","2021-10-09"
"AL1445.06","06-048-00-ADJUSTABLE SUCTIONN HOOD ASSY","AL1445.06[-06-048-00-ADJUSTABLE SUCTIONN HOOD ASSY","8","","09-10-2021","Kiran","PPRAJ","2021-10-09"
"AL1445.06","04-250-00-RETAINER PLATE TAPPED","AL1445.06-04-250-00-RETAINER PLATE TAPPED","10","","09-10-2021","Kiran","PPRAJ","2021-10-09"
"AL1445.06","10-330-00-PROFILE MTG PLATE","AL1445.06-10-330-00-PROFILE MTG PLATE","10","","09-10-2021","Kiran","PPRAJ","2021-10-09"
"AL1445.06","05-210-00-CONNECTING THREAD","AL1445.06-05-210-00-CONNECTING THREAD","5","","09-10-2021","Kiran","PPRAJ","2021-10-09"
"AL1445.06","04-210-ROLLER CAP","AL1445.06-04-210-ROLLER CAP","20","","09-10-2021","Kiran","PPRAJ","2021-10-09"
"AL1445.06","02-220-00-SHOCK ABSORBER PLT","AL1445.06-02-220-00-SHOCK ABSORBER PLT","5","","09-10-2021","Kiran","PPRAJ","2021-10-09"
"AL1445.06","02-270-R1CYLINDER MTG PLATE","AL1445.06-02-270-R1CYLINDER MTG PLATE","1","","22-02-2022","Dayanand","PPRAJ","2022-02-22"
"AL1445.06","04-330-00-BELT MOTOR PULLEY","AL1445.06-04-330-00-BELT MOTOR PULLEY","10","","09-10-2021","Kiran","PPRAJ","2021-10-09"
"AL1445.06","02-140-00-SADDLE GIB","AL1445.06-02-140-00-SADDLE GIB","10","","09-10-2021","Kiran","PPRAJ","2021-10-09"
"AL1445.06","03-650-00-END STOPPER","AL1445.06-03-650-00-END STOPPER","10","","09-10-2021","Kiran","PPRAJ","2021-10-09"
"AL1445.06","10-042-00-BEARING MOUNTING PLATE","AL1445.06-10-042-00-BEARING MOUNTING PLATE","10","","09-10-2021","Kiran","PPRAJ","2021-10-09"
"AL1445.06","05-160-00-BRUSH MOTOR MTG PLATE","AL1445.06-05-160-00-BRUSH MOTOR MTG PLATE","5","","09-10-2021","Kiran","PPRAJ","2021-10-09"
"AL1445.06","04-180-ROLLER SHAFT","AL1445.06-04-180-ROLLER SHAFT","20","","09-10-2021","Kiran","PPRAJ","2021-10-09"
"AL1445.06","02-080-R1-GUAGE BLOCK","AL1445.06-02-080-R1-GUAGE BLOCK","3","","22-02-2022","Dayanand","PPRAJ","2022-02-22"
"AL1445.06","04-310-00-BEARING HSG","AL1445.06-04-310-00-BEARING HSG","5","","09-10-2021","Kiran","PPRAJ","2021-10-09"
"AL1445.06","02-100-00-SENSOR MTG PLATE","AL1445.06-02-100-00-SENSOR MTG PLATE","10","","09-10-2021","Kiran","PPRAJ","2021-10-09"
"AL1445.06","03-120-00-TESA NUT","AL1445.06-03-120-00-TESA NUT","15","","09-10-2021","Kiran","PPRAJ","2021-10-09"
"AL1445.06","02-190-00-TOOL HOLDER PIN","AL1445.06-02-190-00-TOOL HOLDER PIN","20","","09-10-2021","Kiran","PPRAJ","2021-10-09"
"AL1445.06","04-220-FRONT ROLLER ARM","AL1445.06-04-220-FRONT ROLLER ARM","5","","09-10-2021","Kiran","PPRAJ","2021-10-09"
"AL1445.06","02-740-00-GUIDE ROD","AL1445.06-02-740-00-GUIDE ROD","5","","09-10-2021","Kiran","PPRAJ","2021-10-09"
"AL1445.06","04-670-00-TENSIONER COUPLER","AL1445.06-04-670-00-TENSIONER COUPLER","5","","09-10-2021","Kiran","PPRAJ","2021-10-09"
"AL1445.06","03-020-00-ADJUSTABLE V BLOCK HOLDER","AL1445.06-03-020-00-ADJUSTABLE V BLOCK HOLDER","10","","09-10-2021","Kiran","PPRAJ","2021-10-09"
"AL1445.06","02-260-00-TOOL POST BACK DUST COVER","AL1445.06-02-260-00-TOOL POST BACK DUST COVER","5","","09-10-2021","Kiran","PPRAJ","2021-10-09"
"AL1445.06","04-300-00-BELT DRIVE SENSOR PLATE","AL1445.06-04-300-00","10","","28-12-2021","Amar","PPRAJ","2021-12-28"
"AL1445.06","10-181-00-FRNT FIXED FRAME","AL1445.06-10-181-00-FRNT FIXED FRAME","10","","09-10-2021","Kiran","PPRAJ","2021-10-09"
"AL1445.06","05-120-00-CONNECTING PLATE","AL1445.06-05-120-00-CONNECTING PLATE","5","","09-10-2021","Kiran","PPRAJ","2021-10-09"
"AL1445.06","04-110-TOOL SIDE ROLLER ARM","AL1445.06-04-110-TOOL SIDE ROLLER ARM","5","","09-10-2021","Kiran","PPRAJ","2021-10-09"
"AL1445.06","08-020-00-SENSOR MTG PLATE","AL1445.06-08-020-00-SENSOR MTG PLATE","5","","09-10-2021","Kiran","PPRAJ","2021-10-09"
"AL1445.06","04-550-00-ARM GUIDE BUSH","AL1445.06-04-550-00-ARM GUIDE BUSH","10","","09-10-2021","Kiran","PPRAJ","2021-10-09"
"AL1445.06","02-130-00-SADDLE TOOL BASE","AL1445.06-02-130-00-SADDLE TOOL BASE","5","","09-10-2021","Kiran","PPRAJ","2021-10-09"
"AL1445.06","04-610-00-SPACER","AL1445.06-04-610-00-SPACER","5","","09-10-2021","Kiran","PPRAJ","2021-10-09"
"AL1445.06","02-181-00-FINE ADJUSTABLE LOCK NUT","AL1445.06-02-181-00-FINE ADJUSTABLE LOCK NUT","5","","09-10-2021","Kiran","PPRAJ","2021-10-09"
"AL1445.06","10-290-00-COMPONENT HOLDER","AL1445.06-10-290-00-COMPONENT HOLDER","35","","09-10-2021","Kiran","PPRAJ","2021-10-09"
"AL1445.06","04-050-00-MOTOR MTG BRACKET","AL1445.06-04-050-00-MOTOR MTG BRACKET","5","","09-10-2021","Kiran","PPRAJ","2021-10-09"
"AL1445.06","10-400-00-SUPPORT GUIDE PLATE LH","AL1445.06-10-400-00-SUPPORT GUIDE PLATE LH","6","","28-04-2022","Dayanand","PPRAJ","2022-04-28"
"AL1445.06","10-370-00-FRONT BRUSHING ROLLER MTG SHEET","AL1445.06-10-370-00-FRONT BRUSHING ROLLER MTG SHEET","10","","09-10-2021","Kiran","PPRAJ","2021-10-09"
"AL1445.06","05-020-00 -MOTOR MOUTING PLATE","AL1445.06-05-020-00 -MOTOR MOUTING PLATE","5","","09-10-2021","Kiran","PPRAJ","2021-10-09"
"AL1445.06","04-260-00-BELT UNIT STOPPER KNOB","AL1445.06-04-260-00-BELT UNIT STOPPER KNOB","5","","09-10-2021","Kiran","PPRAJ","2021-10-09"
"AL1445.06","02-060-00-NUT HSG FOR X-AXIS","AL1445.06-02-060-00-NUT HSG FOR X-AXIS","5","","09-10-2021","Kiran","PPRAJ","2021-10-09"
"AL1445.06","04-440-00-ROLLER JACKING PLATE","AL1445.06-04-440-00-ROLLER JACKING PLATE","5","","09-10-2021","Kiran","PPRAJ","2021-10-09"
"AL1445.06","02-10-00-SLIDE BASE PLATE","AL1445.06-02-10-00-SLIDE BASE PLATE","5","","09-10-2021","Kiran","PPRAJ","2021-10-09"
"AL1445.06","06-049-00-SUCTION MAIN BOX","AL1445.06-06-049-00-SUCTION MAIN BOX","10","","09-10-2021","Kiran","PPRAJ","2021-10-09"
"AL1445.06","04-080-00-COUPLER MTG PLATE","AL1445.06-04-080-00-COUPLER MTG PLATE","5","","09-10-2021","Kiran","PPRAJ","2021-10-09"
"AL1445.06","10-340-00-DUST COVER","AL1445.06-10-340-00-DUST COVER","25","","09-10-2021","Kiran","PPRAJ","2021-10-09"
"AL1445.06","05-080-00-BRUSH HOLDING SHAFT","AL1445.06-05-080-00-BRUSH HOLDING SHAFT","5","","09-10-2021","Kiran","PPRAJ","2021-10-09"
"AL1445.06","04-012-00-VERTICAL PILLER","AL1445.06-04-012-00-VERTICAL PILLER","5","","09-10-2021","Kiran","PPRAJ","2021-10-09"
"AL1445.06","02-300-00-SADDLE CYL MTG BRACKET","AL1445.06-02-300-00-SADDLE CYL MTG BRACKET","5","","09-10-2021","Kiran","PPRAJ","2021-10-09"
"AL1445.06","02-300-R1-SADDLE CYL MTG BRACKET","AL1445.06-02-300-R1-SADDLE CYL MTG BRACKET","1","","22-02-2022","Dayanand","PPRAJ","2022-02-22"
"AL1445.06","06-030-R1-SUCTION HOLDER PLATE","AL1445.06-06-030-R1-SUCTION HOLDER PLATE","1","","04-05-2022","Dayanand","PPRAJ","2022-05-04"
"AL1445.06","04-430-00-BEARING SPACER BUSH","AL1445.06-04-430-00-BEARING SPACER BUSH","20","","09-10-2021","Kiran","PPRAJ","2021-10-09"
"AL1445.06","02-250-00-TOOL POST DUST COVER","AL1445.06-02-250-00-TOOL POST DUST COVER","5","","09-10-2021","Kiran","PPRAJ","2021-10-09"
"AL1445.06","04-680-00-TENSIONER COUPLER PLATE","AL1445.06-04-680-00-TENSIONER COUPLER PLATE","5","","09-10-2021","Kiran","PPRAJ","2021-10-09"
"AL1445.06","10-60-00-STD GUIDE ROD","AL1445.06-10-60-00-STD GUIDE ROD","20","","09-10-2021","Kiran","PPRAJ","2021-10-09"
"AL1445.06","05-170-00-SLIDE GUIDE BUSH HOLDER","AL1445.06-05-170-00-SLIDE GUIDE BUSH HOLDER","5","","09-10-2021","Kiran","PPRAJ","2021-10-09"
"AL1445.06","04-190-SPACER","AL1445.06-04-190-SPACER","20","","09-10-2021","Kiran","PPRAJ","2021-10-09"
"AL1445.06","02-042-00-DOVETAIL BLOCK","AL1445.06-02-042-00-DOVETAIL BLOCK","5","","09-10-2021","Kiran","PPRAJ","2021-10-09"
"AL1445.06","02-150-R1-FINE ADJUSTMENT STOPPER","AL1445.06-02-150-R1-FINE ADJUSTMENT STOPPER","1","","22-02-2022","Dayanand","PPRAJ","2022-02-22"
"AL1445.06","04-320-00-SHAFT","AL1445.06-04-320-00-SHAFT","5","","09-10-2021","Kiran","PPRAJ","2021-10-09"
"AL1445.06","02-120-00-TOOL POST BASE","AL1445.06-02-120-00-TOOL POST BASE","5","","09-10-2021","Kiran","PPRAJ","2021-10-09"
"AL1445.06","03-051-00-BUTTING CAP","AL1445.06-03-051-00-BUTTING CAP","24","","09-10-2021","Kiran","PPRAJ","2021-10-09"
"AL1445.06","02-200-00-TOOL HOLDER","AL1445.06-02-200-00-TOOL HOLDER","10","","09-10-2021","Kiran","PPRAJ","2021-10-09"
"AL1445.06","04-350-00-ROLLER SPACER","AL1445.06-04-350-00-ROLLER SPACER","20","","09-10-2021","Kiran","PPRAJ","2021-10-09"
"AL1445.06","02-750-00-SLIDE TOP CVR","AL1445.06-02-750-00-SLIDE TOP CVR","5","","09-10-2021","Kiran","PPRAJ","2021-10-09"
"AL1445.06","03-030-00-BASE PLATE","AL1445.06-03-030-00-BASE PLATE","5","","09-10-2021","Kiran","PPRAJ","2021-10-09"
"AL1445.06","02-270-00-CYLINDER MTG PLATE","AL1445.06-02-270-00-CYLINDER MTG PLATE","5","","09-10-2021","Kiran","PPRAJ","2021-10-09"
"AL1445.06","10-391-00-SUPPORT GUIDE PLATE LH","AL1445.06-10-391-00-SUPPORT GUIDE PLATE LH","20","","09-10-2021","Kiran","PPRAJ","2021-10-09"
"AL1445.06","05-140-00-LM BLOCK MTG PLATE","AL1445.06-05-140-00-LM BLOCK MTG PLATE","5","","09-10-2021","Kiran","PPRAJ","2021-10-09"
"AL1445.06","04-120-TENSIONER ROLLER SHAFT","AL1445.06-04-120-TENSIONER ROLLER SHAFT","10","","09-10-2021","Kiran","PPRAJ","2021-10-09"
"AL1445.06","08-010-00-SENSOR HOLDER ROD","AL1445.06-08-010-00-SENSOR HOLDER ROD","5","","09-10-2021","Kiran","PPRAJ","2021-10-09"
"AL1445.06","04-600-00-BELT DRIVE SENSOR PLT","AL1445.06-04-600-00-BELT DRIVE SENSOR PLT","10","","09-10-2021","Kiran","PPRAJ","2021-10-09"
"AL1445.06","02-030-00-TOOL HOLDER SPACER","AL1445.06-02-030-00-TOOL HOLDER SPACER","5","","09-10-2021","Kiran","PPRAJ","2021-10-09"
"AL1445.06","04-450-00-STD GUIDE ROD","AL1445.06-04-450-00-STD GUIDE ROD","24","","09-10-2021","Kiran","PPRAJ","2021-10-09"
"AL1445.06","02-221-00-SHOCK ABSORBER CAP","AL1445.06-02-221-00-SHOCK ABSORBER CAP","5","","09-10-2021","Kiran","PPRAJ","2021-10-09"
"AL1445.06","10-300-00-ADJUSTABLE GUIDE ROD","AL1445.06-10-300-00-ADJUSTABLE GUIDE ROD","20","","09-10-2021","Kiran","PPRAJ","2021-10-09"
"AL1445.06","05-100-00-BRUSH RETAINER BUSH","AL1445.06-05-100-00-BRUSH RETAINER BUSH","5","","09-10-2021","Kiran","PPRAJ","2021-10-09"
"AL1445.06","04-130-TENSIONER ROLLER","AL1445.06-04-130-TENSIONER ROLLER","10","","09-10-2021","Kiran","PPRAJ","2021-10-09"
"AL1445.06","05-050-00-GEAR BOX MTG SHEET","AL1445.06-05-050-00-GEAR BOX MTG SHEET","5","","09-10-2021","Kiran","PPRAJ","2021-10-09"
"AL1445.06","04-292-00-QCT BUTTING SPACER","AL1445.06-04-292-00-QCT BUTTING SPACER","5","","09-10-2021","Kiran","PPRAJ","2021-10-09"
"AL1445.06","02-070-00-DOOM NUT","AL1445.06-02-070-00-DOOM NUT","5","","09-10-2021","Kiran","PPRAJ","2021-10-09"
"AL1445.06","10-201-00-CYLINDER MTG BLOCK","AL1445.06-10-201-00-CYLINDER MTG BLOCK","5","","09-10-2021","Kiran","PPRAJ","2021-10-09"
"AL1445.06","04-020-00-CYLINDER HOLDER PLATE","AL1445.06-04-020-00-CYLINDER HOLDER PLATE","5","","09-10-2021","Kiran","PPRAJ","2021-10-09"
"AL1445.06","02-170-00-DEPTH STOPPER PLATE","AL1445.06-02-170-00-DEPTH STOPPER PLATE","5","","09-10-2021","Kiran","PPRAJ","2021-10-09"
"AL1445.06","06-010-00-VERTICAL ADJUSTABLE PLATE","AL1445.06-06-010-00-VERTICAL ADJUSTABLE PLATE","8","","09-10-2021","Kiran","PPRAJ","2021-10-09"
"AL1445.06","04-100-00-BEARING RETAINER","AL1445.06-04-100-00-BEARING RETAINER","5","","09-10-2021","Kiran","PPRAJ","2021-10-09"
"AL1445.06","10-360-00-COUPLER PLATE","AL1445.06-10-360-00-COUPLER PLATE","5","","09-10-2021","Kiran","PPRAJ","2021-10-09"
"AL1445.06","05-090-00-DRIVE PULLEY","AL1445.06-05-090-00-DRIVE PULLEY","5","","09-10-2021","Kiran","PPRAJ","2021-10-09"
"AL1445.06","04-230-00-RETAINER PLATE","AL1445.06-04-230-00-RETAINER PLATE","10","","09-10-2021","Kiran","PPRAJ","2021-10-09"
"AL1445.06","02-410-00-BEARING HOLDING BLOCK","AL1445.06-02-410-00-BEARING HOLDING BLOCK","5","","09-10-2021","Kiran","PPRAJ","2021-10-09"
"AL1445.06","06-060-00-CLAMP PLATE","AL1445.06-06-060-00-CLAMP PLATE","1","","04-05-2022","Dayanand","PPRAJ","2022-05-04"
"AL1445.06","04-270-00-BELT DOWN SNSR BKT","AL1445.06-04-270-00","5","","09-10-2021","Kiran","PPRAJ","2021-10-09"
"AL1445.06","02-150-00-FINE ADJUSTMENT STOPPER","AL1445.06-02-150-00-FINE ADJUSTMENT STOPPER","5","","09-10-2021","Kiran","PPRAJ","2021-10-09"
"AL1445.06","06-030-00-SUCTION HOLDER PLATE","AL1445.06-06-030-00-SUCTION HOLDER PLATE","5","","09-10-2021","Kiran","PPRAJ","2021-10-09"
"AL1445.06","04-070-00-CYLNDR COUPLER HOLDING PLT","AL1445.06-04-070-00-CYLNDR COUPLER HOLDING PLT","5","","09-10-2021","Kiran","PPRAJ","2021-10-09"
"AL1445.06","10-220-00-CYLINDER MTG BLOCK RH","AL1445.06-10-220-00-CYLINDER MTG BLOCK RH","5","","09-10-2021","Kiran","PPRAJ","2021-10-09"
"AL1445.06","05-200-00-CONNECTING PLATE","AL1445.06-05-200-00-CONNECTING PLATE","5","","09-10-2021","Kiran","PPRAJ","2021-10-09"
"AL1445.06","04-200-ROLLER","AL1445.06-04-200-ROLLER","20","","09-10-2021","Kiran","PPRAJ","2021-10-09"
"AL1445.06","02-210-00-TOOL HOLDER CLAMP","AL1445.06-02-210-00-TOOL HOLDER CLAMP","10","","09-10-2021","Kiran","PPRAJ","2021-10-09"
"AL1445.06","02-170-R1-DEPTH STOPPER PLATE","AL1445.06-02-170-R1-DEPTH STOPPER PLATE","1","","22-02-2022","Dayanand","PPRAJ","2022-02-22"
"AL1445.06","04-060-00-GUIDE ROD","AL1445.06-04-060-00-GUIDE ROD","10","","09-10-2021","Kiran","PPRAJ","2021-10-09"
"AL1445.06","02-127-00-BACK COVER","AL1445.06-02-127-00-BACK COVER","5","","09-10-2021","Kiran","PPRAJ","2021-10-09"
"AL1445.06","03-640-00-END STPR MTG PLATE","AL1445.06-03-640-00-END STPR MTG PLATE","5","","09-10-2021","Kiran","PPRAJ","2021-10-09"
"AL1445.06","04-145-00-SPACER PLATE","AL1445.06-04-145-00-SPACER PLATE","5","","09-10-2021","Kiran","PPRAJ","2021-10-09"
"AL1445.06","04-360-00-TENSIONER ROLLER HOLDER SHEET","AL1445.06-04-360-00-TENSIONER ROLLER HOLDER SHEET","5","","09-10-2021","Kiran","PPRAJ","2021-10-09"
"AL1445.06","02-090-00-CYLINDER COUPLER","AL1445.06- 02-090-00-CYLINDER COUPLER","5","","09-10-2021","Kiran","PPRAJ","2021-10-09"
"AL1445.06","03-100-00-STOPPER PLATE","AL1445.06-03-100-00-STOPPER PLATE","10","","09-10-2021","Kiran","PPRAJ","2021-10-09"
"AL1445.06","02-283-00-SLIDE COVER LH","AL1445.06-02-283-00-SLIDE COVER LH","10","","09-10-2021","Kiran","PPRAJ","2021-10-09"
"AL1445.06","10-240-00-GUIDE PLATE","AL1445.06-10-240-00-GUIDE PLATE","10","","09-10-2021","Kiran","PPRAJ","2021-10-09"
"AL1445.06","05-150-00-TOP PLATE","AL1445.06-05-150-00-TOP PLATE","5","","09-10-2021","Kiran","PPRAJ","2021-10-09"
"AL1462.01","23-210-00-GUIDE ROD","AL1462.01-23-210-00","4","","24-09-2021","Nirmal","PPRAJ","2021-09-24"
"AL1462.01","06-080-00-PAPER ROLLER BUSH","AL1462.01-06-080-00","1","","24-09-2021","Nirmal","PPRAJ","2021-09-24"
"AL1462.01","01-214-R1-PAPER GUIDE STRIP","AL1462.01-01-214-R1","2","","24-03-2022","Amar","PPRAJ","2022-03-24"
"AL1462.01","01-130-00-PAWL HOLDER","AL1462.01-01-130-00","1","","29-09-2021","Nitish","PPRAJ","2021-09-29"
"AL1462.01","13-050-00-PAPER TENSIONER SPRING","AL1462.01-13-050-00","4","","24-09-2021","Nirmal","PPRAJ","2021-09-24"
"AL1462.01","02-110-00-BLADE CONNECTOR PLT","AL1462.01-02-110-00","1","","24-09-2021","Nirmal","PPRAJ","2021-09-24"
"AL1462.01","23-200-00-SPACER PLT","AL1462.01-23-201-00","4","","24-09-2021","Nirmal","PPRAJ","2021-09-24"
"AL1462.01","03-080-00-INSERTING PUNCH","AL1462.01-03-080-00","2","","24-09-2021","Nirmal","PPRAJ","2021-09-24"
"AL1462.01","23-03-00-WALKING BEAM-FRONT  SIDE PLT","AL1462.01-23-03-00","1","","24-09-2021","Nirmal","PPRAJ","2021-09-24"
"AL1462.01","06-050-00-SHEET MTG PLT","AL1462.01-06-050-00","2","","24-09-2021","Nirmal","PPRAJ","2021-09-24"
"AL1462.01","13-040-00-TENSIONER RELIEF PIN","AL1462.01-13-040-00","1","","24-09-2021","Nirmal","PPRAJ","2021-09-24"
"AL1462.01","01-180-00-GUIDED COMPONENT HOLDER","AL1462.01-01-180-00","1","","24-09-2021","Nirmal","PPRAJ","2021-09-24"
"AL1462.01","01-180-R1-GUIDED COMPONENT HOLDER","AL1462.01-01-180-R1","1","","24-02-2022","Amar","PPRAJ","2022-02-24"
"AL1462.01","23-240-00-GUIDE PLATE","AL1462.01-23-240-00","6","","11-01-2022","Amar","PPRAJ","2022-01-11"
"AL1462.01","23-140-00-MOVING FRAME HOLDER","AL1462.01-23-140-00","2","","24-09-2021","Nirmal","PPRAJ","2021-09-24"
"AL1462.01","03-010-00-SUPPORT BLOCK","AL1462.01-03-010-00","1","","24-09-2021","Nirmal","PPRAJ","2021-09-24"
"AL1462.01","23-280-00-STD GUIDE ROD Ø8","AL1462.01-23-280-00","2","","24-09-2021","Nirmal","PPRAJ","2021-09-24"
"AL1462.01","05-010-00- STOPPER HOLDING SHAFT","AL1462.01-05-010-00","1","","24-09-2021","Nirmal","PPRAJ","2021-09-24"
"AL1462.01","23-40-00-COMP HOLDER","AL1462.01-23-40-00","2","","18-06-2022","Amar","PPRAJ","2022-06-18"
"AL1462.01","11-02-00-BASE GUIDE","AL1462.01-11-02-00","1","","24-09-2021","Nirmal","PPRAJ","2021-09-24"
"AL1462.01","23-70-00-V BLOCK ADJUSTABLE BLOCK","AL1462.01-23-70-00","1","","24-09-2021","Nirmal","PPRAJ","2021-09-24"
"AL1462.01","02-070-00-PAPER SUPPORT CONVEAR","AL1462.01-02-070-00","1","","24-09-2021","Nirmal","PPRAJ","2021-09-24"
"AL1462.01","16-011-R1-CYLINDER COUPLER","AL1462.01-16-011-R1","1","","14-01-2022","Amar","PPRAJ","2022-01-14"
"AL1462.01","23-80-00-V BLOCK GUIDE PLATE","AL1462.01-23-80-00","2","","24-09-2021","Nirmal","PPRAJ","2021-09-24"
"AL1462.01","05-030-00-STOPPER BUSH","AL1462.01-05-030-00","1","","24-09-2021","Nirmal","PPRAJ","2021-09-24"
"AL1462.01","07-200-00 RETAINER","AL1462.01-07-200-00","1","","24-09-2021","Nirmal","PPRAJ","2021-09-24"
"AL1462.01","23-010-00 RIB PLT","AL1462.01-23-010-00","2","","24-09-2021","Nirmal","PPRAJ","2021-09-24"
"AL1462.01","02-011-00-SLIDER PLT FRONT SIDE","AL1462.01-02-011-00","1","","24-09-2021","Nirmal","PPRAJ","2021-09-24"
"AL1462.01","23-180-00-FRONT FIXED FRAME","AL1462.01-23-180-00","2","","24-09-2021","Nirmal","PPRAJ","2021-09-24"
"AL1462.01","04-020-00-IND CYL MTG PLT","AL1462.01-04-020-00","1","","24-09-2021","Nirmal","PPRAJ","2021-09-24"
"AL1462.01","07-080-00-PAPER SUPPORTER PIN","AL1462.01-07-080-00","2","","24-09-2021","Nirmal","PPRAJ","2021-09-24"
"AL1462.01","16-061-00-INSERTER BLADE","AL1462.01-16-061-00","2","","24-09-2021","Nirmal","PPRAJ","2021-09-24"
"AL1462.01","02-150-00-GUIDE ROD","AL1462.01-02-150-00","2","","24-09-2021","Nirmal","PPRAJ","2021-09-24"
"AL1462.01","23-160-00-MAIN CYL MTG PLATE","AL1462.01-23-161-00","1","","24-09-2021","Nirmal","PPRAJ","2021-09-24"
"AL1462.01","07-011-00-ROLLER MTG PLT ASSY","AL1462.01-07-011-00","1","","24-09-2021","Nirmal","PPRAJ","2021-09-24"
"AL1462.01","23-120-00-COUPLER HOLDER PLATE","23-120-00-COUPLER HOLDER PLATE","2","","28-01-2022","Amar","PPRAJ","2022-01-28"
"AL1462.01","01-140-00-PAWL","AL1462.01-01-140-00","3","","29-09-2021","Nitish","PPRAJ","2021-09-29"
"AL1462.01","16-082-00 COUPLER HOLDER","AL1462.01-16-082-00","1","","24-09-2021","Nirmal","PPRAJ","2021-09-24"
"AL1462.01","02-120-00-CUTTER GIDE PLTE","AL1462.01-02-120-00","2","","24-09-2021","Nirmal","PPRAJ","2021-09-24"
"AL1462.01","23-030-00-NEW CONVEYOR BASE PLATE","AL1462.01-23-030-00","1","","24-09-2021","Nirmal","PPRAJ","2021-09-24"
"AL1462.01","03-110-00-CYLINDER COUPLER","AL1462.01-03-110-00","1","","24-09-2021","Nirmal","PPRAJ","2021-09-24"
"AL1462.01","23-90-00-CYLINDER STOPER PLT","AL1462.01-23-90-00","2","","24-09-2021","Nirmal","PPRAJ","2021-09-24"
"AL1462.01","06-060-00-SIDE PLT FOR ROLL HOLDER","AL1462.01-06-060-00","2","","24-09-2021","Nirmal","PPRAJ","2021-09-24"
"AL1462.01","13-010-00-PAPER TENTIONER PLATE","AL1462.01-13-010-00","1","","24-09-2021","Nirmal","PPRAJ","2021-09-24"
"AL1462.01","01-190-00-SINGLE BLOCK FEEDER PLATE","AL1462.01-01-190-00","2","","24-09-2021","Nirmal","PPRAJ","2021-09-24"
"AL1462.01","23-101-R1- CYLINER COUPLER","AL1462.01-23-101-R1","2","","24-02-2022","Amar","PPRAJ","2022-02-24"
"AL1462.01","23-230-00-VERTICAL CYL MTG BLOCK","AL1462.01-23-150-00","4","","24-09-2021","Nirmal","PPRAJ","2021-09-24"
"AL1462.01","03-020-00-CYL CONN PLT","AL1462.01-03-020-00","1","","24-09-2021","Nirmal","PPRAJ","2021-09-24"
"AL1462.01","23-60-00-STD GUIDE ROD","AL1462.01-23-60-00","4","","24-09-2021","Nirmal","PPRAJ","2021-09-24"
"AL1462.01","06-010-00-ROLL HOLDER L PLT","AL1462.01-06-010-00","1","","24-09-2021","Nirmal","PPRAJ","2021-09-24"
"AL1462.01","11-01-00-BASE PLATE","AL1462.01-11-01-00","1","","24-09-2021","Nirmal","PPRAJ","2021-09-24"
"AL1462.01","16-060-00-INSERTER BLADE","AL1462.01-16-060-00","2","","07-04-2022","Amar","PPRAJ","2022-04-07"
"AL1462.01","23-120-00-COUPLER HOLDER PLATE","AL1462.01-23-120-00","1","","24-09-2021","Nirmal","PPRAJ","2021-09-24"
"AL1462.01","02-090-00-STRIPPER HOLDER PLATE","AL1462.01-02-090-00","1","","24-09-2021","Nirmal","PPRAJ","2021-09-24"
"AL1462.01","23-250-00-TIE SPACER PLT","AL1462.01-23-250-00","4","","24-09-2021","Nirmal","PPRAJ","2021-09-24"
"AL1462.01","05-040-00-CYLINDER HOLDING SHAFT","AL1462.01-05-040-00","1","","24-09-2021","Nirmal","PPRAJ","2021-09-24"
"AL1462.01","16-009-00-SENSOR MOUNTING BRKT","AL1462.01-16-009-00","25","","18-01-2022","Amar","PPRAJ","2022-01-18"
"AL1462.01","07-210-00 TOP MTG BRKT","AL1462.01-07-210-00","2","","24-09-2021","Nirmal","PPRAJ","2021-09-24"
"AL1462.01","23-020-00 BASE PLATE SUPPORT","AL1462.01-23-020-00","1","","24-09-2021","Nirmal","PPRAJ","2021-09-24"
"AL1462.01","02-020-00-SUPPORT BRACKET","AL1462.01-02-020-00","1","","24-09-2021","Nirmal","PPRAJ","2021-09-24"
"AL1462.01","23-20-00-DOOM NUT","AL1462.01-23-20-00","1","","24-09-2021","Nirmal","PPRAJ","2021-09-24"
"AL1462.01","05-020-00-SHAFT  MTG BLOCK","AL1462.01-05-020-00","2","","24-09-2021","Nirmal","PPRAJ","2021-09-24"
"AL1462.01","07-091-00-TENSTIONER PLATE","AL1462.01-07-091-00","1","","24-09-2021","Nirmal","PPRAJ","2021-09-24"
"AL1462.01","16-079-00-INSERTER ROD CONN PLT","AL1462.01-16-079-00","1","","24-09-2021","Nirmal","PPRAJ","2021-09-24"
"AL1462.01","02-161-00-PROXIMITY SENSOR CLAMP","AL1462.01-02-161-00","2","","24-09-2021","Nirmal","PPRAJ","2021-09-24"
"AL1462.01","23-270-00-BRACKET GUIDE PLATE","AL1462.01-23-270-00","2","","24-09-2021","Nirmal","PPRAJ","2021-09-24"
"AL1462.01","03-120-00-GUIDE ROD","AL1462.01-03-120-00","2","","24-09-2021","Nirmal","PPRAJ","2021-09-24"
"AL1462.01","07-101-00-SHAFT FOR REMOVABLE ROLLER","AL1462.01-07-101-00","1","","24-09-2021","Nirmal","PPRAJ","2021-09-24"
"AL1462.01","03-080-R1-INSERTING PUNCH","AL1462.01-03-080-R1","2","","14-02-2022","Amar","PPRAJ","2022-02-14"
"AL1462.01","16-011-00-CYLINDER COUPLER","AL1462.01-16-011-00","1","","24-09-2021","Nirmal","PPRAJ","2021-09-24"
"AL1462.01","02-130-00-BLADE","AL1462.01-02-130-00","50","","24-09-2021","Nirmal","PPRAJ","2021-09-24"
"AL1462.01","05-070-00- LOCKING STOPPER","AL1462.01-05-070-00","1","","24-09-2021","Nirmal","PPRAJ","2022-03-05"
"AL1462.01","23-101-00- CYLINER COUPLER","AL1462.01-23-101-00","2","","24-09-2021","Nirmal","PPRAJ","2021-09-24"
"AL1462.01","06-070-00-LOCKING BUSH","AL1462.01-06-070-00","2","","24-09-2021","Nirmal","PPRAJ","2021-09-24"
"AL1462.01","01-050-00-SPRING FOR BALLS","AL1462.01-01-050-00","4","","29-09-2021","Nitish","PPRAJ","2021-09-29"
"AL1462.01","13-020-00-BACK PLATE","AL1462.01-13-020-00","1","","24-09-2021","Nirmal","PPRAJ","2021-09-24"
"AL1462.01","01-210-00-PAPER GUIDE STRIP","AL1462.01-01-210-00","2","","24-09-2021","Nirmal","PPRAJ","2021-09-24"
"AL1462.01","23-181-00-BACK FIXED FRAME","AL14632.01-23-181-00","2","","24-09-2021","Nirmal","PPRAJ","2021-09-24"
"AL1462.01","03-070-00-INSERTER HOLDINIG PLATE","AL1462.01-03-070-00","1","","24-09-2021","Nirmal","PPRAJ","2021-09-24"
"AL1462.01","23-110-00-DIA 12 GUIDE ROD","AL1462.01-23-110-00","4","","24-09-2021","Nirmal","PPRAJ","2021-09-24"
"AL1462.01","06-030-00-SUPPORT ROD","AL1462.01-06-030-00","1","","24-09-2021","Nirmal","PPRAJ","2021-09-24"
"AL1462.01","13-030-00-PAPER TENTIONER TOP PLATE","AL1462.01-13-030-00","1","","24-09-2021","Nirmal","PPRAJ","2021-09-24"
"AL1462.01","01-030-00-TOP PLATE","AL1462.01-01-030-00","1","","24-09-2021","Nirmal","PPRAJ","2021-09-24"
"AL1462.01","23-130-00-MAIN COUPLER","AL1462.01-23-130-00","1","","24-09-2021","Nirmal","PPRAJ","2021-09-24"
"AL1462.01","02-100-00-BLADE CONNECTING PIN","AL1462.01-02-100-00","1","","24-09-2021","Nirmal","PPRAJ","2021-09-24"
"AL1462.01","23-230-00-FRONT ADJUSTABLE BKT","AL1462.01-23-230-00","4","","24-09-2021","Nirmal","PPRAJ","2021-09-24"
"AL1462.01","05-07-0-00- LOCKING STOPPER","AL1462.01-05-07-0-00","1","","24-09-2021","Nirmal","PPRAJ","2021-09-24"
"AL1462.01","07-220-00 RH RETAINER","AL1462.01-07-220-00","1","","24-09-2021","Nirmal","PPRAJ","2021-09-24"
"AL1462.01","23-50-00-GUIDE BUSH MTG PLATE","AL1462.01-23-50-00","1","","24-09-2021","Nirmal","PPRAJ","2021-09-24"
"AL1462.01","02-060-00-INSERTER BLADE SUPPORT PLATE","AL1462.01-02-060-00","2","","24-09-2021","Nirmal","PPRAJ","2021-09-24"
"AL1462.01","16-061-R1-INSERTER BLADE","AL1462.01-16-061-R1","2","","14-01-2022","Amar","PPRAJ","2022-01-14"
"AL1462.01","23-31-00-CRADLE CYL CONNECTOR","AL1462.01-23-31-00","1","","24-09-2021","Nirmal","PPRAJ","2021-09-24"
"AL1462.01","05-060-00-PART SENSOR MTG PLATE","AL1462.01-05-060-00","2","","24-09-2021","Nirmal","PPRAJ","2021-09-24"
"AL1462.01","07-190-00 SUPRTNG BRKT 4 RLR","AL1462.01-07-190-00","1","","24-09-2021","Nirmal","PPRAJ","2021-09-24"
"AL1462.01","23-170-00-FIXED FRAME MTG PLATE","AL1462.01-23-170-00","4","","24-09-2021","Nirmal","PPRAJ","2021-09-24"
"AL1462.01","02-170-00 L-PATE FOR RAIL MTG","AL1462.01-02-171-00","1","","24-09-2021","Nirmal","PPRAJ","2021-09-24"
"AL1462.01","23-10-00-CRADLE GUIDE ROD","AL1462.01-23-11-00","1","","24-09-2021","Nirmal","PPRAJ","2021-09-24"
"AL1462.01","04-010-00-IXR CYL CONNTR","AL1462.01-04-010-00","1","","24-09-2021","Nirmal","PPRAJ","2021-09-24"
"AL1462.01","07-140-00-GUIDE ROD DIA 8","AL1462.01-07-140-00","2","","24-09-2021","Nirmal","PPRAJ","2021-09-24"
"AL1462.01","16-040-00-GUIDE ROD DIA 10","AL1462.01-16-040-00","2","","24-09-2021","Nirmal","PPRAJ","2021-09-24"
"AL1462.01","02-140-00-CUTTER HOLDING PLATE","AL1462.01-02-140-00","1","","24-09-2021","Nirmal","PPRAJ","2021-09-24"
"AL1462.03","01-016-00-GUIDE BUSH LOCK","AL1462.03-01-016-00","1","","28-03-2022","Amar","PPRAJ","2022-03-28"
"AL1462.03","07-092-00 GUIDE ROD","AL1462.03-07-092-00","2","","30-09-2021","Amar","PPRAJ","2021-09-30"
"AL1462.03","20-101-R1- CYLINER COUPLER","AL1462.03-20-101-R1","2","","09-05-2022","Amar","PPRAJ","2022-05-09"
"AL1462.03","06-030-00-SUPPORT ROD","AL1462.03-06-030-00","1","","30-09-2021","Amar","PPRAJ","2021-09-30"
"AL1462.03","11-022-00-COUPLER PLATE","AL1462.03-11-022-00","1","","16-04-2022","Amar","PPRAJ","2022-04-16"
"AL1462.03","20-101-00- CYLINER COUPLER","AL1462.03-20-101-00","2","","30-09-2021","Amar","PPRAJ","2021-09-30"
"AL1462.03","01-107-00 PLUNGER HSG","AL1462.03-01-107-00","1","","30-09-2021","Amar","PPRAJ","2021-09-30"
"AL1462.03","07-190-00 SUPRTNG BRKT 4 RLR","AL1462.03-07-190-00","1","","30-09-2021","Amar","PPRAJ","2021-09-30"
"AL1462.03","01-030-R1 CUTTER BLADE GUIDE-LH","AL1462.03-01-030-R1","1","","29-06-2022","Amar","PPRAJ","2022-06-29"
"AL1462.03","01-106-R2-PAPER HOLDING FORM","AL1462.03-01-106-R2","2","","23-03-2022","Amar","PPRAJ","2022-03-23"
"AL1462.03","16-010-00 PROFILE GUIDE MTG BRKT","AL1462.03-16-010-00","1","","30-09-2021","Amar","PPRAJ","2021-09-30"
"AL1462.03","20-91-00-CONVIER STOPPER","20-91-00-CONVIYER STOPPER","1","","09-03-2022","Amar","PPRAJ","2022-03-09"
"AL1462.03","11-018-00-DOOM NUT","AL1462.03-11-018-00","1","","16-04-2022","Amar","PPRAJ","2022-04-16"
"AL1462.03","20-70-00-V BLOCK ADJUSTABLE BLOCK","AL1462.03-20-70-00","1","","30-09-2021","Amar","PPRAJ","2021-09-30"
"AL1462.03","01-030-00 CUTTER BLADE GUIDE-LH","AL1462.03-01-030-00","1","","30-09-2021","Amar","PPRAJ","2021-09-30"
"AL1462.03","20-02-00-WALKING BEAM-BACK SIDE PLT","AL1462.03-20-02-00","1","","13-10-2021","Nirmal","PPRAJ","2021-10-13"
"AL1462.03","07-050-00-SHAFT FOR REMOVABLE ROLLER","AL1462.03-07-050-00","1","","30-09-2021","Amar","PPRAJ","2021-09-30"
"AL1462.03","01-013-00 GUIDE ROD","AL1462.03-01-013-00","2","","06-10-2021","Amar","PPRAJ","2021-10-06"
"AL1462.03","16-020-00 U PROFILE GUIDE BOTTOM","AL1462.03-16-020-00","1","","30-09-2021","Amar","PPRAJ","2021-09-30"
"AL1462.03","11-015-00-SHAFT","AL1462.03-11-015-00","1","","16-04-2022","Amar","PPRAJ","2022-04-16"
"AL1462.03","20-60-00-STD GUIDE ROD","AL1462.03-20-60-00","4","","30-09-2021","Amar","PPRAJ","2021-09-30"
"AL1462.03","01-010-00 INDEXER MTG BRKT","AL1462.03-01-010-00","1","","30-09-2021","Amar","PPRAJ","2021-09-30"
"AL1462.03","20-181-00-FRNT FIXED FRAME","AL1462.03-20-181-00","1","","13-10-2021","Nirmal","PPRAJ","2021-10-13"
"AL1462.03","20-250-00-TIE SPACER PLT","AL1462.03-20-250-00","4","","30-09-2021","Amar","PPRAJ","2021-09-30"
"AL1462.03","01-033-00 FORM GUIDE MTG PLT","AL1462.03-01-032-00","1","","30-09-2021","Amar","PPRAJ","2021-09-30"
"AL1462.03","01-040-R1 COUPLER HOLDER","AL1462.03-01-040-R1","1","","01-03-2022","Amar","PPRAJ","2022-03-01"
"AL1462.03","13-040-00-TENSIONER RELIEF PIN","AL1462.03-13-040-00","1","","30-09-2021","Amar","PPRAJ","2021-09-30"
"AL1462.03","20-31-00-CRADLE CYL CONNECTOR","AL1462.03-20-31-00","1","","30-09-2021","Amar","PPRAJ","2021-09-30"
"AL1462.03","01-108-00-PAPER HOLDING FORM","AL1462.03-01-108-00","3","","04-07-2022","Amar","PPRAJ","2022-07-04"
"AL1462.03","20-140-00-MOVING FRAME HOLDER","AL1462.03-20-140-00","2","","30-09-2021","Amar","PPRAJ","2021-09-30"
"AL1462.03","01-040-00 COUPLER HOLDER","AL1462.03-01-040-00","1","","30-09-2021","Amar","PPRAJ","2021-09-30"
"AL1462.03","20-200-00-SPACER PLT","AL1462.03-20-200-00","2","","13-10-2021","Nirmal","PPRAJ","2022-03-01"
"AL1462.03","13-020-00-BACK PLATE","AL1462.03-13-020-00","1","","30-09-2021","Amar","PPRAJ","2021-09-30"
"AL1462.03","01-061-R1 CUTTING BLADE","AL1462.03-01-061-R1","2","","02-03-2022","Amar","PPRAJ","2022-03-02"
"AL1462.03","20-020-00 BASE PLATE SUPPORT","AL1462.03-20-020-00","1","","30-09-2021","Amar","PPRAJ","2021-09-30"
"AL1462.03","01-107-R1 PLUNGER HSG","AL1462.03-01-107-R1","2","","10-02-2022","Amar","PPRAJ","2022-02-10"
"AL1462.03","11-012-00-TOP MTG PLT","AL1462.03-11-012-00","1","","15-04-2022","Amar","PPRAJ","2022-04-16"
"AL1462.03","01-015-00-PILLER","AL1462.03-01-015-00","1","","28-03-2022","Amar","PPRAJ","2022-03-28"
"AL1462.03","13-060-00-HEATER MTG BLOCK","AL1462.03-13-060-00","1","","30-09-2021","Amar","PPRAJ","2021-09-30"
"AL1462.03","06-050-00-SHEET MTG PLT","AL1462.03-06-050-00","30","","30-09-2021","Amar","PPRAJ","2021-09-30"
"AL1462.03","11-023-00-STAFFING RUBBER","AL1462.03-11-023-00","2","","16-04-2022","Amar","PPRAJ","2022-04-16"
"AL1462.03","20-110-00-DIA 12 GUIDE ROD","AL1462.03-20-110-00","4","","30-09-2021","Amar","PPRAJ","2021-09-30"
"AL1462.03","01-130-00-PAWL HOLDER","AL1462.03-01-130-00","2","","30-09-2021","Amar","PPRAJ","2021-09-30"
"AL1462.03","07-210-00 TOP MTG BRKT","AL1462.03-07-210-00","1","","30-09-2021","Amar","PPRAJ","2021-09-30"
"AL1462.03","01-031-R1 CUTTER BLADE GUIDE-RH","AL1462.03-01-031-R1","1","","29-06-2022","Amar","PPRAJ","2022-06-29"
"AL1462.03","16-020-R2-U PROFILE GUIDE BOTTOM","AL1462.03-16-020-R2","1","","23-03-2022","Amar","PPRAJ","2022-03-23"
"AL1462.03","06-080-00-PAPER ROLLER BUSH","AL1462.03-06-080-00","15","","30-09-2021","Amar","PPRAJ","2021-09-30"
"AL1462.03","11-019-00-ROLLERS","AL1462.03-11-019-00","2","","16-04-2022","Amar","PPRAJ","2022-04-16"
"AL1462.03","20-80-00-V BLOCK GUIDE PLATE","AL1462.03-20-80-00","2","","30-09-2021","Amar","PPRAJ","2021-09-30"
"AL1462.03","01-031-00 CUTTER BLADE GUIDE-RH","AL1462.03-01-031-00","1","","30-09-2021","Amar","PPRAJ","2021-09-30"
"AL1462.03","20-03-00-WALKING BEAM-FRONT  SIDE PLT","AL1462.03-20-03-00","1","","13-10-2021","Nirmal","PPRAJ","2021-10-13"
"AL1462.03","07-102-00-TENSTIONER PLATE","AL1462.03-07-102-00","1","","30-09-2021","Amar","PPRAJ","2021-09-30"
"AL1462.03","23-40-00-COMP HOLDER","AL1462.03-23-40-00","2","","18-06-2022","Amar","PPRAJ","2022-06-18"
"AL1462.03","01-110-00 GUIDE PLUNGER","AL1462.03-01-110-00","1","","06-10-2021","Amar","PPRAJ","2021-10-06"
"AL1462.03","16-030-00-PAPER GUIDE","AL1462.03-16-030-00","1","","30-09-2021","Amar","PPRAJ","2021-09-30"
"AL1462.03","11-016-00-CYLINDER MTG BRKT","AL1462.03-11-016-00","1","","16-04-2022","Amar","PPRAJ","2022-04-16"
"AL1462.03","20-010-00 RIB PLT","AL1462.03-20-010-00","2","","30-09-2021","Amar","PPRAJ","2021-09-30"
"AL1462.03","01-011-00-IXR CYL CONNTR","AL1462.03-01-011-00","1","","30-09-2021","Amar","PPRAJ","2021-09-30"
"AL1462.03","20-180-00-FRNT FIXED FRAME","AL1462.03-20-180-00","1","","13-10-2021","Nirmal","PPRAJ","2021-10-13"
"AL1462.03","20-270-00-BRACKET GUIDE PLATE","AL1462.03-15-270-00","2","","30-09-2021","Amar","PPRAJ","2021-09-30"
"AL1462.03","01-053-00 COUPLER","AL1462.03-01-052-00","1","","30-09-2021","Amar","PPRAJ","2021-09-30"
"AL1462.03","20-140-R1-MOVING FRAME HOLDER","AL1462.01-20-140-R1","2","","01-03-2022","Amar","PPRAJ","2022-03-01"
"AL1462.03","07-011-00-INDEXER ROLLER ASSLY MTG BRAKET","AL1462.03-07-011-00","1","","06-10-2021","Amar","PPRAJ","2021-10-06"
"AL1462.03","13-090-00-HEATER MTG PLATE","AL1462.03-13-090-00","1","","30-09-2021","Amar","PPRAJ","2021-09-30"
"AL1462.03","20-40-00-COMP HOLDER","AL1462.03-20-40-00","2","","30-09-2021","Amar","PPRAJ","2021-09-30"
"AL1462.03","01-106-00-PAPER HOLDING FORM","AL1462.03-01-106-00","2","","30-09-2021","Amar","PPRAJ","2021-09-30"
"AL1462.03","11-013-00-SHAFT MTG PLT LH","AL1462.03-11-013-00","1","","15-04-2022","Amar","PPRAJ","2022-04-16"
"AL1462.03","20-150-00-VERTICAL CYL MTG BLOCK","AL1462.03-20-150-00","4","","30-09-2021","Amar","PPRAJ","2021-09-30"
"AL1462.03","01-050-00 COUPLER","AL1462.03-01-050-00","1","","30-09-2021","Amar","PPRAJ","2021-09-30"
"AL1462.03","20-211-00-SPACER PLT","AL1462.3-20-211-00","2","","01-03-2022","Karumbaiah","PPRAJ","2022-03-01"
"AL1462.03","13-080-00-HEATER RETAINER PLATE","AL1462.03-13-080-00","1","","30-09-2021","Amar","PPRAJ","2021-09-30"
"AL1462.03","01-101-R1 STOPPER PLT","AL1462.03-01-101-R1","1","","02-03-2022","Amar","PPRAJ","2022-03-02"
"AL1462.03","20-21-00-DOOM NUT","AL1462.03-20-21-00","1","","30-09-2021","Amar","PPRAJ","2021-09-30"
"AL1462.03","01-106-R1-PAPER HOLDING FORM","AL1462.03-01-106-R1","4","","10-02-2022","Amar","PPRAJ","2022-02-10"
"AL1462.03","20-120-00-COUPLER HOLDER PLATE","AL1462.03-20-120-00","2","","30-09-2021","Amar","PPRAJ","2021-09-30"
"AL1462.03","01-140-00-PAWL","AL1462.03-01-140-00","2","","30-09-2021","Amar","PPRAJ","2021-09-30"
"AL1462.03","01-014-00-PILLER BASE","AL1462.03-01-014-00","1","","28-03-2022","Amar","PPRAJ","2022-03-28"
"AL1462.03","13-070-00-HEATER TOP COVER","AL1462.03-13-070-00","1","","30-09-2021","Amar","PPRAJ","2021-09-30"
"AL1462.03","01-102-00-COMPONENT STOPPER PLT","AL1462.03-01-102-00","1","","02-03-2022","Amar","PPRAJ","2022-03-02"
"AL1462.03","06-060-00-SIDE PLT FOR ROLL HOLDER","AL1462.03-06-060-00","2","","30-09-2021","Amar","PPRAJ","2021-09-30"
"AL1462.03","11-024-00-STAFFING ROLLER SPACER","AL1462.03-11-024-00","1","","16-04-2022","Amar","PPRAJ","2022-04-16"
"AL1462.03","07-091-00 GUIDE ROLLER SHEET","AL1462.03-07-091-00","2","","30-09-2021","Amar","PPRAJ","2021-09-30"
"AL1462.03","01-041-00 COUPLER HOLDER","AL1462.03-01-041-00","1","","29-06-2022","Amar","PPRAJ","2022-06-29"
"AL1462.03","01-050-R1 COUPLER","AL1462.03-01-050-R1","2","","09-05-2022","Amar","PPRAJ","2022-05-09"
"AL1462.03","16-030-R2-PAPER GUIDE","AL1462.03-16-030-R2","1","","23-03-2022","Amar","PPRAJ","2022-03-23"
"AL1462.03","06-010-00-ROLL HOLDER L PLT","AL1462.03-06-010-00","1","","30-09-2021","Amar","PPRAJ","2021-09-30"
"AL1462.03","11-021-00-CYLINDER COUPLER","AL1462.03-11-021-00","1","","16-04-2022","Amar","PPRAJ","2022-04-16"
"AL1462.03","20-90-00-CYLINDER STOPER PLT","AL1462.03-20-90-00","2","","30-09-2021","Amar","PPRAJ","2021-09-30"
"AL1462.03","01-101-00 STOPPER PLT","AL1462.03-01-101-00","1","","30-09-2021","Amar","PPRAJ","2021-09-30"
"AL1462.03","07-184-00 WEDGE GUIDE","AL1462.03-07-184-00","1","","30-09-2021","Amar","PPRAJ","2021-09-30"
"AL1462.03","01-034-00-PAPER PUSHER CYL MTG PLT","AL1462.03-01-034-00","1","","06-10-2021","Amar","PPRAJ","2021-10-06"
"AL1462.03","16-02-00-BASE GUIDE","AL1462.03-16-02-00","1","","30-09-2021","Amar","PPRAJ","2021-09-30"
"AL1462.03","01-070-R1-COMPONENT HOLDER","AL1462.03-01-070-R1","1","","09-03-2022","Amar","PPRAJ","2022-03-09"
"AL1462.03","11-017-00-STAFFING ASSY MTG PLT","AL1462.03-11-017-00","1","","16-04-2022","Amar","PPRAJ","2022-04-16"
"AL1462.03","20-11-00-CRADLE GUIDE ROD","AL1462.03-20-11-00","1","","30-09-2021","Amar","PPRAJ","2021-09-30"
"AL1462.03","01-070-00-COMPONENT HOLDER","AL1462.03-01-070-00","1","","30-09-2021","Amar","PPRAJ","2021-09-30"
"AL1462.03","20-230-00-FRONT ADJUSTABLE BKT","AL1462.03-20-230-00","2","","13-10-2021","Nirmal","PPRAJ","2021-10-13"
"AL1462.03","20-280-00-STD GUIDE ROD Ø8","AL1462.03-20-280-00","2","","30-09-2021","Amar","PPRAJ","2021-09-30"
"AL1462.03","07-052-00-SHAFT FOR REMOVABLE ROLLER","AL1462.03-07-052-00","1","","30-09-2021","Amar","PPRAJ","2021-09-30"
"AL1462.03","07-012-00 GUIDE ROD","AL1462.03-07-012-00","2","","06-10-2021","Amar","PPRAJ","2021-10-06"
"AL1462.03","14-01-00-BASE PLATE","AL1462.03-14-01-00","1","","30-09-2021","Amar","PPRAJ","2021-09-30"
"AL1462.03","11-014-00-GUIDE ROD","AL1462.03-11-014-00","2","","16-04-2022","Amar","PPRAJ","2022-04-16"
"AL1462.03","20-50-00-GUIDE BUSH MTG PLATE","AL1462.03-20-50-00","1","","30-09-2021","Amar","PPRAJ","2021-09-30"
"AL1462.03","01-109-00 STOPPER","AL1462.03-01-109-00","1","","30-09-2021","Amar","PPRAJ","2021-09-30"
"AL1462.03","11-102-00-LOCK PLATE","AL1462.03-11-102-00","2","","16-04-2022","Amar","PPRAJ","2022-04-16"
"AL1462.03","20-170-00-FIXED FRAME MTG PLATE","AL1462.03-20-170-00","2","","13-10-2021","Nirmal","PPRAJ","2021-10-13"
"AL1462.03","20-160-00-MAIN CYL MTG PLATE","AL1462.03-20-161-00","1","","30-09-2021","Amar","PPRAJ","2021-09-30"
"AL1462.03","01-061-00 CUTTING BLADE","AL1462.03-01-061-00","50","","30-09-2021","Amar","PPRAJ","2021-09-30"
"AL1462.03","01-020-R1 CUTTER CYL MTG BRKT","AL1462.03-01-020-R1","1","","01-03-2022","Amar","PPRAJ","2022-03-01"
"AL1462.03","13-030-00-PAPER TENTIONER TOP PLATE","AL1436.02-13-030-00","1","","30-09-2021","Amar","PPRAJ","2021-09-30"
"AL1462.03","20-030-00-NEW CONVEYOR BASE PLATE","AL1462.03-20-030-00","1","","30-09-2021","Amar","PPRAJ","2021-09-30"
"AL1462.03","01-035-00-INDEXER ADDITIONAL PLT","AL1462.03-01-035-00","1","","10-02-2022","Amar","PPRAJ","2022-02-10"
"AL1462.03","20-130-00-MAIN COUPLER","AL1462.03-20-130-00","1","","30-09-2021","Amar","PPRAJ","2021-09-30"
"AL1462.03","01-020-00 CUTTER CYL MTG BRKT","AL1462.03-01-020-00","1","","30-09-2021","Amar","PPRAJ","2021-09-30"
"AL1462.03","07-013-00 GUIDE ROLLER","AL1462.03-07-013-00","1","","01-03-2022","Karumbaiah","PPRAJ","2022-03-01"
"AL1462.03","13-010-00-PAPER TENTIONER PLATE","AL1462.03-13-010-00","1","","30-09-2021","Amar","PPRAJ","2021-09-30"
"AL1462.03","01-104-00-CYLINDER MTG SPACER","AL1462.03-01-104-00","1","","02-03-2022","Amar","PPRAJ","2022-03-02"
"AL1462.03","06-070-00-LOCKING BUSH","AL1462.03-06-070-00","30","","30-09-2021","Amar","PPRAJ","2021-09-30"
"AL1462.03","11-101-00-MOTOR MTG PLT","AL1462.03-11-101-00","1","","16-04-2022","Amar","PPRAJ","2022-04-16"
"AL1468.05","05-121-R1-SUPPORT BLOCK SPACER","AL1468.05-05-121-R1-SUPPORT BLOCK SPACER","3","","19-01-2022","Dayanand","PPRAJ","2022-01-19"
"AL1468.05","01-A03-00-TRANSFERMER MOUNTING FRAME ASSY","AL1468.05-01-A03-00-TRANSFERMER MOUNTING FRAME ASSY","3","","19-01-2022","Dayanand","PPRAJ","2022-01-19"
"AL1468.05","05-122-R1-SUPPORT BLOCK SPACER","AL1468.05-05-122-R1-SUPPORT BLOCK SPACER","6","","19-01-2022","Dayanand","PPRAJ","2022-01-19"
"AL1468.05","01-A05-00-TUBE STRUCTURE BASE ASSY","AL1468.05-01-A05-00-TUBE STRUCTURE BASE ASSY","3","","19-01-2022","Dayanand","PPRAJ","2022-01-19"
"AL1468.05","05-260-00-SPACER PLATE","AL1468.05-05-260-00-SPACER PLATE","6","","19-01-2022","Dayanand","PPRAJ","2022-01-19"
"AL1468.05","04-42-00-WALKER MTG BRACKET","AL1468.05-04-42-00-WALKER MTG BRACKET","6","","19-01-2022","Dayanand","PPRAJ","2022-01-19"
"AL1468.06","02-128-00-BACK COVER BACK","AL1468.06-02-128-00-BACK COVER BACK","1","","13-10-2021","Kiran","PPRAJ","2021-10-13"
"AL1468.06","05-020-00 -MOTOR MOUTING PLATE","AL1468.06-05-020-00 -MOTOR MOUTING PLATE","1","","13-10-2021","Kiran","PPRAJ","2021-10-13"
"AL1468.06","04-440-00-ROLLER JACKING PLATE","AL1468.06-04-440-00-ROLLER JACKING PLATE","3","","13-10-2021","Kiran","PPRAJ","2021-10-13"
"AL1468.06","03-640-00-END STPR MTG PLATE","AL1468.06-03-640-00-END STPR MTG PLATE","1","","13-10-2021","Kiran","PPRAJ","2021-10-13"
"AL1468.06","02-100-00-SENSOR MTG PLATE","AL1468.06-02-100-00-SENSOR MTG PLATE","3","","13-10-2021","Kiran","PPRAJ","2021-10-13"
"AL1468.06","06-030-00-SUCTION HOLDER PLATE","AL1468.06-06-030-00-SUCTION HOLDER PLATE","3","","13-10-2021","Kiran","PPRAJ","2021-10-13"
"AL1468.06","05-110-00-BEARING RETAINER PLATE","AL1468.06-05-110-00-BEARING RETAINER PLATE","2","","13-10-2021","Kiran","PPRAJ","2021-10-13"
"AL1468.06","04-280-00-DOOM NUT BUTTING BLOCK","AL1468.06-04-280-00-DOOM NUT BUTTING BLOCK","2","","13-10-2021","Kiran","PPRAJ","2021-10-13"
"AL1468.06","06-049-00-SUCTION MAIN BOX","AL1468.06-06-049-00-SUCTION MAIN BOX","6","","13-10-2021","Kiran","PPRAJ","2021-10-13"
"AL1468.06","05-080-00-BRUSH HOLDING SHAFT","AL1468.06-05-080-00-BRUSH HOLDING SHAFT","2","","13-10-2021","Kiran","PPRAJ","2021-10-13"
"AL1468.06","04-100-00-BEARING RETAINER","AL1468.06-04-100-00-BEARING RETAINER","1","","13-10-2021","Kiran","PPRAJ","2021-10-13"
"AL1468.06","02-270-00-CYLINDER MTG PLATE","AL1468.06-02-270-00-CYLINDER MTG PLATE","3","","13-10-2021","Kiran","PPRAJ","2021-10-13"
"AL1468.06","05-210-00-CONNECTING THREAD","AL1468.06-05-210-00-CONNECTING THREAD","1","","13-10-2021","Kiran","PPRAJ","2021-10-13"
"AL1468.06","04-060-00-GUIDE ROD","AL1468.06-04-060-00-GUIDE ROD","2","","13-10-2021","Kiran","PPRAJ","2021-10-13"
"AL1468.06","02-210-00-TOOL HOLDER CLAMP","AL1468.06-02-210-00-TOOL HOLDER CLAMP","4","","13-10-2021","Kiran","PPRAJ","2021-10-13"
"AL1468.06","05-150-00-TOP PLATE","AL1468.06-05-150-00-TOP PLATE","1","","13-10-2021","Kiran","PPRAJ","2021-10-13"
"AL1468.06","02-150-00-FINE ADJUSTMENT STOPPER","AL1468.06-02-150-00-FINE ADJUSTMENT STOPPER","1","","13-10-2021","Kiran","PPRAJ","2021-10-13"
"AL1468.06","05-160-00-BRUSH MOTOR MTG PLATE","AL1468.06-05-160-00-BRUSH MOTOR MTG PLATE","1","","13-10-2021","Kiran","PPRAJ","2021-10-13"
"AL1468.06","04-013-00-VERTICAL PILLER","AL1468.06-04-013-00-VERTICAL PILLER","1","","13-10-2021","Kiran","PPRAJ","2021-10-13"
"AL1468.06","03-650-00-END STOPPER","AL1468.06-03-650-00-END STOPPER","6","","13-10-2021","Kiran","PPRAJ","2021-10-13"
"AL1468.06","02-120-00-TOOL POST BASE","AL1468.06-02-120-00-TOOL POST BASE","1","","13-10-2021","Kiran","PPRAJ","2021-10-13"
"AL1468.06","06-048-00-ADJUSTABLE SUCTIONN HOOD ASSY","AL1468.06-06-048-00-ADJUSTABLE SUCTIONN HOOD ASSY","3","","13-10-2021","Kiran","PPRAJ","2021-10-13"
"AL1468.06","04-670-00-TENSIONER COUPLER","AL1468.06-04-670-00-TENSIONER COUPLER","3","","13-10-2021","Kiran","PPRAJ","2021-10-13"
"AL1468.06","03-030-00-BASE PLATE","AL1468.06-03-030-00-BASE PLATE","1","","13-10-2021","Kiran","PPRAJ","2021-10-13"
"AL1468.06","06-010-00-VERTICAL ADJUSTABLE PLATE","AL1468.06-06-010-00-VERTICAL ADJUSTABLE PLATE","3","","13-10-2021","Kiran","PPRAJ","2021-10-13"
"AL1468.06","05-090-00-DRIVE PULLEY","AL1468.06-05-090-00-DRIVE PULLEY","1","","13-10-2021","Kiran","PPRAJ","2021-10-13"
"AL1468.06","04-240-00-BEARING SPACER","AL1468.06-04-240-00-BEARING SPACER","3","","13-10-2021","Kiran","PPRAJ","2021-10-13"
"AL1468.06","02-300-00-SADDLE CYL MTG BRACKET","AL1468.06-02-300-00-SADDLE CYL MTG BRACKET","3","","13-10-2021","Kiran","PPRAJ","2021-10-13"
"AL1468.06","05-230-00-BRUSH PULLYSHAFT","AL1468.06-05-230-00-BRUSH PULLYSHAFT","1","","13-10-2021","Kiran","PPRAJ","2021-10-13"
"AL1468.06","04-070-00-CYLNDR COUPLER HOLDING PLT","AL1468.06-04-070-00-CYLNDR COUPLER HOLDING PLT","1","","13-10-2021","Kiran","PPRAJ","2021-10-13"
"AL1468.06","02-740-00-GUIDE ROD","AL1468.06-02-740-00-GUIDE ROD","3","","13-10-2021","Kiran","PPRAJ","2021-10-13"
"AL1468.06","02-220-00-SHOCK ABSORBER PLT","AL1468.06-02-220-00-SHOCK ABSORBER PLT","2","","13-10-2021","Kiran","PPRAJ","2021-10-13"
"AL1468.06","05-050-00-GEAR BOX MTG SHEET","AL1468.06-05-050-00-GEAR BOX MTG SHEET","1","","13-10-2021","Kiran","PPRAJ","2021-10-13"
"AL1468.06","02-200-00-TOOL HOLDER","AL1468.06-02-200-00-TOOL HOLDER","3","","13-10-2021","Kiran","PPRAJ","2021-10-13"
"AL1468.06","05-170-00-SLIDE GUIDE BUSH HOLDER","AL1468.06-05-170-00-SLIDE GUIDE BUSH HOLDER","1","","13-10-2021","Kiran","PPRAJ","2021-10-13"
"AL1468.06","04-012-00-VERTICAL PILLER","AL1468.06-04-012-00-VERTICAL PILLER","1","","13-10-2021","Kiran","PPRAJ","2021-10-13"
"AL1468.06","02-127-00-BACK COVER","AL1468.06-02-127-00-BACK COVER","3","","13-10-2021","Kiran","PPRAJ","2021-10-13"
"AL1468.06","05-120-00-CONNECTING PLATE","AL1468.06-05-120-00-CONNECTING PLATE","1","","13-10-2021","Kiran","PPRAJ","2021-10-13"
"AL1468.06","04-320-00-SHAFT","AL1468.06-04-320-00-SHAFT","1","","13-10-2021","Kiran","PPRAJ","2021-10-13"
"AL1468.06","03-100-00-STOPPER PLATE","AL1468.06-03-100-00-STOPPER PLATE","6","","13-10-2021","Kiran","PPRAJ","2021-10-13"
"AL1468.06","02-750-00-SLIDE TOP CVR","AL1468.06-02-750-00-SLIDE TOP CVR","3","","13-10-2021","Kiran","PPRAJ","2021-10-13"
"AL1468.06","06-020-00-HORIZONTAL ADJUSTABLE PLATE","AL1468.06-06-020-00-HORIZONTAL ADJUSTABLE PLATE","3","","13-10-2021","Kiran","PPRAJ","2021-10-13"
"AL1468.06","05-100-00-BRUSH RETAINER BUSH","AL1468.06-05-100-00-BRUSH RETAINER BUSH","1","","13-10-2021","Kiran","PPRAJ","2021-10-13"
"AL1468.06","04-260-00-BELT UNIT STOPPER KNOB","AL1468.06-04-260-00-BELT UNIT STOPPER KNOB","1","","13-10-2021","Kiran","PPRAJ","2021-10-13"
"AL1468.06","02-410-00-BEARING HOLDING BLOCK","AL1468.06-02-410-00-BEARING HOLDING BLOCK","3","","13-10-2021","Kiran","PPRAJ","2021-10-13"
"AL1468.06","05-060-00-RUBBER ROLLER","AL1468.06-05-060-00-RUBBER ROLLER","1","","13-10-2021","Kiran","PPRAJ","2021-10-13"
"AL1468.06","04-080-00-COUPLER MTG PLATE","AL1468.06-04-080-00-COUPLER MTG PLATE","1","","13-10-2021","Kiran","PPRAJ","2021-10-13"
"AL1468.06","02-240-00-HYDROLIC PUSHER PLATE","AL1468.06-02-240-00-HYDROLIC PUSHER PLATE","3","","13-10-2021","Kiran","PPRAJ","2021-10-13"
"AL1468.06","05-200-00-CONNECTING PLATE","AL1468.06-05-200-00-CONNECTING PLATE","1","","13-10-2021","Kiran","PPRAJ","2021-10-13"
"AL1468.06","02-090-00-CYLINDER COUPLER","AL1468.06-02-090-00-CYLINDER COUPLER","3","","13-10-2021","Kiran","PPRAJ","2021-10-13"
"AL1468.06","05-140-00-LM BLOCK MTG PLATE","AL1468.06-05-140-00-LM BLOCK MTG PLATE","1","","13-10-2021","Kiran","PPRAJ","2021-10-13"
"AL1468.06","04-040-00-CYLINDER COUPLER","AL1468.06-04-040-00-CYLINDER COUPLER","2","","13-10-2021","Kiran","PPRAJ","2021-10-13"
"AL1473.01","04-03-00- GUIDE ROD","AL1473.01-04-03-00","2","","17-03-2022","Amar","PPRAJ","2022-03-27"
"AL1473.01","03-02-00GUIDE BUSH HOLDER","AL1473.01-03-02-00","2","","17-03-2022","Amar","PPRAJ","2022-03-27"
"AL1473.01","03-05-00-GUIDE ROD","AL1473.01-03-05-00","4","","18-03-2022","Amar","PPRAJ","2022-03-27"
"AL1473.01","05-060-00-COMPONENT HOLDING BLK","AL1473.01-05-060-00","1","","27-03-2022","Amar","PPRAJ","2022-03-27"
"AL1473.01","02-07-00-COUPLER BLOCK","AL1473.01-02-07-00","1","","27-03-2022","Amar","PPRAJ","2022-03-27"
"AL1473.01","05-02-00-INSERT PIN","AL1473.01-05-02-00","1","","26-03-2022","Amar","PPRAJ","2022-03-27"
"AL1473.01","05-03-00-TOOL BASE","AL1473.01-05-03-00","1","","17-03-2022","Amar","PPRAJ","2022-03-19"
"AL1473.01","02-03-00-GUIDE ROD","AL1473.01-02-03-00","2","","17-03-2022","Amar","PPRAJ","2022-03-27"
"AL1473.01","04-05-00-STIFFER PLATE-TOP","AL1473.01-04-05-00","1","","17-03-2022","Amar","PPRAJ","2022-03-27"
"AL1473.01","04-09-00-WASHER","AL1473.01-04-09-00","4","","17-03-2022","Amar","PPRAJ","2022-03-27"
"AL1473.01","03-10-00-STOPPER PAD","AL1473.01-03-10-00","2","","27-03-2022","Amar","PPRAJ","2022-03-27"
"AL1473.01","03-08-00-WASHER","AL1473.01-03-08-00","4","","18-03-2022","Amar","PPRAJ","2022-03-27"
"AL1473.01","01-03-00-VSPM BASE PLATE","AL1473.01-01-03-00","1","","29-03-2022","Amar","PPRAJ","2022-03-29"
"AL1473.01","03-04-00-SHAFT MTG PLATE","AL1473.01-03-04-00","1","","18-03-2022","Amar","PPRAJ","2022-03-27"
"AL1473.01","05-010-00-COMP HOLDING BLK","AL1473.01-05-010-00","1","","26-03-2022","Amar","PPRAJ","2022-03-27"
"AL1473.01","05-01-00-COMP HOLDING BLK","AL1473.01-05-01-00","1","","17-03-2022","Amar","PPRAJ","2022-03-19"
"AL1473.01","02-09-00-ROD HOUSING BOTTOM","AL1473.01-02-09-00","2","","17-03-2022","Amar","PPRAJ","2022-03-27"
"AL1473.01","04-02-00-STIFFER PLATE","AL1473.01-04-02-00","1","","17-03-2022","Amar","PPRAJ","2022-03-27"
"AL1473.01","04-10-00-SEN BRKT","AL1473.01-04-10-00","1","","05-07-2022","Amar","PPRAJ","2022-07-05"
"AL1473.01","02-05-00-CYLINDER COUPLER","AL1473.01-02-05-00","1","","17-03-2022","Amar","PPRAJ","2022-03-27"
"AL1473.01","04-07-00-COUPLER BLOCK","AL1487.01-04-07-00","1","","18-03-2022","Amar","PPRAJ","2022-03-27"
"AL1473.01","03-13-00-LOADE CELL SPACER","AL1473.01-03-13-00","1","","27-03-2022","Amar","PPRAJ","2022-03-27"
"AL1473.01","03-01-00-TOOL HOLDER PLATE","AL1473.01-03-01-00","1","","17-03-2022","Amar","PPRAJ","2022-03-27"
"AL1473.01","05-20-00-PIN FOR DOWEL","AL1473.01-05-20-00","2","","16-04-2022","Amar","PPRAJ","2022-04-16"
"AL1473.01","03-03-00-PRESSING SHAFT","AL1473.01-03-03-00","1","","18-03-2022","Amar","PPRAJ","2022-03-27"
"AL1473.01","05-06-00-TOOL BASE","AL1473.01-05-06-00","1","","27-03-2022","Amar","PPRAJ","2022-03-27"
"AL1473.01","05-02-00-INSERT PIN","AL1487.01-05-02-00","4","","17-03-2022","Amar","PPRAJ","2022-03-19"
"AL1473.01","02-04-00-CYLINDER HOLDER PLATE","AL1473.01-02-04-00","1","","17-03-2022","Amar","PPRAJ","2022-03-27"
"AL1473.01","04-01-00-CYLINDER COUPLER BOTTOM","AL1473.01-04-01-00","1","","17-03-2022","Amar","PPRAJ","2022-03-27"
"AL1473.01","02-02-00-TOP SUPPORT WASHER","AL1473.01-02-02-00","2","","17-03-2022","Amar","PPRAJ","2022-03-27"
"AL1473.01","04-04-00-STOPPER FOR STIFFNER","AL1473.01-04-04-00","2","","27-03-2022","Amar","PPRAJ","2022-03-27"
"AL1473.02","02-04-00-CYLINDER HOLDER PLATE","AL1473.02-02-04-00","2","","22-02-2022","Amar","PPRAJ","2022-03-09"
"AL1473.02","01-130-00-COMP GUIDE PIN","AL1473.02-01-130-00","1","","22-02-2022","Amar","PPRAJ","2022-03-09"
"AL1473.02","01-100-00-COMPONENT LOCATOR","AL1473.02-01-100-00","1","","22-02-2022","Amar","PPRAJ","2022-03-09"
"AL1473.02","03-04-00-STOPPER","AL1473.02-03-04-00","2","","18-03-2022","Amar","PPRAJ","2022-03-18"
"AL1473.02","03-02-00GUIDE BUSH HOLDER","AL1473.02-03-02-00","4","","22-02-2022","Amar","PPRAJ","2022-03-09"
"AL1473.02","02-03-00-GUIDE ROD","AL1473.02-02-03-00","4","","22-02-2022","Amar","PPRAJ","2022-03-09"
"AL1473.02","02-05-R1-CYLINDER COUPLER","AL1473.02-02-05-R1","2","","22-02-2022","Amar","PPRAJ","2022-03-09"
"AL1473.02","01-05-00-STOPPER","AL1473.02-01-05-00","4","","22-02-2022","Amar","PPRAJ","2022-03-09"
"AL1473.02","01-140-00-JACKING PLT","AL1473.02-01-140-00","1","","22-02-2022","Amar","PPRAJ","2022-03-09"
"AL1473.02","01-110-00-COMP GUIDE","AL1473.02-01-110-00","1","","22-02-2022","Amar","PPRAJ","2022-03-09"
"AL1473.02","01-04-00- STOPPER PAD","AL1473.02-01-04-00","2","","27-06-2022","Amar","PPRAJ","2022-06-27"
"AL1473.02","03-06-00-TIMER ROLLER HOLDER","AL1473.02-03-06-00","2","","22-02-2022","Amar","PPRAJ","2022-03-09"
"AL1473.02","02-09-00-ROD HOUSING BOTTOM","AL1473.02-02-09-00","4","","22-02-2022","Amar","PPRAJ","2022-03-09"
"AL1473.02","02-06-00-COUPLER BLOCK","AL1473.02-02-06-00","2","","22-02-2022","Amar","PPRAJ","2022-03-09"
"AL1473.02","03-80-00- MANIFOLD BLOCK","AL1473.02-03-80-00","25","","12-03-2022","Amar","PPRAJ","2022-03-12"
"AL1473.02","01-06-00-GUIDE STRIP","AL1473.02-01-06-00","2","","22-02-2022","Amar","PPRAJ","2022-03-09"
"AL1473.02","01-150-00-STOPPER","AL1473.02-01-150-00","1","","09-03-2022","Amar","PPRAJ","2022-03-09"
"AL1473.02","01-120-00-COM LOCATOR","AL1473.02-01-120-00","1","","22-02-2022","Amar","PPRAJ","2022-03-09"
"AL1473.02","03-07-00-TIMER ROLLER HOLDER","AL1473.02-03-07-00","2","","22-02-2022","Amar","PPRAJ","2022-03-09"
"AL1473.02","03-01-00-TOOL HOLDER PLATE","AL1473.02-03-01-00","2","","22-02-2022","Amar","PPRAJ","2022-03-09"
"AL1473.02","02-02-00-TOP SUPPORT WASHER","AL1473.02-02-02-00","8","","22-02-2022","Amar","PPRAJ","2022-03-09"
"AL1473.07","01-100-00-COMPONENT LOCATOR","AL1473.07-01-100-00","1","","23-02-2022","Amar","PPRAJ","2022-03-09"
"AL1473.07","01-110-00-COMP GUIDE","AL1473.07-01-110-00","1","","23-02-2022","Amar","PPRAJ","2022-03-09"
"AL1473.07","01-120-R1-COM LOCATOR","AL1473.07-01-120-R1","1","","23-02-2022","Amar","PPRAJ","2022-03-09"
"AL1473.07","01-04-00- STOPPER PAD","AL1473.07-01-04-00","2","","27-06-2022","Amar","PPRAJ","2022-06-27"
"AL1473.07","01-150-00-STOPPER","AL1473.07-01-150-00","1","","09-03-2022","Amar","PPRAJ","2022-03-09"
"AL1474.02","09-011-00-CYLINDER COUPLER","AL1474.02-09-011-00","2","","02-11-2021","Amar","PPRAJ","2021-11-02"
"AL1474.02","20-030-00-SIDE GUIDE PLT RH","AL1474.02-20-030-00","1","","31-10-2021","Amar","PPRAJ","2021-10-31"
"AL1474.02","05-031-00-STOPPER PAD","AL1474.02-05-031-00","2","","01-11-2021","Amar","PPRAJ","2021-11-01"
"AL1474.02","17-080-00-INSERTING PUNCHS","AL1474.02-17-080-00","2","","08-11-2021","Amar","PPRAJ","2021-11-08"
"AL1474.02","01-243-00-COMPONENT GUIDE PLATE","AL1474.02-01-243-00","2","","02-11-2021","Amar","PPRAJ","2021-11-02"
"AL1474.02","16-212-00 FEEDER PLATE","AL1474.02-16-212-00","2","","31-10-2021","Amar","PPRAJ","2021-10-31"
"AL1474.02","02-070-00-PAPER SUPPORT CONVEAR","AL1474.02-02-070-00","4","","01-11-2021","Amar","PPRAJ","2021-11-01"
"AL1474.02","01-213-00-GUIDE PLATE RH","AL1474.02-01-213-00","1","","01-11-2021","Amar","PPRAJ","2021-11-01"
"AL1474.02","01-209-00-GUIDE STRIPS","AL1474.02-01-202-00","2","","01-11-2021","Amar","PPRAJ","2021-11-01"
"AL1474.02","16-243-00-COMPONENT GUIDE PLATE","AL1474.02-16-243-00","2","","02-11-2021","Amar","PPRAJ","2021-11-02"
"AL1474.02","20-040-00-SIDE GUIDE PLT","AL1474.02-20-040-00","1","","31-10-2021","Amar","PPRAJ","2021-10-31"
"AL1474.02","02-106-00-CYLINDER COUPLER","AL1474.02-02-106-00","2","","02-11-2021","Amar","PPRAJ","2021-11-02"
"AL1474.02","16-213-00-GUIDE PLATE RH","AL1474.02-16-213-00","1","","31-10-2021","Amar","PPRAJ","2021-10-31"
"AL1474.02","03-080-00-INSERTING PUNCHS","AL1474.02-03-080-00","2","","01-11-2021","Amar","PPRAJ","2021-11-01"
"AL1474.02","02-030-00-SIDE GUIDE PLT RH","AL1474.02-02-030-00","1","","01-11-2021","Amar","PPRAJ","2021-11-01"
"AL1474.02","01-210-00-GUIDE PLATE","AL1474.02-01-210-00","1","","01-11-2021","Amar","PPRAJ","2021-11-01"
"AL1474.02","16-248-00-INDEXER LOCATER","AL1474.02-16-248-00","1","","02-11-2021","Amar","PPRAJ","2021-11-02"
"AL1474.02","20-070-00-PAPER SUPPORT CONVEAR","AL1474.02-20-070-00","1","","31-10-2021","Amar","PPRAJ","2021-10-31"
"AL1474.02","01-241-00-INDEXER LOCATER","AL1474.02-01-241-00","1","","02-12-2021","Amar","PPRAJ","2021-12-02"
"AL1474.02","03-020-00-CYLINDER COUPLER","AL1474.02-03-020-00","2","","02-11-2021","Amar","PPRAJ","2021-11-02"
"AL1474.02","16-231-00-INDEXER BASE PLATE","AL1474.02-16-231-00","1","","31-10-2021","Amar","PPRAJ","2021-10-31"
"AL1474.02","05-030-00-STOPPER PAD MTG","AL1474.02-05-030-00","1","","01-11-2021","Amar","PPRAJ","2021-11-01"
"AL1474.02","16-210-00-GUIDE PLATE","AL1474.02-16-210-00","1","","31-10-2021","Amar","PPRAJ","2021-10-31"
"AL1474.02","02-040-00-SIDE GUIDE PLT","AL1474.02-02-040-00","1","","01-11-2021","Amar","PPRAJ","2021-11-01"
"AL1474.02","01-212-00 FEEDER PLATE","AL1474.02-01-212-00","2","","01-11-2021","Amar","PPRAJ","2021-11-01"
"AL1474.02","26-030-00-STOPPER PAD MTG","AL1474.02-26-030-00","2","","02-11-2021","Amar","PPRAJ","2021-11-02"
"AL1474.02","16-203-00-GUIDE STRIPS","AL1474.02-16-202-00","2","","01-11-2021","Amar","PPRAJ","2021-11-01"
"AL1474.03","03-063-00-DRAW BAR","AL1474.03-03-063-00","10","","01-01-2022","Amar","PPRAJ","2022-01-01"
"AL1474.03","03-150-00-HOUSING COVER","AL1474.03-03-150-00","5","","01-01-2022","Amar","PPRAJ","2022-01-01"
"AL1474.03","03-065-00-HOLLOW CYL END COVER","AL1474.03-03-065-00","5","","01-01-2022","Amar","PPRAJ","2022-01-01"
"AL1474.03","03-067-00-HOLLOW CYL PISTON","AL1474.03-03-067-00","5","","01-01-2022","Amar","PPRAJ","2022-01-01"
"AL1474.03","02-A09-00-FLYER ARM ASSY","AL1474.03-02-A09-00","10","","01-01-2022","Amar","PPRAJ","2022-01-01"
"AL1474.03","03-066-00-HOLLOW CYL HSG","AL1474.03-03-066-00","5","","01-01-2022","Amar","PPRAJ","2022-01-01"
"AL1474.03","03-068-00-DOOM NUT","AL1474.03-03-068-00","5","","01-01-2022","Amar","PPRAJ","2022-01-01"
"AL1474.03","03-062-00-COLLET OPEN CLOSE SEN BRKT","AL1474.03-03-062-00","2","","01-01-2022","Amar","PPRAJ","2022-01-01"
"AL1474.03","03-069-00-SPACER_","AL1474.03-03-069-00","20","","01-01-2022","Amar","PPRAJ","2022-01-01"
"AL1474.03","03-064-00-DRAWBR RETAINER","AL1474.03-03-064-00","10","","01-01-2022","Amar","PPRAJ","2022-01-01"
"AL1474.06","04-211-ROLLER CAP INSIDE","AL1474.06-04-211-ROLLER CAP INSIDE","4","","06-10-2021","Kiran","PPRAJ","2021-10-06"
"AL1474.06","02-150-00-SADDLE CYL MTG PLT","AL1474.06-02-150-00-SADDLE CYL MTG PLT","1","","06-10-2021","Kiran","PPRAJ","2021-10-06"
"AL1474.06","04-280-00-DOOM NUT BUTTING BLOCK","AL1474.06-04-280-00-DOOM NUT BUTTING BLOCK","1","","06-10-2021","Kiran","PPRAJ","2021-10-06"
"AL1474.06","04-150-00-SUCTION MTG BRACKET","AL1474.06-04-150-00-SUCTION MTG BRACKET","1","","06-10-2021","Kiran","PPRAJ","2021-10-06"
"AL1474.06","01-130-00-BASE CHIPS SLOT COVER","AL1474.06-01-130-00-BASE CHIPS SLOT COVER","1","","04-10-2021","Kiran","PPRAJ","2021-10-06"
"AL1474.06","04-500-00-BEARING DUST COVER","AL1474.06-04-500-00-BEARING DUST COVER","4","","06-10-2021","Kiran","PPRAJ","2021-10-06"
"AL1474.06","02-126-00-FRONT COVER","AL1474.06-02-126-00-FRONT COVER","1","","05-10-2021","Kiran","PPRAJ","2021-10-06"
"AL1474.06","03-410-00-BUTTING CAP","AL1474.06-03-410-00-BUTTING CAP","3","","06-10-2021","Kiran","PPRAJ","2021-10-06"
"AL1474.06","04-070-00-CYLNDR COUPLER HOLDING PLT","AL1474.06-04-070-00-CYLNDR COUPLER HOLDING PLT","1","","06-10-2021","Kiran","PPRAJ","2021-10-06"
"AL1474.06","04-180-ROLLER SHAFT","AL1474.06-04-180-ROLLER SHAFT","4","","06-10-2021","Kiran","PPRAJ","2021-10-06"
"AL1474.06","02-090-00-CONNECTOR  PLT","AL1474.06-02-090-00-CONNECTOR  PLT","1","","05-10-2021","Kiran","PPRAJ","2021-10-06"
"AL1474.06","02-230-00-FIXED COUPLER MTG BLOCK","AL1474.06-02-230-00-FIXED COUPLER MTG BLOCK","1","","06-10-2021","Kiran","PPRAJ","2021-10-06"
"AL1474.06","04-430-00-BEARING SPACER BUSH","AL1474.06-04-430-00-BEARING SPACER BUSH","6","","06-10-2021","Kiran","PPRAJ","2021-10-06"
"AL1474.06","04-460-00-SUCTION PIPE MTG PLATE","AL1474.06-04-460-00-SUCTION PIPE MTG PLATE","1","","06-10-2021","Kiran","PPRAJ","2021-10-06"
"AL1474.06","02-041-00-SLIDE BLOCK","AL1474.06-02-041-00-SLIDE BLOCK","1","","05-10-2021","Kiran","PPRAJ","2021-10-06"
"AL1474.06","04-680-00-TENSIONER COUPLER PLATE","AL1474.06-04-680-00-TENSIONER COUPLER PLATE","1","","06-10-2021","Kiran","PPRAJ","2021-10-06"
"AL1474.06","02-181-00-TOOL FRONT COVER","AL1474.06-02-181-00-TOOL FRONT COVER","1","","06-10-2021","Kiran","PPRAJ","2021-10-06"
"AL1474.06","04-330-00-BELT MOTOR PULLEY","AL1474.06-04-330-00-BELT MOTOR PULLEY","2","","06-10-2021","Kiran","PPRAJ","2021-10-06"
"AL1474.06","04-440-00-ROLLER JACKING PLATE","AL1474.06-04-440-00-ROLLER JACKING PLATE","1","","06-10-2021","Kiran","PPRAJ","2021-10-06"
"AL1474.06","02-042-00-DOVETAIL BLOCK","AL1474.06-02-042-00-DOVETAIL BLOCK","1","","05-10-2021","Kiran","PPRAJ","2021-10-06"
"AL1474.06","04-270-00-BELT DOWN SNSR BKT","AL1474.06-04-270-00-BELT DOWN SNSR BKT","1","","06-10-2021","Kiran","PPRAJ","2021-10-06"
"AL1474.06","02-210-00-TOOL HOLDER CLAMP","AL1474.06-02-210-00-TOOL HOLDER CLAMP","2","","06-10-2021","Kiran","PPRAJ","2021-10-06"
"AL1474.06","04-040-00-CYLINDER COUPLER","AL1474.06-04-040-00-CYLINDER COUPLER","1","","06-10-2021","Kiran","PPRAJ","2021-10-06"
"AL1474.06","04-220-00-RETAINER PLATE TAPPED","AL1474.06-04-220-00","2","","06-10-2021","Kiran","PPRAJ","2021-10-06"
"AL1474.06","02-140-00-SADDLE GIB","AL1474.06-02-140-00-SADDLE GIB","2","","05-10-2021","Kiran","PPRAJ","2021-10-06"
"AL1474.06","04-432-00-TENSIONER ROLLER HOLDER PLT","AL1474.06-04-432-00-TENSIONER ROLLER HOLDER PLT","2","","06-10-2021","Kiran","PPRAJ","2021-10-06"
"AL1474.06","04-100-00-BEARING RETAINER","AL1474.06-04-100-00-BEARING RETAINER","1","","06-10-2021","Kiran","PPRAJ","2021-10-06"
"AL1474.06","02-590-00-TOOL BUTTING PLATE","AL1474.06-02-590-00-TOOL BUTTING PLATE","2","","06-10-2021","Kiran","PPRAJ","2021-10-06"
"AL1474.06","04-550-00-GUIDE PLT","AL1474.06-04-550-00-GUIDE PLT","1","","06-10-2021","Kiran","PPRAJ","2021-10-06"
"AL1474.06","02-128-00-SIDE DUST COVER","AL1474.06-02-128-00-SIDE DUST COVER","2","","05-10-2021","Kiran","PPRAJ","2021-10-06"
"AL1474.06","03-650-00-END STOPPER","AL1474.06-03-650-00-END STOPPER","2","","06-10-2021","Kiran","PPRAJ","2021-10-06"
"AL1474.06","04-090-00-ROD HOUSING TOP","AL1474.06-04-090-00-ROD HOUSING TOP","4","","06-10-2021","Kiran","PPRAJ","2021-10-06"
"AL1474.06","01-04-00-CABLE DUCT","AL1474.06-01-04-00-CABLE DUCT","2","","04-10-2021","Kiran","PPRAJ","2021-10-06"
"AL1474.06","04-190-SPACER","AL1474.06-04-190-SPACER","4","","06-10-2021","Kiran","PPRAJ","2021-10-06"
"AL1474.06","02-120-00-TOOL POST BASE","AL1474.06-02-120-00-TOOL POST BASE","1","","05-10-2021","Kiran","PPRAJ","2021-10-06"
"AL1474.06","02-240-00-STOPPER PLATE","AL1474.06-02-240-00-STOPPER PLATE","2","","06-10-2021","Kiran","PPRAJ","2021-10-06"
"AL1474.06","04-030-00-ROD HOUSING BOTTOM","AL1474.06-04-030-00-ROD HOUSING BOTTOM","2","","06-10-2021","Kiran","PPRAJ","2021-10-06"
"AL1474.06","04-470-00-TENSIONER Z BRACKET","AL1474.06-04-470-00-TENSIONER Z BRACKET","1","","06-10-2021","Kiran","PPRAJ","2021-10-06"
"AL1474.06","02-127-00-BACK COVER","AL1474.06-02-127-00-BACK COVER","1","","05-10-2021","Kiran","PPRAJ","2021-10-06"
"AL1474.06","02-190-00-TOOL HOLDER PIN","AL1474.06-02-190-00-TOOL HOLDER PIN","6","","06-10-2021","Kiran","PPRAJ","2021-10-06"
"AL1474.06","04-310-00-BEARING HSG","AL1474.06-04-310-00-BEARING HSG","1","","06-10-2021","Kiran","PPRAJ","2021-10-06"
"AL1474.06","04-200-00-ROLLER","AL1474.06-04-200-00-ROLLER","4","","06-10-2021","Kiran","PPRAJ","2021-10-06"
"AL1474.06","02-050-00-SLIDE CYL MTG BKT","AL1474.06-02-050-00-SLIDE CYL MTG BKT","1","","05-10-2021","Kiran","PPRAJ","2021-10-06"
"AL1474.06","04-610-00-SPACER","AL1474.06-04-610-00-SPACER","1","","06-10-2021","Kiran","PPRAJ","2021-10-06"
"AL1474.06","02-220-R1-SHOCK ABSORBER PLT","AL1474.06-02-220-R1-SHOCK ABSORBER PLT","1","","06-10-2021","Kiran","PPRAJ","2021-10-06"
"AL1474.06","04-050-00-TOOL HOLDER PLATE","AL1474.06-04-050-00-TOOL HOLDER PLATE","1","","06-10-2021","Kiran","PPRAJ","2021-10-06"
"AL1474.06","04-230-00-RETAINER PLATE","AL1474.06-04-230-00-RETAINER PLATE","2","","06-10-2021","Kiran","PPRAJ","2021-10-06"
"AL1474.06","02-141-00-LM BLOCK SUPPORT PLATE","AL1474.06-02-141-00-LM BLOCK SUPPORT PLATE","2","","05-10-2021","Kiran","PPRAJ","2021-10-06"
"AL1474.06","04-010-00-GUIDE ROD","AL1474.06-04-010-00-GUIDE ROD","2","","06-10-2021","Kiran","PPRAJ","2021-10-06"
"AL1474.06","04-120-TENSIONER ROLLER SHAFT","AL1474.06-04-120-TENSIONER ROLLER SHAFT","2","","06-10-2021","Kiran","PPRAJ","2021-10-06"
"AL1474.06","02-010-00-SLIDE BASE","AL1474.06-02-010-00-SLIDE BASE","1","","05-10-2021","Kiran","PPRAJ","2021-10-06"
"AL1474.06","04-560-00-SUCTION PIPE","AL1474.06-04-560-00-SUCTION PIPE04-560-00-SUCTION PIPE","2","","06-10-2021","Kiran","PPRAJ","2021-10-06"
"AL1474.06","02-130-00-SADDLE TOOL BASE","AL1474.06-02-130-00-SADDLE TOOL BASE","1","","05-10-2021","Kiran","PPRAJ","2021-10-06"
"AL1474.06","04-290-00-QCT BUTTING SPACER","AL1474.06-04-290-00","1","","07-10-2021","Karumbaiah","PPRAJ","2021-10-07"
"AL1474.06","03-710-00-SPACER PLATE","AL1474.06-03-710-00-SPACER PLATE","2","","06-10-2021","Kiran","PPRAJ","2021-10-06"
"AL1474.06","04-140-TENSIONER SPACER","AL1474.06-04-140-TENSIONER SPACER","4","","06-10-2021","Kiran","PPRAJ","2021-10-06"
"AL1474.06","01-060-00-DUCT TOP COVER","AL1474.06-01-060-00-DUCT TOP COVER","2","","04-10-2021","Kiran","PPRAJ","2021-10-06"
"AL1474.06","04-210-ROLLER CAP","AL1474.06-04-210-ROLLER CAP","4","","06-10-2021","Kiran","PPRAJ","2021-10-06"
"AL1474.06","02-125-00-THIMBLE HOLDER","AL1474.06-02-125-00-THIMBLE HOLDER","2","","05-10-2021","Kiran","PPRAJ","2021-10-06"
"AL1474.06","02-310-00-SLIDE CYL STOPPER","AL1474.06-02-310-00-SLIDE CYL STOPPER","1","","06-10-2021","Kiran","PPRAJ","2021-10-06"
"AL1474.06","04-060-00-BELT FRAME HINGE HOLDER","AL1474.06-04-060-00-BELT FRAME HINGE HOLDER","2","","06-10-2021","Kiran","PPRAJ","2021-10-06"
"AL1474.06","04-171-00-SPINDLE BRAKET ASSY","AL1474.06-04-171-00-SPINDLE BRAKET ASSY","1","","06-10-2021","Kiran","PPRAJ","2021-10-06"
"AL1474.06","02-051-00-CYL MTG SPACER","AL1474.06-02-051-00-CYL MTG SPACER","1","","05-10-2021","Kiran","PPRAJ","2021-10-06"
"AL1474.06","02-200-00-TOOL HOLDER","AL1474.06-02-200-00-TOOL HOLDER","2","","06-10-2021","Kiran","PPRAJ","2021-10-06"
"AL1474.06","04-350-00-ROLLER SPACER","AL1474.06-04-350-00-ROLLER SPACER","4","","06-10-2021","Kiran","PPRAJ","2021-10-06"
"AL1474.06","04-450-00-STD GUIDE ROD","AL1474.06-04-450-00-STD GUIDE ROD","2","","06-10-2021","Kiran","PPRAJ","2021-10-06"
"AL1474.06","02-031-00-TOOL HOLDER SPACER","AL1474.06-02-031-00-TOOL HOLDER SPACER","1","","05-10-2021","Kiran","PPRAJ","2021-10-06"
"AL1474.06","04-670-00-TENSIONER COUPLER","AL1474.06-04-670-00-TENSIONER COUPLER","1","","06-10-2021","Kiran","PPRAJ","2021-10-06"
"AL1474.06","02-180-R1-TOOL SLIDE COVER","AL1474.06-02-180-R1-TOOL SLIDE COVER","2","","06-10-2021","Kiran","PPRAJ","2021-10-06"
"AL1474.06","04-320-00-SHAFT","AL1474.06-04-320-00-SHAFT","1","","06-10-2021","Kiran","PPRAJ","2021-10-06"
"AL1474.06","04-130-TENSIONER ROLLER","AL1474.06-04-130-TENSIONER ROLLER","2","","06-10-2021","Kiran","PPRAJ","2021-10-06"
"AL1474.06","02-030-00-PROXIMITY SENSOR MTG PLATE","AL1474.06-02-030-00-PROXIMITY SENSOR MTG PLATE","2","","05-10-2021","Kiran","PPRAJ","2021-10-06"
"AL1474.06","04-260-00-BELT UNIT STOPPER KNOB","AL1474.06-04-260-00-BELT UNIT STOPPER KNOB","1","","06-10-2021","Kiran","PPRAJ","2021-10-06"
"AL1474.06","02-180-00-TOOL SLIDE COVER","AL1474.06-02-180-00-TOOL SLIDE COVER","1","","06-10-2021","Kiran","PPRAJ","2021-10-06"
"AL1474.06","04-020-00-CYLINDER HOLDER PLATE","AL1474.06-04-020-00-CYLINDER HOLDER PLATE","1","","06-10-2021","Kiran","PPRAJ","2021-10-06"
"AL1487.01","03-04-00-SHAFT MTG PLATE","AL1487.01-03-04-00","1","","25-11-2021","Amar","PPRAJ","2021-11-25"
"AL1487.01","04-10-00-SEN BRKT","AL1487.07-04-10-00","1","","25-11-2021","Amar","PPRAJ","2021-11-25"
"AL1487.01","02-12-00-SIDE L PLATE","AL1487.01-02-12-00","2","","25-11-2021","Amar","PPRAJ","2021-11-25"
"AL1487.01","04-08-00-POTENTIOMETER MTG PLT","AL1487.01-04-08-00","1","","25-11-2021","Amar","PPRAJ","2021-11-25"
"AL1487.01","02-09-00-ROD HOUSING BOTTOM","AL1487.01-02-09-00","2","","25-11-2021","Amar","PPRAJ","2021-11-25"
"AL1487.01","04-04-00-STOPPER FOR STIFFNER","AL1487.01-04-04-00","2","","25-11-2021","Amar","PPRAJ","2021-11-25"
"AL1487.01","02-04-00-CYLINDER HOLDER PLATE","AL1487.01-02-04-00","1","","25-11-2021","Amar","PPRAJ","2021-11-25"
"AL1487.01","04-01-00-CYLINDER COUPLER BOTTOM","AL1487.01-04-01-00","1","","25-11-2021","Amar","PPRAJ","2021-11-25"
"AL1487.01","03-03-00-PRESSING SHAFT","AL1487.01-03-03-00","1","","25-11-2021","Amar","PPRAJ","2021-11-25"
"AL1487.01","03-10-00-STOPPER PAD","AL1487.01-03-10-00","2","","25-11-2021","Amar","PPRAJ","2021-11-25"
"AL1487.01","05-03-00-TOOL BASE","AL1487.01-05-03-00","2","","25-11-2021","Amar","PPRAJ","2021-11-25"
"AL1487.01","03-05-00-GUIDE ROD","AL1487.01-03-05-00","4","","25-11-2021","Amar","PPRAJ","2021-11-25"
"AL1487.01","04-11-00-POTENTIOMETER MTG PLT","AL1487.01-04-11-00","1","","25-11-2021","Amar","PPRAJ","2021-11-25"
"AL1487.01","03-01-00-TOOL HOLDER PLATE","AL1487.01-03-01-00","1","","25-11-2021","Amar","PPRAJ","2021-11-25"
"AL1487.01","04-09-00-WASHER","AL1487.01-04-09-00","4","","25-11-2021","Amar","PPRAJ","2021-11-25"
"AL1487.01","02-10-00-SEN BRKT","AL1487.01-02-10-00","1","","25-11-2021","Amar","PPRAJ","2021-11-25"
"AL1487.01","04-06-00-SEN BRKT-TOP","AL1487.01-04-06-00","1","","25-11-2021","Amar","PPRAJ","2021-11-25"
"AL1487.01","02-05-00-CYLINDER COUPLER","AL1487.01-02-05-00","1","","25-11-2021","Amar","PPRAJ","2021-11-25"
"AL1487.01","04-02-00-STIFFER PLATE","AL1487.01-04-02-00","1","","25-11-2021","Amar","PPRAJ","2021-11-25"
"AL1487.01","03-11-00-POTENTIOMETER STOPER PLATE","AL1487.01-03-11-00","1","","25-11-2021","Amar","PPRAJ","2021-11-25"
"AL1487.01","03-13-00-LOADE CELL SPACER","AL1487.01-03-13-00","1","","25-11-2021","Amar","PPRAJ","2021-11-25"
"AL1487.01","04-12-00-POTENTIOMETER COUPLER","AL1487.01.-04-12-00","2","","26-11-2021","Amar","PPRAJ","2021-11-26"
"AL1487.01","02-03-00-GUIDE ROD","AL1487.01-02-03-00","2","","25-11-2021","Amar","PPRAJ","2021-11-25"
"AL1487.01","03-06-00-BUTTON","AL1487.01-03-06-00","1","","25-11-2021","Amar","PPRAJ","2021-11-25"
"AL1487.01","05-01-00-COMP HOLDING BLK","AL1487.01-05-01-00","1","","25-11-2021","Amar","PPRAJ","2021-11-25"
"AL1487.01","02-10-R1-SEN BRKT","AL1487.01-02-10-R1","1","","04-02-2022","Amar","PPRAJ","2022-02-04"
"AL1487.01","03-02-00GUIDE BUSH HOLDER","AL1487.01-03-02-00","2","","25-11-2021","Amar","PPRAJ","2021-11-25"
"AL1487.01","04-05-00-STIFFER PLATE-TOP","AL1487.01-04-05-00","1","","25-11-2021","Amar","PPRAJ","2021-11-25"
"AL1487.01","02-11-00-L -PLATE","AL1487.01-02-11-00","2","","25-11-2021","Amar","PPRAJ","2021-11-25"
"AL1487.01","04-07-00-COUPLER BLOCK","AL1487.01-04-07-00","1","","25-11-2021","Amar","PPRAJ","2021-11-25"
"AL1487.01","02-06-00-COUPLER BLOCK","AL1487.01-02-06-00","1","","25-11-2021","Amar","PPRAJ","2021-11-25"
"AL1487.01","04-03-00- GUIDE ROD","AL1487.01-04-03-00","2","","25-11-2021","Amar","PPRAJ","2021-11-25"
"AL1487.01","03-12-00-POTENTIOMETER STOPER PLATE","AL1487.01-03-12-00","1","","25-11-2021","Amar","PPRAJ","2021-11-25"
"AL1487.01","01-03-00-VSPM BASE PLATE","AL1487.01-01-03-00","1","","25-11-2021","Amar","PPRAJ","2021-11-25"
"AL1487.01","02-02-00-TOP SUPPORT WASHER","AL1487.01-02-02-00","2","","25-11-2021","Amar","PPRAJ","2021-11-25"
"AL1487.01","03-08-00-WASHER","AL1487.01-03-08-00","4","","25-11-2021","Amar","PPRAJ","2021-11-25"
"AL1487.01","03-80-00-MANIFOLD BLOCK","AL1487.01-03-80-00","2","","28-01-2022","Amar","PPRAJ","2022-01-28"
"AL1487.01","05-02-00-INSERT PIN","AL1487.01-05-02-00","4","","25-11-2021","Amar","PPRAJ","2021-11-25"
"AL1487.02","01-140-00-JACKING PLT","AL1487.02-01-140-00","2","","17-11-2021","Gnaneshwari","PPRAJ","2021-11-18"
"AL1487.02","01-100-00-COMPONENT LOCATOR","AL1487.02-01-100-00","2","","17-11-2021","Gnaneshwari","PPRAJ","2021-11-18"
"AL1487.02","01-04-00- STOPPER PAD","AL1487.02-01-04-00","4","","18-11-2021","Amar","PPRAJ","2021-11-18"
"AL1487.02","01-110-00-COMP GUIDE","AL1487.02-01-110-00","2","","17-11-2021","Gnaneshwari","PPRAJ","2021-11-18"
"AL1487.02","01-120-00-COM LOCATOR","AL1487.02-01-120-00","2","","17-11-2021","Gnaneshwari","PPRAJ","2021-11-18"
"AL1487.02","01-130-00-COMP GUIDE PIN","AL1487.02-01-130-00","2","","17-11-2021","Gnaneshwari","PPRAJ","2021-11-18"
"AL1487.03","17-210-00-GUIDE PLATE","AL1487.03-17-210-R1","1","","04-02-2022","Amar","PPRAJ","2022-02-04"
"AL1487.03","17-040-00-GUIDE ROD DIA 10","AL1487.03-17-040-00","2","","19-01-2022","Amar","PPRAJ","2022-01-19"
"AL1487.03","02-106-00-CYLINDER COUPLER","AL1487.03-02-106-00","1","","20-11-2021","Amar","PPRAJ","2021-11-20"
"AL1487.03","16-213-00-GUIDE PLATE RH","AL1487.03-17-213-R1","1","","04-02-2022","Amar","PPRAJ","2022-02-04"
"AL1487.03","01-030-00-INDEXER ADAPTER","AL1487.03-01-030-00","1","","20-11-2021","Amar","PPRAJ","2021-11-20"
"AL1487.03","01-231-00-INDEXER BASE PLATE","AL1487.03-01-231-00","1","","20-11-2021","Amar","PPRAJ","2021-11-20"
"AL1487.03","17-210-00-GUIDE PLATE","AL1487.03-17-210-00","1","","19-01-2022","Amar","PPRAJ","2022-01-19"
"AL1487.03","05-030-00-STOPPER PAD MTG","AL1487.03-05-030-00","1","","20-11-2021","Amar","PPRAJ","2021-11-20"
"AL1487.03","17-213-00-GUIDE PLATE RH","AL1487.03-17-213-R1","1","","04-02-2022","Amar","PPRAJ","2022-02-04"
"AL1487.03","17-061-00-INSERTER BLADE","AL1487.03-17-061-00","2","","19-01-2022","Amar","PPRAJ","2022-01-19"
"AL1487.03","03-020-00-CYLINDER COUPLER","AL1487.03-03-020-00","1","","20-11-2021","Amar","PPRAJ","2021-11-20"
"AL1487.03","01-070-00-SUPPORT WASHER","AL1487.03-01-070-00","1","","20-11-2021","Amar","PPRAJ","2021-11-20"
"AL1487.03","01-202-R1-GUIDE STRIPS","AL1487.03-01-202-R1","2","","04-02-2022","Amar","PPRAJ","2022-02-04"
"AL1487.03","01-259-00-INDEXER LOCATER","AL1487.03-01-241-00","1","","20-11-2021","Amar","PPRAJ","2021-11-20"
"AL1487.03","01-204-00-COMPONENT GUIDE PLATE","AL1487.03-01-204-00","2","","20-11-2021","Amar","PPRAJ","2021-11-20"
"AL1487.03","17-212-00 FEEDER PLATE","AL1487.03-17-212-00","2","","19-01-2022","Amar","PPRAJ","2022-01-19"
"AL1487.03","09-011-00-CYLINDER COUPLER","AL1487.03-09-011-00","1","","20-11-2021","Amar","PPRAJ","2021-11-20"
"AL1487.03","17-080-00-INSERTING PUNCHS","AL1487.03-17-080-00","4","","19-01-2022","Amar","PPRAJ","2022-01-19"
"AL1487.03","03-080-00-INSERTING PUNCHS","AL1487.03-03-080-00","2","","20-11-2021","Amar","PPRAJ","2021-11-20"
"AL1487.03","17-01-00-BASE PLATE","AL1487.03-17-01-00","1","","20-01-2022","Amar","PPRAJ","2022-01-20"
"AL1487.03","01-202-00-GUIDE STRIPS","AL1487.03-01-202-00","2","","20-11-2021","Amar","PPRAJ","2021-11-20"
"AL1487.03","16-210-00-GUIDE PLATE","AL1487.03-17-210-R1","1","","04-02-2022","Amar","PPRAJ","2022-02-04"
"AL1487.03","01-02-00-INDEXER HOUSING","AL1487.03-01-02-00","1","","20-11-2021","Amar","PPRAJ","2021-11-20"
"AL1487.03","01-212-00 FEEDER PLATE","AL1487.03-01-212-00","2","","20-11-2021","Amar","PPRAJ","2021-11-20"
"AL1487.03","17-213-00-GUIDE PLATE RH","AL1487.03-17-213-00","1","","19-01-2022","Amar","PPRAJ","2022-01-19"
"AL1487.03","04-020-00-IND CYL MTG PLT","AL1487.03-04-020-00","1","","20-11-2021","Amar","PPRAJ","2021-11-20"
"AL1487.03","17-207-00-FEEDER SUPPORT BLOCK","AL1487.03-17-207-00","1","","19-01-2022","Amar","PPRAJ","2022-01-19"
"AL1487.03","04-010-00-IXR CYL CONNTR","AL1487.03-04-010-00","1","","20-11-2021","Amar","PPRAJ","2021-11-20"
"AL1487.04","04-03-00-HOOK HOLDER.","AL1487.04-04-03-00","4","","16-11-2021","Amar","PPRAJ","2021-11-16"
"AL1487.04","05-05-00-COLLET","AL1487.04-05-05-00","8","","16-11-2021","Amar","PPRAJ","2021-11-16"
"AL1487.04","05-01-00-GRIPPER SLEEVE","AL1487.04-05-01-00","4","","16-11-2021","Amar","PPRAJ","2021-11-16"
"AL1487.04","04-14-00-HOOK SPRING REATINER","AL1487.04-04-14-00","4","","16-11-2021","Amar","PPRAJ","2021-11-16"
"AL1487.04","04-11-00- BOTTOM TO TOP  HOOKING PLATE","AL1487.04-04-11-00","4","","16-11-2021","Amar","PPRAJ","2021-11-16"
"AL1487.04","04-04-00-CENTRE BLOCK","AL1487.04-04-04-00","2","","16-11-2021","Amar","PPRAJ","2021-11-16"
"AL1487.04","04-01-00-BACK PLATE","AL1487.04-04-01-00","4","","16-11-2021","Amar","PPRAJ","2021-11-16"
"AL1487.04","05-06-00-DRAW BAR","AL1487.04-05-06-00","8","","16-11-2021","Amar","PPRAJ","2021-11-16"
"AL1487.04","05-03-00-OUTER SHIELD","AL1487.04-05-03-00","4","","16-11-2021","Amar","PPRAJ","2021-11-16"
"AL1487.04","04-06-00-CENTRE BLOCK","AL1487.04-04-06-00","2","","16-11-2021","Gnaneshwari","PPRAJ","2021-11-16"
"AL1487.04","04-12-00-BALANCING WEDGE","AL1487.04-04-12-00","4","","16-11-2021","Amar","PPRAJ","2021-11-16"
"AL1487.04","04-08-00-PAWL HOLDER","AL1487.04-04-08-00","2","","16-11-2021","Amar","PPRAJ","2021-11-16"
"AL1487.04","04-02-00-HOOK GUIDE PLATE","AL1487.04-04-02-00","8","","16-11-2021","Amar","PPRAJ","2021-11-16"
"AL1487.04","05-04-00-COLLET SLEEVE","AL1487.04-05-04-00","4","","16-11-2021","Amar","PPRAJ","2021-11-16"
"AL1487.04","05-02-00-THIMBLE","AL1487.04-05-02-00","4","","16-11-2021","Amar","PPRAJ","2021-11-16"
"AL1487.04","04-13-00-BALANCING PLATE","AL1487.04-04-13-00","4","","16-11-2021","Amar","PPRAJ","2021-11-16"
"AL1487.04","04-10-00-HOOK GUDE MTG PLATE","AL1487.04-04-10-00","4","","16-11-2021","Amar","PPRAJ","2021-11-16"
"AL1487.05","07-090-00-DIA12 STD GUIDE ROD","AL1487.05-07-090-00-DIA12 STD GUIDE ROD","2","","26-12-2021","Dayanand","PPRAJ","2021-12-26"
"AL1487.05","07-060-00-ACRYLIC MOUNTING BRACKET","AL1487.05-07-060-00-ACRYLIC MOUNTING BRACKET","1","","26-12-2021","Dayanand","PPRAJ","2021-12-26"
"AL1487.05","03-300-00-INDEXER GUIDE PLT","AL1487.05-03-300-00-INDEXER GUIDE PLT","2","","17-01-2022","Dayanand","PPRAJ","2022-01-17"
"AL1487.05","03-96-00-COLLET","AL1487.05-03-96-00-COLLET","2","","08-01-2022","Dayanand","PPRAJ","2022-01-08"
"AL1487.05","07-270-00-SPACRE FOR CYLINDER BRKT","AL1487.05-07-270-00-SPACRE FOR CYLINDER BRKT","1","","26-12-2021","Dayanand","PPRAJ","2021-12-26"
"AL1487.05","07-220-00-COUPLER","AL1487.05-07-220-00-COUPLER","1","","26-12-2021","Dayanand","PPRAJ","2021-12-26"
"AL1487.05","06-130-00-SETTING MANDRAL","AL1487.05-06-130-00-SETTING MANDRAL","1","","20-01-2022","Dayanand","PPRAJ","2022-01-20"
"AL1487.05","03-290-00-FIXED MTG BRACKET","AL1487.05-03-290-00-FIXED MTG BRACKET","2","","14-01-2022","Dayanand","PPRAJ","2022-01-14"
"AL1487.05","07-070-00-CYLINDER MOUNTING BRACKET","AL1487.05-07-070-00-CYLINDER MOUNTING BRACKET","1","","26-12-2021","Dayanand","PPRAJ","2021-12-26"
"AL1487.05","01-A05-00-TUBE STRUCTURE BASE ASSY","AL1487.05-01-A05-00-TUBE STRUCTURE BASE ASSY","1","","26-12-2021","Dayanand","PPRAJ","2021-12-26"
"AL1487.05","06-010-00-V BLOCK","AL1487.05-06-010-00-V BLOCK","1","","08-01-2022","Dayanand","PPRAJ","2022-01-08"
"AL1487.05","07-140-00-ADITIONAL ROLLING SHEET","AL1487.05-07-140-00-ADITIONAL ROLLING SHEET","1","","18-02-2022","Dayanand","PPRAJ","2022-02-18"
"AL1487.05","07-280-00- PC SHEET HOLDER PLATE","AL1487.05-07-280-00- PC SHEET HOLDER PLATE","4","","26-12-2021","Dayanand","PPRAJ","2021-12-26"
"AL1487.05","07-230-00-DOOR SLIDE PC HOLDER","AL1487.05-07-230-00-DOOR SLIDE PC HOLDER","1","","26-12-2021","Dayanand","PPRAJ","2021-12-26"
"AL1487.05","07-080-00-SK MODEL","AL1487.05-07-080-00-SK MODEL","4","","26-12-2021","Dayanand","PPRAJ","2021-12-26"
"AL1487.05","07-050-00-CONTROL UNIT BOTTOM SHEET","AL1487.05-07-050-00-CONTROL UNIT BOTTOM SHEET","1","","26-12-2021","Dayanand","PPRAJ","2021-12-26"
"AL1487.05","07-290-00-CYLINDER GUIDE PLATE","AL1487.05-07-290-00-CYLINDER GUIDE PLATE","1","","26-12-2021","Dayanand","PPRAJ","2021-12-26"
"AL1487.05","03-96-R1-COLLET","AL1487.05-03-96-R1","2","","12-03-2022","Dayanand","PPRAJ","2022-03-12"
"AL1487.05","07-250-00-SPACER FOR PC SHEET","AL1487.05-07-250-00-SPACER FOR PC SHEET","4","","26-12-2021","Dayanand","PPRAJ","2021-12-26"
"AL1487.06","02-131-00-Z AXIS READER SW. MTG PROFILE","AL1487.06-02-131-00-Z AXIS READER SW. MTG PROFILE","1","","08-12-2021","Dayanand","PPRAJ","2021-12-08"
"AL1487.06","05-250-00-LOCKING PIN","AL1487.06-05-250-00-LOCKING PIN","1","","08-12-2021","Dayanand","PPRAJ","2021-12-08"
"AL1487.06","02-123-00-BALL SCREW SPACER INNER RING","AL1487.06-02-123-00-BALL SCREW SPACER INNER RING","2","","08-12-2021","Dayanand","PPRAJ","2021-12-08"
"AL1487.06","05-170-00-ADJUSTABLE HAND KNOB","AL1487.06-05-170-00-ADJUSTABLE HAND KNOB","1","","08-12-2021","Dayanand","PPRAJ","2021-12-08"
"AL1487.06","05-130-00-COVER FOR BRUSHING UNIT","AL1487.06-05-130-00-COVER FOR BRUSHING UNIT","1","","08-12-2021","Dayanand","PPRAJ","2021-12-08"
"AL1487.06","05-100-00-BRUSH RETAINER","AL1487.06-05-100-00-BRUSH RETAINER","1","","08-12-2021","Dayanand","PPRAJ","2021-12-08"
"AL1487.06","05-080-00-GUIDE ROD MTG PLATE","AL1487.06-05-080-00-GUIDE ROD MTG PLATE","1","","08-12-2021","Dayanand","PPRAJ","2021-12-08"
"AL1487.06","02-350-00-X AXIS READER SW MTG PROFILE","AL1487.06-02-350-00-X AXIS READER SW MTG PROFILE","1","","08-12-2021","Dayanand","PPRAJ","2021-12-08"
"AL1487.06","05-040-00-BRUSH HLDR SHAFT","AL1487.06-05-040-00-BRUSH HLDR SHAFT","1","","08-12-2021","Dayanand","PPRAJ","2021-12-08"
"AL1487.06","02-134-00-LIMIT SWITH MTG BLOCK","AL1487.06-02-134-00-LIMIT SWITH MTG BLOCK","1","","08-12-2021","Dayanand","PPRAJ","2021-12-08"
"AL1487.06","05-010-00-MOTOR MTG PLATE","AL1487.06-05-010-00-MOTOR MTG PLATE","3","","08-12-2021","Dayanand","PPRAJ","2021-12-08"
"AL1487.06","02-136-00-STOPPER SPACER","AL1487.05-02-136-00-STOPPER SPACER","1","","22-01-2022","Dayanand","PPRAJ","2022-01-22"
"AL1487.06","02-124-00-BALL SCREW SPACER OUTER RING","AL1487.06-02-124-00-BALL SCREW SPACER OUTER RING","2","","08-12-2021","Dayanand","PPRAJ","2021-12-08"
"AL1487.06","05-210-00-SHEET MTG PLATE","AL1487.06-05-210-00-SHEET MTG PLATE","6","","08-12-2021","Dayanand","PPRAJ","2021-12-08"
"AL1487.06","03-050-00-PCD V BLOCK-LH","AL1487.06-03-050-00-PCD V BLOCK-LH","2","","21-01-2022","Dayanand","PPRAJ","2022-01-21"
"AL1487.06","02-121-00-STOPPER BUSH","AL1487.06-02-121-00-STOPPER BUSH","4","","08-12-2021","Dayanand","PPRAJ","2021-12-08"
"AL1487.06","05-150-00-CAM FOLLOWER  MTG BLK","AL1487.06-05-150-00-CAM FOLLOWER  MTG BLK","3","","08-12-2021","Dayanand","PPRAJ","2021-12-08"
"AL1487.06","05-110-STD GUIDE ROD","AL1487.06-05-110-STD GUIDE ROD","3","","08-12-2021","Dayanand","PPRAJ","2021-12-08"
"AL1487.06","05-080-R1-CAM PROFILE SHAFT","AL1487.06-05-080-R1-CAM PROFILE SHAFT","1","","08-12-2021","Dayanand","PPRAJ","2021-12-08"
"AL1487.06","02-310-00-MOTOR MTG BRACKET","AL1487.06-02-310-00-MOTOR MTG BRACKET","2","","04-05-2022","Dayanand","PPRAJ","2022-05-04"
"AL1487.06","05-060-COMPONENT HOLDER SHAFT","AL1487.06-05-060-COMPONENT HOLDER SHAFT","4","","08-12-2021","Dayanand","PPRAJ","2021-12-08"
"AL1487.06","02-320-LIMIT SWITCH MTG PLT Z AXIS","AL1487.06-02-320-LIMIT SWITCH MTG PLT Z AXIS","1","","08-12-2021","Dayanand","PPRAJ","2021-12-08"
"AL1487.06","05-020-00-CAM _ GUIDE ROD MTG PLE","AL1487.06-05-020-00-CAM _ GUIDE ROD MTG PLE","3","","08-12-2021","Dayanand","PPRAJ","2021-12-08"
"AL1487.06","02-125-00-SPACER PLATE","AL1487.06-02-125-00-SPACER PLATE","1","","08-12-2021","Dayanand","PPRAJ","2021-12-08"
"AL1487.06","05-230-00-HINGE PLATE","AL1487.06-05-230-00-HINGE PLATE","1","","08-12-2021","Dayanand","PPRAJ","2021-12-08"
"AL1487.06","03-060-00-PCD V BLOCK-RH","AL1487.06-03-060-00-PCD V BLOCK-RH","2","","21-01-2022","Dayanand","PPRAJ","2022-01-21"
"AL1487.06","02-122-00-BALL SCREW END STOPPER","AL1487.06-02-122-00-BALL SCREW END STOPPER","1","","08-12-2021","Dayanand","PPRAJ","2021-12-08"
"AL1487.06","05-160-00-CAM KNOB HOLDER","AL1487.06-05-160-00-CAM KNOB HOLDER","3","","08-12-2021","Dayanand","PPRAJ","2021-12-08"
"AL1487.06","05-120-00-SPRING RETAINER","AL1487.06-05-120-00-SPRING RETAINER","1","","08-12-2021","Dayanand","PPRAJ","2021-12-08"
"AL1487.06","05-090-00-CAM TENSTIONER SPRING","AL1487.06-05-090-00-CAM TENSTIONER SPRING","2","","08-12-2021","Dayanand","PPRAJ","2021-12-08"
"AL1487.06","05-070-00-CAM ADJUSTABLE THREAD","AL1487.06-05-070-00-CAM ADJUSTABLE THREAD","1","","08-12-2021","Dayanand","PPRAJ","2021-12-08"
"AL1487.06","02-330-00-L PLATE FOR LIMIT SWITCH","AL1487.06-02-330-00-L PLATE FOR LIMIT SWITCH","2","","08-12-2021","Dayanand","PPRAJ","2021-12-08"
"AL1487.06","05-030-00-BRUSH MOTOR MTG BKT","AL1487.06-05-030-00-BRUSH MOTOR MTG BKT","3","","08-12-2021","Dayanand","PPRAJ","2021-12-08"
"AL1487.07","02-02-00-TOP SUPPORT WASHER","AL1487.07-02-02-00","2","","21-11-2021","Amar","PPRAJ","2021-11-21"
"AL1487.07","02-06-00-COUPLER BLOCK","AL1487.07-02-06-00","1","","21-11-2021","Amar","PPRAJ","2021-11-21"
"AL1487.07","01-100-00-COMPONENT LOCATOR","AL1487.07-01-100-00","1","","21-11-2021","Amar","PPRAJ","2021-11-21"
"AL1487.07","01-06-00-GUIDE STRIP","AL1487.07-01-06-00","1","","21-11-2021","Amar","PPRAJ","2021-11-21"
"AL1487.07","03-04-00-STOPPER","AL1487.07-03-04-00","1","","21-11-2021","Amar","PPRAJ","2021-11-21"
"AL1487.07","03-02-00GUIDE BUSH HOLDER","AL1487.07-03-02-00","2","","21-11-2021","Amar","PPRAJ","2021-11-21"
"AL1487.07","02-04-00-CYLINDER HOLDER PLATE","AL1487.07-02-04-00","1","","21-11-2021","Amar","PPRAJ","2021-11-21"
"AL1487.07","02-09-00-ROD HOUSING BOTTOM","AL1487.07-02-09-00","2","","21-11-2021","Amar","PPRAJ","2021-11-21"
"AL1487.07","01-120-00-COM LOCATOR","AL1487.07-01-120-00","1","","21-11-2021","Amar","PPRAJ","2021-11-21"
"AL1487.07","01-04-00- STOPPER PAD","AL1487.07-01-04-00","2","","21-11-2021","Amar","PPRAJ","2021-11-21"
"AL1487.07","03-06-00-TIMER ROLLER HOLDER","AL1487.07-03-06-00","1","","21-11-2021","Amar","PPRAJ","2021-11-21"
"AL1487.07","02-03-00-GUIDE ROD","AL1487.07-02-03-00","2","","21-11-2021","Amar","PPRAJ","2021-11-21"
"AL1487.07","02-05-00-CYLINDER COUPLER","AL1487.07-02-05-00","1","","21-11-2021","Amar","PPRAJ","2021-11-21"
"AL1487.07","01-110-00-COMP GUIDE","AL1487.07-01-110-00","1","","21-11-2021","Amar","PPRAJ","2021-11-21"
"AL1487.07","01-120-R1-COM LOCATOR","AL1487.07-01-120-R1","1","","06-01-2022","Amar","PPRAJ","2022-01-06"
"AL1487.07","01-05-00-STOPPER","AL1487.07-01-050-00","2","","21-11-2021","Amar","PPRAJ","2021-11-21"
"AL1487.07","03-07-00-TIMER ROLLER HOLDER","AL1487.07-03-07-00","1","","21-11-2021","Amar","PPRAJ","2021-11-21"
"AL1487.07","03-01-00-TOOL HOLDER PLATE","AL1487.07-03-01-00","1","","21-11-2021","Amar","PPRAJ","2021-11-21"
"AL1505.01","04-11-00-TOOL BASE","04-11-00-TOOL BASE","1","","29-04-2022","Nitish","PPRAJ","2022-04-29"
"AL1505.01","05-17-00- STOPPER PAD","AL1505.01-05-17-00","2","","29-03-2022","Sunil","PPRAJ","2022-03-29"
"AL1505.01","01-06-00-GUIDE STRIP","AL1505.01-01-06-00","1","","29-03-2022","Sunil","PPRAJ","2022-03-29"
"AL1505.01","04-02-00-STACK HSG","AL1505.01-04-02-00","1","","28-03-2022","Sunil","PPRAJ","2022-03-29"
"AL1505.01","05-12-00-JACKING PLT","AL1505.01-05-12-00","1","","29-03-2022","Sunil","PPRAJ","2022-03-29"
"AL1505.01","05-19-00-COMP GUIDE 2","AL1505.01-05-19-00","1","","12-07-2022","Nitish","PPRAJ","2022-07-12"
"AL1505.01","03-16-00-PRESSING SHAFT","AL1505.01-03-16-00","1","","28-03-2022","Sunil","PPRAJ","2022-03-29"
"AL1505.01","05-09-00-COMP GUIDE","AL1505.01-05-09-00","1","","28-03-2022","Sunil","PPRAJ","2022-03-29"
"AL1505.01","03-01-00-TOOL HOLDER PLATE","AL1505.01-03-01-00","1","","28-03-2022","Sunil","PPRAJ","2022-03-29"
"AL1505.01","05-06-00- GUIDE ROD","AL1505.01-05-06-00","2","","28-03-2022","Sunil","PPRAJ","2022-03-29"
"AL1505.01","07-08-00-STIFFER TOP PLATE","AL1505.01-07-08-00","1","","29-03-2022","Sunil","PPRAJ","2022-03-29"
"AL1505.01","02-03-00-GUIDE ROD","AL1505.01-02-03-00","2","","28-03-2022","Sunil","PPRAJ","2022-03-29"
"AL1505.01","05-03-00-PRESSING CYL COUPLER","AL1505.01-05-03-00","1","","28-03-2022","Sunil","PPRAJ","2022-03-29"
"AL1505.01","07-04-00-DIA 30 GUIDE ROD","AL1505.01-07-04-00","2","","29-03-2022","Sunil","PPRAJ","2022-03-29"
"AL1505.01","02-05-00-CYLINDER COUPLER","AL1505.01-02-05-00","1","","28-03-2022","Sunil","PPRAJ","2022-03-29"
"AL1505.01","04-12-00-COMP HOLDING BLK","04-12-00-COMP HOLDING BLK","1","","29-04-2022","Nitish","PPRAJ","2022-04-29"
"AL1505.01","05-18-00-STOPPER FOR COM PRESS","AL1505.01-05-18-00","2","","29-03-2022","Sunil","PPRAJ","2022-03-29"
"AL1505.01","01-03-00- PRESS BASE PLATE","AL1505.01-01-03-00","1","","29-03-2022","Sunil","PPRAJ","2022-03-29"
"AL1505.01","04-03-00-STACK LOCATING PIN","AL1505.01-04-03-00","4","","28-03-2022","Sunil","PPRAJ","2022-03-29"
"AL1505.01","05-13-00-STOPPER","AL1505.01-05-13-00","1","","29-03-2022","Sunil","PPRAJ","2022-03-29"
"AL1505.01","05-20-00-COMPONENT LOCATOR 2","AL1505.01-05-20-00","1","","12-07-2022","Nitish","PPRAJ","2022-07-12"
"AL1505.01","03-15-00-PRESSING SHAFT","AL1505.01-03-15-00","1","","28-03-2022","Sunil","PPRAJ","2022-03-29"
"AL1505.01","05-10-00-COM LOCATOR","AL1505.01-05-10-00","1","","28-03-2022","Sunil","PPRAJ","2022-03-29"
"AL1505.01","03-02-00-GUIDE BUSH HOLDER","AL1505.01-03-02-00","2","","28-03-2022","Sunil","PPRAJ","2022-03-29"
"AL1505.01","05-07-00- STOPPER PAD","AL1505.01-05-07-00","2","","28-03-2022","Sunil","PPRAJ","2022-03-29"
"AL1505.01","07-09-00-STOPPER FOR STIFFNER","AL1505.01-07-09-00","2","","29-03-2022","Sunil","PPRAJ","2022-03-29"
"AL1505.01","02-04-00-CYLINDER HOLDER PLATE","AL1505.01-02-04-00","1","","28-03-2022","Sunil","PPRAJ","2022-03-29"
"AL1505.01","05-04-00-PRESSING CYLD COUPLER BLOCK","AL1505.01-05-04-00","1","","28-03-2022","Sunil","PPRAJ","2022-03-29"
"AL1505.01","07-05-00-STIFFER PLATE","AL1505.01-07-05-00","1","","29-03-2022","Sunil","PPRAJ","2022-03-29"
"AL1505.01","02-06-00-COUPLER BLOCK","AL1505.01-02-06-00","1","","28-03-2022","Sunil","PPRAJ","2022-03-29"
"AL1505.01","04-13-00-PIN FOR DOWEL","04-13-00-PIN FOR DOWEL","2","","29-04-2022","Nitish","PPRAJ","2022-04-29"
"AL1505.01","07-02-00-COM COUPLER BOTTOM","AL1505.01-07-02-00","1","","29-03-2022","Sunil","PPRAJ","2022-03-29"
"AL1505.01","01-05-00-STOPPER","AL1505.01-01-05-00","2","","29-03-2022","Sunil","PPRAJ","2022-03-29"
"AL1505.01","05-01-00-COMM PRESSING MTG BRKT","AL1505.01-05-01-00","1","","28-03-2022","Sunil","PPRAJ","2022-03-29"
"AL1505.01","05-11-00-COMP GUIDE PIN","AL1505.01-05-11-00","1","","29-03-2022","Sunil","PPRAJ","2022-03-29"
"AL1505.01","05-21-00-COMP GUIDE PIN","AL1505.01-05-21-00","1","","12-07-2022","Nitish","PPRAJ","2022-07-12"
"AL1505.01","01-031-00-MANIFOLD BLOCK","AL1505.01-01-031-00","1","","29-03-2022","Sunil","PPRAJ","2022-03-29"
"AL1505.01","04-01-00-STACK HSG MTG PLATE","AL1505.01-04-01-00","1","","28-03-2022","Sunil","PPRAJ","2022-03-29"
"AL1505.01","05-16-00-COM LOCATOR","AL1505.01-05-16-00","1","","29-03-2022","Sunil","PPRAJ","2022-03-29"
"AL1505.01","03-03-00-STOPPER FOR CYL HLDR","AL1505.01-03-03-00","2","","28-03-2022","Sunil","PPRAJ","2022-03-29"
"AL1505.01","05-08-00-COMPONENT LOCATOR","AL1505.01-05-08-00","1","","28-03-2022","Sunil","PPRAJ","2022-03-29"
"AL1505.01","01-38-00-PNEUMATC PLATE","AL1505.01-01-38-00","1","","29-03-2022","Sunil","PPRAJ","2022-03-29"
"AL1505.01","02-02-00-TOP SUPPORT WASHER","AL1505.01-02-02-00","2","","28-03-2022","Sunil","PPRAJ","2022-03-29"
"AL1505.01","05-05-00-PRESSING CYL RUNNER PLT","AL1505.01-05-05-00","1","","28-03-2022","Sunil","PPRAJ","2022-03-29"
"AL1505.01","07-06-00-STOPPER FOR STIFFNER","AL1505.01-07-06-00","2","","29-03-2022","Sunil","PPRAJ","2022-03-29"
"AL1505.01","02-07-00-ROD HOUSING BOTTOM","AL1505.01-02-07-00","2","","28-03-2022","Sunil","PPRAJ","2022-03-29"
"AL1505.01","04-14-00-STACK LOCATING PIN","04-14-00-STACK LOCATING PIN","4","","29-04-2022","Nitish","PPRAJ","2022-04-29"
"AL1505.01","07-03-00-WASHER","AL1505.01-07-03-00","4","","29-03-2022","Sunil","PPRAJ","2022-03-29"
"AL1505.01","01-A01-00-BASE ASSY","AL1505.01-01-A01-00","1","","29-03-2022","Sunil","PPRAJ","2022-03-29"
"AL1505.01","05-02-00-PRESSING CYL MTG BRKT","AL1505.01-05-02-00","1","","28-03-2022","Sunil","PPRAJ","2022-03-29"
"AL1505.02","01-205-00-COMPONENT GUIDE PLATE","AL1505.02-01-205-00","2","","04-04-2022","Amar","PPRAJ","2022-04-04"
"AL1505.02","02-040-00-SIDE GUIDE PLT","AL1505.02-02-040-00","1","","01-04-2022","Amar","PPRAJ","2022-04-04"
"AL1505.02","01-02-00-INDEXER HOUSING","AL1505.02-01-02-00","1","","04-04-2022","Amar","PPRAJ","2022-04-04"
"AL1505.02","07-031-00-MALE ROLLER","AL1505.02-07-031-00","1","","04-04-2022","Amar","PPRAJ","2022-04-04"
"AL1505.02","07-017-00 DRIVEN GEAR","AL1505.02-07-017-00","1","","04-04-2022","Amar","PPRAJ","2022-04-04"
"AL1505.02","04-010-00-IXR CYL CONNTR","AL1505.02-04-010-00","1","","04-04-2022","Amar","PPRAJ","2022-04-04"
"AL1505.02","01-213-00-GUIDE PLATE RH","AL1505.02-01-213-00","1","","04-04-2022","Amar","PPRAJ","2022-04-04"
"AL1505.02","01-210-00-GUIDE PLATE","AL1505.02-01-210-00","1","","04-04-2022","Amar","PPRAJ","2022-04-04"
"AL1505.02","02-106-00-CYLINDER COUPLER","AL1505.02-02-106-00","1","","01-04-2022","Amar","PPRAJ","2022-04-04"
"AL1505.02","01-201-00-INDEXER LOCATER","AL1505.02-01-201-00","1","","04-04-2022","Amar","PPRAJ","2022-04-04"
"AL1505.02","09-011-00-CYLINDER COUPLER","AL1505.02-09-011-00","1","","04-04-2022","Amar","PPRAJ","2022-04-04"
"AL1505.02","07-018-00 DRIVER GEAR","AL1505.02-07-018-00","1","","04-04-2022","Amar","PPRAJ","2022-04-04"
"AL1505.02","04-020-00-IND CYL MTG PLT","AL1505.02-04-020-00","1","","04-04-2022","Amar","PPRAJ","2022-04-04"
"AL1505.02","03-020-00-CYLINDER COUPLER","AL1505.02-03-020-00","1","","01-04-2022","Amar","PPRAJ","2022-04-04"
"AL1505.02","01-219-00 FEEDER PLATE","AL1505.02-01-219-00","2","","04-04-2022","Amar","PPRAJ","2022-04-04"
"AL1505.02","01-203-00-GUIDE STRIPS","AL1505.02-01-203-00","2","","04-04-2022","Amar","PPRAJ","2022-04-04"
"AL1505.02","02-030-00-SIDE GUIDE PLT RH","AL1505.02-02-030-00","1","","01-04-2022","Amar","PPRAJ","2022-04-04"
"AL1505.02","07-021-00-FEMALE ROLLER","AL1505.02-07-021-00","1","","04-04-2022","Amar","PPRAJ","2022-04-04"
"AL1505.02","05-030-00-STOPPER PAD MTG","AL1505.02-05-030-00","1","","04-04-2022","Amar","PPRAJ","2022-04-04"
"AL1505.02","03-080-00-INSERTING PUNCHS","AL1505.02-03-080-00","2","","01-04-2022","Amar","PPRAJ","2022-04-04"
"AL1505.02","01-231-00-INDEXER BASE PLATE","AL1505.02-01-231-00","1","","04-04-2022","Amar","PPRAJ","2022-04-04"
"AL1505.02","09-082-00 COUPLER HOLDER","AL1505.02-09-082-00","1","","04-04-2022","Amar","PPRAJ","2022-04-04"
"AL1505.03","10-67-00-COMP.CLAMPING PLT","AL1505.03-10-67-00","1","","19-05-2022","Amar","PPRAJ","2022-06-03"
"AL1505.03","10-23-R1-L PLATE","AL1505.03-10-23-R1","8","","07-07-2022","Amar","PPRAJ","2022-07-07"
"AL1505.03","04-02-00-HOOK GUIDE PLATE","AL1505.03-04-02-00","4","","24-03-2022","Amar","PPRAJ","2022-03-28"
"AL1505.03","10-23-00-L PLATE","AL1505.03-10-23-00","4","","19-05-2022","Amar","PPRAJ","2022-06-03"
"AL1505.03","05-11-00-COLLET","AL1505.03-05-11-00","2","","24-03-2022","Amar","PPRAJ","2022-03-28"
"AL1505.03","10-03-00-WALKING BEAM-FRONT  SIDE PLT","AL1505.03-10-02-00","1","","19-05-2022","Amar","PPRAJ","2022-06-03"
"AL1505.03","05-01-00-GRIPPER SLEEVE","AL1505.03-05-01-00","1","","24-03-2022","Amar","PPRAJ","2022-03-28"
"AL1505.03","06-01-00-TEN ARM HOLDER HINGE","AL1505.03-06-01-00","10","","19-05-2022","Amar","PPRAJ","2022-06-03"
"AL1505.03","04-12-00-BALANCING WEDGE","AL1505.03-04-12-00","2","","24-03-2022","Amar","PPRAJ","2022-03-28"
"AL1505.03","04-08-00-PAWL HOLDER","AL1505.03-04-08-00","1","","24-03-2022","Amar","PPRAJ","2022-03-28"
"AL1505.03","10-90-00 CRADLE MTG SPACER PLATE","AL1505.03-10-90-00","2","","19-05-2022","Amar","PPRAJ","2022-06-03"
"AL1505.03","04-03-00-HOOK HOLDER.","AL1505.03-04-03-00","2","","24-03-2022","Amar","PPRAJ","2022-03-28"
"AL1505.03","10-29-00-FIXED  BEAM-FRONT","AL1505.03-10-29-00","1","","19-05-2022","Amar","PPRAJ","2022-06-03"
"AL1505.03","05-12-00-DRAW BAR","AL1505.03-05-12-00","2","","24-03-2022","Amar","PPRAJ","2022-03-28"
"AL1505.03","10-03-00-WALKING BEAM-FRONT  SIDE PLT","AL1505.03-10-03-00","1","","19-05-2022","Amar","PPRAJ","2022-06-03"
"AL1505.03","05-02-00-THIMBLE","AL1505.03-05-02-00","1","","24-03-2022","Amar","PPRAJ","2022-03-28"
"AL1505.03","05-12-00-COLLET","AL1505.03-05-12-00","2","","19-05-2022","Amar","PPRAJ","2022-06-03"
"AL1505.03","04-13-00-BALANCING PLATE","AL1505.03-04-13-00","2","","24-03-2022","Amar","PPRAJ","2022-03-28"
"AL1505.03","04-10-00-HOOK GUDE MTG PLATE","AL1505.03-04-10-00","2","","24-03-2022","Amar","PPRAJ","2022-03-28"
"AL1505.03","04-04-00-CENTRE BLOCK","AL1505.03-04-04-00","1","","24-03-2022","Amar","PPRAJ","2022-03-28"
"AL1505.03","10-30-00-FIXED  BEAM SPACER PLT","AL1505.03-10-30-00","2","","19-05-2022","Amar","PPRAJ","2022-06-03"
"AL1505.03","04-01-00-BACK PLATE","AL1505.03-04-01-00","2","","24-03-2022","Amar","PPRAJ","2022-03-28"
"AL1505.03","10-11-00-COMP HOLDER (V-BLK)","AL1505.03-10-11-00","1","","19-05-2022","Amar","PPRAJ","2022-06-03"
"AL1505.03","05-03-00-OUTER SHIELD","AL1505.03-05-03-00","1","","24-03-2022","Amar","PPRAJ","2022-03-28"
"AL1505.03","10-01-00-FIXED  BEAM","AL1505.03-10-01-00","1","","19-05-2022","Amar","PPRAJ","2022-06-03"
"AL1505.03","04-14-00-HOOK SPRING REATINER","AL1505.03-04-14-00","2","","24-03-2022","Amar","PPRAJ","2022-03-28"
"AL1505.03","04-11-00- BOTTOM TO TOP  HOOKING PLATE","AL1505.03-04-11-00","2","","24-03-2022","Amar","PPRAJ","2022-03-28"
"AL1505.03","04-06-00-CENTRE BLOCK","AL1505.03-04-06-00","1","","24-03-2022","Amar","PPRAJ","2022-03-28"
"AL1505.04","02-090-00-SUPPORT PLATE","AL1505.04-02-090-00-SUPPORT PLATE","6","","14-02-2022","Dayanand","PPRAJ","2022-02-14"
"AL1505.04","04-42-00-WALKER MTG BRACKET","AL1505.04-04-42-00-WALKER MTG BRACKET","2","","03-06-2022","Dayanand","PPRAJ","2022-06-03"
"AL1505.04","03-43-00-CYLINDER PISTON GUIDE BUSH","AL1505.04-03-43-00-CYLINDER PISTON GUIDE BUSH","3","","16-02-2022","Dayanand","PPRAJ","2022-02-16"
"AL1505.04","02-580-00-COPPER SPACER","AL1505.04-02-580-00-COPPER SPACER","3","","14-02-2022","Dayanand","PPRAJ","2022-02-14"
"AL1505.04","02-230-00-CLAMPING BUSH BOTTOM","AL1505.04-02-230-00-CLAMPING BUSH BOTTOM","12","","14-02-2022","Dayanand","PPRAJ","2022-02-14"
"AL1505.04","05-250-00-SENSOR PLATE","AL1505.04-05-250-00-SENSOR PLATE","1","","03-06-2022","Dayanand","PPRAJ","2022-06-03"
"AL1505.04","07-070-00-CYLINDER MOUNTING BRACKET","AL1505.04-07-070-00-CYLINDER MOUNTING BRACKET","3","","15-02-2022","Dayanand","PPRAJ","2022-02-15"
"AL1505.04","02-630-00-SCREW SLOT WASHER","AL1505.04-02-630-00-SCREW SLOT WASHER","10","","14-02-2022","Dayanand","PPRAJ","2022-02-14"
"AL1505.04","04-27-00-FIXED BEAM MTG HSG","AL1505.04-04-27-00-FIXED BEAM MTG HSG","4","","03-06-2022","Dayanand","PPRAJ","2022-06-03"
"AL1505.04","04-34-00-SENSOR MTG BKT","AL1505.04-04-34-00-SENSOR MTG BKT","2","","03-06-2022","Dayanand","PPRAJ","2022-06-03"
"AL1505.04","03-20-00-COLLECT EJECTOR HOLDER","AL1505.04-03-20-00-COLLECT EJECTOR HOLDER","3","","16-02-2022","Dayanand","PPRAJ","2022-02-16"
"AL1505.04","02-570-00-SAFTY COVER","AL1505.04-02-570-00-SAFTY COVER","3","","14-02-2022","Dayanand","PPRAJ","2022-02-14"
"AL1505.04","05-220-00-ADITIONAL SPACER","AL1505.04-05-220-00-ADITIONAL SPACER","1","","03-06-2022","Dayanand","PPRAJ","2022-06-03"
"AL1505.04","01-021-00-TRANSFORMER BOTTOM PLT","AL1505.04-01-021-00-TRANSFORMER BOTTOM PLT","3","","29-03-2022","Dayanand","PPRAJ","2022-03-29"
"AL1505.04","06-060-00-BOTTOM PLATE","AL1505.04-06-060-00-BOTTOM PLATE","3","","14-02-2022","Dayanand","PPRAJ","2022-02-14"
"AL1505.04","02-400-00-HAND KNOB","AL1505.04-02-400-00-HAND KNOB","6","","14-02-2022","Dayanand","PPRAJ","2022-02-14"
"AL1505.04","07-340-00-CUT OUT COVER SHEET","AL1505.04-07-340-00-CUT OUT COVER SHEET","1","","09-07-2022","Dayanand","PPRAJ","2022-07-09"
"AL1505.04","06-190-00-COUPLER PLATE","AL1505.04-06-190-00-COUPLER PLATE","1","","03-06-2022","Dayanand","PPRAJ","2022-06-03"
"AL1505.04","04-23-00-L PLATE","AL1505.04-04-23-00-L PLATE","4","","03-06-2022","Dayanand","PPRAJ","2022-06-03"
"AL1505.04","02-560-00-STOPPER THREAD ROD","AL1505.04-02-560-00-STOPPER THREAD ROD","3","","07-04-2022","Dayanand","PPRAJ","2022-04-07"
"AL1505.04","02-490-00-SPRING","AL1505.04-02-490-00-SPRING","20","","14-02-2022","Dayanand","PPRAJ","2022-02-14"
"AL1505.04","01-A05-00-TUBE STRUCTURE BASE ASSY","AL1505.04-01-A05-00-TUBE STRUCTURE BASE ASSY","3","","10-02-2022","Dayanand","PPRAJ","2022-02-10"
"AL1505.04","04-18-00-CYLINDER MTG PLT","AL1505.04-04-18-00-CYLINDER MTG PLT","1","","03-06-2022","Dayanand","PPRAJ","2022-06-03"
"AL1505.04","03-17-00-DRAW BAR","AL1505.04-03-17-00-DRAW BAR","3","","16-02-2022","Dayanand","PPRAJ","2022-02-16"
"AL1505.04","02-170-00-ANODE & CATHODE CONNECTING BLK","AL1505.04-02-170-00-ANODE & CATHODE CONNECTING BLK","6","","14-02-2022","Dayanand","PPRAJ","2022-02-14"
"AL1505.04","05-160-00-COUPLER PLATE","AL1505.04-05-160-00-COUPLER PLATE","1","","03-06-2022","Dayanand","PPRAJ","2022-06-03"
"AL1505.04","03-310-00-RING FEEDER LOCKING BUSH","AL1505.04-03-310-00-RING FEEDER LOCKING BUSH","9","","16-02-2022","Dayanand","PPRAJ","2022-02-16"
"AL1505.04","06-020-00-V BLOCK HODER","AL1505.04-06-020-00-V BLOCK HODER","3","","14-02-2022","Dayanand","PPRAJ","2022-02-14"
"AL1505.04","02-340-00-COPPER SPACER","AL1505.04-02-340-00-COPPER SPACER","3","","14-02-2022","Dayanand","PPRAJ","2022-02-14"
"AL1505.04","06-160-00-COMPONENT SUPPORT BLOCK","AL1505.04-06-160-00-COMPONENT SUPPORT BLOCK","1","","03-06-2022","Dayanand","PPRAJ","2022-06-03"
"AL1505.04","04-01-00-FIXED  BEAM","AL1505.04-04-01-00-FIXED  BEAM","1","","03-06-2022","Dayanand","PPRAJ","2022-06-03"
"AL1505.04","02-250-00-FINE ADJUSTMENT THREAD","AL1505.04-02-250-00-FINE ADJUSTMENT THREAD","3","","15-02-2022","Dayanand","PPRAJ","2022-02-15"
"AL1505.04","02-070-00-TOP SLIDE LM BLOCK MTG PLT","AL1505.04-02-070-00-TOP SLIDE LM BLOCK MTG PLT","3","","14-02-2022","Dayanand","PPRAJ","2022-02-14"
"AL1505.04","01-040-00-CABINET MOUNTING BRACKET","AL1505.04-01-040-00-CABINET MOUNTING BRACKET","6","","10-02-2022","Dayanand","PPRAJ","2022-02-10"
"AL1505.04","04-17-00- CYLINER COUPLER","AL1505.04-04-17-00- CYLINER COUPLER","2","","03-06-2022","Dayanand","PPRAJ","2022-06-03"
"AL1505.04","03-11-HOLLOW  CYLINDER  SHAFT SPACER","AL1505.04-03-11-HOLLOW  CYLINDER  SHAFT SPACER","3","","16-02-2022","Dayanand","PPRAJ","2022-02-16"
"AL1505.04","02-140-00-RETAINER WASHER","AL1505.04-02-140-00-RETAINER WASHER","6","","14-02-2022","Dayanand","PPRAJ","2022-02-14"
"AL1505.04","06-230-00-PUSHER PAD","AL1505.04-06-230-00-PUSHER PAD","1","","29-06-2022","Dayanand","PPRAJ","2022-06-29"
"AL1505.04","05-041-00-HSG RETAINER","AL1505.04-05-041-00-HSG RETAINER","2","","03-06-2022","Dayanand","PPRAJ","2022-06-03"
"AL1505.04","03-280-00-PROXIMITY SENSOR PLATE","AL1505.04-03-280-00-PROXIMITY SENSOR PLATE","3","","16-02-2022","Dayanand","PPRAJ","2022-02-16"
"AL1505.04","06-08-00-PAWL HOLDER","AL1505.04-06-08-00-PAWL HOLDER","3","","14-02-2022","Dayanand","PPRAJ","2022-02-14"
"AL1505.04","02-280-00-CATHODE PLATE","AL1505.04-02-280-00-CATHODE PLATE","3","","14-02-2022","Dayanand","PPRAJ","2022-02-14"
"AL1505.04","05-022-00-RETAINER PLT","AL1505.04-05-022-00-RETAINER PLT","1","","03-06-2022","Dayanand","PPRAJ","2022-06-03"
"AL1505.04","03-130-00-CYLINDER MTG PLATE","AL1505.04-03-130-00-CYLINDER MTG PLATE","1","","03-06-2022","Dayanand","PPRAJ","2022-06-03"
"AL1505.04","07-290-00-CYLINDER GUIDE PLATE","AL1505.04-07-290-00-CYLINDER GUIDE PLATE","3","","15-02-2022","Dayanand","PPRAJ","2022-02-15"
"AL1505.04","02-067-00-SPING SPACER","AL1505.04-02-067-00-SPING SPACER","6","","14-02-2022","Dayanand","PPRAJ","2022-02-14"
"AL1505.04","03-08-00-HOLLOW CYL END COVER","AL1505.04-03-08-00-HOLLOW CYL END COVER","3","","16-02-2022","Dayanand","PPRAJ","2022-02-16"
"AL1505.04","02-550-00-STOPPER BLOCK","AL1505.04-02-550-00-STOPPER BLOCK","3","","14-02-2022","Dayanand","PPRAJ","2022-02-14"
"AL1505.04","05-061-00-BOTTOM PLATE","AL1505.04-05-061-00-BOTTOM PLATE","4","","03-06-2022","Dayanand","PPRAJ","2022-06-03"
"AL1505.04","03-87-00-MOTOR HSG COVER","AL1505.04-03-87-00-MOTOR HSG COVER","3","","16-02-2022","Dayanand","PPRAJ","2022-02-16"
"AL1505.04","02-062-00-LM BLOCK MTG PLATE","AL1505.04-02-062-00-LM BLOCK MTG PLATE","3","","14-02-2022","Dayanand","PPRAJ","2022-02-14"
"AL1505.04","05-062-00-GRIPPER","AL1505.04-05-062-00-GRIPPER","4","","03-06-2022","Dayanand","PPRAJ","2022-06-03"
"AL1505.04","03-170-00-FRONT FACE COVER","AL1505.04-03-170-00-FRONT FACE COVER","1","","03-06-2022","Dayanand","PPRAJ","2022-06-03"
"AL1505.04","03-07-00-INEXER SLIDE SHAFT SPACER","AL1505.04-03-07-00-INEXER SLIDE SHAFT SPACER","1","","25-02-2022","Dayanand","PPRAJ","2022-02-25"
"AL1505.04","07-250-00-SPACER FOR PC SHEET","AL1505.04-07-250-00-SPACER FOR PC SHEET","12","","15-02-2022","Dayanand","PPRAJ","2022-02-15"
"AL1505.04","02-450-00-FIXED FRAME","AL1505.04-02-450-00-FIXED FRAME","3","","14-02-2022","Dayanand","PPRAJ","2022-02-14"
"AL1505.04","04-07-00-WALKING BEAM-FRONT  SIDE PLT","AL1505.04-04-07-00-WALKING BEAM-FRONT  SIDE PLT","1","","03-06-2022","Dayanand","PPRAJ","2022-06-03"
"AL1505.04","01-A03-00-TRANSFERMER MOUNTING FRAME ASSY","AL1505.04-01-A03-00-TRANSFERMER MOUNTING FRAME ASSY","3","","16-02-2022","Dayanand","PPRAJ","2022-02-16"
"AL1505.04","02-100-00-GUIDE BLOCK","AL1505.04-02-100-00-GUIDE BLOCK","6","","14-02-2022","Dayanand","PPRAJ","2022-02-14"
"AL1505.04","04-20-00-COUPLER","AL1505.04-04-20-00-COUPLER","1","","03-06-2022","Dayanand","PPRAJ","2022-06-03"
"AL1505.04","03-44-00-INDEXER  MOTOR MTG PLT","AL1505.04-03-44-00-INDEXER  MOTOR MTG PLT","3","","16-02-2022","Dayanand","PPRAJ","2022-02-16"
"AL1505.04","02-590-00-NYLON PAD","AL1505.04-02-590-00-NYLON PAD","3","","14-02-2022","Dayanand","PPRAJ","2022-02-14"
"AL1505.04","02-260-00-CATHODE ROD","AL1505.04-02-260-00-CATHODE ROD","6","","14-02-2022","Dayanand","PPRAJ","2022-02-14"
"AL1505.04","05-260-00-BRACKET BOTTOM SPACER PLT","AL1505.04-05-260-00-BRACKET BOTTOM SPACER PLT","1","","03-06-2022","Dayanand","PPRAJ","2022-06-03"
"AL1505.04","03-100-00-LM RAIL MTG PLATE","AL1505.04-03-100-00-LM RAIL MTG PLATE","1","","03-06-2022","Dayanand","PPRAJ","2022-06-03"
"AL1505.04","07-080-00-SK MODEL","AL1505.04-07-080-00-SK MODEL","12","","15-02-2022","Dayanand","PPRAJ","2022-02-15"
"AL1505.04","02-640-00-SCREW SLOT WASHER","AL1505.04-02-640-00-SCREW SLOT WASHER","101","","14-02-2022","Dayanand","PPRAJ","2022-02-14"
"AL1505.04","04-28-00-DIA 12 GUIDE ROD","AL1505.04-04-28-00-DIA 12 GUIDE ROD","4","","03-06-2022","Dayanand","PPRAJ","2022-06-03"
"AL1505.04","04-35-00-PART PRASENT SENSOR BKT","AL1505.04-04-35-00-PART PRASENT SENSOR BKT","1","","03-06-2022","Dayanand","PPRAJ","2022-06-03"
"AL1505.04","03-21-00-EJECTOR PIN","AL1505.04-03-21-00-EJECTOR PIN","3","","16-02-2022","Dayanand","PPRAJ","2022-02-16"
"AL1505.04","02-200-00-ADJUSTABLE ANODE HOLDER CLAMP","AL1505.04-02-200-00-ADJUSTABLE ANODE HOLDER CLAMP","6","","14-02-2022","Dayanand","PPRAJ","2022-02-14"
"AL1505.04","05-230-00-SHAFT SPACER","AL1505.04-05-230-00-SHAFT SPACER","1","","03-06-2022","Dayanand","PPRAJ","2022-06-03"
"AL1505.04","07-050-00-CONTROL UNIT BOTTOM SHEET","AL1505.04-07-050-00-CONTROL UNIT BOTTOM SHEET","3","","15-02-2022","Dayanand","PPRAJ","2022-02-15"
"AL1505.04","02-410-00-RETAINER","AL1505.04-02-410-00-RETAINER","6","","14-02-2022","Dayanand","PPRAJ","2022-02-14"
"AL1505.04","06-200-00-PUSHING CONNECTOR","AL1505.04-06-200-00-PUSHING CONNECTOR","1","","03-06-2022","Dayanand","PPRAJ","2022-06-03"
"AL1505.04","04-40-00-FIXED  BEAM SPACER PLT","AL1505.04-04-40-00-FIXED  BEAM SPACER PLT","1","","03-06-2022","Dayanand","PPRAJ","2022-06-03"
"AL1505.04","02-650-00-BUTTING PAD","AL1505.04-02-650-00-BUTTING PAD","6","","07-04-2022","Dayanand","PPRAJ","2022-04-07"
"AL1505.04","02-080-00-SPACER PLATE","AL1505.04-02-080-00-SPACER PLATE","3","","14-02-2022","Dayanand","PPRAJ","2022-02-14"
"AL1505.04","04-19-00-STOPPER PLT","AL1505.04-04-19-00-STOPPER PLT","1","","03-06-2022","Dayanand","PPRAJ","2022-06-03"
"AL1505.04","03-18-00-INEXER MOTOR MTG PLT","AL1505.04-03-18-00-INEXER MOTOR MTG PLT","3","","16-02-2022","Dayanand","PPRAJ","2022-02-16"
"AL1505.04","02-180-00-CATHODE HOLDER BLOCK","AL1505.04-02-180-00-CATHODE HOLDER BLOCK","3","","14-02-2022","Dayanand","PPRAJ","2022-02-14"
"AL1505.04","05-170-00-MOTOR MTG PLATE","AL1505.04-05-170-00-MOTOR MTG PLATE","1","","03-06-2022","Dayanand","PPRAJ","2022-06-03"
"AL1505.04","03-01-00-INDEXER HSG PLT","AL1505.04-03-01-00-INDEXER HSG PLT","3","","16-02-2022","Dayanand","PPRAJ","2022-02-16"
"AL1505.04","06-030-00-PAWL RETAINER PLATE","AL1505.04-06-030-00-PAWL RETAINER PLATE","3","","14-02-2022","Dayanand","PPRAJ","2022-02-14"
"AL1505.04","02-380-00-SPRING GUIDE BUSH","AL1505.04-02-380-00-SPRING GUIDE BUSH","6","","14-02-2022","Dayanand","PPRAJ","2022-02-14"
"AL1505.04","06-170-00-END STOPPER MTG PLATE","AL1505.04-06-170-00-END STOPPER MTG PLATE","1","","03-06-2022","Dayanand","PPRAJ","2022-06-03"
"AL1505.04","04-03-00-WALKING BEAM-FRONT  SIDE PLT","AL1505.04-04-03-00-WALKING BEAM-FRONT  SIDE PLT","1","","03-06-2022","Dayanand","PPRAJ","2022-06-03"
"AL1505.04","02-72-00-WIPER SHEET","AL1505.04-02-72-00-WIPER SHEET","3","","14-02-2022","Dayanand","PPRAJ","2022-02-14"
"AL1505.04","01-070-00-PNEUMATIC PLATE","AL1505-.04-01-070-00-PNEUMATIC PLATE","3","","10-02-2022","Dayanand","PPRAJ","2022-02-10"
"AL1505.04","04-31-00-SETTING GAUGE BLOCK 122-SL","AL1505.04-04-31-00-SETTING GAUGE BLOCK 122-SL","10","","03-06-2022","Dayanand","PPRAJ","2022-06-03"
"AL1505.04","03-14-00-THRUST BEARING SHAFT","AL1505.04-03-14-00-THRUST BEARING SHAFT","3","","16-02-2022","Dayanand","PPRAJ","2022-02-16"
"AL1505.04","02-150-00-BUSH","AL1505.04-02-150-00-BUSH","12","","14-02-2022","Dayanand","PPRAJ","2022-02-14"
"AL1505.04","06-240-00-NUT","AL1505.04-06-240-00-NUT","2","","29-06-2022","Dayanand","PPRAJ","2022-06-29"
"AL1505.04","05-130-00-STD GUIDE ROD","AL1505.04-05-130-00-STD GUIDE ROD","4","","03-06-2022","Dayanand","PPRAJ","2022-06-03"
"AL1505.04","03-290-00-FIXED MTG BRACKET","AL1505.04-03-290-00-FIXED MTG BRACKET","3","","16-02-2022","Dayanand","PPRAJ","2022-02-16"
"AL1505.04","06-09-00-PAWL SPRING","AL1505.04-06-09-00-PAWL SPRING","6","","14-02-2022","Dayanand","PPRAJ","2022-02-14"
"AL1505.04","02-290-00-ANODE PLATE","AL1505.04-02-290-00-ANODE PLATE","3","","14-02-2022","Dayanand","PPRAJ","2022-02-14"
"AL1505.04","05-090-00-SPACER PLATE","AL1505.04-05-090-00-SPACER PLATE","2","","03-06-2022","Dayanand","PPRAJ","2022-06-03"
"AL1505.04","03-140-00-CYLINDER COUPLER","AL1505.04-03-140-00-CYLINDER COUPLER","1","","03-06-2022","Dayanand","PPRAJ","2022-06-03"
"AL1505.04","07-230-00-DOOR SLIDE PC HOLDER","AL1505.04-07-230-00-DOOR SLIDE PC HOLDER","3","","15-02-2022","Dayanand","PPRAJ","2022-02-15"
"AL1505.04","02-068-00-GUIDE PLATE","AL1505.04-02-068-00-GUIDE PLATE","6","","14-02-2022","Dayanand","PPRAJ","2022-02-14"
"AL1505.04","03-09-00-HOLLOW CYL HSG","AL1505.04-03-09-00-HOLLOW CYL HSG","3","","16-02-2022","Dayanand","PPRAJ","2022-02-16"
"AL1505.04","02-110-00-STD GUIDE ROD","AL1505.04-02-110-00-STD GUIDE ROD","12","","14-02-2022","Dayanand","PPRAJ","2022-02-14"
"AL1505.04","06-210-00-ADJUSTABLE PLATE","AL1505.04-06-210-00-ADJUSTABLE PLATE","1","","29-06-2022","Dayanand","PPRAJ","2022-06-29"
"AL1505.04","05-020-00-BEARING HSG","AL1505.04-05-020-00-BEARING HSG","1","","03-06-2022","Dayanand","PPRAJ","2022-06-03"
"AL1505.04","03-96-00-COLLET","AL1505.04-03-96-00-COLLET","6","","16-02-2022","Dayanand","PPRAJ","2022-02-16"
"AL1505.04","02-063-00-CYLINDER MTG PLATE","AL1505.04-02-063-00-CYLINDER MTG PLATE","3","","14-02-2022","Dayanand","PPRAJ","2022-02-14"
"AL1505.04","05-070-00-GRIPPER PAD","AL1505.04-05-070-00-GRIPPER PAD","6","","03-06-2022","Dayanand","PPRAJ","2022-06-03"
"AL1505.04","03-180-00-BACK FACE COVER","AL1505.04-03-180-00-BACK FACE COVER","1","","03-06-2022","Dayanand","PPRAJ","2022-06-03"
"AL1505.04","07-270-00-SPACRE FOR CYLINDER BRKT","AL1505.04-07-270-00-SPACRE FOR CYLINDER BRKT","3","","15-02-2022","Dayanand","PPRAJ","2022-02-15"
"AL1505.04","02-460-00-ELECTRICAL BUS BAR RH","AL1505.04-02-460-00-ELECTRICAL BUS BAR RH","3","","14-02-2022","Dayanand","PPRAJ","2022-02-14"
"AL1505.04","04-41-00-TIE SPACER PLT","AL1505.04-04-41-00-TIE SPACER PLT","4","","03-06-2022","Dayanand","PPRAJ","2022-06-03"
"AL1505.04","03-05-00-INDEXER SLDNG SHAFT","AL1505.04-03-05-00-INDEXER SLDNG SHAFT","3","","16-02-2022","Dayanand","PPRAJ","2022-02-16"
"AL1505.04","02-520-00-BAS BAR SPACER","AL1505.04-02-520-00-BAS BAR SPACER","3","","14-02-2022","Dayanand","PPRAJ","2022-02-14"
"AL1505.04","05-110-00-CYLINDER MGT PLATE","AL1505.04-05-110-00-CYLINDER MGT PLATE","1","","03-06-2022","Dayanand","PPRAJ","2022-06-03"
"AL1505.04","03-190-00-GEAR SAFTY COVER","AL1505.04-03-190-00-GEAR SAFTY COVER","3","","16-02-2022","Dayanand","PPRAJ","2022-02-16"
"AL1505.04","02-600-00-CYLINDER COUPLER","AL1505.04-02-600-00-CYLINDER COUPLER","3","","14-02-2022","Dayanand","PPRAJ","2022-02-14"
"AL1505.04","05-019-00-FLYER SHAFT PULLEY","AL1505.04-05-019-00-FLYER SHAFT PULLEY","1","","03-06-2022","Dayanand","PPRAJ","2022-06-03"
"AL1505.04","03-110-00-LM BLOCK MTG PLATE","AL1505.04-03-110-00-LM BLOCK MTG PLATE","1","","03-06-2022","Dayanand","PPRAJ","2022-06-03"
"AL1505.04","07-090-00-DIA12 STD GUIDE ROD","AL1505.04-07-090-00-DIA12 STD GUIDE ROD","6","","15-02-2022","Dayanand","PPRAJ","2022-02-15"
"AL1505.04","02-450-00-ELECTRICAL BUS BAR","AL1505.04-02-450-00-ELECTRICAL BUS BAR","3","","14-02-2022","Dayanand","PPRAJ","2022-02-14"
"AL1505.04","04-29-00-FIXED  BEAM-FRONT","AL1505.04-04-29-00-FIXED  BEAM-FRONT","1","","03-06-2022","Dayanand","PPRAJ","2022-06-03"
"AL1505.04","04-39-00-TIE SPACER PLT","AL1505.04-04-39-00-TIE SPACER PLT","2","","03-06-2022","Dayanand","PPRAJ","2022-06-03"
"AL1505.04","03-22-00-EJECTOR SPRING","AL1505.04-03-22-00-EJECTOR SPRING","3","","16-02-2022","Dayanand","PPRAJ","2022-02-16"
"AL1505.04","02-220-00-SPRING CONNECTING BUSH","AL1505.04-02-220-00-SPRING CONNECTING BUSH","6","","14-02-2022","Dayanand","PPRAJ","2022-02-14"
"AL1505.04","05-240-00-JACKING PAD","AL1505.04-05-240-00-JACKING PAD","1","","03-06-2022","Dayanand","PPRAJ","2022-06-03"
"AL1505.04","07-060-00-ACRYLIC MOUNTING BRACKET","AL1505.04-07-060-00-ACRYLIC MOUNTING BRACKET","3","","15-02-2022","Dayanand","PPRAJ","2022-02-15"
"AL1505.04","02-440-00-SAFTY COVER","AL1505.04-02-440-00-SAFTY COVER","3","","14-02-2022","Dayanand","PPRAJ","2022-02-14"
"AL1505.04","04-04-00-CYLINDER MTG PLT","AL1505.04-04-04-00-CYLINDER MTG PLT","2","","03-06-2022","Dayanand","PPRAJ","2022-06-03"
"AL1505.04","02-510-00-CYLINDER MTG BRACKET","AL1505.04-02-510-00-CYLINDER MTG BRACKET","3","","14-02-2022","Dayanand","PPRAJ","2022-02-14"
"AL1505.04","04-33-00-SENSOR MTG PLATE","AL1505.04-04-33-00-SENSOR MTG PLATE","3","","03-06-2022","Dayanand","PPRAJ","2022-06-03"
"AL1505.04","03-19-00-ADJUSTABLE DRIVING GEAR","AL1505.04-03-19-00-ADJUSTABLE DRIVING GEAR","9","","16-02-2022","Dayanand","PPRAJ","2022-02-16"
"AL1505.04","02-190-00-ANODE HOLDER BLOCK","AL1505.04-02-190-00-ANODE HOLDER BLOCK","3","","14-02-2022","Dayanand","PPRAJ","2022-02-14"
"AL1505.04","05-180-00-BEARING SPACER","AL1505.04-05-180-00-BEARING SPACER","1","","03-06-2022","Dayanand","PPRAJ","2022-06-03"
"AL1505.04","03-04-00-COLLET SLEEVE","AL1505.04-03-04-00-COLLET SLEEVE","3","","16-02-2022","Dayanand","PPRAJ","2022-02-16"
"AL1505.04","06-040-00-SPACER PLATE","AL1505.04-06-040-00-SPACER PLATE","6","","14-02-2022","Dayanand","PPRAJ","2022-02-14"
"AL1505.04","02-390-00-FINE ADJUSTMENT THREAD","AL1505.04-02-390-00-FINE ADJUSTMENT THREAD","6","","14-02-2022","Dayanand","PPRAJ","2022-02-14"
"AL1505.04","06-180-00-END STOPPER PIN","AL1505.04-06-180-00-END STOPPER PIN","1","","03-06-2022","Dayanand","PPRAJ","2022-06-03"
"AL1505.04","04-22-00-CONVER LOCKING PLT","AL1505.04-04-22-00-CONVER LOCKING PLT","4","","03-06-2022","Dayanand","PPRAJ","2022-06-03"
"AL1505.04","02-480-00-EPOXY SHEET","AL1505.04-02-480-00-EPOXY SHEET","12","","14-02-2022","Dayanand","PPRAJ","2022-02-14"
"AL1505.04","01-165-00-AIR BLOWER MTG BLOCK","AL1505.04-01-165-00-AIR BLOWER MTG BLOCK","3","","10-02-2022","Dayanand","PPRAJ","2022-02-10"
"AL1505.04","04-32-00-FIXED  BEAM SPACER PLT","AL1505.04-04-32-00-FIXED  BEAM SPACER PLT","2","","03-06-2022","Dayanand","PPRAJ","2022-06-03"
"AL1505.04","03-16-00-FIXED DRIVING GEAR","AL1505.04-03-16-00-FIXED DRIVING GEAR","9","","16-02-2022","Dayanand","PPRAJ","2022-02-16"
"AL1505.04","02-160-00-SHOULDER BUSH","AL1505.04-02-160-00-SHOULDER BUSH","12","","14-02-2022","Dayanand","PPRAJ","2022-02-14"
"AL1505.04","05-150-00-CYLINDER COUPLER","AL1505.04-05-150-00-CYLINDER COUPLER","1","","03-06-2022","Dayanand","PPRAJ","2022-06-03"
"AL1505.04","03-300-00-INDEXER GUIDE PLT","AL1505.04-03-300-00-INDEXER GUIDE PLT","6","","16-02-2022","Dayanand","PPRAJ","2022-02-16"
"AL1505.04","06-010-00-V BLOCK","AL1505.04-06-010-00-V BLOCK","3","","14-02-2022","Dayanand","PPRAJ","2022-02-14"
"AL1505.04","02-310-00-COUPLER PLATE","AL1505.04-02-310-00-COUPLER PLATE","6","","14-02-2022","Dayanand","PPRAJ","2022-02-14"
"AL1505.04","05-100-00-HOUSING BOTTOM PLATE","AL1505.04-05-100-00-HOUSING BOTTOM PLATE","1","","03-06-2022","Dayanand","PPRAJ","2022-06-03"
"AL1505.04","03-150-00-SLIDE GUIDE PLATE","AL1505.04-03-150-00-SLIDE GUIDE PLATE","2","","03-06-2022","Dayanand","PPRAJ","2022-06-03"
"AL1505.04","02-240-00-SPRING CONNECTING BUSH","AL1505.04-02-240-00-SPRING CONNECTING BUSH","3","","15-02-2022","Dayanand","PPRAJ","2022-02-15"
"AL1505.04","02-069-00-EPOXY SHEET","AL1505.04-02-069-00-EPOXY SHEET","6","","14-02-2022","Dayanand","PPRAJ","2022-02-14"
"AL1505.04","03-10-00-HALLOW CYL PISTON","AL1505.04-03-10-00-HALLOW CYL PISTON","3","","16-02-2022","Dayanand","PPRAJ","2022-02-16"
"AL1505.04","02-120-00-GUIDE ROD HOLDER PLATE","AL1505.04-02-120-00-GUIDE ROD HOLDER PLATE","6","","14-02-2022","Dayanand","PPRAJ","2022-02-14"
"AL1505.04","06-220-00-CYLINDER MTG PLATE","AL1505.04-06-220-00-CYLINDER MTG PLATE","1","","29-06-2022","Dayanand","PPRAJ","2022-06-29"
"AL1505.04","05-080-00-HOUSING MTG PLATE","AL1505.04-05-080-00-HOUSING MTG PLATE","1","","03-06-2022","Dayanand","PPRAJ","2022-06-03"
"AL1505.04","03-120-00-MOTOR SUPPORT PLATE","AL1505.04-03-120-00-MOTOR SUPPORT PLATE","6","","16-02-2022","Dayanand","PPRAJ","2022-02-16"
"AL1505.04","06-07-00-PAWL","AL1505.04-06-07-00-PAWL","6","","14-02-2022","Dayanand","PPRAJ","2022-02-14"
"AL1505.04","02-270-00-ANODE ROD","AL1505.04-02-270-00-ANODE ROD","6","","14-02-2022","Dayanand","PPRAJ","2022-02-14"
"AL1505.04","05-010-00-GRIPPER CYLINDER MFG PLATE","AL1505.04-05-010-00-GRIPPER CYLINDER MFG PLATE","1","","03-06-2022","Dayanand","PPRAJ","2022-06-03"
"AL1505.04","03-200-00-COUPLER PLATE","AL1505.04-03-200-00-COUPLER PLATE","1","","03-06-2022","Dayanand","PPRAJ","2022-06-03"
"AL1505.04","07-280-00- PC SHEET HOLDER PLATE","AL1505.04-07-280-00- PC SHEET HOLDER PLATE","12","","15-02-2022","Dayanand","PPRAJ","2022-02-15"
"AL1505.04","02-066-00-LM BLOCK COVER SHEET","AL1505.04-02-066-00-LM BLOCK COVER SHEET","3","","14-02-2022","Dayanand","PPRAJ","2022-02-14"
"AL1505.04","02-71-00-REATAINER WASHER","AL1505.04-02-71-00","4","","13-06-2022","Amar","PPRAJ","2022-06-13"
"AL1505.04","04-16-00-CYLINDER STOPER PLT","AL1505.04-04-16-00-CYLINDER STOPER PLT","2","","03-06-2022","Dayanand","PPRAJ","2022-06-03"
"AL1505.04","03-06-00-SPUR GEAR 2M-75T 20PA 20FW","AL1505.04-03-06-00-SPUR GEAR 2M-75T 20PA 20FW","3","","16-02-2022","Dayanand","PPRAJ","2022-02-16"
"AL1505.04","02-530-00-CYLINDER COUPLER","AL1505.04-02-530-00-CYLINDER COUPLER","3","","14-02-2022","Dayanand","PPRAJ","2022-02-14"
"AL1505.04","05-030-00-SHAFT","AL1505.04-05-030-00-SHAFT","1","","03-06-2022","Dayanand","PPRAJ","2022-06-03"
"AL1505.04","03-270-00-SCREW PLATE","AL1505.04-03-270-00-SCREW PLATE","6","","16-02-2022","Dayanand","PPRAJ","2022-02-16"
"AL1505.04","02-620-00-CLAMP PLATE","AL1505.04-02-620-00-CLAMP PLATE","6","","14-02-2022","Dayanand","PPRAJ","2022-02-14"
"AL1505.04","05-028-00-FLYER SHAFT PULLEY","AL1505.04-05-028-00-FLYER SHAFT PULLEY","1","","03-06-2022","Dayanand","PPRAJ","2022-06-03"
"AL1505.04","03-160-00-SIDE COVER","AL1505.04-03-160-00-SIDE COVER","2","","03-06-2022","Dayanand","PPRAJ","2022-06-03"
"AL1505.04","07-220-00-COUPLER","AL1505.04-07-220-00-COUPLER","3","","15-02-2022","Dayanand","PPRAJ","2022-02-15"
"AL1505.04","02-065-00-GUIDE STIP","AL1505.04-02-065-00-GUIDE STIP","3","","14-02-2022","Dayanand","PPRAJ","2022-02-14"
"AL1505.04","04-06-00-LOADER MTG BKT","AL1505.04-04-06-00-LOADER MTG BKT","1","","03-06-2022","Dayanand","PPRAJ","2022-06-03"
"AL1505.05","02-051-00-IXR CYL CONNECTOR","AL1505.05-02-051-00","1","","03-05-2022","Amar","PPRAJ","2022-05-05"
"AL1505.05","11-140-00-MOVING FRAME HOLDER","AL1505.05-11-140-00","2","","24-05-2022","Amar","PPRAJ","2022-05-25"
"AL1505.05","02-047-00-PROFILE GUIDE TOP MTG","AL1505.05-02-047-00","2","","03-05-2022","Amar","PPRAJ","2022-05-05"
"AL1505.05","11-110-00-DIA 12 GUIDE ROD","AL1505.05-11-110-00","4","","24-05-2022","Amar","PPRAJ","2022-05-25"
"AL1505.05","06-050-00-SHEET MTG PLT","AL1505.05-06-050-00","2","","03-05-2022","Amar","PPRAJ","2022-05-05"
"AL1505.05","02-023-00-ROLLER BASE PLATE","AL1505.05-02-023-00","1","","03-05-2022","Amar","PPRAJ","2022-05-05"
"AL1505.05","02-042-00 STOPPER","AL1505.05-02-042-00","1","","03-05-2022","Amar","PPRAJ","2022-05-05"
"AL1505.05","11-130-00-MAIN COUPLER","AL1505.05-11-130-00","1","","24-05-2022","Amar","PPRAJ","2022-05-25"
"AL1505.05","02-040-00 GUIDE ROD","AL1505.05-02-040-00","2","","03-05-2022","Amar","PPRAJ","2022-05-05"
"AL1505.05","11-27-00-FIXED BEAM MTG HSG","AL1505.05-11-27-00","4","","24-05-2022","Amar","PPRAJ","2022-05-25"
"AL1505.05","05-012-00-PAPER TENTIONER TOP PLATE","AL1505.05-05-012-00","1","","03-05-2022","Amar","PPRAJ","2022-05-05"
"AL1505.05","02-020-00-ROLLER SIDE PLATE","AL1505.05-02-020-00","1","","03-05-2022","Amar","PPRAJ","2022-05-05"
"AL1505.05","02-035-00 COUPLER HOLDER","AL1505.05-02-035-00","1","","03-05-2022","Amar","PPRAJ","2022-05-05"
"AL1505.05","11-60-00-STD GUIDE ROD","AL1373.01-11-60-00","4","","24-05-2022","Amar","PPRAJ","2022-05-25"
"AL1505.05","02-037-00-HEATER RETAINER PLATE","AL1505.05-02-037-00","2","","03-05-2022","Amar","PPRAJ","2022-05-05"
"AL1505.05","11-80-00-V BLOCK GUIDE PLATE","AL1505.05-11-80-00","2","","24-05-2022","Amar","PPRAJ","2022-05-25"
"AL1505.05","04-011-00-CRADLE GUIDE","AL1505.05-04-011-00","1","","03-05-2022","Amar","PPRAJ","2022-05-05"
"AL1505.05","02-015-00 PLUNGER HSG","AL1505.05-02-015-00","1","","03-05-2022","Amar","PPRAJ","2022-05-05"
"AL1505.05","02-032-00-HEATER MTG PLATE","AL1505.05-02-032-00","1","","03-05-2022","Amar","PPRAJ","2022-05-05"
"AL1505.05","11-41-00-COMP HOLDER.SLDPRT","AL1505.05-11-41-00","2","","24-05-2022","Amar","PPRAJ","2022-05-25"
"AL1505.05","02-022-00-CYLINDER MTG PLT","AL1505.05-02-022-00","2","","03-05-2022","Amar","PPRAJ","2022-05-05"
"AL1505.05","11-021-00-CRADLE GUIDE ROD","AL1505.05-11-11-00","1","","24-05-2022","Amar","PPRAJ","2022-05-25"
"AL1505.05","04-020-00-STOPER PAD","AL1505.05-04-020-00","1","","03-05-2022","Amar","PPRAJ","2022-05-05"
"AL1505.05","02-012-00 CUTTER BLADE GUIDE-LH","AL1505.05-02-012-00","1","","03-05-2022","Amar","PPRAJ","2022-05-05"
"AL1505.05","11-31-00-CRADLE CYL CONNECTOR","AL1505.05-11-31-00","1","","24-05-2022","Amar","PPRAJ","2022-05-25"
"AL1505.05","02-050-00 INDEXER MTG BRKT","AL1505.05-02-050-00","1","","03-05-2022","Amar","PPRAJ","2022-05-05"
"AL1505.05","11-04-00-WALKING BEAM-FRONT  SIDE PLT","AL1505.05-11-04-00","1","","24-05-2022","Amar","PPRAJ","2022-05-25"
"AL1505.05","04-017-00-CRADLE CYL CONNECTOR","AL1505.05-04-017-00","1","","03-05-2022","Amar","PPRAJ","2022-05-05"
"AL1505.05","02-054-00-PAWL HOLDER","AL1505.05-02-054-00","2","","03-05-2022","Amar","PPRAJ","2022-05-05"
"AL1505.05","02-058-00 COUPLER HOLDER","AL1505.05-02-058-00","1","","01-07-2022","Amar","PPRAJ","2022-07-01"
"AL1505.05","14-070-00- LOCKING STOPPER","AL1505.05-14-070-00","1","","24-05-2022","Amar","PPRAJ","2022-05-25"
"AL1505.05","06-010-00-ROLL HOLDER L PLT","AL1505.05-06-010-00","1","","03-05-2022","Amar","PPRAJ","2022-05-05"
"AL1505.05","02-028-00-SHAFT FOR REMOVABLE ROLLER","AL1505.05-02-028-00","1","","03-05-2022","Amar","PPRAJ","2022-05-05"
"AL1505.05","02-053-00-HEATER MTG BLOCK","AL1505.05-02-053-00","1","","03-05-2022","Amar","PPRAJ","2022-05-05"
"AL1505.05","11-160-00-MAIN CYL MTG PLATE","AL1505.05-11-160-00","1","","24-05-2022","Amar","PPRAJ","2022-05-25"
"AL1505.05","04-013-00-V BLOCK ADJUSTABLE BLOCK","AL1505.05-04-013-00","1","","03-05-2022","Amar","PPRAJ","2022-05-05"
"AL1505.05","02-02-00-DEFORMER GUIDE","AL1505.05-02-02-00","1","","03-05-2022","Amar","PPRAJ","2022-05-05"
"AL1505.05","14-030-00-STOPPER BUSH","AL1505.05-14-030-00","1","","24-05-2022","Amar","PPRAJ","2022-05-25"
"AL1505.05","06-060-00-SIDE PLT FOR ROLL HOLDER","AL1505.05-06-060-00","2","","03-05-2022","Amar","PPRAJ","2022-05-05"
"AL1505.05","02-024-00-SUPPORTING BRKT","AL1505.05-02-024-00","1","","03-05-2022","Amar","PPRAJ","2022-05-05"
"AL1505.05","02-044-00-COMPONENT STOPPER","AL1505.05-02-044-00","1","","03-05-2022","Amar","PPRAJ","2022-05-05"
"AL1505.05","11-42-00-TIE SPACER PLT","AL1505.05-11-42-00","4","","24-05-2022","Amar","PPRAJ","2022-05-25"
"AL1505.05","02-043-00 GUIDE ROLLER SHEET","AL1505.05-02-043-00","2","","03-05-2022","Amar","PPRAJ","2022-05-05"
"AL1505.05","11-29-00-FIXED  BEAM-FRONT","AL1505.05-11-29-00","1","","24-05-2022","Amar","PPRAJ","2022-05-25"
"AL1505.05","05-013-00-TENSIONER RELIEF PIN","AL1505.05-05-013-00","1","","03-05-2022","Amar","PPRAJ","2022-05-05"
"AL1505.05","02-021-00-SHAFT FOR REMOVABLE ROLLER","AL1505.05-02-021-00","1","","03-05-2022","Amar","PPRAJ","2022-05-05"
"AL1505.05","02-036-00-HEATER TOP COVER","AL1505.05-02-036-00","1","","03-05-2022","Amar","PPRAJ","2022-05-05"
"AL1505.05","11-70-00-V BLOCK ADJUSTABLE BLOCK","AL1505.05-11-70-00","1","","24-05-2022","Amar","PPRAJ","2022-05-25"
"AL1505.05","11-90-00-CYLINDER STOPER PLT","AL1505.05-11-90-00","2","","24-05-2022","Amar","PPRAJ","2022-05-25"
"AL1505.05","05-010-00-BACK PLATE","AL1505.05-05-010-00","1","","03-05-2022","Amar","PPRAJ","2022-05-05"
"AL1505.05","02-016-00 GUIDE PLUNGER","AL1505.05-02-016-00","1","","03-05-2022","Amar","PPRAJ","2022-05-05"
"AL1505.05","02-033-00 CUTTER CYL MTG BRKT","AL1505.05-02-033-00","1","","03-05-2022","Amar","PPRAJ","2022-05-05"
"AL1505.05","11-01-00-FIXED  BEAM","AL1505.05-11-01-00","1","","24-05-2022","Amar","PPRAJ","2022-05-25"
"AL1505.05","02-027-00 GUIDE ROD","AL1505.05-02-027-00","2","","03-05-2022","Amar","PPRAJ","2022-05-05"
"AL1505.05","11-22-00-CONVER LOCKING PLT","AL1505.05-11-22-00","4","","24-05-2022","Amar","PPRAJ","2022-05-25"
"AL1505.05","04-041-00-CRADLE COMP STOPPER","AL1505.05-04-041-00","1","","03-05-2022","Amar","PPRAJ","2022-05-05"
"AL1505.05","02-013-00 GUIDE ROLLER","AL1505.05-02-013-00","1","","03-05-2022","Amar","PPRAJ","2022-05-05"
"AL1505.05","11-32-00-FIXED  BEAM SPACER PLT","AL1505.05-11-32-00","1","","24-05-2022","Amar","PPRAJ","2022-05-25"
"AL1505.05","02-055-00 FORM GUIDE MTG PLT","AL1505.05-02-055-00","1","","03-05-2022","Amar","PPRAJ","2022-05-05"
"AL1505.05","11-010-00 RIB PLT","AL1505.05-11-010-00","2","","24-05-2022","Amar","PPRAJ","2022-05-25"
"AL1505.05","04-018-00-CRADDLE BRKT","AL1505.05-04-018-00","1","","03-05-2022","Amar","PPRAJ","2022-05-05"
"AL1505.05","02-010-00-BASE PLATE","AL1505.05-02-010-00","1","","03-05-2022","Amar","PPRAJ","2022-05-05"
"AL1505.05","02-059-00 CUTTING BLADE","AL1505.05-02-059-00","2","","01-07-2022","Amar","PPRAJ","2022-07-01"
"AL1505.05","14-010-00- STOPPER HOLDING SHAFT","AL1505.05-14-010-00","1","","24-05-2022","Amar","PPRAJ","2022-05-25"
"AL1505.05","02-041-00 HEATER GUARDING","AL1505.05-02-041-00","1","","05-05-2022","Amar","PPRAJ","2022-05-05"
"AL1505.05","02-029-00-MALE ROLLER","AL1505.05-02-029-00","1","","03-05-2022","Amar","PPRAJ","2022-05-05"
"AL1505.05","02-048-00 COUPLER","AL1505.05-02-048-00","1","","03-05-2022","Amar","PPRAJ","2022-05-05"
"AL1505.05","11-230-00-VERTICAL CYL MTG BLOCK","AL1505.05-11-230-00","2","","24-05-2022","Amar","PPRAJ","2022-05-25"
"AL1505.05","04-014-00-V BLOCK GUIDE PLATE","AL1505.05-04-014-00","2","","03-05-2022","Amar","PPRAJ","2022-05-05"
"AL1505.05","02-03-00-INDEXER GUIDE","AL1505.05-02-03-00","1","","03-05-2022","Amar","PPRAJ","2022-05-05"
"AL1505.05","02-056-00 CUTTER BLADE GUIDE-LH","AL1505.05-02-056-00","1","","01-07-2022","Amar","PPRAJ","2022-07-01"
"AL1505.05","14-040-00-CYLINDER HOLDING SHAFT","AL1505.05-14-040-00","1","","24-05-2022","Amar","PPRAJ","2022-05-25"
"AL1505.05","06-070-00-LOCKING BUSH","AL1505.05-06-070-00","2","","03-05-2022","Amar","PPRAJ","2022-05-05"
"AL1505.05","02-025-00-FEMALE ROLLER","AL1505.05-02-025-00","1","","03-05-2022","Amar","PPRAJ","2022-05-05"
"AL1505.05","02-045-00 U PROFILE GUIDE BOTTOM","AL1505.05-02-045-00","1","","03-05-2022","Amar","PPRAJ","2022-05-05"
"AL1505.05","11-50-00-GUIDE BUSH MTG PLATE","AL1505.05-11-50-00","1","","24-05-2022","Amar","PPRAJ","2022-05-25"
"AL1505.05","02-046-00-PAPER HOLDING FORM","AL1505.05-02-046-00","2","","03-05-2022","Amar","PPRAJ","2022-05-05"
"AL1505.05","11-101-00- CYLINER COUPLER","AL1505.05-11-101-00","2","","24-05-2022","Amar","PPRAJ","2022-05-25"
"AL1505.05","06-030-00-SUPPORT ROD","AL1505.05-06-030-00","1","","03-05-2022","Amar","PPRAJ","2022-05-05"
"AL1505.05","02-017-00- DEFORMER  SPRING","AL1505.05-02-017-00","4","","03-05-2022","Amar","PPRAJ","2022-05-05"
"AL1505.05","02-038-00-PAPER PUSHER CYL MTG PLT","AL1505.05-02-038-00","1","","03-05-2022","Amar","PPRAJ","2022-05-05"
"AL1505.05","11-120-00-COUPLER HOLDER PLATE","AL1505.05-11-120-00","1","","24-05-2022","Amar","PPRAJ","2022-05-25"
"AL1505.05","11-280-00-STD GUIDE ROD Ø8","AL1505.05-11-280-00","2","","24-05-2022","Amar","PPRAJ","2022-05-25"
"AL1505.05","05-011-00-PAPER TENTIONER PLATE","AL1505.05-05-011-00","1","","03-05-2022","Amar","PPRAJ","2022-05-05"
"AL1505.05","02-019-00- SUPPORTING BRKT","AL1505.05-02-019-00","1","","03-05-2022","Amar","PPRAJ","2022-05-05"
"AL1505.05","02-034-00 COUPLER","AL1505.05-02-034-00","1","","03-05-2022","Amar","PPRAJ","2022-05-05"
"AL1505.05","11-03-00-WALKING BEAM-BACK SIDE PLT","AL1505.05-11-03-00","1","","24-05-2022","Amar","PPRAJ","2022-05-25"
"AL1505.05","02-031-00 CUTTING BLADE","AL1505.05-02-031-00","2","","03-05-2022","Amar","PPRAJ","2022-05-05"
"AL1505.05","11-23-00-L PLATE","AL1505.05-11-23-00","4","","24-05-2022","Amar","PPRAJ","2022-05-25"
"AL1505.05","04-010-00-COMP HOLDER","AL1505.05-04-010-00","2","","03-05-2022","Amar","PPRAJ","2022-05-05"
"AL1505.05","02-014-00 CUTTER BLADE GUIDE-RH","AL1505.05-02-014-00","1","","03-05-2022","Amar","PPRAJ","2022-05-05"
"AL1505.05","02-030-00-TENSTIONER PLATE","AL1505.05-02-030-00","1","","03-05-2022","Amar","PPRAJ","2022-05-05"
"AL1505.05","11-33-00-FIXED  BEAM SPACER PLT","AL1505.05-11-33-00","1","","24-05-2022","Amar","PPRAJ","2022-05-25"
"AL1505.05","02-018-00 GUIDE ROD","AL1505.05-02-018-00","2","","03-05-2022","Amar","PPRAJ","2022-05-05"
"AL1505.05","11-020-00 BASE PLATE SUPPORT","AL1505.05-11-020-00","1","","24-05-2022","Amar","PPRAJ","2022-05-25"
"AL1505.05","04-019-00-STOPER BRKT","AL1505.05-04-019-00","1","","03-05-2022","Amar","PPRAJ","2022-05-05"
"AL1505.05","02-011-00-COMPONENT HOLDER","AL1505.05-02-011-00","1","","03-05-2022","Amar","PPRAJ","2022-05-05"
"AL1505.05","14-020-00-SHAFT  MTG BLOCK","AL1505.05-14-020-00","1","","24-05-2022","Amar","PPRAJ","2022-05-25"
"AL1505.05","11-030-00-NEW CONVEYOR BASE PLATE","AL1505.05-11-030-00","1","","24-05-2022","Amar","PPRAJ","2022-05-25"
"AL1505.05","02-049-00-PROFILE GUIDE MTG BRKT","AL1505.05-02-049-00","1","","03-05-2022","Amar","PPRAJ","2022-05-05"
"AL1505.05","11-270-00-BRACKET GUIDE PLATE","AL1505.05-11-270-00","2","","24-05-2022","Amar","PPRAJ","2022-05-25"
"AL1505.05","04-015-00-STD GUIDE ROD Ø8","AL1505.05-04-015-00","2","","03-05-2022","Amar","PPRAJ","2022-05-05"
"AL1505.05","02-052-00-PAWL","AL1505.05-02-052-00","2","","03-05-2022","Amar","PPRAJ","2022-05-05"
"AL1505.05","02-057-00 CUTTER BLADE GUIDE-RH","AL1505.05-02-057-00","1","","01-07-2022","Amar","PPRAJ","2022-07-01"
"AL1505.05","14-060-00-PART SENSOR MTG PLATE","AL1505.05-14-060-00","1","","24-05-2022","Amar","PPRAJ","2022-05-25"
"AL1505.05","06-080-00-PAPER ROLLER BUSH","AL1505.05-06-080-00","1","","03-05-2022","Amar","PPRAJ","2022-05-05"
"AL1505.05","02-026-00 TOP MTG BRKT","AL1505.05-02-026-00","1","","03-05-2022","Amar","PPRAJ","2022-05-05"
"AL1520.08","02-131-00-SADDLE TOOL BASE","AL1520.08-02-131-00-SADDLE TOOL BASE","5","","23-06-2022","Dayanand","PPRAJ","2022-06-23"
"AL1520.08","02-282-00-SLIDE COVER - RH","AL1520.08-02-282-00-SLIDE COVER - RH","5","","23-06-2022","Dayanand","PPRAJ","2022-06-23"
"AL1520.08","02-124-00-BALL SCREW SPACER OUTER RING","AL1520.08-02-124-00-BALL SCREW SPACER OUTER RING","10","","23-06-2022","Dayanand","PPRAJ","2022-06-23"
"AL1520.08","02-390-00-SERVO MOTOR COVER","AL1520.08-02-390-00-SERVO MOTOR COVER","5","","23-06-2022","Dayanand","PPRAJ","2022-06-23"
"AL1520.08","02-123-00-BALL SCREW SPACER INNER RING","AL1520.08-02-123-00-BALL SCREW SPACER INNER RING","10","","23-06-2022","Dayanand","PPRAJ","2022-06-23"
"AL1520.08","02-210-00-TOOL HOLDER CLAMP","AL1520.08-02-210-00-TOOL HOLDER CLAMP","10","","23-06-2022","Dayanand","PPRAJ","2022-06-23"
"AL1520.08","02-590-00-TOOL BUTTING PLATE","AL1520.08-02-590-00-TOOL BUTTING PLATE","10","","23-06-2022","Dayanand","PPRAJ","2022-06-23"
"AL1520.08","02-190-00-TOOL HOLDER PIN","AL1520.08-02-190-00-TOOL HOLDER PIN","20","","23-06-2022","Dayanand","PPRAJ","2022-06-23"
"AL1520.08","02-730-00-wiper for slide","AL1520.08-02-730-00-wiper for slide","5","","23-06-2022","Dayanand","PPRAJ","2022-06-23"
"AL1520.08","02-160-00-COUPLER COVER SHEET","AL1520.08-02-160-00-COUPLER COVER SHEET","5","","23-06-2022","Dayanand","PPRAJ","2022-06-23"
"AL1520.08","02-100-00-SHAFT SPCR","AL1520-08-100-00-SHAFT SPCR","20","","23-06-2022","Dayanand","PPRAJ","2022-06-23"
"AL1520.08","02-134-00-LIMIT SWITH MTG BLOCK","AL1520.08-02-134-00-LIMIT SWITH MTG BLOCK","5","","23-06-2022","Dayanand","PPRAJ","2022-06-23"
"AL1520.08","02-770-00-BALL NUT SPACER","AL1520.08-02-770-00-BALL NUT SPACER","5","","23-06-2022","Dayanand","PPRAJ","2022-06-23"
"AL1520.08","02-127-00-BACK COVER","AL1520.08-02-127-00-BACK COVER","5","","23-06-2022","Dayanand","PPRAJ","2022-06-23"
"AL1520.08","02-130- Z AXIS READER SW MTG PROFILE","AL1520.08-02-130- Z AXIS READER SW MTG PROFILE","5","","23-06-2022","Dayanand","PPRAJ","2022-06-23"
"AL1520.08","02-041-00-SLIDE BLOCK","AL1520.08-02-041-00-SLIDE BLOCK","5","","23-06-2022","Dayanand","PPRAJ","2022-06-23"
"AL1520.08","02-042-00-DOVETAIL BLOCK","AL1520.08-02-042-00-DOVETAIL BLOCK","5","","23-06-2022","Dayanand","PPRAJ","2022-06-23"
"AL1520.08","02-260-00-TOOL POST BACK DUST COVER","AL1520.08-02-260-00-TOOL POST BACK DUST COVER","5","","23-06-2022","Dayanand","PPRAJ","2022-06-23"
"AL1520.08","02-600-00-MOTOR BRCKT SPACER","AL1520.08-02-600-00-MOTOR BRCKT SPACER","5","","23-06-2022","Dayanand","PPRAJ","2022-06-23"
"AL1520.08","02-740-00-SLIDE STOPPER PLATE","AL1520.08-02-740-00-SLIDE STOPPER PLATE","10","","23-06-2022","Dayanand","PPRAJ","2022-06-23"
"AL1520.08","02-310-00-MOTOR MTG BRACKET","AL1520.08-02-310-00-MOTOR MTG BRACKET","10","","23-06-2022","Dayanand","PPRAJ","2022-06-23"
"AL1520.08","02-170-00-BALL SCREW STOPPER","AL1520.08-02-170-00-BALL SCREW STOPPER","5","","23-06-2022","Dayanand","PPRAJ","2022-06-23"
"AL1520.08","02-110-00-MATCH PAIR BEARING RETAINER","AL1520.08-02-110-00-MATCH PAIR BEARING RETAINER","10","","23-06-2022","Dayanand","PPRAJ","2022-06-23"
"AL1520.08","02-140-00-SADDLE GIB","AL1520.08-02-140-00-SADDLE GIB","5","","23-06-2022","Dayanand","PPRAJ","2022-06-23"
"AL1520.08","02-10-00-SLIDE BASE PLATE","AL1520.08-02-10-00-SLIDE BASE PLATE","5","","23-06-2022","Dayanand","PPRAJ","2022-06-23"
"AL1520.08","02-350-00-X AXIS READER SW MTG PROFILE","AL1520.08-02-350-00-X AXIS READER SW MTG PROFILE","5","","23-06-2022","Dayanand","PPRAJ","2022-06-23"
"AL1520.08","02-380-00-BALL SCREW NUT HSG SPACER","AL1520.08-02-380-00-BALL SCREW NUT HSG SPACER","5","","23-06-2022","Dayanand","PPRAJ","2022-06-23"
"AL1520.08","02-281-00-COVER MTG PLATE","AL1520.08-02-281-00-COVER MTG PLATE","5","","23-06-2022","Dayanand","PPRAJ","2022-06-23"
"AL1520.08","02-330-00-L PLATE FOR LIMIT SWITCH","AL1520.08-02-330-00-L PLATE FOR LIMIT SWITCH","10","","23-06-2022","Dayanand","PPRAJ","2022-06-23"
"AL1520.08","02-280-00-BALL SCREW DUST COVER","AL1520.08-02-280-00-BALL SCREW DUST COVER","5","","23-06-2022","Dayanand","PPRAJ","2022-06-23"
"AL1520.08","02-120-00-TOOL POST BASE","AL1520.08-02-120-00-TOOL POST BASE","5","","23-06-2022","Dayanand","PPRAJ","2022-06-23"
"AL1520.08","02-200-00-TOOL HOLDER","AL1520.08-02-200-00-TOOL HOLDER","10","","23-06-2022","Dayanand","PPRAJ","2022-06-23"
"AL1520.08","02-320-LIMIT SWITCH MTG PLT Z AXIS","AL1520.08-02-320-LIMIT SWITCH MTG PLT Z AXIS","5","","23-06-2022","Dayanand","PPRAJ","2022-06-23"
"AL1520.08","02-180-00-SPACER PLATE","AL1520.08-02-180-00-SPACER PLATE","5","","23-06-2022","Dayanand","PPRAJ","2022-06-23"
"AL1520.08","02-283-00-SLIDE COVER LH","AL1520.08-02-283-00-SLIDE COVER LH","5","","23-06-2022","Dayanand","PPRAJ","2022-06-23"
"AL1520.08","02-150-00-NUT HSG FOR X-AXIS","AL1520.08-02-150-00-NUT HSG FOR X-AXIS","5","","23-06-2022","Dayanand","PPRAJ","2022-06-23"
"AL1520.08","02-030-00-TOOL HOLDER SPACER","AL1520.08-02-030-00-TOOL HOLDER SPACER","5","","23-06-2022","Dayanand","PPRAJ","2022-06-23"
"AL1520.08","02-360-00-LIMIT SWITCH PROFILE SPACER","AL1520.08-02-360-00-LIMIT SWITCH PROFILE SPACER","5","","23-06-2022","Dayanand","PPRAJ","2022-06-23"
"ASTW1475","05-021-00 CERAMIC ROLLER MTG PLT","ASTW1475-05-021-00","2","","10-11-2021","Nitish","PPRAJ","2021-11-24"
"ASTW1475","03-015-00- RH PILLAR WELDMENT WITH GUSSET","ASTW1475-03-015-00","2","","09-11-2021","Nitish","PPRAJ","2021-11-24"
"ASTW1475","02-035-00-HOLDING PLATE","ASTW1475-02-035-00","2","","09-11-2021","Nitish","PPRAJ","2021-11-24"
"ASTW1475","06-013-00-CYLINDER MOVEMENT PLATE","ASTW1475-06-013-00","8","","10-11-2021","Nitish","PPRAJ","2021-11-24"
"ASTW1475","03-033-00- CYLINDER COUPLER","ASTW1475-03-033-00","2","","10-11-2021","Nitish","PPRAJ","2021-11-24"
"ASTW1475","03-037-00 RETAINER FOR LM BLOCK","ASTW1475-03-037-00","4","","10-11-2021","Nitish","PPRAJ","2021-11-24"
"ASTW1475","02-050-00-BELT PULLEY","ASTW1475-02-050-00","4","","09-11-2021","Nitish","PPRAJ","2021-11-24"
"ASTW1475","03-034-00-GRIPPER","ASTW1475-03-034-00","8","","19-02-2022","Nitish","PPRAJ","2022-02-19"
"ASTW1475","05-020-00 WIRE GUIDE MTG PLT","ASTW1475-05-020-00","4","","10-11-2021","Nitish","PPRAJ","2021-11-24"
"ASTW1475","03-099-00-CLAMPING BUSH","ASTW1475-03-099-00","4","","10-11-2021","Nitish","PPRAJ","2021-11-24"
"ASTW1475","02-014-00-TOP CLAMP","ASTW1475-02-014-00","2","","09-11-2021","Nitish","PPRAJ","2021-11-24"
"ASTW1475","05-017-00-VERTICAL ROD","ASTW1475-05-017-00","4","","10-11-2021","Nitish","PPRAJ","2021-11-24"
"ASTW1475","03-086-00-LH LM RAIL SUPPORT BOTTOM PLATE","ASTW1475-03-086-00","2","","10-11-2021","Nitish","PPRAJ","2021-11-24"
"ASTW1475","02-031-00-ROD DRIVEN PLATE","ASTW1475-02-031-00","2","","09-11-2021","Nitish","PPRAJ","2021-11-24"
"ASTW1475","06-010-00-BOTTOM GRIPPER MTG PLATE","ASTW1475-06-010-00","2","","10-11-2021","Nitish","PPRAJ","2021-11-24"
"ASTW1475","03-019-00-CPLATE","ASTW1475-03-019-00","2","","09-11-2021","Nitish","PPRAJ","2021-11-24"
"ASTW1475","02-048-00-BOTTOM SENSORE PLATE","ASTW1475-02-048-00","2","","09-11-2021","Nitish","PPRAJ","2021-11-24"
"ASTW1475","03-020-00-TOP FIXTURE","ASTW1475-03-020-00","4","","19-02-2022","Nitish","PPRAJ","2022-02-19"
"ASTW1475","08-022-00-MOP BOX STOPPER","ASTW1475-08-022-00","2","","11-11-2021","Nitish","PPRAJ","2021-11-24"
"ASTW1475","05-031-00 RUBBER BUSH","ASTW1475-05-031-00","16","","10-11-2021","Nitish","PPRAJ","2021-11-24"
"ASTW1475","03-025-00-CLYDER SLDG MTG PLATE","ASTW1475-03-025-00","2","","10-11-2021","Nitish","PPRAJ","2021-11-24"
"ASTW1475","02-011-00-GUIDE BUSH","ASTW1475-02-011-00","8","","09-11-2021","Nitish","PPRAJ","2021-11-24"
"ASTW1475","05-012-00-MTG BAR","ASTW1475-05-012-00","4","","10-11-2021","Nitish","PPRAJ","2021-11-24"
"ASTW1475","03-027-00-CYLINDER CONNETING PLTR1","ASTW1475-03-027-00","2","","10-11-2021","Nitish","PPRAJ","2021-11-24"
"ASTW1475","02-029-00-FLYER ARM D2 ROLLER","ASTW1475-02-029-00","32","","24-11-2021","Nitish","PPRAJ","2021-11-24"
"ASTW1475","05-032-00-BRG HSG","ASTW1475-05-032-00","8","","10-11-2021","Nitish","PPRAJ","2021-11-24"
"ASTW1475","03-073-00 SPACER FOR BACK SIDE JAW INSERTION","ASTW1475-03-073-00","4","","10-11-2021","Nitish","PPRAJ","2021-11-24"
"ASTW1475","02-045-00-TOP MOUNTING PLATE","ASTW1475-02-045-00","2","","09-11-2021","Nitish","PPRAJ","2021-11-24"
"ASTW1475","07-016-00-CYLINDER SPACER","ASTW1475-07-016-00","4","","11-11-2021","Nitish","PPRAJ","2021-11-24"
"ASTW1475","04-014-00 DRIVER PULLEY","ASTW1475-04-014-00","4","","10-11-2021","Nitish","PPRAJ","2021-11-24"
"ASTW1475","03-080-00 SENSOR BRACKET","ASTW1475-03-080-00","4","","10-11-2021","Nitish","PPRAJ","2021-11-24"
"ASTW1475","02-061-00-RETAINER PLATE","ASTW1475-02-061-00","8","","09-11-2021","Nitish","PPRAJ","2021-11-24"
"ASTW1475","03-101-00-WINDING FORM","ASTW1475-03-101-00","16","","19-02-2022","Nitish","PPRAJ","2022-02-19"
"ASTW1475","05-043-00 WIRE GUIDE CLAMP","ASTW1475-05-043-00","4","","10-11-2021","Nitish","PPRAJ","2021-11-24"
"ASTW1475","03-016-00-LH PILLAR WELDMENT WITH GUSSET","ASTW1475-03-016-00","2","","17-11-2021","Nitish","PPRAJ","2021-11-24"
"ASTW1475","02-019-00-BEARING RETAINER PLT","ASTW1475-02-019-00","4","","09-11-2021","Nitish","PPRAJ","2021-11-24"
"ASTW1475","05-027-00-WIRE HOLDER PLT","ASTW1475-05-027-00","10","","10-11-2021","Nitish","PPRAJ","2021-11-24"
"ASTW1475","03-031-00-SUPPORT PLATE","ASTW1475-03-031-00","4","","10-11-2021","Nitish","PPRAJ","2021-11-24"
"ASTW1475","02-042-00-CAM ROTATING SHAFT","ASTW1475-02-042-00","2","","09-11-2021","Nitish","PPRAJ","2021-11-24"
"ASTW1475","06-023-00 WIRE GRIPPER","ASTW1475-06-023-00","8","","11-11-2021","Nitish","PPRAJ","2021-11-24"
"ASTW1475","04-012-00-MOTOR PLATE","ASTW1475-04-012-00","2","","10-11-2021","Nitish","PPRAJ","2021-11-24"
"ASTW1475","03-060-00-COUPLER PLATE A","ASTW1475-03-060-00","2","","10-11-2021","Nitish","PPRAJ","2021-11-24"
"ASTW1475","02-058-00-BEARING RETAINER PLATE","ASTW1475-02-058-00","2","","09-11-2021","Nitish","PPRAJ","2021-11-24"
"ASTW1475","03-093-00-SPACER PLATE-2","ASTW1475-03-093-00","4","","19-02-2022","Nitish","PPRAJ","2022-02-19"
"ASTW1475","05-028-00-SPACER & GUIDE PIN","ASTW1475-05-028-00","20","","10-11-2021","Nitish","PPRAJ","2021-11-24"
"ASTW1475","03-070-00-BACK JAWS MOVING WELDMENT","ASTW1475-03-070-00","4","","10-11-2021","Nitish","PPRAJ","2021-11-24"
"ASTW1475","02-039-00-GUIDE PIN FOR MOVEMENT","ASTW1475-02-039-00","8","","09-11-2021","Nitish","PPRAJ","2021-11-24"
"ASTW1475","06-020-00 WIRE HOLDING PLATE","ASTW1475-06-020-00","16","","11-11-2021","Nitish","PPRAJ","2021-11-24"
"ASTW1475","03-058-00-GUIDE ROD A","ASTW1475-03-058-00","4","","10-11-2021","Nitish","PPRAJ","2021-11-24"
"ASTW1475","03-011-00-PILLER MMNT CPLR","ASTW1475-03-011-00","2","","09-11-2021","Nitish","PPRAJ","2021-11-24"
"ASTW1475","02-055-00-GUIDE ROD","ASTW1475-02-055-00","4","","09-11-2021","Nitish","PPRAJ","2021-11-24"
"ASTW1475","03-053-00-GRIPPER PIN","ASTW1475-03-053-00","20","","19-02-2022","Nitish","PPRAJ","2022-02-19"
"ASTW1475","05-037-00-SPRING CONNECTOR","ASTW1475-05-037-00","8","","10-11-2021","Nitish","PPRAJ","2021-11-24"
"ASTW1475","03-046-00- FEEDER UNIT MTG BRKT","ASTW1475-03-046-00","4","","10-11-2021","Nitish","PPRAJ","2021-11-24"
"ASTW1475","02-018-00-WIER GUIDE BUSH","ASTW1475-02-018-00","4","","09-11-2021","Nitish","PPRAJ","2021-11-24"
"ASTW1475","05-022-00 ROD FOR SPRING MTG","ASTW1475-05-022-00","8","","10-11-2021","Nitish","PPRAJ","2021-11-24"
"ASTW1475","03-017-00-ROD","ASTW1475-03-017-00","4","","09-11-2021","Nitish","PPRAJ","2021-11-24"
"ASTW1475","02-036-00-ROTATING SUPPORT PLATE","ASTW1475-02-036-00","2","","09-11-2021","Nitish","PPRAJ","2021-11-24"
"ASTW1475","06-017-00-CYLINDER COUPLERR1","ASTW1475-06-017-00","8","","11-11-2021","Nitish","PPRAJ","2021-11-24"
"ASTW1475","03-056-00 CYLINDER COUPLER","ASTW1475-03-056-00","2","","10-11-2021","Nitish","PPRAJ","2021-11-24"
"ASTW1475","03-039-00 LOADING COUPLER","ASTW1475-03-039-00","2","","10-11-2021","Nitish","PPRAJ","2021-11-24"
"ASTW1475","02-052-00-BEARING RETAINER PLATE","ASTW1475-02-052-00","2","","09-11-2021","Nitish","PPRAJ","2021-11-24"
"ASTW1475","03-041-00-COMP HOLDER BASE PLTR1","ASTW1475-03-041-00","8","","19-02-2022","Nitish","PPRAJ","2022-02-19"
"ASTW1475","03-057-00- CYLINDER COUPLER","ASTW1475-03-057-00","2","","24-11-2021","Nitish","PPRAJ","2021-11-24"
"ASTW1475","05-034-00-ROCKER SHAFT","ASTW1475-05-034-00","8","","10-11-2021","Nitish","PPRAJ","2021-11-24"
"ASTW1475","03-044-00-PLATE1","ASTW1475-03-044-00","2","","10-11-2021","Nitish","PPRAJ","2021-11-24"
"ASTW1475","02-015-00-BEARING LOCK BUSH","ASTW1475-02-015-00","8","","09-11-2021","Nitish","PPRAJ","2021-11-24"
"ASTW1475","05-018-00-TENSIONER MTG PLATE","ASTW1475-05-018-00","2","","10-11-2021","Nitish","PPRAJ","2021-11-24"
"ASTW1475","03-087-00-RH LM FIXTURE SUPPORT BOTTOM PLATE","ASTW1475-03-087-00","2","","10-11-2021","Nitish","PPRAJ","2021-11-24"
"ASTW1475","02-032-00-CAM ROTATING PLATE","ASTW1475-02-032-00","2","","09-11-2021","Nitish","PPRAJ","2021-11-24"
"ASTW1475","06-011-00-MOUNTING PLATE","ASTW1475-06-011-00","8","","10-11-2021","Nitish","PPRAJ","2021-11-24"
"ASTW1475","03-021-00-M10x1.25 CYLINDER COUPLER","ASTW1475-03-021-00","8","","09-11-2021","Nitish","PPRAJ","2021-11-24"
"ASTW1475","02-049-00-TOP SENSORE PLATE","ASTW1475-02-049-00","2","","09-11-2021","Nitish","PPRAJ","2021-11-24"
"ASTW1475","03-028-00- FRONT JAW LOCATER","ASTW1475-03-028-00","4","","19-02-2022","Nitish","PPRAJ","2022-02-19"
"ASTW1475","08-024-00-ENCLOSER BRACKET","ASTW1475-08-024-00","4","","24-11-2021","Nitish","PPRAJ","2021-11-24"
"ASTW1475","05-015-00-BTM CLAMP","ASTW1475-05-015-00","4","","10-11-2021","Nitish","PPRAJ","2021-11-24"
"ASTW1475","03-026-00-RAIL HOLDING PLATE","ASTW1475-03-026-00","2","","10-11-2021","Nitish","PPRAJ","2021-11-24"
"ASTW1475","02-012-00-GUIDE ROD DIA 20","ASTW1475-02-012-00","4","","09-11-2021","Nitish","PPRAJ","2021-11-24"
"ASTW1475","05-014-00-BTM ROD HOLDER","ASTW1475-05-014-00","4","","10-11-2021","Nitish","PPRAJ","2021-11-24"
"ASTW1475","03-049-00 SPACER ON LM BLOCK OF FED-UNIT","ASTW1475-03-049-00","4","","10-11-2021","Nitish","PPRAJ","2021-11-24"
"ASTW1475","02-023-00-HOUSING COVER","ASTW1475-02-023-00","2","","09-11-2021","Nitish","PPRAJ","2021-11-24"
"ASTW1475","05-033-00-BRG HSG","ASTW1475-05-033-00","16","","10-11-2021","Nitish","PPRAJ","2021-11-24"
"ASTW1475","03-074-00 NYLON STOPPER","ASTW1475-03-074-00","8","","10-11-2021","Nitish","PPRAJ","2021-11-24"
"ASTW1475","02-046-00-BOTTOM RETAINER PLATE","ASTW1475-02-046-00","2","","09-11-2021","Nitish","PPRAJ","2021-11-24"
"ASTW1475","07-025-00-TOPPLATE","ASTW1475-07-025-00","2","","11-11-2021","Nitish","PPRAJ","2021-11-24"
"ASTW1475","04-010-00-MOTOR MOUNTING PLATE","ASTW1475-04-010-00","2","","10-11-2021","Nitish","PPRAJ","2021-11-24"
"ASTW1475","03-090-00- CYLINDER COUPLER TOP","ASTW1475-03-090-00","2","","10-11-2021","Nitish","PPRAJ","2021-11-24"
"ASTW1475","02-063-00-SHAFT RETAINER PLATE","ASTW1475-02-063-00","2","","09-11-2021","Nitish","PPRAJ","2021-11-24"
"ASTW1475","03-102-00-PAPER CLAMP","ASTW1475-03-102-00","16","","19-02-2022","Nitish","PPRAJ","2022-02-19"
"ASTW1475","05-010-00-MTG GUIDE ROD","ASTW1475-05-010-00","2","","10-11-2021","Nitish","PPRAJ","2021-11-24"
"ASTW1475","03-012-00-BASE PLATE","ASTW1475-03-012-00","2","","09-11-2021","Nitish","PPRAJ","2021-11-24"
"ASTW1475","02-020-00-SHAFT CLAMP","ASTW1475-02-020-00","4","","09-11-2021","Nitish","PPRAJ","2021-11-24"
"ASTW1475","05-013-00-TOP MTG PLATE","ASTW1475-05-013-00","4","","10-11-2021","Nitish","PPRAJ","2021-11-24"
"ASTW1475","03-084-00-RH LM FIXTURE SUPPORT BOTTOM PLATE","ASTW1475-03-084-00","2","","10-11-2021","Nitish","PPRAJ","2021-11-24"
"ASTW1475","02-043-00-SPACER BEARING","ASTW1475-02-043-00","2","","09-11-2021","Nitish","PPRAJ","2021-11-24"
"ASTW1475","06-015-00-CUTTER MTG PLTE FOR BOTTOM -RH","ASTW1475-06-015-00","4","","11-11-2021","Nitish","PPRAJ","2021-11-24"
"ASTW1475","04-016-00 SCREW MTG PLT","ASTW1475-04-016-00","2","","10-11-2021","Nitish","PPRAJ","2021-11-24"
"ASTW1475","03-061-00-COUPLER PLATE B","ASTW1475-03-061-00","2","","10-11-2021","Nitish","PPRAJ","2021-11-24"
"ASTW1475","02-059-00-WASHER","ASTW1475-02-059-00","2","","09-11-2021","Nitish","PPRAJ","2021-11-24"
"ASTW1475","03-094-00- LONG GRIPPER","ASTW1475-03-094-00","8","","19-02-2022","Nitish","PPRAJ","2022-02-19"
"ASTW1475","05-029-00-SPACER","ASTW1475-05-029-00","16","","10-11-2021","Nitish","PPRAJ","2021-11-24"
"ASTW1475","03-071-00-BACK JAW CYLINDER MOUNTING PLATE","ASTW1475-03-071-00","4","","10-11-2021","Nitish","PPRAJ","2021-11-24"
"ASTW1475","02-040-00 WASHER","ASTW1475-02-040-00","4","","09-11-2021","Nitish","PPRAJ","2021-11-24"
"ASTW1475","06-021-00 WIRE HLDNG PLT LH","ASTW1475-06-021-00","16","","11-11-2021","Nitish","PPRAJ","2021-11-24"
"ASTW1475","03-036-00 SPACER FOR FRONT JAW INSERTION","ASTW1475-03-036-00","4","","10-11-2021","Nitish","PPRAJ","2021-11-24"
"ASTW1475","03-047-00-PLATE-LH","ASTW1475-03-047-00","2","","10-11-2021","Nitish","PPRAJ","2021-11-24"
"ASTW1475","02-056-00-CENTRE GUIDE BUSH","ASTW1475-02-056-00","2","","09-11-2021","Nitish","PPRAJ","2021-11-24"
"ASTW1475","03-066-00-JAW LOCATER","ASTW1475-03-066-00","4","","19-02-2022","Nitish","PPRAJ","2022-02-19"
"ASTW1475","05-038-00-ROCKER ARM","ASTW1475-05-038-00","8","","10-11-2021","Nitish","PPRAJ","2021-11-24"
"ASTW1475","03-065-00 RH LM FIXTURE SUPPORT STOPPER PLATE","ASTW1475-03-065-00","4","","10-11-2021","Nitish","PPRAJ","2021-11-24"
"ASTW1475","02-066-00-SPAR GEAR BACK PLATE","ASTW1475-02-066-00","2","","09-11-2021","Nitish","PPRAJ","2021-11-24"
"ASTW1475","05-024-00-TENSIONER SUPPORT","ASTW1475-05-024-00","8","","10-11-2021","Nitish","PPRAJ","2021-11-24"
"ASTW1475","03-054-00- CYLINDER COUPLER","ASTW1475-03-054-00","2","","10-11-2021","Nitish","PPRAJ","2021-11-24"
"ASTW1475","02-037-00-DRIVE ROD","ASTW1475-02-037-00","2","","09-11-2021","Nitish","PPRAJ","2021-11-24"
"ASTW1475","06-018-00 GRIPPER","ASTW1475-06-018-00","8","","11-11-2021","Nitish","PPRAJ","2021-11-24"
"ASTW1475","03-076-00-BACK JAW Y AXIS BASE PLATE","ASTW1475-03-076-00","4","","10-11-2021","Nitish","PPRAJ","2021-11-24"
"ASTW1475","03-040-00- CYLINDER COUPLER","ASTW1475-03-040-00","2","","10-11-2021","Nitish","PPRAJ","2021-11-24"
"ASTW1475","02-024-00-OIL STORAGE SHEET","ASTW1475-02-024-00","4","","09-11-2021","Nitish","PPRAJ","2021-11-24"
"ASTW1475","03-042-00 STOPPER PLATE","ASTW1475-03-042-00","8","","19-02-2022","Nitish","PPRAJ","2022-02-19"
"ASTW1475","03-069-00-M10X1.25 COUPLER PLATE","ASTW1475-03-069-00","4","","24-11-2021","Nitish","PPRAJ","2021-11-24"
"ASTW1475","05-035-00-BEARING SPACER","ASTW1475-05-035-00","8","","10-11-2021","Nitish","PPRAJ","2021-11-24"
"ASTW1475","03-064-00 TENON","ASTW1475-03-064-00","4","","10-11-2021","Nitish","PPRAJ","2021-11-24"
"ASTW1475","02-065-00-SPACER","ASTW1475-02-065-00","4","","09-11-2021","Nitish","PPRAJ","2021-11-24"
"ASTW1475","05-019-00-SPRING HOLDER","ASTW1475-05-019-00","2","","10-11-2021","Nitish","PPRAJ","2021-11-24"
"ASTW1475","03-088-00 LM RAIL MTG","ASTW1475-03-088-00","4","","10-11-2021","Nitish","PPRAJ","2021-11-24"
"ASTW1475","02-033-00-ADJUSTABLE PLATE","ASTW1475-02-033-00","2","","09-11-2021","Nitish","PPRAJ","2021-11-24"
"ASTW1475","06-012-00-CYLINDER MOUNTING PLATE","ASTW1475-06-012-00","8","","10-11-2021","Nitish","PPRAJ","2021-11-24"
"ASTW1475","03-032-00-RAIL HOLDING PLATE-1","ASTW1475-03-032-00","2","","10-11-2021","Nitish","PPRAJ","2021-11-24"
"ASTW1475","03-022-00-COUPLER PLATE","ASTW1475-03-022-00","2","","09-11-2021","Nitish","PPRAJ","2021-11-24"
"ASTW1475","03-031-00-SUPPORT PLATE","ASTW1475-03-031-00","4","","19-02-2022","Nitish","PPRAJ","2022-02-19"
"ASTW1475","08-023-00-MOP BOX SLIDE STOPPER","ASTW1475-08-023-00","4","","11-11-2021","Nitish","PPRAJ","2021-11-24"
"ASTW1475","05-030-00-SPACER","ASTW1475-05-030-00","20","","10-11-2021","Nitish","PPRAJ","2021-11-24"
"ASTW1475","03-096-00-M10x1.25 JAW COUPLER","ASTW1475-03-096-00","4","","10-11-2021","Nitish","PPRAJ","2021-11-24"
"ASTW1475","02-013-00-BEARING HOUSING PLT RH","ASTW1475-02-013-00","4","","09-11-2021","Nitish","PPRAJ","2021-11-24"
"ASTW1475","05-023-00 WIRE GUIDE MTG PLT","ASTW1475-05-023-00","4","","10-11-2021","Nitish","PPRAJ","2021-11-24"
"ASTW1475","03-072-00 SENSOR BRACKET","ASTW1475-03-072-00","16","","10-11-2021","Nitish","PPRAJ","2021-11-24"
"ASTW1475","02-030-00 WIRE GUIDE BRKT","ASTW1475-02-030-00","12","","09-11-2021","Nitish","PPRAJ","2021-11-24"
"ASTW1475","06-014-00-CUTTER MTG PLTE FOR BOTTOM","ASTW1475-06-014-00","4","","11-11-2021","Nitish","PPRAJ","2021-11-24"
"ASTW1475","03-018-00-FIXTURE HOLDER PLATE","ASTW1475-03-018-00","2","","09-11-2021","Nitish","PPRAJ","2021-11-24"
"ASTW1475","02-047-00-DRIVE TAPER LOCK","ASTW1475-02-047-00","4","","09-11-2021","Nitish","PPRAJ","2021-11-24"
"ASTW1475","02-034-00 NOZZLE ROD (0.65)","ASTW1475-02-034-00","4","","19-02-2022","Nitish","PPRAJ","2022-02-19"
"ASTW1475","07-026-00-SUPPORT PLATE","ASTW1475-07-026-00","4","","11-11-2021","Nitish","PPRAJ","2021-11-24"
"ASTW1475","04-015-00 SCREW JACK","ASTW1475-04-015-00","2","","10-11-2021","Nitish","PPRAJ","2021-11-24"
"ASTW1475","03-095-00 COUPLER 02","ASTW1475-03-095-00","2","","10-11-2021","Nitish","PPRAJ","2021-11-24"
"ASTW1475","02-010-00-CAM HOUSING","ASTW1475-02-010-00","2","","09-11-2021","Nitish","PPRAJ","2021-11-24"
"ASTW1475","03-097-00-TOP COMPONENT HOLDER","ASTW1475-03-097-00","4","","19-02-2022","Nitish","PPRAJ","2022-02-19"
"ASTW1475","05-011-00-BTM MTG PLATE","ASTW1475-05-011-00","4","","10-11-2021","Nitish","PPRAJ","2021-11-24"
"ASTW1475","03-014-00-SUPPORT PLATE","ASTW1475-03-014-00","2","","09-11-2021","Nitish","PPRAJ","2021-11-24"
"ASTW1475","02-022-00-HOUSING COVER","ASTW1475-02-022-00","4","","09-11-2021","Nitish","PPRAJ","2021-11-24"
"ASTW1475","05-016-00-VERTICAL ROD HOLDER","ASTW1475-05-016-00","4","","10-11-2021","Nitish","PPRAJ","2021-11-24"
"ASTW1475","03-085-00 LH LM RAIL SUPPORT PLATE","ASTW1475-03-085-00","2","","10-11-2021","Nitish","PPRAJ","2021-11-24"
"ASTW1475","02-044-00-OIL RETAINER COVER","ASTW1475-02-044-00","2","","09-11-2021","Nitish","PPRAJ","2021-11-24"
"ASTW1475","06-016-00-CYLINDER SPACER","ASTW1475-06-016-00","8","","11-11-2021","Nitish","PPRAJ","2021-11-24"
"ASTW1475","04-013-00 ADD MTR MTG","ASTW1475-04-013-00","4","","10-11-2021","Nitish","PPRAJ","2021-11-24"
"ASTW1475","03-078-00-BACK JAW Y AXIS CYLINDER PLATE","ASTW1475-03-078-00","4","","10-11-2021","Nitish","PPRAJ","2021-11-24"
"ASTW1475","02-060-00-SETTING CLAMP","ASTW1475-02-060-00","8","","09-11-2021","Nitish","PPRAJ","2021-11-24"
"ASTW1475","03-098-00- BOTTOM COMPONENT HOLDER","ASTW1475-03-098-00","8","","19-02-2022","Nitish","PPRAJ","2022-02-19"
"ASTW1475","05-026-00-WIRE HOLDER BACK PLT","ASTW1475-05-026-00","8","","10-11-2021","Nitish","PPRAJ","2021-11-24"
"ASTW1475","03-030-00-BASE BRACKET","ASTW1475-03-030-00","2","","10-11-2021","Nitish","PPRAJ","2021-11-24"
"ASTW1475","02-041-00-BEARING HOUSING","ASTW1475-02-041-00","2","","09-11-2021","Nitish","PPRAJ","2021-11-24"
"ASTW1475","06-022-00 WIRE GRIPPER MTG BRKT","ASTW1475-06-022-00","8","","11-11-2021","Nitish","PPRAJ","2021-11-24"
"ASTW1475","04-017-00 SCREW HOLDER","ASTW1475-04-017-00","2","","10-11-2021","Nitish","PPRAJ","2021-11-24"
"ASTW1475","03-048-00 FEEDER UNIT SPACER","ASTW1475-03-048-00","4","","10-11-2021","Nitish","PPRAJ","2021-11-24"
"ASTW1475","02-057-00-PULLY HOLDER","ASTW1475-02-057-00","2","","09-11-2021","Nitish","PPRAJ","2021-11-24"
"ASTW1475","03-067-00-JAW LOCATOR PLATE","ASTW1475-03-067-00","4","","19-02-2022","Nitish","PPRAJ","2022-02-19"
"ASTW1475","05-039-00-ROLLER CLAMP","ASTW1475-05-039-00","8","","10-11-2021","Nitish","PPRAJ","2021-11-24"
"ASTW1475","03-023-00-FIXTURE ROD","ASTW1475-03-023-00","4","","10-11-2021","Nitish","PPRAJ","2021-11-24"
"ASTW1475","02-070-00- CAM ROTATING PLATE LEG","ASTW1475-02-070-00","2","","09-11-2021","Nitish","PPRAJ","2021-11-24"
"ASTW1475","05-025-00-ROLLER MTG PLATE","ASTW1475-05-025-00","8","","10-11-2021","Nitish","PPRAJ","2021-11-24"
"ASTW1475","03-055-00-BOTTOM PLATE WELDMENT","ASTW1475-03-055-00","2","","10-11-2021","Nitish","PPRAJ","2021-11-24"
"ASTW1475","02-038-00-HEIGHT ADJUSTABLE PLATE","ASTW1475-02-038-00","2","","09-11-2021","Nitish","PPRAJ","2021-11-24"
"ASTW1475","06-019-00 COUPLER","ASTW1475-06-019-00","8","","11-11-2021","Nitish","PPRAJ","2021-11-24"
"ASTW1475","03-077-00-GRIPPER MOUNTING PLATE","ASTW1475-03-077-00","4","","10-11-2021","Nitish","PPRAJ","2021-11-24"
"ASTW1475","03-010-00-CYLINDER MOUNTING PLATE","ASTW1475-03-010-00","2","","09-11-2021","Nitish","PPRAJ","2021-11-24"
"ASTW1475","02-053-00-SPAR GEAR LOCKING PLATE","ASTW1475-02-053-00","2","","09-11-2021","Nitish","PPRAJ","2021-11-24"
"ASTW1475","01-A01-00 BASE ASSM","ASTW-1475 -01-A01-00","2","","25-02-2022","Nitish","PPRAJ","2022-02-25"
"ASTW1475","03-043-00 RH STOPPER","ASTW1475-03-043-00","8","","19-02-2022","Nitish","PPRAJ","2022-02-19"
"ASTW1475","05-036-00-ROCKER PINGE CLAMP","ASTW1475-05-036-00","16","","10-11-2021","Nitish","PPRAJ","2021-11-24"
"ASTW1475","03-045-00-PLATE2","ASTW1475-03-045-00","2","","10-11-2021","Nitish","PPRAJ","2021-11-24"
"ASTW1475","02-016-00-COUPLING","ASTW1475-02-016-00","12","","09-11-2021","Nitish","PPRAJ","2021-11-24"
"ATM1437","07-13-R1-IRIS CYL HOLDER","ATM1437-07-13-R1","1","","21-02-2022","Sunil","PPRAJ","2022-02-21"
"ATM1437","01-063-00-WELDING BUSH FOR BASE COVERS","ATM1437-01-063-00","18","","09-10-2021","Sunil","PPRAJ","2021-10-09"
"ATM1437","02-73-00-SLOT PLATE BOTTOM","ATM1437-02-73-00","1","","10-05-2022","Nitish","PPRAJ","2022-05-11"
"ATM1437","03-028-00-SPACER FOR BASE HOLDER","ATM1437-03-028-00","1","","12-02-2022","Nitish","PPRAJ","2022-02-12"
"ATM1437","05-39-00-SERVO COUPLER MTG FLANGE","ATM1437-05-39-00","2","","22-12-2021","Sunil","PPRAJ","2021-12-22"
"ATM1437","03-27-00-SPACER-1800","ATM1437-03-27-00","1","","09-02-2022","Nitish","PPRAJ","2022-02-09"
"ATM1437","02-04-00-TWISTER ARM","ATM1437-02-04-00","1","","30-11-2021","Sunil","PPRAJ","2021-11-30"
"ATM1437","07-41-00-TOP PLATE","ATM1437-07-41-00","2","","10-05-2022","Nitish","PPRAJ","2022-05-11"
"ATM1437","02-80-00-PART REST","ATM1437-02-80-00","1","","10-05-2022","Nitish","PPRAJ","2022-05-11"
"ATM1437","01-211-00-BASE SHEET","ATM1437-01-211-00","2","","07-12-2021","Sunil","PPRAJ","2021-12-07"
"ATM1437","02-77-00-SLOT PLATE TOP","ATM1437-02-77-00","1","","10-05-2022","Nitish","PPRAJ","2022-05-11"
"ATM1437","03-010-00-IRIS SPACER","ATM1437-03-010-00","1","","09-02-2022","Nitish","PPRAJ","2022-02-09"
"ATM1437","02-74-00-IRIS TOP HOUSING SPACER","ATM1437-02-74-00","1","","10-05-2022","Nitish","PPRAJ","2022-05-11"
"ATM1437","01-057-00-BASE FRONT DOOR","ATM1437-01-057-00","1","","09-10-2021","Sunil","PPRAJ","2021-10-09"
"ATM1437","02-15-00-TWISTER ARM LH","ATM1437-02-15-00","1","","30-11-2021","Sunil","PPRAJ","2021-11-30"
"ATM1437","02-71-00-IRIS BASE","ATM1437-02-71-00","1","","10-05-2022","Nitish","PPRAJ","2022-05-11"
"ATM1437","07-42-00-IRIS LOCK","ATM1437-07-42-00","2","","10-05-2022","Nitish","PPRAJ","2022-05-11"
"ATM1437","02-81-00-IRIS ARM","ATM1437-02-81-00","2","","10-05-2022","Nitish","PPRAJ","2022-05-11"
"ATM1437","02-78-00-IRIS PIN TOP","ATM1437-02-78-00","25","","10-05-2022","Nitish","PPRAJ","2022-05-11"
"ATM1437","08-02-R1-PART EJECTOR","ATM1437-08-02-R1","1","","08-07-2022","Nitish","PPRAJ","2022-07-08"
"ATM1437","02-75-00-IRIS TOP ASSY HSG","ATM1437-02-75-00","1","","10-05-2022","Nitish","PPRAJ","2022-05-11"
"ATM1437","01-061-00-BASE SIDE COVER RH","ATM1437-01-061-00","4","","09-10-2021","Sunil","PPRAJ","2021-10-09"
"ATM1437","02-72-00-IRIS RETAINER","ATM1437-02-72-00","1","","10-05-2022","Nitish","PPRAJ","2022-05-11"
"ATM1437","07-43-00-DOUBLE IRIS PULLER","ATM1437-07-43-00","1","","10-05-2022","Nitish","PPRAJ","2022-05-11"
"ATM1437","01-212-00-BASE BACK SHEET","ATM1437-01-212-00","2","","21-12-2021","Sunil","PPRAJ","2021-12-21"
"ATM1437","07-011-R1-CYL HINGE PLATE","ATM1437-07-011-R1","1","","17-12-2021","Sunil","PPRAJ","2021-12-17"
"ATM1437","02-81-00-IRIS ARM","ATM1437-02-81-00-IRIS ARM","2","","10-05-2022","Nitish","PPRAJ","2022-05-11"
"ATM1437","02-79-00-SLOT PLATE SPACER","ATM1437-02-79-00","1","","10-05-2022","Nitish","PPRAJ","2022-05-11"
"ATM1437","02-76-00-IRIS PLATE TOP","ATM1437-02-76-00","1","","10-05-2022","Nitish","PPRAJ","2022-05-11"
"B562","15-290-00-PICK & PLACE FRAME PAD-1","B562-15-290-00","2","","20-07-2022","SACHIN","PPRAJ","2022-07-20"
"B562","15-300-00-PICK & PLACE FRAME PAD-2","B562-15-300-00","6","","20-07-2022","SACHIN","PPRAJ","2022-07-20"
"B562","14-430-00-BALL SCREW PIPE FIXING BRKT","B562-14-430-00","2","","22-04-2022","Amar","PPRAJ","2022-04-22"
"B562","15-310-00-CONVEYOR RAISER BLOCK","B562-15-310-00","8","","20-07-2022","SACHIN","PPRAJ","2022-07-20"
"B562","B562-06-100-R5-LIFTING PLATE-AUTO","B562-06-100-R5","4","","20-04-2022","Amar","PPRAJ","2022-04-20"
"B562","20-070-00-INLET CONVEYOR PART COUNT SENSOR BRKT","B562-20-070-00","1","","25-04-2022","","PPRAJ","2022-04-25"
"B562","14-440-00-BALL SCREW COVER PIPE FLANGE","B562-14-440-00","2","","22-04-2022","Amar","PPRAJ","2022-04-22"
"B564","20-040-00-CYL BRKT BLOCK","B564-20-040-00","1","","02-12-2021","SACHIN","Chandru","2021-12-02"
"B564","20-140-R1-CUTTER SUPPORT PLATE-V2","B564-20-140-R1","1","","24-02-2022","SACHIN","Chandru","2022-02-24"
"B564","20-010-00-PICK AND PLACE ASSY MTG BLOCK","B564-20-010-00","4","","02-12-2021","SACHIN","Chandru","2021-12-02"
"B564","07-440-00-GUIDE PIPE HOLDER","B564-07-440-00","2","","16-05-2022","SACHIN","PPRAJ","2022-05-16"
"B564","20-140-00-CUTTER SUPPORT PLATE","B564-20-140-00","1","","02-12-2021","SACHIN","Chandru","2021-12-02"
"B564","20-150-R1-HORIZONTAL CLAMPING CYILNDER MTG PLATE","B564-20-150-R1","1","","10-03-2022","SACHIN","Chandru","2022-03-10"
"B564","20-110-00-VETICAL PLATE CLAMP","B564-20-110-00","2","","02-12-2021","SACHIN","Chandru","2021-12-02"
"B564","20-080-00- VERTICAL CYL COUPLING CLAMP","B564-20-080-00","4","","02-12-2021","SACHIN","Chandru","2021-12-02"
"B564","08-190-00-CUTTING WHEEL SPACER-1","B564-08-190-00","1","","29-01-2022","SACHIN","Chandru","2022-01-29"
"B564","20-050-00-PE CLAMP ASSY MTG PAD","B564-20-050-00","2","","02-12-2021","SACHIN","Chandru","2021-12-02"
"B564","20-180-00-CUTTER SUPPORT SPACER","B564-20-180-00","2","","24-02-2022","SACHIN","Chandru","2022-02-24"
"B564","20-020-00- PIACK AND PLACE LM GUIDE ROD","B564-20-020-00","2","","02-12-2021","SACHIN","Chandru","2021-12-02"
"B564","22-010-00-SIDE PLATE SENSOR BRKT","B564-22-010-00","6","","14-02-2022","SACHIN","Chandru","2022-02-14"
"B564","20-150-00-HORIZONTAL CLAMPING CYILNDER MTG PLATE","B564-20-150-00","1","","02-12-2021","SACHIN","Chandru","2021-12-02"
"B564","07-420-00-COUNTER WEIGHT STAND BASE","B564-07-420-00","1","","16-05-2022","SACHIN","PPRAJ","2022-05-16"
"B564","20-180-R1-CUTTER SUPPORT SPACER","B564-20-180-R1","2","","10-03-2022","SACHIN","Chandru","2022-03-10"
"B564","20-120-00-VERTICAL CLAMP CYL GUIDE ROD","B564-20-120-00","4","","02-12-2021","SACHIN","Chandru","2021-12-02"
"B564","20-090-00- VERTIVAL CLAMP CYL COUPLER NUT","B564-20-090-00","4","","02-12-2021","SACHIN","Chandru","2021-12-02"
"B564","20-060-00-HORIZONTAL CLAMP CYL MTG MRKT","B564-20-060-00","2","","02-12-2021","SACHIN","Chandru","2021-12-02"
"B564","08-160-00-CUTTING WHEEL SHAFT","B564-08-160-00","1","","29-01-2022","SACHIN","Chandru","2022-01-29"
"B564","20-030-00-PICK N PLACE ASSY MTG PAD","B564-20-030-00","4","","02-12-2021","SACHIN","Chandru","2021-12-02"
"B564","22-020-00-PLATE GROUP SENSOR BRKT","B564-22-020-00","6","","14-02-2022","SACHIN","Chandru","2022-02-14"
"B564","20-160-00-HORIZONTAL CLAMP SUPPORT PLATE","B564-20-160-00","1","","02-12-2021","SACHIN","Chandru","2021-12-02"
"B564","07-430-00-GUIDE PIPE 1","B564-07-430-00","6","","16-05-2022","SACHIN","PPRAJ","2022-05-16"
"B564","20-200-00-HORIZONTAL CLAMP KEY","B564-20-200-00","1","","10-03-2022","SACHIN","Chandru","2022-03-10"
"B564","20-130-00-GRIPPER STRIP","B564-20-130-00","10","","02-12-2021","SACHIN","Chandru","2021-12-02"
"B564","20-170-00-GRIPPER-BUSH CONNECTING PLATE","B564-20-170-00","4","","03-12-2021","Karumbaiah","PPRAJ","2021-12-03"
"B564","20-100-00-VERTICAL CLAMP CYL MTG MRKT","B564-20-100-00","2","","02-12-2021","SACHIN","Chandru","2021-12-02"
"B564","20-070-00-ORIZONTAL CLAMP CYL GUIDE ROD","B564-20-070-00","4","","02-12-2021","SACHIN","Chandru","2021-12-02"
"B564","08-170-00-CUTTER MOTOR BRKT","B564-08-170-00","1","","29-01-2022","SACHIN","Chandru","2022-01-29"
"B589","15-260-00-SHUTTLE BLADE 2.0 SOLAR","B589-15-260-00","1","","30-09-2021","SACHIN","Chandru","2021-09-30"
"B589","04-510-R1 SPROCKET-CONVEY DRIVEN-10B-12Z","B589-04-510-R1","1","","07-07-2022","SACHIN","PPRAJ","2022-07-07"
"B589","04-570-00 SPACER-TENSIONER SHAFT","B589-04-570-00","10","","20-06-2022","Amar","PPRAJ","2022-06-20"
"B589","02-035-00-FEED MOTOR PULLEY","B589-02-035-00","1","","27-07-2022","Amar","PPRAJ","2022-07-27"
"B589","15-180-00-SHUTTLE BLADE 2.3 GC1 -VE","B589-15-180-00","1","","30-09-2021","SACHIN","Chandru","2021-09-30"
"B589","01-035C-R3 - CUTTER SHAFT-SLI","B589-01-035C-R3","5","","25-03-2022","Amar","PPRAJ","2022-03-25"
"B589","15-200-00-SHUTTLE BLADE 2.4 +VE OLD","B589-15-200-00","1","","30-09-2021","SACHIN","Chandru","2021-09-30"
"B591","10-890-00-PUNCH-RACK-1.5P_1.5DP_168W_TYPE2","B591-10-890-00","4","","25-08-2021","SACHIN","Chandru","2021-08-25"
"B591","07-350-00-EXIT CONVEYOR FRAME-2","B591-07-350-00","2","","18-11-2021","SACHIN","Chandru","2021-11-18"
"B591","10-470-00-SENSOR BRKT GUIDE KEY","B591-10-470-00","2","","03-11-2021","SACHIN","Chandru","2021-11-03"
"B591","10-980-00-PINCH RUBBER ROLLER TYPE1","B591-10-980-00","4","","27-10-2021","SACHIN","Chandru","2021-10-27"
"B591","03-670-SEALING WHEEL-BOT CLAMP-Ø58","B591-03-670-00","6","","25-10-2021","SACHIN","Chandru","2021-10-25"
"B591","05-350-00-S-GUIDE-4.5MM AND 3.5MM_GAP_BACK","B591-05-350-00","1","","21-10-2021","SACHIN","Chandru","2021-10-21"
"B591","10-710-00-EXIT LEAF SPRING FIXING ROD","B591-10-710-00","4","","20-08-2021","SACHIN","Chandru","2021-08-20"
"B591","03-055-R3-PIPE-64x40x1000-VER5","B591-03-055-R3","1","","14-12-2021","SACHIN","Chandru","2021-12-14"
"B591","17-030-00-ELECTRIC JUCNTION BOX FIXING FLAT","B591-17-030-00","2","","24-08-2021","SACHIN","Chandru","2021-08-24"
"B591","10-1080-00-CONV AND BTM PUNCH FRAME CONNECTING PAD-1","B591-10-1080-00","10","","06-12-2021","SACHIN","Chandru","2021-12-06"
"B591","24-160-R1-SENSOR FIXING BRKT-2","B591-24-160-R1","2","","03-11-2021","SACHIN","Chandru","2021-11-03"
"B591","05-550-00-TOGGLE CLAMP SENSOR BRAKT-2","B591-05-550-00","2","","08-10-2021","SACHIN","Chandru","2021-10-08"
"B591","05-720-00-SLEEVE HOLDING WHEEL SPACER-2","B591-05-720-00","4","","17-11-2021","SACHIN","Chandru","2021-11-17"
"B591","10-290-00-SPACER DRIVE SHAFT-VER5","B591-10-290-00","2","","03-11-2021","SACHIN","Chandru","2021-11-03"
"B591","24-150-R1-SENSOR FIXING BRKT-1","B591-24-150-R1","2","","28-04-2022","Amar","PPRAJ","2022-04-28"
"B591","24-130-00-PICK & PLACE ASSY BASE FRAME","B591-24-130-00","1","","20-08-2021","SACHIN","Chandru","2021-08-20"
"B591","24-170-00-PART PRESENT SENSOR BRKT-3","B591-24-170-00","2","","04-10-2021","SACHIN","Chandru","2021-10-04"
"B591","05-520-00-CYL COUPLER HOUSING","B591-05-520-00","2","","08-09-2021","SACHIN","Chandru","2021-09-08"
"B591","10-850-00-PUNCH-RACK-1.5P_1.5DP_168W_TYPE2","B591-10-850-00","4","","24-08-2021","SACHIN","Chandru","2021-08-24"
"B591","05-740-00-UNLTRASONIC GUN BTM PLT","B591-05-740-00","1","","08-12-2021","SACHIN","Chandru","2021-12-08"
"B591","05-650-00-V GROOVE TOP WHEEL","B591-05-650-00","1","","03-11-2021","SACHIN","Chandru","2021-11-03"
"B591","10-960-00-PUNCH-RACK-1.5P_1.5DP_55W_2MM THICK","B591-10-960-00","4","","08-10-2021","SACHIN","Chandru","2021-10-08"
"B591","07-110-R1-ROLLER SUPPORT PLATE","B591-07-110-R1","16","","06-10-2021","SACHIN","Chandru","2021-10-06"
"B591","01-910-00-CUTTING HEAD INLET GUARD-MALE","B591-01-910-00","2","","03-09-2021","SACHIN","Chandru","2021-09-03"
"B591","B591-03-330-00-S-GUIDE BACK-4_5 GAP","B591-03-330-00","1","","27-08-2021","SACHIN","Chandru","2021-08-27"
"B591","03-650-00-WASHER-61901","B591-03-650-00","40","","07-12-2021","SACHIN","Chandru","2021-12-07"
"B591","07-280-00-GB MTG BRKT","B591-07-280-00","2","","10-11-2021","SACHIN","Chandru","2021-11-10"
"B591","10-260-00-SIDE PLATE-MOT SIDE-VER5","B591-10-260-00","2","","03-11-2021","SACHIN","Chandru","2021-11-03"
"B591","10-900-00-SPACER-ROLLER","B591-10-900-00","6","","31-08-2021","SACHIN","Chandru","2021-08-31"
"B591","24-100-00-VACUUM CUPS FIXING PLATE","B591-24-100-00","2","","20-08-2021","SACHIN","Chandru","2021-08-20"
"B591","05-430-00-CLEANING WHEEL MTG BLOCK-1","B591-05-430-00","1","","16-11-2021","SACHIN","Chandru","2021-11-16"
"B591","05-380-00-SEALING WHEEL-WIRECUT-75-DEG-100T","B591-05-380-00","2","","08-09-2021","SACHIN","Chandru","2021-09-08"
"B591","10-810-00 JACKING SCREW-M8","B591-10-810-00","4","","24-08-2021","SACHIN","Chandru","2021-08-24"
"B591","05-610-R2-SEALING GUIDE WHEEL PIN","B591-05-610-R2","2","","08-12-2021","SACHIN","Chandru","2021-12-08"
"B591","05-620-00-SEALING GUIDE WHEEL TOP BLOCK","B591-05-620-00","1","","03-11-2021","SACHIN","Chandru","2021-11-03"
"B591","B591-03-300-00-S-GUIDE FRONT-4_0 GAP","B591-03-300-00","1","","27-08-2021","SACHIN","Chandru","2021-08-27"
"B591","07-250-00-TENSIONER BRG SAPCER","B591-07-250-00","2","","10-11-2021","SACHIN","Chandru","2021-11-10"
"B591","10-230-00-PINCH RUBBER ROLLER-VER5","B591-10-230-00","4","","03-11-2021","SACHIN","Chandru","2021-11-03"
"B591","24-070-00-BOTTOM CYL SIDE PLATE-LH","B591-24-070-00","2","","20-08-2021","SACHIN","Chandru","2021-08-20"
"B591","10-1050-00-JIG PLATE-3","B591-10-1050-00","2","","18-11-2021","SACHIN","Chandru","2021-11-18"
"B591","05-340-R2-S-GUIDE-4.5MM AND 2.5MM_GAP FRONT","B591-05-340-R2","2","","14-04-2022","SACHIN","Chandru","2022-04-14"
"B591","10-780-00- NUT HSG","B591-10-780-00","2","","24-08-2021","SACHIN","Chandru","2021-08-24"
"B591","05-590-00-PRESSING WHEEL MTG BRKT","B591-05-590-00","1","","03-11-2021","SACHIN","Chandru","2021-11-03"
"B591","07-170-R1-LEAF SPRING","B591-07-170-R1","4","","08-10-2021","SACHIN","Chandru","2021-10-08"
"B591","10-830-R1 JACK-NUT-M8","B591-10-830-R1","4","","21-09-2021","SACHIN","Chandru","2021-09-21"
"B591","07-320-00-SENSOR BRKT-5","B591-07-320-00","2","","16-09-2021","SACHIN","Chandru","2021-09-16"
"B591","10-190-00-CLAMPING RING-12x15","B591-10-190-00","75","","13-09-2021","SACHIN","Chandru","2021-09-13"
"B591","24-040-00-TOP CYL MTG L PLATE","B591-24-040-00","2","","20-08-2021","SACHIN","Chandru","2021-08-20"
"B591","10-1020-00 -SLEEVE GUIDE STRIP-LH","B591-10-1020-00","2","","18-11-2021","SACHIN","Chandru","2021-11-18"
"B591","10-730-R1-JIG PLATE-2","B591-10-730-R1","4","","13-11-2021","SACHIN","Chandru","2021-11-13"
"B591","03-530-00-GUIDE RUBBER-ROLLER","B591-03-530-00","50","","04-09-2021","SACHIN","Chandru","2021-09-04"
"B591","10-730-R2-JIG PLATE-2","B591-10-730-R2","4","","29-11-2021","SACHIN","Chandru","2021-11-29"
"B591","05-350-R1-S-GUIDE-4.5MM AND 2.5MM_GAP_BACK","B591-05-350-R1","1","","05-03-2022","SACHIN","Chandru","2022-03-05"
"B591","07-150-00 GUIDE RUBBER ROLLER CLAMP","B591-07-150-00","26","","10-11-2021","SACHIN","Chandru","2021-11-10"
"B591","10-030-00-PILLAR FIXING PLATE-A-SDLH","B591-10-030-00","4","","03-11-2021","SACHIN","Chandru","2021-11-03"
"B591","20-004-R1 FEED RUBBER ROLLER","B591-20-004-R1","15","","16-09-2021","SACHIN","Chandru","2021-09-16"
"B591","24-010-00-PICK &  PLACE CYL FRAME","B591-24-010-00","2","","20-08-2021","SACHIN","Chandru","2021-08-20"
"B591","07-360-00-EXIT CONVEYOR LEG","B591-07-360-00","4","","18-11-2021","SACHIN","Chandru","2021-11-18"
"B591","10-990-00-PINCH RUBBER ROLLER TYPE2","B591-10-990-00","8","","27-10-2021","SACHIN","Chandru","2021-10-27"
"B591","07-170-R2-LEAF SPRING","B591-07-170-R2","10","","26-10-2021","SACHIN","Chandru","2021-10-26"
"B591","01-920-00-RAISER BLOCK","B591-01-920-00","4","","17-09-2021","SACHIN","Chandru","2021-09-17"
"B591","10-750-00-CYL TOP SPACER","B591-10-750-00","6","","20-08-2021","SACHIN","Chandru","2021-08-20"
"B591","07-460-00-GUARDING TOP LH-2nd","B591-07-460-00","2","","15-12-2021","SACHIN","Chandru","2021-12-15"
"B591","10-1100-00-CONV AND BTM PUNCH FRAME CONNECTING PAD-3","B591-10-1100-00","10","","06-12-2021","SACHIN","Chandru","2021-12-06"
"B591","07-050-00-POLY-V-PK6-PULLEY EXIT CONV","B591-07-050-00","12","","10-11-2021","SACHIN","Chandru","2021-11-10"
"B591","24-170-R1-PART PRESENT SENSOR BRKT-3","B591-24-170-R1","2","","03-11-2021","SACHIN","Chandru","2021-11-03"
"B591","05-360-00-SEALING WHEEL-WIRECUT-75-DEG-100T-SLEEVER","B591-05-360-00","10","","20-01-2022","Amar","PPRAJ","2022-01-20"
"B591","10-300-00- BEARING HOUSING SEALING (DRIVE)-COM-VER5","B591-10-300-00","2","","03-11-2021","SACHIN","Chandru","2021-11-03"
"B591","24-160-R2-SENSOR FIXING BRKT-2","B591-24-160-R2","2","","28-04-2022","Amar","PPRAJ","2022-04-28"
"B591","24-140-00-PICK & PLACE CYL FRAME PAD","B591-24-140-00","1","","20-08-2021","SACHIN","Chandru","2021-08-20"
"B591","05-800-00-ULTRASONIC GUN BOTTOM FLANGE","B591-05-800-00","1","","14-12-2021","SACHIN","Chandru","2021-12-14"
"B591","05-530-00-SEALING ASSY LIFTER CYL COUPLER","B591-05-530-00","3","","08-09-2021","SACHIN","Chandru","2021-09-08"
"B591","10-870-00-PUNCH-RACK-1.5P_1.5DP_55W_TYPE3","B591-10-870-00","4","","24-08-2021","SACHIN","Chandru","2021-08-24"
"B591","17-040-00-ELECTRIC JUCNTION BOX FIXING FLAT-2","B591-17-040-00","2","","06-12-2021","SACHIN","Chandru","2021-12-06"
"B591","05-660-00-V GROOVE WHEEL ADJ KEY","B591-05-660-00","1","","03-11-2021","SACHIN","Chandru","2021-11-03"
"B591","10-970-00-PUNCH-RACK-1.5P_1.5DP_55W_3MM THICK","B591-10-970-00","4","","08-10-2021","SACHIN","Chandru","2021-10-08"
"B591","05-610-R1-SEALING GUIDE WHEEL PIN","B591-05-610-R1","2","","17-11-2021","SACHIN","Chandru","2021-11-17"
"B591","10-270-00-SIDE PLATE-FAR SIDE SUPPORT-VER5","B591-10-270-00","2","","03-11-2021","SACHIN","Chandru","2021-11-03"
"B591","24-110-00-LM GUIDE ROD","B591-24-110-00","8","","20-08-2021","SACHIN","Chandru","2021-08-20"
"B591","05-440-00-CLEANING WHEEL MTG BLOCK-2","B591-05-440-00","1","","16-11-2021","SACHIN","Chandru","2021-11-16"
"B591","24-150-00-SENSOR FIXING BRKT-1","B591-24-150-00","4","","04-10-2021","SACHIN","Chandru","2021-10-04"
"B591","20-050-00-FEED ROLLER ROTATING NUT","B591-20-050-00","1","","28-09-2021","SACHIN","Chandru","2021-09-28"
"B591","07-090-R1-EXIT CONVEYOR DRIVE SHAFT","B591-07-090-R1","4","","23-09-2021","SACHIN","Chandru","2021-09-23"
"B591","05-500-00-TOGGLE CLAMP MTG  PLATE","B591-05-500-00","1","","08-09-2021","SACHIN","Chandru","2021-09-08"
"B591","10-830-00 JACK-NUT-M8","B591-10-830-00","2","","24-08-2021","SACHIN","Chandru","2021-08-24"
"B591","03-064-00-SHAFT-S-WHEEL","B591-03-064-00","10","","16-12-2021","SACHIN","Chandru","2021-12-16"
"B591","05-720-R1-SLEEVE HOLDING WHEEL SPACER-2","B591-05-720-R1","4","","08-12-2021","SACHIN","Chandru","2021-12-08"
"B591","05-630-00-SLEEVE GUIDE TOP ASSY MTG BRKT","B591-05-630-00","1","","03-11-2021","SACHIN","Chandru","2021-11-03"
"B591","10-940-PUNCH HOLDER PLATE-100MM","B591-10-940-00","4","","06-10-2021","SACHIN","Chandru","2021-10-06"
"B591","B591-03-310-00-S-GUIDE BACK-4_0 GAP","B591-03-310-00","1","","27-08-2021","SACHIN","Chandru","2021-08-27"
"B591","07-260-00-TENSIONER BRG OUTER SPACER","B591-07-260-00","2","","10-11-2021","SACHIN","Chandru","2021-11-10"
"B591","10-240-00-TIMER PULLEY-3M-26T-VER5","B591-10-240-00","4","","03-11-2021","SACHIN","Chandru","2021-11-03"
"B591","24-080-00-BOTTOM CYL SIDE PLATE-RH","B591-24-080-00","2","","20-08-2021","SACHIN","Chandru","2021-08-20"
"B591","10-1060-00 -SLEEVE GUIDE STRIP-RH","B591-10-1060-00","2","","18-11-2021","SACHIN","Chandru","2021-11-18"
"B591","05-380-R1-SEALING WHEEL-WIRECUT-75-DEG-100T","B591-05-380-R1","2","","19-10-2021","SACHIN","Chandru","2021-10-19"
"B591","05-050-S2 WEAR PLATE-MAG INLET-S2-v1","SPB0581-05-050-S2","1","","08-03-2022","SACHIN","Chandru","2022-03-08"
"B591","10-790-00 WASHER-Ø5x3","B591-10-790-00","4","","24-08-2021","SACHIN","Chandru","2021-08-24"
"B591","10-910-00-INDEX MOTOR DRIVE SHAFT-SERVO-2nd","B591-10-910-00","4","","16-12-2021","SACHIN","Chandru","2021-12-16"
"B591","05-110-R1-BOOSTER MTG PLATE-VER5","B591-05-110-R1","1","","08-12-2021","SACHIN","Chandru","2021-12-08"
"B591","05-600-00-V GROOVE BOTTOM WHEEL","B591-05-600-00","1","","03-11-2021","SACHIN","Chandru","2021-11-03"
"B591","05-380-R2-SEALING WHEEL-WIRECUT-75-DEG-100T","B591-05-380-R2","4","","28-10-2021","SACHIN","Chandru","2021-10-28"
"B591","25-010-00-PNEUMATIC PANEL","B591-25-010-00","1","","24-08-2021","SACHIN","Chandru","2021-08-24"
"B591","07-330-00-SENSOR BRKT-6","B591-07-330-00","2","","16-09-2021","SACHIN","Chandru","2021-09-16"
"B591","24-050-00-TOP CYL MTG PAD","B591-24-050-00","2","","20-08-2021","SACHIN","Chandru","2021-08-20"
"B591","10-1030-00-TOP BASE PLATE-2","B591-10-1030-00","2","","18-11-2021","SACHIN","Chandru","2021-11-18"
"B591","10-760-00-SENSOR MTG BRKT","B591-10-760-00","2","","24-08-2021","SACHIN","Chandru","2021-08-24"
"B591","07-230-00-TENSIONER SPROCKET","B591-07-230-00","2","","10-11-2021","SACHIN","Chandru","2021-11-10"
"B591","10-160-00-BASE PLATE LEADING ROLLER UNIT-VER5","B591-10-160-00","2","","03-11-2021","SACHIN","Chandru","2021-11-03"
"B591","07-220-00-TENSIONER PIN","B591-07-220-00","8","","21-09-2021","SACHIN","Chandru","2021-09-21"
"B591","24-020-00-SIDE PLATE-LH","B591-24-020-00","2","","20-08-2021","SACHIN","Chandru","2021-08-20"
"B591","10-170-00-SIDE PLATE-LEADING ROLLER SUPPORT-VER5","B591-10-170-00","4","","27-11-2021","SACHIN","Chandru","2021-11-27"
"B591","10-1000-00-BOTTOM PUNCH FRAME-2","B591-10-1000-00","2","","18-11-2021","SACHIN","Chandru","2021-11-18"
"B591","07-470-00-SS SIDE GUIDE STRIP-2nd","B591-07-470-00","4","","15-12-2021","SACHIN","Chandru","2021-12-15"
"B591","10-930-00-BOOSTER SPACER","B591-10-930-00","4","","20-09-2021","SACHIN","Chandru","2021-09-20"
"B591","07-120-00-SHAFT PE &GM","B591-07-120-00","10","","10-11-2021","SACHIN","Chandru","2021-11-10"
"B591","05-560-00-STRIP MTG GUIDE ROD","B591-05-560-00","4","","08-10-2021","SACHIN","Chandru","2021-10-08"
"B591","10-320-00- SPACER SEALING DRIVE HOUSING-VER5","B591-10-320-00","2","","03-11-2021","SACHIN","Chandru","2021-11-03"
"B591","24-170-R2-PART PRESENT SENSOR BRKT-3","B591-24-170-R2","2","","28-04-2022","Amar","PPRAJ","2022-04-28"
"B591","05-340-00-S-GUIDE-4.5MM AND 3.5MM_GAP FRONT","B591-05-340-00","1","","21-10-2021","SACHIN","Chandru","2021-10-21"
"B591","07-040-00-EXIT CONVEYOR DRIVEN SHAFT","B591-07-040-00","4","","20-08-2021","SACHIN","Chandru","2021-08-20"
"B591","05-810-00-ULTRASONIC GUN TOP FLANGE","B591-05-810-00","1","","14-12-2021","SACHIN","Chandru","2021-12-14"
"B591","10-1070-00-TOP BASE PLATE-RH","B591-10-1070-00","2","","18-11-2021","SACHIN","Chandru","2021-11-18"
"B591","10-880-00-PUNCH-RACK-1.5P_1.5DP_30W_TYPE3","B591-10-880-00","8","","24-08-2021","SACHIN","Chandru","2021-08-24"
"B591","07-450-00-TRAY STAND","B591-07-450-00","1","","06-12-2021","SACHIN","Chandru","2021-12-06"
"B591","10-510-00-PART PRESENT SENSOR BRKT","B591-10-510-00","4","","03-11-2021","SACHIN","Chandru","2021-11-03"
"B591","05-540-00-TOGGLE CLAMP SENSOR BRKT-1","B591-05-540-00","2","","08-10-2021","SACHIN","Chandru","2021-10-08"
"B591","05-710-00-SLEEVE HOLDING WHEEL SPACER-1","B591-05-710-00","4","","17-11-2021","SACHIN","Chandru","2021-11-17"
"B591","10-280-00-PINCH RUBBER ROLLER DRIVE SHAFT-VER5","B591-10-280-00","2","","03-11-2021","SACHIN","Chandru","2021-11-03"
"B591","10-760-R1-SENSOR MTG BRKT-2nd","B591-10-760-R1","4","","28-04-2022","Amar","PPRAJ","2022-04-28"
"B591","24-120-00-CYL SPACER","B591-24-120-00","2","","20-08-2021","SACHIN","Chandru","2021-08-20"
"B591","24-160-00-SENSOR FIXING BRKT-2","B591-24-160-00","2","","04-10-2021","SACHIN","Chandru","2021-10-04"
"B591","05-510-00-SEALING ASSY LIFTER CYL BRKT","B591-05-510-00","2","","08-09-2021","SACHIN","Chandru","2021-09-08"
"B591","10-840-00-PUNCH-RACK-1.5P_1.5DP_65 W_TYPE-1","B591-10-840-00","4","","24-08-2021","SACHIN","Chandru","2021-08-24"
"B591","05-730-00-S-WHEEL-BOT-HSG","B591-05-730-00","1","","08-12-2021","SACHIN","Chandru","2021-12-08"
"B591","05-640-00-PRESSING WHEEL TOP PLATE","B591-05-640-00","1","","03-11-2021","SACHIN","Chandru","2021-11-03"
"B591","10-950-PUNCH HOLDER PLATE-163MM","B591-10-950-00","4","","06-10-2021","SACHIN","Chandru","2021-10-06"
"B591","01-900-00-CUTTING HEAD INLET GUARD-FEMALE","B591-01-900-00","2","","03-09-2021","SACHIN","Chandru","2021-09-03"
"B591","05-730-R1-S-WHEEL-BOT-HSG","B591-05-730-R1","1","","14-01-2022","Amar","PPRAJ","2022-01-14"
"B591","B591-03-320-00-S-GUIDE FRONT-4_5 GAP","B591-03-320-00","1","","27-08-2021","SACHIN","Chandru","2021-08-27"
"B591","07-270-00-GB MTG PLATE","B591-07-270-00","2","","10-11-2021","SACHIN","Chandru","2021-11-10"
"B591","10-250-00-BASE PLATE MOT DRIVE UNIT-VER5","B591-10-250-00","2","","03-11-2021","SACHIN","Chandru","2021-11-03"
"B591","24-090-00-BOTTOM CYL RUNNER BLOCK","B591-24-090-00","2","","20-08-2021","SACHIN","Chandru","2021-08-20"
"B591","05-420-00-CLEANING WHEEL PLATE","B591-05-420-00","1","","16-11-2021","SACHIN","Chandru","2021-11-16"
"B591","05-060-S2 WEAR PLATE-MAG EXIT-S2-v1","SPB0581-05-060-S2","1","","08-03-2022","SACHIN","Chandru","2022-03-08"
"B591","10-800-00 WASHER-Ø6x3","B591-10-800-00","8","","24-08-2021","SACHIN","Chandru","2021-08-24"
"B591","05-590-R1-PRESSING WHEEL MTG BRKT","B591-05-590-R1","1","","08-12-2021","SACHIN","Chandru","2021-12-08"
"B591","05-610-00-SEALING GUIDE WHEEL PIN","B591-05-610-00","2","","03-11-2021","SACHIN","Chandru","2021-11-03"
"B591","20-040-00-PLATE FOLDING ASSY WASHER","B591-20-040-00","10","","27-08-2021","SACHIN","Chandru","2021-08-27"
"B591","07-240-00-TENSIONER LOCK WASHER","B591-07-240-00","2","","10-11-2021","SACHIN","Chandru","2021-11-10"
"B591","10-220-00-ADJ CLAMP-12DIA-VER5","B591-10-220-00","8","","03-11-2021","SACHIN","Chandru","2021-11-03"
"B591","07-340-00-SENSOR FIXING BRACKET-3","B591-07-340-00","2","","16-09-2021","SACHIN","Chandru","2021-09-16"
"B591","24-060-00-TOP CYL RUNNER BLOCK PLATE","B591-24-060-00","2","","20-08-2021","SACHIN","Chandru","2021-08-20"
"B591","10-1040-00-TOP BASE PLATAE FIXING PILLAR","B591-10-1040-00","4","","18-11-2021","SACHIN","Chandru","2021-11-18"
"B591","10-770-00-SENSOR FIXING BRKT","B591-10-770-00","2","","24-08-2021","SACHIN","Chandru","2021-08-24"
"B591","05-580-00-PRESSING WHEEL MTG PLATE","B591-05-580-00","1","","03-11-2021","SACHIN","Chandru","2021-11-03"
"B591","05-570-00-GUIDE STRIP MTG CLAMP","B591-05-570-00","10","","08-10-2021","SACHIN","Chandru","2021-10-08"
"B591","10-770-R1-SENSOR FIXING BRKT","B591-10-770-R1","4","","21-09-2021","SACHIN","Chandru","2021-09-21"
"B591","07-310-00-SENSOR BRKT-4","B591-07-310-00","4","","16-09-2021","SACHIN","Chandru","2021-09-16"
"B591","24-030-00-SIDE PLATE-RH","B591-24-030-00","2","","20-08-2021","SACHIN","Chandru","2021-08-20"
"B591","10-1010-00-SLEEVE GUIDE STRIP MTG BRKT","B591-10-1010-00","8","","18-11-2021","SACHIN","Chandru","2021-11-18"
"B591","05-370-00-SEALING WHEEL-WIRECUT-75-DEG-100T-SLEEVER","B591-05-370-00","37","","05-11-2021","SACHIN","Chandru","2021-11-05"
"B591","10-920-00-BOTTOM PUNCH FRAME SHEET","B591-10-920-00","2","","17-09-2021","SACHIN","Chandru","2021-09-17"
"B591","07-480-00-GUARDING TOP RH-2nd","B591-07-480-00","2","","15-12-2021","SACHIN","Chandru","2021-12-15"
"B591","05-340-R1-S-GUIDE-4.5MM AND 2.5MM_GAP FRONT","B591-05-340-R1","1","","05-03-2022","SACHIN","Chandru","2022-03-05"
"B591","07-130-00-GM ROLLER","B591-07-130-00","10","","10-11-2021","SACHIN","Chandru","2021-11-10"
"B591","10-020-00-INDEXING MOT MTG PLATE","B591-10-020-00","2","","03-11-2021","SACHIN","Chandru","2021-11-03"
"B592","02-191-00-SPACER SLI & MC - COM","B592-02-191-00","32","","12-11-2021","SACHIN","Chandru","2021-11-12"
"B592","01-084-R2 - SHAFT DANCING UNIT","B592-01-084-R2","1","","29-10-2021","SACHIN","Chandru","2021-10-29"
"B592","01-054-00 - SPACER FOR CUTTER MANDREL","B592-01-054-00","2","","29-10-2021","SACHIN","Chandru","2021-10-29"
"B592","12-060-00 DRIVEN PULLEY","B592-12-060-00","4","","29-10-2021","SACHIN","Chandru","2021-10-29"
"B592","01-008-00 - SPACER FOR FEED DRIVE ROLLER","B592-01-008-00","2","","29-10-2021","SACHIN","Chandru","2021-10-29"
"B592","01-149-00-IM FLANGE-APEX-PEII70-MOT80 FRAME","B592-01-149-00","4","","07-10-2021","SACHIN","Chandru","2021-10-07"
"B592","09-480-R1 - GM BACK PLATE","B592-09-480-R1","1","","29-10-2021","SACHIN","Chandru","2021-10-29"
"B592","02-860-00 SPACER RING-CAM BRG","B592-02-860-00","1","","29-10-2021","SACHIN","Chandru","2021-10-29"
"B592","02-080-00 CRANK","B592-02-080-00","2","","29-10-2021","SACHIN","Chandru","2021-10-29"
"B592","01-073-00 - KNOB","B592-01-073-00","4","","29-10-2021","SACHIN","Chandru","2021-10-29"
"B592","12-230-00 PAD-DRIVEN SHAFT ASSY","B592-12-230-00","2","","29-10-2021","SACHIN","Chandru","2021-10-29"
"B592","01-015-00 LOCK WASHER-GYMBAL NUT","B592-01-015-00","2","","29-10-2021","SACHIN","Chandru","2021-10-29"
"B592","09-490-00 - PE-REMOVABLE DISC-PC","B592-09-490-00","1","","29-10-2021","SACHIN","Chandru","2021-10-29"
"B592","09-070-R1 - BUSH BACK PLATE","B592-09-070-R1","2","","29-10-2021","SACHIN","Chandru","2021-10-29"
"B592","01-960-00-ENV HD SPACERS","B592-01-960-00","16","","30-10-2021","SACHIN","Chandru","2021-10-30"
"B592","01-980-00- SWING ARM DANCING UNIT 75 PITCH","B592-01-980-00","8","","07-12-2021","SACHIN","Chandru","2021-12-07"
"B592","02-185-R1-SPACER LM HOUSING","B592-02-185-R1","4","","29-10-2021","SACHIN","Chandru","2021-10-29"
"B592","01-083-R1 SWING ARM DANCING UNIT","B592-01-083-R1","8","","29-10-2021","SACHIN","Chandru","2021-10-29"
"B592","12-390-00-TENSIONER MTG PIECE","B592-12-390-00","1","","29-10-2021","SACHIN","Chandru","2021-10-29"
"B592","01-030-R2 GIMBAL-NUT","B592-01-030-R2","2","","29-10-2021","SACHIN","Chandru","2021-10-29"
"B592","12-030-00 EXIT CONVEYOR FRAME","B592-12-030-00","1","","29-10-2021","SACHIN","Chandru","2021-10-29"
"B592","09-080-R1 - BACK PLATE","B592-09-080-R1","1","","29-10-2021","SACHIN","Chandru","2021-10-29"
"B592","01-970-00-ENV HD SPACERS 2","B592-01-970-00","8","","30-10-2021","SACHIN","Chandru","2021-10-30"
"B592","01-990-00- SWING ARM DANCING UNIT 72 PITCH","B592-01-990-00","6","","07-12-2021","SACHIN","Chandru","2021-12-07"
"B592","02-195-00-BEARING HSG SPACER","B592-02-195-00","1","","29-10-2021","SACHIN","Chandru","2021-10-29"
"B593","12-030-R1 FRAME-EXIT CONVEYOR-ESTMN","B593-12-030-R1","1","","12-02-2022","SACHIN","Chandru","2022-02-12"
"B593","02-090-R2 - CRANK-ESTMN","B593-02-090-R2","1","","12-02-2022","SACHIN","Chandru","2022-02-12"
"B593","13-020-00-MAIN FRAME GUARD - RIGHT","B593-13-020-00","1","","24-05-2022","SACHIN","PPRAJ","2022-05-24"
"B593","CSPB003-03-36C-00 -SEALING DRIVE SHAFT-SLI","CSPB003-03-36C-00","5","","17-02-2022","SACHIN","Chandru","2022-02-17"
"B593","02-864-00-IT BRKT HEIGHT ADJ PLATE-ESTMN","B593-02-864-00","10","","12-02-2022","SACHIN","Chandru","2022-02-12"
"B593","02-1150-R1-SHUTTLE BLADE-3","B593-02-1150-R1","1","","29-06-2022","SACHIN","PPRAJ","2022-06-29"
"B593","02-1250-00-SHUTTLE PLATE-5","B593-02-1250-00","1","","23-06-2022","Amar","PPRAJ","2022-06-23"
"B593","01-910-R1-DANCING ROLLER PE GUIDE STRIP-128-ESTMN","B593-01-910-R1","10","","15-04-2022","SACHIN","PPRAJ","2022-04-15"
"B593","08-680-R1 LONG SUPPORT BAR-RH-COM-ESTMN","B593-08-680-R1","1","","12-02-2022","SACHIN","Chandru","2022-02-12"
"B593","01-035C-R3 - CUTTER SHAFT-SLI-ESTMN","B593-01-035C-R3","2","","12-02-2022","SACHIN","Chandru","2022-02-12"
"B593","03-780-SEALING RUBBER ROLLER TOP-ESTMN","B593-03-780-00","2","","14-07-2022","SACHIN","PPRAJ","2022-07-14"
"B593","CSPB003-01-017-00 - FEED ROLLER RUBBER ROLLER (DRIVEN)","CSPB003-01-017-00","20","","17-02-2022","SACHIN","Chandru","2022-02-17"
"B593","02-840-R1 LOCK BLOCK-SLIDER-ESTMN","B593-02-840-R1","1","","12-02-2022","SACHIN","Chandru","2022-02-12"
"B593","02-1220-00-SHUTTLE PLATE-2","B593-02-1220-00","1","","23-06-2022","Amar","PPRAJ","2022-06-23"
"B593","08-130-R1 LONG SUPPORT BAR-LH-COM-ESTMN","B593-08-130-R1","1","","12-02-2022","SACHIN","Chandru","2022-02-12"
"B593","01-016-R2 - FEED ROLLER SHAFT RUBBER ROLLER (DRIVEN)-ESTMN","B593-01-016-R2","1","","12-02-2022","SACHIN","Chandru","2022-02-12"
"B593","10-310-00-GUIDE PLATE-FAR SIDE-PC6-ESTMN","B593-10-310-00","1","","12-02-2022","SACHIN","Chandru","2022-02-12"
"B593","02-010-00 - BASE PLATE SHUTTLE-CRANK-ESTMN","B593-02-010-00","1","","12-02-2022","SACHIN","Chandru","2022-02-12"
"B593","01-030-00-Roller for Enveloping machine_Type 1","SPB0578-01-030-00","6","","17-02-2022","SACHIN","Chandru","2022-02-17"
"B593","02-255-00-LM HOUSING ADD SUPPORT BAR-ESTMN","B593-02-255-00","1","","12-02-2022","SACHIN","Chandru","2022-02-12"
"B593","02-1190-00-SHUTTLE BLADE-7","B593-02-1190-00","1","","23-06-2022","Amar","PPRAJ","2022-06-23"
"B593","04-010-00 TENSIONER ROLLER-ESTMN","B593-04-010-00","1","","12-02-2022","SACHIN","Chandru","2022-02-12"
"B593","01-002-R5 SIDE PLATE ENCODER SIDE-SLI-ESTMN","B593-01-002-R5","1","","12-02-2022","SACHIN","Chandru","2022-02-12"
"B593","10-280-00-GUIDE PLATE-FAR SIDE-PC3-ESTMN","B593-10-280-00","1","","12-02-2022","SACHIN","Chandru","2022-02-12"
"B593","01-820-00 SLITTING BLADE-ESTMN","B593-01-820-00","10","","12-02-2022","SACHIN","Chandru","2022-02-12"
"B593","02-1130-R1-SHUTTLE BLADE-1","B593-02-1130-R1","1","","16-07-2022","SACHIN","PPRAJ","2022-07-16"
"B593","02-1090-00 BEARING HOUSING-ESTMN","B593-02-1090-00","1","","12-02-2022","SACHIN","Chandru","2022-02-12"
"B593","02-190-00 SLIDER PLATE-ESTMN","B593-02-190-00","1","","12-02-2022","SACHIN","Chandru","2022-02-12"
"B593","02-1160-00-SHUTTLE BLADE-4","B593-02-1160-00","1","","23-06-2022","Amar","PPRAJ","2022-06-23"
"B593","01-028-00 - HANDLE HUB-ESTMN","B593-01-028-00","3","","18-02-2022","SACHIN","Chandru","2022-02-18"
"B593","03-080-R1 - SEALING SHAFT DRIVEN-ESTMN","B593-03-080-R1","6","","12-02-2022","SACHIN","Chandru","2022-02-12"
"B593","03-090-SEALING RUBBER ROLLER TOP-ESTMN","B593-03-090-00","4","","08-02-2022","SACHIN","Chandru","2022-02-08"
"B593","10-040-R1-SS-GUIDE PLATE-FAR SIDE-ESTMN","B593-10-040-R1","1","","12-02-2022","SACHIN","Chandru","2022-02-12"
"B593","01-087-00 - ROLL CLAMP DANCING ASSEMBLY-ESTMN","B593-01-087-00","10","","12-02-2022","SACHIN","Chandru","2022-02-12"
"B593","12-250-R1 DUMMY ROLLER-EXIT CONV-ESTMN","B593-12-250-R1","2","","12-02-2022","SACHIN","Chandru","2022-02-12"
"B593","02-1080-00-SENSOR QUADRANT FOR CYL-ESTMN","B593-02-1080-00","2","","12-02-2022","SACHIN","Chandru","2022-02-12"
"B593","01-1010-00-LM ROD FIXING PLATE","B593-01-1010-00","1","","12-07-2022","SACHIN","PPRAJ","2022-07-12"
"B593","01-960-00-SEALING EXIT PE GUIDE","B593-01-960-00","1","","02-07-2022","SACHIN","PPRAJ","2022-07-04"
"B593","02-1130-00-SHUTTLE BLADE-1","B593-02-1130-00","1","","23-06-2022","Amar","PPRAJ","2022-06-23"
"B593","03-016-00 - FEED ROLLER SHAFT RUBBER ROLLER (DRIVEN)-ESTMN","B593-03-016-00","1","","12-02-2022","SACHIN","Chandru","2022-02-12"
"B593","02-1320-00-SHUTTLE PLATE-9","B593-02-1320-00","1","","30-06-2022","SACHIN","PPRAJ","2022-06-30"
"B593","09-220-00 - SHAFT PE &GM-ESTMN","B593-09-220-00","5","","12-02-2022","SACHIN","Chandru","2022-02-12"
"B593","01-055-R2 SHAFT CUTTER SUPPORT-SLI-ESTMN","B593-01-055-R2","2","","12-02-2022","SACHIN","Chandru","2022-02-12"
"B593","02-510-P2 SHUTTLE BLADE-P2-ESTMN","B593-02-510-00","1","","12-05-2022","Amar","PPRAJ","2022-05-12"
"B593","12-056-00-DUMMY ROLLER HOLDER-ESTMN","B593-12-056-00","6","","12-02-2022","SACHIN","Chandru","2022-02-12"
"B593","02-1050-00-PUSHER MTG PLATE-ESTMN","B593-02-1050-00","2","","12-02-2022","SACHIN","Chandru","2022-02-12"
"B593","13-030-00-MAIN FRAME GUARD - FRONT","B593-13-030-00","2","","24-05-2022","SACHIN","PPRAJ","2022-05-24"
"B593","01-880-00 TARGET PLATE-CUT TO CREASE-SLI-ESTMN","B593-01-880-00","5","","12-04-2022","SACHIN","Chandru","2022-04-12"
"B593","CSPB003-07-140-00-GUIDE RUBBER ROLLER","CSPB003-07-140-00","20","","17-02-2022","SACHIN","Chandru","2022-02-17"
"B593","02-870-00 CAM BRG COVER-ESTMN","B593-02-870-00","10","","12-02-2022","SACHIN","Chandru","2022-02-12"
"B593","02-1230-R1-SHUTTLE PLATE-3","B593-02-1230-R1","1","","29-06-2022","SACHIN","PPRAJ","2022-06-29"
"B593","02-1260-00-SHUTTLE PLATE-6","B593-02-1260-00","1","","23-06-2022","Amar","PPRAJ","2022-06-23"
"B593","08-950-00-MOTOR MTG PLTE HINGE","B593-08-950-00","2","","12-02-2022","SACHIN","Chandru","2022-02-12"
"B593","01-036-R2 CUSHION PIN CUTTER BLADE-ESTMN","B593-01-036-R2","40","","12-02-2022","SACHIN","Chandru","2022-02-12"
"B593","CSPB003-02-040-R2 - CRANK DRIVE SHAFT","CSPB003-02-040-R2","5","","17-02-2022","SACHIN","Chandru","2022-02-17"
"B593","02-860-00 BASE PLATE SHUTTLE-SLI&MC-ESTMN","B593-02-860-00","1","","12-02-2022","SACHIN","Chandru","2022-02-12"
"B593","02-1230-00-SHUTTLE PLATE-3","B593-02-1230-00","1","","23-06-2022","Amar","PPRAJ","2022-06-23"
"B593","08-370-00 - MOTOR MOUNTIG BRACKET-ESTMN","B593-08-370-00","1","","12-02-2022","SACHIN","Chandru","2022-02-12"
"B593","01-019-00 SIDE PLATE CONNECTING  ROD DIA20-ESTMN","B593-01-019-00","2","","12-02-2022","SACHIN","Chandru","2022-02-12"
"B593","10-320-00-LONG GUIDE PLATE-FAR SIDE-PC6-ESTMN","B593-10-320-00","1","","12-02-2022","SACHIN","Chandru","2022-02-12"
"B593","02-020-00-LM HOUSING-ESTMN","B593-02-020-00","1","","12-02-2022","SACHIN","Chandru","2022-02-12"
"B593","09-100-R2 - LOCATING PIN-NEW","B593-09-100-R2","4","","05-07-2022","SACHIN","PPRAJ","2022-07-05"
"B593","01-040-00-Roller for Enveloping machine_Type 2","SPB0578-01-040-00","6","","17-02-2022","SACHIN","Chandru","2022-02-17"
"B593","02-720-00 - PLATE SHUTTLE SUPPORT-ESTMN","B593-02-720-00","2","","12-02-2022","SACHIN","Chandru","2022-02-12"
"B593","02-1200-00-SHUTTLE BLADE-8","B593-02-1200-00","1","","23-06-2022","Amar","PPRAJ","2022-06-23"
"B593","04-020-00 TENSIONER PIN-ESTMN","B593-04-020-00","1","","12-02-2022","SACHIN","Chandru","2022-02-12"
"B593","01-006-R2 - FEED ROLLER SHAFT DRIVE-ESTMN","B593-01-006-R2","1","","12-02-2022","SACHIN","Chandru","2022-02-12"
"B593","10-290-00-GUIDE PLATE-FAR SIDE-PC4-ESTMN","B593-10-290-00","1","","12-02-2022","SACHIN","Chandru","2022-02-12"
"B593","01-910-00-DANCING ROLLER PE GUIDE STRIP-128-ESTMN","B593-01-910-00","10","","12-02-2022","SACHIN","Chandru","2022-02-12"
"B593","02-1170-R1-SHUTTLE BLADE-5","B593-02-1170-R1","1","","16-07-2022","SACHIN","PPRAJ","2022-07-16"
"B593","01-010-00-RUBBER ROLLER_TYPE 1","SPB0578-01-010-00","4","","17-02-2022","SACHIN","Chandru","2022-02-17"
"B593","02-240-00 - STD BACK PLATE SHUTTLE GR-ESTMN","B593-02-240-00","1","","12-02-2022","SACHIN","Chandru","2022-02-12"
"B593","01-970-00-CUTTER SHAFT SPACER","B593-01-970-00","2","","04-07-2022","SACHIN","PPRAJ","2022-07-04"
"B593","02-1170-00-SHUTTLE BLADE-5","B593-02-1170-00","1","","23-06-2022","Amar","PPRAJ","2022-06-23"
"B593","02-1100-00-SMALL PART PUSHER ROD","B593-02-1100-00","2","","18-02-2022","SACHIN","Chandru","2022-02-18"
"B593","03-148-00 - CLAMP-ESTMN","B593-03-148-00","1","","12-02-2022","SACHIN","Chandru","2022-02-12"
"B593","10-260-00 GUIDE PLATE-PC1-ESTMN","B593-10-260-00","2","","12-02-2022","SACHIN","Chandru","2022-02-12"
"B593","01-148-00 - CLAMP-GUIDE ROD-ESTMN","B593-01-148-00","20","","12-02-2022","SACHIN","Chandru","2022-02-12"
"B593","12-320-00 WASHER-COMBO DRV TENSIONER-ESTMN","B593-12-320-00","1","","12-02-2022","SACHIN","Chandru","2022-02-12"
"B593","02-150-00 CRANK DRIVE SHAFT FOR SHIMPO GB-090B-ESTMN","B593-02-150-00","2","","12-02-2022","SACHIN","Chandru","2022-02-12"
"B593","01-910-R2-DANCING ROLLER PE GUIDE STRIP-128-ESTMN","B593-01-910-R2","10","","12-07-2022","SACHIN","PPRAJ","2022-07-12"
"B593","02-1140-00-SHUTTLE BLADE-2","B593-02-1140-00","1","","23-06-2022","Amar","PPRAJ","2022-06-23"
"B593","03-020-R3 - BOTTOM PLATE-SEALING-SLI-ESTMN","B593-03-020-R3","7","","12-02-2022","SACHIN","Chandru","2022-02-12"
"B593","02-1120-R1-SHUTTLE SUPPORT BRKT","B593-02-1120-R1","1","","08-07-2022","SACHIN","PPRAJ","2022-07-08"
"B593","02-1330-00-SHUTTLE BLADE-10","B593-02-1330-00","1","","30-06-2022","SACHIN","PPRAJ","2022-06-30"
"B593","09-430-00 - GM ROLL-ESTMN","B593-09-430-00","5","","12-02-2022","SACHIN","Chandru","2022-02-12"
"B593","01-084-R2 - SHAFT DANCING UNIT-ESTMN","B593-01-084-R2","2","","12-02-2022","SACHIN","Chandru","2022-02-12"
"B593","12-060-00 DRIVEN PULLEY-ESTMN","B593-12-060-00","8","","12-02-2022","SACHIN","Chandru","2022-02-12"
"B593","02-1060-00-ADAPTOR HOUSING-SHIMPO-GBP090-ESTMN","B593-02-1060-00","1","","12-02-2022","SACHIN","Chandru","2022-02-12"
"B593","CSPB003-20-004-R1 FEED RUBBER ROLLER","CSPB003-20-004-R1","30","","17-02-2022","SACHIN","Chandru","2022-02-17"
"B593","03-008-00 - SPACER FOR FEED DRIVE ROLLER-ESTMN","B593-03-008-00","1","","12-02-2022","SACHIN","Chandru","2022-02-12"
"B593","02-1120-00-SHUT HEIGHT ADJ BRKT-ESTMN","B593-02-1120-00","10","","30-06-2022","SACHIN","PPRAJ","2022-06-30"
"B593","02-1270-00-SHUTTLE PLATE-7","B593-02-1270-00","1","","23-06-2022","Amar","PPRAJ","2022-06-23"
"B593","03-330-R1 - SEAL END STOPPER-ESTMN","B593-03-330-R1","1","","04-04-2022","SACHIN","Chandru","2022-04-04"
"B593","09-010-00 - MOTOR BRACKET-NEW","B593-09-010-00","2","","12-02-2022","SACHIN","Chandru","2022-02-12"
"B593","01-041-R2 CREASING BLADE-ESTMN","B593-01-041-R2","2","","12-02-2022","SACHIN","Chandru","2022-02-12"
"B593","02-060-R1 - BEARING HOUSING COVER-ESTMN","B593-02-060-R1","1","","12-02-2022","SACHIN","Chandru","2022-02-12"
"B593","13-010-00-MAIN FRAME GUARD - LEFT","B593-13-010-00","1","","24-05-2022","SACHIN","PPRAJ","2022-05-24"
"B593","03-750-00-SEALING WHEEL-126T","SPB0579-03-750-00","12","","26-03-2022","Amar","PPRAJ","2022-03-26"
"B593","CSPB003-03-067-R1-SEALING WHEEL-BOT CLAMP-Ø50","CSPB003-03-067-R1","20","","17-02-2022","SACHIN","Chandru","2022-02-17"
"B593","02-863-00-IT SHUT HEIGHT ADJ BRKT-ESTMN","B593-02-863-00","10","","12-02-2022","SACHIN","Chandru","2022-02-12"
"B593","02-1240-00-SHUTTLE PLATE-4","B593-02-1240-00","1","","23-06-2022","Amar","PPRAJ","2022-06-23"
"B593","08-380-00 - MAIN MOTOR HINGE-ESTMN","B593-08-380-00","2","","12-02-2022","SACHIN","Chandru","2022-02-12"
"B593","01-025-R1 GUIDE ROD OPENER-ESTMN","B593-01-025-R1","1","","12-02-2022","SACHIN","Chandru","2022-02-12"
"B593","10-330-00-LONG GUIDE PLATE-FAR SIDE-PC4-ESTMN","B593-10-330-00","1","","12-02-2022","SACHIN","Chandru","2022-02-12"
"B593","CSPB002-01-001-00-CLAMPING RING-12x15","CSPB002-01-001-00","192","","17-02-2022","SACHIN","Chandru","2022-02-17"
"B593","02-820-00 PUSHER-ESTMN-SP133","B593-02-820-00","10","","12-02-2022","SACHIN","Chandru","2022-02-12"
"B593","02-1210-00-SHUTTLE PLATE-1","B593-02-1210-00","1","","23-06-2022","Amar","PPRAJ","2022-06-23"
"B593","08-010-00-FRAME-ESTMN","B593-08-010-00","1","","12-02-2022","SACHIN","Chandru","2022-02-12"
"B593","01-008-00 - SPACER FOR FEED DRIVE ROLLER-ESTMN","B593-01-008-00","2","","12-02-2022","SACHIN","Chandru","2022-02-12"
"B593","10-300-00-GUIDE PLATE-FAR SIDE-PC5-ESTMN","B593-10-300-00","1","","12-02-2022","SACHIN","Chandru","2022-02-12"
"B593","01-930-00-BELT TENSIONER KEY ROD","B593-01-930-00","1","","12-02-2022","SACHIN","Chandru","2022-02-12"
"B593","01-020-00-RUBBER ROLLER_TYPE 4","SPB0578-01-020-00","4","","17-02-2022","SACHIN","Chandru","2022-02-17"
"B593","02-250-00 - STD FRONT PLATE SHUTTLE GR-ESTMN","B593-02-250-00","1","","12-02-2022","SACHIN","Chandru","2022-02-12"
"B593","01-980-00-SEALING ASSY PULLEY SPACER","B593-01-980-00","1","","04-07-2022","SACHIN","PPRAJ","2022-07-04"
"B593","02-1180-00-SHUTTLE BLADE-6","B593-02-1180-00","1","","23-06-2022","Amar","PPRAJ","2022-06-23"
"B593","02-1110-00-SMALL PART PUSHER ROD","B593-02-1110-00","2","","18-02-2022","SACHIN","Chandru","2022-02-18"
"B593","03-640-00 SPACER -6204-ESTMN","B593-03-640-00","4","","12-02-2022","SACHIN","Chandru","2022-02-12"
"B593","01-001C-R5 SIDE PLATE DRIVE SIDE-ESTMN","B593-01-001C-R5","1","","12-02-2022","SACHIN","Chandru","2022-02-12"
"B593","10-270-00-GUIDE PLATE-NEAR SIDE-PC2-ESTMN","B593-10-270-00","2","","12-02-2022","SACHIN","Chandru","2022-02-12"
"B593","01-570-R1 PLATE PE & GM GUIDE-ESTMN","B593-01-570-R1","2","","12-02-2022","SACHIN","Chandru","2022-02-12"
"B593","12-390-00-TENSIONER MTG PIECE-ESTMN","B593-12-390-00","1","","12-02-2022","SACHIN","Chandru","2022-02-12"
"B593","02-180-00 SLIDER PIECE-ESTMN","B593-02-180-001","1","","12-02-2022","SACHIN","Chandru","2022-02-12"
"B593","01-960-R1-SEALING EXIT PE GUIDE","B593-01-960-R1","1","","12-07-2022","SACHIN","PPRAJ","2022-07-12"
"B593","02-1150-00-SHUTTLE BLADE-3","B593-02-1150-00","1","","23-06-2022","Amar","PPRAJ","2022-06-23"
"B593","03-070-R1 - SEALING DRIVE SHAFT -ESTMN","B593-03-070-R1","6","","12-02-2022","SACHIN","Chandru","2022-02-12"
"B593","02-1350-00-SUTTLE HEIGHT ADJUSTMENT PLATE","B593-02-1350-00","1","","08-07-2022","SACHIN","PPRAJ","2022-07-08"
"B593","02-1340-00-SHUTTLE PLATE-10","B593-02-1340-00","1","","30-06-2022","SACHIN","PPRAJ","2022-06-30"
"B593","03-770-00-STITCHING ASSY SHAFT SPACER","B593-03-770-00","100","","13-05-2022","SACHIN","PPRAJ","2022-05-13"
"B593","09-690-00-SENSOR BRKT","B593-09-690-00","20","","15-04-2022","Amar","PPRAJ","2022-04-15"
"B593","10-030-R1-SS-GUIDE PLATE-NEAR SIDE-ESTMN","B593-10-030-R1","1","","12-02-2022","SACHIN","Chandru","2022-02-12"
"B593","01-085-00 DANCING ROLLER-ESTMN","B593-01-085-00","2","","12-02-2022","SACHIN","Chandru","2022-02-12"
"B593","12-080-00 DRIVER SHAFT-EXIT CONVEYR-ESTMN","B593-12-080-00","1","","12-02-2022","SACHIN","Chandru","2022-02-12"
"B593","02-1070-00-PROX MTG PLATE-ESTMN","B593-02-1070-00","2","","12-02-2022","SACHIN","Chandru","2022-02-12"
"B593","01-1000-00-LM ROD FIXING BLOCK","B593-01-1000-00","1","","12-07-2022","SACHIN","PPRAJ","2022-07-12"
"B593","03-010-R2 BASE PLATE SEALING-COM-eastman","B593-03-010-R2","1","","12-02-2022","SACHIN","Chandru","2022-02-12"
"B593","02-1310-00-SHUTTLE BLADE-9","B593-02-1310-00","1","","30-06-2022","SACHIN","PPRAJ","2022-06-30"
"B593","02-1280-00-SHUTTLE PLATE-8","B593-02-1280-00","1","","23-06-2022","Amar","PPRAJ","2022-06-23"
"B593","09-100-R1 - LOCATING PIN-NEW","B593-09-100-R1","8","","12-02-2022","SACHIN","Chandru","2022-02-12"
"B593","01-054-00 - SPACER FOR CUTTER MANDREL-ESTMN","B593-01-054-00","2","","12-02-2022","SACHIN","Chandru","2022-02-12"
"B594","03-390-00 PINCH ROLL-SS-ASTD","B594-03-390-00","3","","23-02-2022","SACHIN","Chandru","2022-02-23"
"B594","02-195-00-BEARING HSG SPACER-ASTD","B594-02-195-00","2","","23-02-2022","SACHIN","Chandru","2022-02-23"
"B594","09-680-00-PROFILE FIXING PLATE","B594-09-680-00","6","","28-03-2022","SACHIN","Chandru","2022-03-28"
"B594","02-070-00 STD LM HOUSING - SHUTTLE-ASTD","B594-02-070-00","2","","23-02-2022","SACHIN","Chandru","2022-02-23"
"B594","12-070-00-SENSOR BRKT FIXING PLATE-ASTD","B594-12-070-00","5","","23-02-2022","SACHIN","Chandru","2022-02-23"
"B594","01-141-R4 MOUNTING BRKT-PE070-11-ASTD","B594-01-141-R4","3","","23-02-2022","SACHIN","Chandru","2022-02-23"
"B594","09-170-00-UNWINDER FRAME-100x50.-ASTD","B594-09-170-00","1","","23-02-2022","SACHIN","Chandru","2022-02-23"
"B594","01-054-00 - SPACER FOR CUTTER MANDREL-ASTD","B594-01-054-00","2","","23-02-2022","SACHIN","Chandru","2022-02-23"
"B594","08-020-00 LONG SUPPORT BAR-RH-ASTD","B594-08-020-00","1","","23-02-2022","SACHIN","Chandru","2022-02-23"
"B594","01-003-00 - BEARING HOUSING FEEDER (DRIVE)-ASTD","B594-01-003-00","4","","23-02-2022","SACHIN","Chandru","2022-02-23"
"B594","03-640-00 SPACER -6204-ASTD","B594-03-640-00","4","","23-02-2022","SACHIN","Chandru","2022-02-23"
"B594","02-860-00 SPACER RING-CAM BRG-ASTD","B594-02-860-00","1","","23-02-2022","SACHIN","Chandru","2022-02-23"
"B594","02-080-00 CRANK-ASTD","B594-02-080-00","2","","23-02-2022","SACHIN","Chandru","2022-02-23"
"B594","12-250-R1 DUMMY ROLLER-EXIT CONV-ASTD","B594-12-250-R1","3","","23-02-2022","SACHIN","Chandru","2022-02-23"
"B594","01-146-00 SPACER PULLEY LOCK-ASTD","B594-01-146-00","2","","23-02-2022","SACHIN","Chandru","2022-02-23"
"B594","09-420-00 - ROLLER SUPPORT BRKT-ASTD","B594-09-420-00","10","","23-02-2022","SACHIN","Chandru","2022-02-23"
"B594","01-066-00 - FRONT PLATE CUTTER SUPPORT-ASTD","B594-01-066-00","4","","23-02-2022","SACHIN","Chandru","2022-02-23"
"B594","09-040-R3 - UNWINDER SHAFT-ASTD","B594-09-040-R3","4","","23-02-2022","SACHIN","Chandru","2022-02-23"
"B594","01-008-00 - SPACER FOR FEED DRIVE ROLLER-ASTD","B594-01-008-00","2","","23-02-2022","SACHIN","Chandru","2022-02-23"
"B594","03-750-R1-SEALING WHEEL-126T-ASTD","B594-03-750-R1","12","","23-02-2022","SACHIN","Chandru","2022-02-23"
"B594","03-060-00-SEALING DRIVE SHAFT-SERVO-ASTD","B594-03-060-00","3","","23-02-2022","SACHIN","Chandru","2022-02-23"
"B594","02-100-00 BASE PLATE SHUTTLE--MC-ASTD","B594-02-100-00","2","","23-02-2022","SACHIN","Chandru","2022-02-23"
"B594","02-020-R1 BEARING HOUSING-ASTD","B594-02-020-R1","2","","23-02-2022","SACHIN","Chandru","2022-02-23"
"B594","08-030-00-MAIN FRAME-ASTD","B594-08-030-00","1","","22-02-2022","SACHIN","Chandru","2022-02-22"
"B594","012-060-00-SENSOR FIXING BRKT-ASTD","B594-012-060-00","5","","23-02-2022","SACHIN","Chandru","2022-02-23"
"B594","01-073-00 - KNOB-ASTD","B594-01-073-00","4","","23-02-2022","SACHIN","Chandru","2022-02-23"
"B594","09-070-R1 - BUSH BACK PLATE-ASTD","B594-09-070-R1","4","","23-02-2022","SACHIN","Chandru","2022-02-23"
"B594","01-020-00 - SPACER FOR FEED DRIVEN ROLLER-ASTD","B594-01-020-00","2","","23-02-2022","SACHIN","Chandru","2022-02-23"
"B594","08-010-00 LONG SUPPORT BAR-LH-ASTD","B594-08-010-00","1","","23-02-2022","SACHIN","Chandru","2022-02-23"
"B595","05-720-00-SPACER SEALING DRIVE HOUSING-R & D","B595-05-720-00","1","","01-07-2022","SACHIN","PPRAJ","2022-07-01"
"B595","03-023-00 SHAFT PE","B595-03-023-00","1","","19-05-2022","SACHIN","PPRAJ","2022-05-19"
"B595","07-900-00-UNW BOT SENSOR","B595-07-900-00","1","","19-05-2022","SACHIN","PPRAJ","2022-05-19"
"B595","11-530-00 GUIDE RUBBER ROLLER CLAMP","B595-11-530-00","2","","19-05-2022","SACHIN","PPRAJ","2022-05-19"
"B595","09-210-00 SUPPORT PLATE-2","B595-09-210-00","5","","26-05-2022","SACHIN","PPRAJ","2022-05-26"
"B595","02-005-00 JACKING SCREW-M8","B595-02-005-00","2","","19-05-2022","SACHIN","PPRAJ","2022-05-19"
"B595","04-025-00-LEAF SPRING","B595-04-025-00","2","","19-05-2022","SACHIN","PPRAJ","2022-05-19"
"B595","11-440-00-STROKE  ADJUSTING SPACER","B595-11-440-00","1","","19-05-2022","SACHIN","PPRAJ","2022-05-19"
"B595","05-008-R1  SEALING DRIVE SHAFT-R & D","B595-05-008-R1","1","","01-07-2022","SACHIN","PPRAJ","2022-07-01"
"B595","04-360-00-EXIT CONVEYOR GUARDINGS RH","B595-04-360-00","1","","25-05-2022","SACHIN","PPRAJ","2022-05-25"
"B595","01-045-00 WASHER-M12","B595-01-045-00","4","","19-05-2022","SACHIN","PPRAJ","2022-05-19"
"B595","04-016-00 WASHER-COMBO DRV TENSIONER","B595-04-016-00","1","","19-05-2022","SACHIN","PPRAJ","2022-05-19"
"B595","11-340-R1-JIG PLATE","B595-11-340-R1","1","","19-05-2022","SACHIN","PPRAJ","2022-05-19"
"B595","02-021-R2-FEED ROLLER DRIVE SHAFTMOD-R & D","B595-02-021-R2","1","","01-07-2022","SACHIN","PPRAJ","2022-07-01"
"B595","01-900-00-SUPPORT GUIDE BASE","B595-01-900-00","2","","25-05-2022","SACHIN","PPRAJ","2022-05-25"
"B595","11-1010-00-SLEEVE GUIDE STRIP MTG BRKT","B595-11-1010-00","4","","20-05-2022","SACHIN","PPRAJ","2022-05-20"
"B595","01-020-00 WASHER-M12x36","B595-01-020-00","2","","19-05-2022","SACHIN","PPRAJ","2022-05-19"
"B595","10-560-00-00-FEED MOTOR MOUNTING PILLAR","B595-10-560-00","1","","01-07-2022","SACHIN","PPRAJ","2022-07-01"
"B595","04-010-00 PAD-DRIVEN SHAFT ASSY","B595-04-010-00","2","","19-05-2022","SACHIN","PPRAJ","2022-05-19"
"B595","11-280-00-PINCH RUBBER ROLLER DRIVE SHAFT","B595-11-280-00","1","","19-05-2022","SACHIN","PPRAJ","2022-05-19"
"B595","10-520-00-SIDE GUIDE PIECE-R & D","B595-10-520-00","2","","01-07-2022","SACHIN","PPRAJ","2022-07-01"
"B595","03-220-00-L BRKT","B595-03-220-00","2","","19-05-2022","SACHIN","PPRAJ","2022-05-19"
"B595","01-013-00 BEARING BLOCK RUBBER ROLLER (ENCODER)","B595-01-013-00","5","","08-06-2022","Amar","PPRAJ","2022-06-08"
"B595","11-100-00-LM ROD-DIA10","B595-11-100-00","1","","19-05-2022","SACHIN","PPRAJ","2022-05-19"
"B595","04-310-00-GUARDING TOP RH","B595-04-310-00","1","","20-05-2022","SACHIN","PPRAJ","2022-05-20"
"B595","05-730-00-SEALING MOTOR DRIVE SHAFT-SERVO-R & D","B595-05-730-00","1","","01-07-2022","SACHIN","PPRAJ","2022-07-01"
"B595","03-099-00-SLEEVE SUPPORT GUIDE ROD","B595-03-099-00","1","","19-05-2022","SACHIN","PPRAJ","2022-05-19"
"B595","09-190-00-WELD TABS","B595-09-190-00","4","","19-05-2022","SACHIN","PPRAJ","2022-05-19"
"B595","03-055-R3-PIPE-64x40x1000","B595-03-055-R3","2","","09-05-2022","SACHIN","PPRAJ","2022-05-09"
"B595","11-690-00 - SHAFT PE &GM","B595-11-690-00","1","","19-05-2022","SACHIN","PPRAJ","2022-05-19"
"B595","05-700-00-BEARING HOUSING I_F FLANGE-R & D","B595-05-700-00","1","","01-07-2022","SACHIN","PPRAJ","2022-07-01"
"B595","02-015-00 WASHER-Ø5x3","B595-02-015-00","2","","19-05-2022","SACHIN","PPRAJ","2022-05-19"
"B595","04-026-00-LEAF SPRING FIXING ROD","B595-04-026-00","1","","19-05-2022","SACHIN","PPRAJ","2022-05-19"
"B595","11-500-PUNCH-RACK-2P_2DP_40 WIDTH","B595-11-500-00","1","","19-05-2022","SACHIN","PPRAJ","2022-05-19"
"B595","01-053-00 T-NUT-SLEEVE GUIDE","B595-01-053-00","4","","19-05-2022","SACHIN","PPRAJ","2022-05-19"
"B595","04-020-00 SPACER-TENSIONER PIN","B595-04-020-00","1","","19-05-2022","SACHIN","PPRAJ","2022-05-19"
"B595","11-380-00 WASHER-Ø6x3","B595-11-380-00","2","","19-05-2022","SACHIN","PPRAJ","2022-05-19"
"B595","03-018-R2 FRAME-R & D","B595-03-018-R2","1","","01-07-2022","SACHIN","PPRAJ","2022-07-01"
"B595","01-910-00 SIDE GUIDE-INLET","B595-01-910-00","2","","25-05-2022","SACHIN","PPRAJ","2022-05-25"
"B595","11-590-00 LEAF SUP MTG BRKT","B595-11-590-00","1","","20-05-2022","SACHIN","PPRAJ","2022-05-20"
"B595","01-034-00 KNOB","B595-01-034-00","20","","19-05-2022","SACHIN","PPRAJ","2022-05-19"
"B595","03-061-00-ROLLER SUPPORT-12DIA","B595-03-061-00","5","","08-06-2022","Amar","PPRAJ","2022-06-08"
"B595","04-012-00 SHFT-PINCH ROLL TENSIONER","B595-04-012-00","1","","19-05-2022","SACHIN","PPRAJ","2022-05-19"
"B595","11-300-00- BEARING HOUSING SEALING (DRIVE)-COM","B595-11-300-00","1","","19-05-2022","SACHIN","PPRAJ","2022-05-19"
"B595","10-530-00-LEAD SCREW MTG-R & D","B595-10-530-00","1","","01-07-2022","SACHIN","PPRAJ","2022-07-01"
"B595","03-240-00-SPACER-SHAFT","B595-03-240-00","2","","19-05-2022","SACHIN","PPRAJ","2022-05-19"
"B595","11-220-00-ADJ CLAMP-12DIA","B595-11-220-00","4","","19-05-2022","SACHIN","PPRAJ","2022-05-19"
"B595","02-035-00-FEEDER MOTOR PULLEY DRIVE","B595-02-035-00","1","","20-06-2022","Amar","PPRAJ","2022-06-20"
"B595","04-320-00-CONVEYOR GUARD VERTICAL GUIDE PLATE","B595-04-320-00","2","","20-05-2022","SACHIN","PPRAJ","2022-05-20"
"B595","01-010-00 JACK NUT-CUTTER-M12","B595-01-010-00","2","","19-05-2022","SACHIN","PPRAJ","2022-05-19"
"B595","10-500-00 FRAME-FEED ROLLER-R & D","B595-10-500-00","1","","01-07-2022","SACHIN","PPRAJ","2022-07-01"
"B595","03-100-R1-SENSOR BRKT","B595-03-100-R1","4","","19-05-2022","SACHIN","PPRAJ","2022-05-19"
"B595","10-03-00-WASHER-FRAME","B595-10-03-00","8","","19-05-2022","SACHIN","PPRAJ","2022-05-19"
"B595","03-069-00-CYLINDRICAL SPACER FOR PIPE ID","B595-03-069-00","2","","09-05-2022","SACHIN","PPRAJ","2022-05-09"
"B595","11-150-R2-GUIDE STRIP-BASE","B595-11-150-R2","2","","06-06-2022","Karumbaiah","PPRAJ","2022-06-06"
"B595","04-001-00 FRAME-EXIT CONVEYOR","B595-04-001-00","1","","20-05-2022","SACHIN","PPRAJ","2022-05-20"
"B595","05-710-00-BEARING HOUSING SEALING (DRIVE)-R & D","B595-05-710-00","1","","01-07-2022","SACHIN","PPRAJ","2022-07-01"
"B595","03-005-00 SPACER BLK-LONG SUP PLATE-TOP","B595-03-005-00","1","","19-05-2022","SACHIN","PPRAJ","2022-05-19"
"B595","01-024-00 SIDE GUIDE-INLET","B595-01-024-00","5","","31-05-2022","Karumbaiah","PPRAJ","2022-05-31"
"B595","07-020-00CLAMP-UW-ROD","B595-07-020-00","2","","19-05-2022","SACHIN","PPRAJ","2022-05-19"
"B595","11-510-00-GUIDE RUBBER ROLLER","B595-11-510-00","6","","19-05-2022","SACHIN","PPRAJ","2022-05-19"
"B595","03-569-00-BRKT1","B595-03-569-00","1","","26-05-2022","SACHIN","PPRAJ","2022-05-26"
"B595","01-880-00 TARGET PLATE-CUT TO CREASE-SLI","B595-01-880-00","1","","19-05-2022","SACHIN","PPRAJ","2022-05-19"
"B595","07-024-00-GEARBOX-SHAFT-TW63","B595-07-024-00","2","","28-05-2022","Amar","PPRAJ","2022-05-28"
"B595","04-023-00-TRAY STAND","B595-04-023-00","1","","19-05-2022","SACHIN","PPRAJ","2022-05-19"
"B595","11-390-00 WASHER-Ø5x3","B595-11-390-00","2","","19-05-2022","SACHIN","PPRAJ","2022-05-19"
"B595","10-120-00-LONG GUIDE ASSY","B595-10-120-00","3","","09-05-2022","SACHIN","PPRAJ","2022-05-09"
"B595","01-930-00-SPACER","B595-01-930-00","6","","16-07-2022","SACHIN","PPRAJ","2022-07-16"
"B595","03-240-R1-SPACER-SHAFT-R & D","B595-03-240-R1","2","","01-07-2022","SACHIN","PPRAJ","2022-07-01"
"B595","04-350-00-EXIT CONVEYOR GUARDING LH","B595-04-350-00","1","","25-05-2022","SACHIN","PPRAJ","2022-05-25"
"B595","11-680-00 - ROLLER SUPPORT PLATE","B595-11-680-00","4","","20-05-2022","SACHIN","PPRAJ","2022-05-20"
"B595","01-038-00 SPACER PULLEY LOCK","B595-01-038-00","1","","19-05-2022","SACHIN","PPRAJ","2022-05-19"
"B595","04-014-00  SPACER-TENSIONER SHAFT","B595-04-014-00","1","","19-05-2022","SACHIN","PPRAJ","2022-05-19"
"B595","11-310-00-INDEX MOTOR DRIVE SHAFT-SERVO","B595-11-310-00","1","","19-05-2022","SACHIN","PPRAJ","2022-05-19"
"B595","10-540-00-STOPPER PLATE-R & D","B595-10-540-00","1","","01-07-2022","SACHIN","PPRAJ","2022-07-01"
"B595","04-008-00 SPROCKET-TENSIONER","B595-04-008-00","1","","19-05-2022","SACHIN","PPRAJ","2022-05-19"
"B595","11-250-R1-BASE PLATE MOT DRIVE UNIT","B595-11-250-R1","1","","19-05-2022","SACHIN","PPRAJ","2022-05-19"
"B595","04-330-00 SPROCKET-12_7-12T EX CONV","B595-04-330-00","1","","20-05-2022","SACHIN","PPRAJ","2022-05-20"
"B595","01-012-00  BRG BLK RUB ROLLER (DRIVE)-SLI","B595-01-012-00","1","","19-05-2022","SACHIN","PPRAJ","2022-05-19"
"B595","10-510-00-FEED MOTOR MTG BRKT","B595-10-510-00","1","","01-07-2022","SACHIN","PPRAJ","2022-07-01"
"B595","03-210-00 STIFFNER-SLEEVE","B595-03-210-00","1","","19-05-2022","SACHIN","PPRAJ","2022-05-19"
"B595","11-020-R1-INDEXING MOT MTG PLATE","B595-11-020-R1","1","","19-05-2022","SACHIN","PPRAJ","2022-05-19"
"B595","03-098-R1-S-WHEEL-BOT-HSG","B595-03-098-R1","1","","09-05-2022","SACHIN","PPRAJ","2022-05-09"
"B595","04-300-00-GUARDING TOP LH","B595-04-300-00","1","","20-05-2022","SACHIN","PPRAJ","2022-05-20"
"B596","07-004-00 LM-ROD-25DIA-UW-SHAFT-A","B596-07-004-00","2","","23-07-2022","SACHIN","PPRAJ","2022-07-23"
"B596","02-006-00 JACK-NUT-M8-A","B596-02-006-00","2","","04-07-2022","SACHIN","PPRAJ","2022-07-04"
"B596","11-250-R1-BASE PLATE MOT DRIVE UNIT-A","B596-11-250-R1","1","","04-07-2022","SACHIN","PPRAJ","2022-07-04"
"B596","01-900-00-SUPPORT GUIDE BASE-A","B596-01-900-00","2","","04-07-2022","SACHIN","PPRAJ","2022-07-04"
"B596","11-130-00-SLIDEWAY PIECE-A","B596-11-130-00","1","","04-07-2022","SACHIN","PPRAJ","2022-07-04"
"B596","03-650-00-S-GUIDE-3.5MM","B596-03-650-00","2","","23-07-2022","SACHIN","PPRAJ","2022-07-23"
"B596","01-049-00 PINION SUPORT-A","B596-01-049-00","1","","04-07-2022","SACHIN","PPRAJ","2022-07-04"
"B596","11-1010-00-SLEEVE GUIDE STRIP MTG BRKT-A","B596-11-1010-00","4","","04-07-2022","SACHIN","PPRAJ","2022-07-04"
"B596","03-052-00-GUIDE ROD-10DIA-A","B596-03-052-00","8","","23-07-2022","SACHIN","PPRAJ","2022-07-23"
"B596","03-569-00-BRKT1-A","B596-03-569-00","2","","04-07-2022","SACHIN","PPRAJ","2022-07-04"
"B596","03-005-00 SPACER BLK-LONG SUP PLATE-TOP-A","B596-03-005-00","1","","04-07-2022","SACHIN","PPRAJ","2022-07-04"
"B596","07-029-00-BRG HSG LOWER-A","B596-07-029-00","2","","20-07-2022","SACHIN","PPRAJ","2022-07-20"
"B596","04-320-R1-CONVEYOR GUARD VERTICAL GUIDE PLATE-A","B596-04-320-R1","2","","14-07-2022","SACHIN","PPRAJ","2022-07-14"
"B596","11-330-00-BEARING HOUSING I_F FLANGE-A","B596-11-330-00","1","","04-07-2022","SACHIN","PPRAJ","2022-07-04"
"B596","02-017-00 SOLID COUPLING-A","B596-02-017-00","1","","04-07-2022","SACHIN","PPRAJ","2022-07-04"
"B596","04-001-00 FRAME-EXIT CONVEYOR-A","B596-04-001-00","1","","14-07-2022","SACHIN","PPRAJ","2022-07-14"
"B596","11-260-00-SIDE PLATE-MOT SIDE-A","B596-11-260-00","1","","04-07-2022","SACHIN","PPRAJ","2022-07-04"
"B596","01-910-00 SIDE GUIDE-INLET-A","B596-01-910-00","2","","04-07-2022","SACHIN","PPRAJ","2022-07-04"
"B596","11-170-00-SIDE PLATE-LEADING ROLLER SUPPORT-A","B596-11-170-00","2","","04-07-2022","SACHIN","PPRAJ","2022-07-04"
"B596","03-660-00-S-GUIDE-3.5MM TOP_4MM BTM","B596-03-660-00","2","","23-07-2022","SACHIN","PPRAJ","2022-07-23"
"B596","01-053-00 T-NUT-SLEEVE GUIDE-A","B596-01-053-00","4","","04-07-2022","SACHIN","PPRAJ","2022-07-04"
"B596","11-1020-00 -SLEEVE GUIDE STRIP RH-A","B596-11-1020-00","1","","04-07-2022","SACHIN","PPRAJ","2022-07-04"
"B596","03-057-00-SUPPORTING ROD-TOOLING-A","B596-03-057-00","8","","23-07-2022","SACHIN","PPRAJ","2022-07-23"
"B596","09-10-00 BASE PLATE-VIBRO MOUNT-A","B596-09-10-00","2","","04-07-2022","SACHIN","PPRAJ","2022-07-04"
"B596","03-012-R1 SUPPORT FIN-A","B596-03-012-R1","1","","04-07-2022","SACHIN","PPRAJ","2022-07-04"
"B596","04-350-R1-EXIT CONVEYOR GUARDING LH-A","B596-04-350-R1","1","","14-07-2022","SACHIN","PPRAJ","2022-07-14"
"B596","11-460-00 -SLEEVE GUIDE STRIP LH-A","B596-11-460-00","1","","04-07-2022","SACHIN","PPRAJ","2022-07-04"
"B596","02-024-00-ROLLER SHAFT SUPPORT PIECE-A","B596-02-024-00","1","","04-07-2022","SACHIN","PPRAJ","2022-07-04"
"B596","04-300-R1-GUARDING TOP LH-A","B596-04-300-R1","1","","14-07-2022","SACHIN","PPRAJ","2022-07-14"
"B596","11-270-00-SIDE PLATE-FAR SIDE SUPPORT-A","B596-11-270-00","1","","04-07-2022","SACHIN","PPRAJ","2022-07-04"
"B596","03-670-00-S-GUIDE-3MM TOP_3.5MM BTM","B596-03-670-00","2","","23-07-2022","SACHIN","PPRAJ","2022-07-23"
"B596","02-005-00 JACKING SCREW-M8-A","B596-02-005-00","2","","04-07-2022","SACHIN","PPRAJ","2022-07-04"
"B596","11-220-00-ADJ CLAMP-12DIA-A","B596-11-220-00","4","","04-07-2022","SACHIN","PPRAJ","2022-07-04"
"B596","01-678-00-WING BOLT-A","B596-01-678-00","8","","04-07-2022","SACHIN","PPRAJ","2022-07-04"
"B596","11-120-00-TOP BASE PLATE-A","B596-11-120-00","1","","04-07-2022","SACHIN","PPRAJ","2022-07-04"
"B596","03-060-00-YOKE BAR-A","B596-03-060-00","8","","23-07-2022","SACHIN","PPRAJ","2022-07-23"
"B596","10-06-00 SENSOR MTG PLATE-NEW-A","B596-10-06-00","1","","04-07-2022","SACHIN","PPRAJ","2022-07-04"
"B596","03-045-00-ANTI ROT PLATE-A","B596-03-045-00","13","","23-07-2022","SACHIN","PPRAJ","2022-07-23"
"B596","03-016-00 SUPPORTING PLATE-3-A","B596-03-016-00","2","","04-07-2022","SACHIN","PPRAJ","2022-07-04"
"B596","04-360-R1-EXIT CONVEYOR GUARDINGS RH-A","B596-04-360-R1","1","","14-07-2022","SACHIN","PPRAJ","2022-07-14"
"B596","11-560-00 JACK-NUT-M8-A","B596-11-560-00","1","","04-07-2022","SACHIN","PPRAJ","2022-07-04"
"B596","02-026-00-GUIDE-CROSS BAR-FOR ROLLER-A","B596-02-026-00","1","","04-07-2022","SACHIN","PPRAJ","2022-07-04"
"B596","07-028-00-BRG HSG UPPER-A","B596-07-028-00","2","","20-07-2022","SACHIN","PPRAJ","2022-07-20"
"B596","04-310-R1-GUARDING TOP RH-A","B596-04-310-R1","1","","14-07-2022","SACHIN","PPRAJ","2022-07-14"
"B596","11-310-00-INDEX MOTOR DRIVE SHAFT-SERVO-A","B596-11-310-00","1","","04-07-2022","SACHIN","PPRAJ","2022-07-04"
"B597","09-007-00 LONG SUPPORT-40-SQ BAR-B","B597-09-007-00","2","","25-07-2022","SACHIN","PPRAJ","2022-07-25"
"B597","10-001-GUIDE-CROSS BAR-B","B597-10-001-00","2","","25-07-2022","SACHIN","PPRAJ","2022-07-25"
"B597","02-026-00-GUIDE-CROSS BAR-FOR ROLLER-B","B597-02-026-00","2","","25-07-2022","SACHIN","PPRAJ","2022-07-25"
"B597","10-06-00 SENSOR MTG PLATE-NEW-B","B597-10-06-00","6","","25-07-2022","SACHIN","PPRAJ","2022-07-25"
"B597","03-016-00 SUPPORTING PLATE-3-B","B597-03-016-00","1","","25-07-2022","SACHIN","PPRAJ","2022-07-25"
"B597","02-027-00- SHAFT PE -B","B597-02-027-00","2","","25-07-2022","SACHIN","PPRAJ","2022-07-25"
"B597","01-026-00 SIDE PLATE-L-R1-B","B597-01-026-00","1","","25-07-2022","SACHIN","PPRAJ","2022-07-25"
"B597","07-004-00 LM-ROD-25DIA-UW-SHAFT-B","B597-07-004-00","2","","25-07-2022","SACHIN","PPRAJ","2022-07-25"
"B597","02-028-00 - GM ROLL-B","B597-02-028-00","2","","25-07-2022","SACHIN","PPRAJ","2022-07-25"
"B597","01-027-00 SIDE PLATE-B","B597-01-027-00","1","","25-07-2022","SACHIN","PPRAJ","2022-07-25"
"BPM1499","02-140-00 BEARING  BASE PAD","BPM1499-02-140-00","2","","28-01-2022","Karumbaiah","PPRAJ","2022-01-28"
"BPM1499","02-100-00-SHAFT MTG PLATE","BPM1499-02-100-00","1","","21-01-2022","Karumbaiah","PPRAJ","2022-01-21"
"BPM1499","02-160-00 LOCK PIN 2","BPM1499-02-160-00","2","","01-04-2022","Karumbaiah","PPRAJ","2022-04-01"
"BPM1499","02-060-00-PRESSING CYLD COUPLER BLOCK","BPM1499-02-060-00","1","","21-01-2022","Karumbaiah","PPRAJ","2022-01-21"
"BPM1499","02-020-00-PRESSING CYL MTG BRKT","BPM1499-02-020-00","1","","21-01-2022","Karumbaiah","PPRAJ","2022-01-21"
"BPM1499","02-045-00 A BEARING CAVITY 2","BPM1499-02-045-00","1","","19-03-2022","Karumbaiah","PPRAJ","2022-03-19"
"BPM1499","01-060-00-BOTTOM SHEET","BPM1499-01-060-00-BOTTOM SHEET","1","","20-01-2022","Karumbaiah","PPRAJ","2022-01-21"
"BPM1499","01-030-00-FIXED SIDE DOOR","BPM1499-01-030-00-FIXED SIDE DOOR","2","","20-01-2022","Karumbaiah","PPRAJ","2022-01-21"
"BPM1499","02-110-00 GUIDE ROD","BPM1499-02-110-00","4","","21-01-2022","Karumbaiah","PPRAJ","2022-01-21"
"BPM1499","02-040-00 A BEARING CAVITY","BPM1499-02-040-00","1","","28-01-2022","Karumbaiah","PPRAJ","2022-01-28"
"BPM1499","02-080-00-PRESSING CYL RUNNER PLT","BPM1499-02-080-00","1","","21-01-2022","Karumbaiah","PPRAJ","2022-01-21"
"BPM1499","02-047-00 A BEARING CAVITY 3","BPM1499-02-047-00 A","1","","01-04-2022","Karumbaiah","PPRAJ","2022-04-01"
"BPM1499","01-080-00 16MM BUSH","BPM1499-01-080-00","40","","28-01-2022","Karumbaiah","PPRAJ","2022-01-28"
"BPM1499","02-030-00-COMP GUIDE","BPM1499-02-030-00","1","","21-01-2022","Karumbaiah","PPRAJ","2022-01-21"
"BPM1499","02-075-00-PRESSING BUSH TYPE2","BPM1499-02-075-00","1","","19-03-2022","Karumbaiah","PPRAJ","2022-03-19"
"BPM1499","01-070-00-CABINET SUPPORT","BPM1499-01-070-00-CABINET SUPPORT","2","","20-01-2022","Karumbaiah","PPRAJ","2022-01-21"
"BPM1499","01-040-00-FRONT  DOOR","BPM1499-01-040-00-FRONT  DOOR","1","","20-01-2022","Karumbaiah","PPRAJ","2022-01-21"
"BPM1499","01-010-00-BASE FRAME","BPM1499-01-010-00-BASE FRAME","1","","20-01-2022","Karumbaiah","PPRAJ","2022-01-21"
"BPM1499","02-120-00-WASHER","BPM1499-02-120-00","4","","21-01-2022","Karumbaiah","PPRAJ","2022-01-21"
"BPM1499","02-070-00-PRESSING BUSH","BPM1499-02-070-00","2","","28-01-2022","Karumbaiah","PPRAJ","2022-01-28"
"BPM1499","02-090-00-PRESSING CYL GUIDE ROD","BPM1499-02-090-00","2","","21-01-2022","Karumbaiah","PPRAJ","2022-01-21"
"BPM1499","02-150-00 LOCK PIN","BPM1499-02-150-00","2","","01-04-2022","Karumbaiah","PPRAJ","2022-04-01"
"BPM1499","02-050-00-PRESSING CYL COUPLER","BPM1499-02-050-00","1","","21-01-2022","Karumbaiah","PPRAJ","2022-01-21"
"BPM1499","02-150-R1 LOCK PIN","BPM1499-02-150-R1","1","","29-04-2022","Karumbaiah","PPRAJ","2022-04-29"
"BPM1499","02-010-00- PRESSING UNITASSY L BRKT","BPM1499-02-010-00","1","","21-01-2022","Karumbaiah","PPRAJ","2022-01-21"
"BPM1499","01-050-00-PUCH BUTTON MTG  BRKT","BPM1499-01-050-00-PUCH BUTTON MTG  BRKT","2","","20-01-2022","Karumbaiah","PPRAJ","2022-01-21"
"BPM1499","01-020-00-BASE PLATE","BPM1499-01-020-00-BASE PLATE","1","","20-01-2022","Karumbaiah","PPRAJ","2022-01-21"
"BPM1499","02-130-00-LOAD CELL BUTTON","BPM1499-02-130-00","1","","21-01-2022","Karumbaiah","PPRAJ","2022-01-21"
"BPM1501","02-060-00-PRESSING CYLD COUPLER BLOCK","BPM1501-02-060-00","1","","21-01-2022","Karumbaiah","PPRAJ","2022-01-21"
"BPM1501","02-040-R1-B BEARING CAVITY","BPM1501-02-040-R1","1","","25-04-2022","Karumbaiah","PPRAJ","2022-04-25"
"BPM1501","02-030-00-COMP RESTING BASE","BPM1501-02-030-00","1","","21-01-2022","Karumbaiah","PPRAJ","2022-01-21"
"BPM1501","02-150-R1 LOCK PIN 1","BPM1501-02-150-R1","1","","29-04-2022","Karumbaiah","PPRAJ","2022-04-29"
"BPM1501","01-070-00-CABINET SUPPORT","BPM1501-01-070-00","2","","21-01-2022","Karumbaiah","PPRAJ","2022-01-21"
"BPM1501","02-130-00-LOAD CELL BUTTON","BPM1501-02-130-00","1","","21-01-2022","Karumbaiah","PPRAJ","2022-01-21"
"BPM1501","01-040-00-FRONT  DOOR","BPM1501-01-040-00","1","","21-01-2022","Karumbaiah","PPRAJ","2022-01-21"
"BPM1501","02-100-00-SHAFT MTG PLATE","BPM1501-02-100-00","1","","21-01-2022","Karumbaiah","PPRAJ","2022-01-21"
"BPM1501","01-010-00-BASE FRAME","BPM1501-01-010-00","1","","21-01-2022","Karumbaiah","PPRAJ","2022-01-21"
"BPM1501","02-070-00-PRESSING BUSH","BPM1501-02-070-00","1","","21-01-2022","Karumbaiah","PPRAJ","2022-01-21"
"BPM1501","02-047-00-B BEARING CAVITY 3","BPM1501-02-047-00","1","","01-04-2022","Karumbaiah","PPRAJ","2022-04-01"
"BPM1501","02-040-00-B BEARING CAVITY","BPM1501-02-040-00","1","","21-01-2022","Karumbaiah","PPRAJ","2022-01-21"
"BPM1501","02-010-00- PRESSING UNITASSY L BRKT","BPM1501-02-010-00","1","","21-01-2022","Karumbaiah","PPRAJ","2022-01-21"
"BPM1501","01-050-00-PUCH BUTTON MTG  BRKT","BPM1501-01-050-00","2","","21-01-2022","Karumbaiah","PPRAJ","2022-01-21"
"BPM1501","02-110-00 GUIDE ROD","BPM1501-02-110-00","4","","21-01-2022","Karumbaiah","PPRAJ","2022-01-21"
"BPM1501","01-020-00-BASE PLATE","BPM1501-01-020-00","1","","21-01-2022","Karumbaiah","PPRAJ","2022-01-21"
"BPM1501","02-080-00-PRESSING CYL RUNNER PLT","BPM1501-02-080-00","1","","21-01-2022","Karumbaiah","PPRAJ","2022-01-21"
"BPM1501","02-150-00 LOCK PIN 1","BPM1501-02-150-00","2","","01-04-2022","Karumbaiah","PPRAJ","2022-04-01"
"BPM1501","02-050-00-PRESSING CYL COUPLER","BPM1501-02-050-00","1","","21-01-2022","Karumbaiah","PPRAJ","2022-01-21"
"BPM1501","02-020-00-PRESSING CYL MTG BRKT","BPM1501-02-020-00","1","","21-01-2022","Karumbaiah","PPRAJ","2022-01-21"
"BPM1501","02-045-00-B BEARING CAVITY 2","BPM1501-02-045-00-B","1","","19-03-2022","Karumbaiah","PPRAJ","2022-03-21"
"BPM1501","01-060-00-BOTTOM SHEET","BPM1501-01-060-00","1","","21-01-2022","Karumbaiah","PPRAJ","2022-01-21"
"BPM1501","02-120-00-WASHER","BPM1501-02-120-00","4","","21-01-2022","Karumbaiah","PPRAJ","2022-01-21"
"BPM1501","01-030-00-FIXED SIDE DOOR","BPM1501-01-030-00","2","","21-01-2022","Karumbaiah","PPRAJ","2022-01-21"
"BPM1501","02-090-00-PRESSING CYL GUIDE ROD","BPM1501-02-090-00","2","","21-01-2022","Karumbaiah","PPRAJ","2022-01-21"
"BWM1263","02-191-00-TOP BEARING HLDR","BWM1263-02-191-00","2","","05-03-2022","Sunil","PPRAJ","2022-03-05"
"BWM1263","01-01-00-RC MTG PLT","BWM1263-01-01-00","2","","26-03-2022","SACHIN","Chandru","2022-03-26"
"BWM1263","02-190-00-SWIEL NOZZLE HLDR PONDY","BWM1263-02-190-00","2","","05-03-2022","Sunil","PPRAJ","2022-03-05"
"BWM1263","02-171-00-LOCKING PIN","BWM1263-02-171-00","2","","05-03-2022","Sunil","PPRAJ","2022-03-05"
"BWM1263","11-112-00-CORE BOTTOM","BWM1263-11-112-00","4","","16-05-2022","Nitish","PPRAJ","2022-05-16"
"BWM1263","01-02-00-REJECTION CHUTE","BWM1263-01-02-00","1","","26-03-2022","SACHIN","Chandru","2022-03-26"
"BWM1263","02-172-00-WIRE NOZZLE HLDR PADI","BWM1263-02-172-00","2","","05-03-2022","Sunil","PPRAJ","2022-03-05"
"BWM1263","02-185-00-LOCK FOR LINK","BWM1263-02-185-00","4","","05-03-2022","Sunil","PPRAJ","2022-03-05"
"BWM1263","11-114-00-BASE PLATE","BWM1263-11-114-00","4","","16-05-2022","Nitish","PPRAJ","2022-05-16"
"BWM1263","01-06-00-BLDC NWM MASTER","BWM1263-01-06-00","1","","27-05-2022","Karumbaiah","PPRAJ","2022-05-27"
"BWM1263","02-187-00-TOP NOZZLE","BWM1263-02-187-00","2","","05-03-2022","Sunil","PPRAJ","2022-03-05"
"BWM1263","02-186-00-LOCKING FOR SWIEL NOZZLE","BWM1263-02-186-00","2","","05-03-2022","Sunil","PPRAJ","2022-03-05"
"BWM1263","02-142-00-NOZZLE SWIEL LINK","BWM1263-02-142-00","4","","05-03-2022","Sunil","PPRAJ","2022-03-05"
"BWM1263","10-176-00-RUBBER PAD","BWM1263-10-176-00","8","","14-06-2022","Nitish","PPRAJ","2022-06-14"
"BWM1332","03-081-R1-INDEXER RING","BWM1332-03-081-R1","1","","07-03-2022","Nitish","PPRAJ","2022-03-07"
"BWM1332","07-020-00-CHANGE OVER PART HOLDER","BWM1332-07-020-00","1","","18-06-2022","Nitish","PPRAJ","2022-06-18"
"BWM1332","03-273-00-TOP GRIPPER BTM PLT","BWM1332-03-273-00","1","","24-08-2021","Sunil","PPRAJ","2021-08-24"
"BWM1332","02-201-00-CENTRE BLOCK HOLDER INVENT","BWM1332-02-201-00","2","","10-01-2022","Sunil","PPRAJ","2022-01-10"
"BWM1332","03-291-00-WINDING JAW HOLDING BKT","BWM1332-03-291-00","1","","24-08-2021","Sunil","PPRAJ","2021-08-24"
"BWM1332","03-081-00-INDEXER RING","BWM1332-03-081-00","2","","29-01-2022","Nitish","PPRAJ","2022-01-29"
"BWM1332","02-132-00-WIRE GUIDE FORM BALAJI","BWM1332-02-132-00","2","","24-08-2021","Sunil","PPRAJ","2021-08-24"
"BWM1332","03-211-R1-WIRE GRIPPER","BWM1332-03-211-R1","1","","24-08-2021","Sunil","PPRAJ","2021-08-24"
"BWM1332","07-030-00-TOP CHANGE OVER PART SEG","BWM1332-07-030-00","1","","18-06-2022","Nitish","PPRAJ","2022-06-18"
"BWM1332","02-202-00-CENTRE BLK HLDR PLATE","BWM1332-02-202-00","2","","10-01-2022","Sunil","PPRAJ","2022-01-10"
"BWM1332","03-271-00-TOP GRIPPER PLT RH","BWM1332-03-271-00","1","","24-08-2021","Sunil","PPRAJ","2021-08-24"
"BWM1332","03-301-00-SIDE WIRE GUIDE TOOLING","BWM1332-03-301-00","4","","29-01-2022","Nitish","PPRAJ","2022-01-29"
"BWM1332","02-025-00-HOOKING CYLINDER MOUNTING PLATE","BWM1332-02-025-00","1","","24-08-2021","Sunil","PPRAJ","2021-08-24"
"BWM1332","07-010-00-SIDE TOOL SEG","BWM1332-07-010-00","2","","18-06-2022","Nitish","PPRAJ","2022-06-18"
"BWM1332","03-272-00-TOP GRIPPER  PLT LH","BWM1332-03-272-00","1","","24-08-2021","Sunil","PPRAJ","2021-08-24"
"BWM1332","03-391-00-LOCKING BTM PLATE","BWM1332-03-391-00","2","","29-01-2022","Nitish","PPRAJ","2022-01-29"
"BWM1332","02-141-00-CENTRE BLK HLDR","BWM1332-02-141-00","1","","10-01-2022","Sunil","PPRAJ","2022-01-10"
"BWM1332","02-191-00-JAW ACTUATOR CONE","BWM1332-02-191-00","1","","24-08-2021","Sunil","PPRAJ","2021-08-24"
"BWM1332","02-163-00-CENTER BLOCK BALAJI","BWM1332-02-163-00","1","","24-08-2021","Sunil","PPRAJ","2021-08-24"
"BWM1336","09-221-00-CENTER BLOCK RAJMANE","BWM1336-09-221-00","2","","07-09-2021","Nirmal","PPRAJ","2021-09-07"
"BWM1336","02-063-00-NOZZLE FOR FLYER ASSY","BWM1336-02-063-00","15","","31-12-2021","Sunil","PPRAJ","2021-12-31"
"BWM1336","09-062-00 WORK HOLDING ADAPTOR","BWM1336-09-062-00","1","","07-09-2021","Nirmal","PPRAJ","2021-09-07"
"BWM1336","09-210-00-WIRE GUIDE FORM RAJMANE","BWM1336-09-210-00","2","","07-09-2021","Nirmal","PPRAJ","2021-09-07"
"BWM1336","09-220-00-CENTER BLOCK RAJMANE","BWM1336-09-220-00","2","","07-09-2021","Nirmal","PPRAJ","2021-09-07"
"BWM1404","03-341-00-MOTOR COVER","BWM1404-03-341-00","1","","20-04-2022","Nitish","PPRAJ","2022-04-20"
"BWM1404","03-338-00-CYLINDER ADAPTER","BWM1404-03-338-00","1","","12-04-2022","Nitish","PPRAJ","2022-04-12"
"BWM1404","03-335-00-MULTI STROKE COUPLER","BWM1404-03-335-00","1","","12-04-2022","Nitish","PPRAJ","2022-04-12"
"BWM1404","03-191-00-JAW ACTUATOR CONE TVS","BWM1404-03-191-00","1","","12-04-2022","Nitish","PPRAJ","2022-04-12"
"BWM1404","03-170-00-TOP TOOL1","BWM1404-03-170-00","1","","12-04-2022","Nitish","PPRAJ","2022-04-12"
"BWM1404","03-336-00-CYL ADAPTER","BWM1404-03-336-00","1","","12-04-2022","Nitish","PPRAJ","2022-04-12"
"BWM1404","03-221-00-COUPLER","BWM1404-03-221-00","2","","12-04-2022","Nitish","PPRAJ","2022-04-12"
"BWM1404","03-180-00-TOOL RETAINER","BWM1404-03-180-00","1","","12-04-2022","Nitish","PPRAJ","2022-04-12"
"BWM1404","03-337-00-SIDE PLATES","BWM1404-03-337-00","2","","12-04-2022","Nitish","PPRAJ","2022-04-12"
"BWM1404","03-334-00-CYL HOLDING PLATE","BWM1404-03-334-00","1","","12-04-2022","Nitish","PPRAJ","2022-04-12"
"BWM1404","03-332-00-WIRE LOCKING PLATE","BWM1332-03-332-00","2","","21-06-2022","Nitish","PPRAJ","2022-06-21"
"CSPB002","CSPB002-01-001-00-CLAMPING RING-12x15","CSPB002-01-001-00","100","","30-10-2021","SACHIN","Chandru","2021-10-30"
"CSPB002","CSPB002-01-020-00 - CRANK","CSPB002-01-020-00","2","","30-10-2021","SACHIN","Chandru","2021-10-30"
"CSPB004","05-030-S2 BASE FLANGE-MAGAZINE-S2-v1","SPB0581-05-030-S2","1","","29-03-2022","Karumbaiah","PPRAJ","2022-03-29"
"CSPB004","CSPB004-02-290-00 PART PUSHER-RH","CSPB004-02-290-00","10","","02-07-2022","SACHIN","PPRAJ","2022-07-04"
"CSPB004","CSPB004-03-530-00 SPUR GEAR_DIN-38T-2M","CSPB004-03-530-00","20","","05-07-2022","SACHIN","PPRAJ","2022-07-05"
"CSPB004","CSPB004-01-041-R2 CREASING BLADE","CSPB004-01-041-R2","20","","08-03-2022","SACHIN","Chandru","2022-03-08"
"CSPB004","CSPB004-02-050-00- PART PUSHER-SLI-PC-1-NEW-ESTMN","CSPB004-02-050-00","20","","04-07-2022","SACHIN","PPRAJ","2022-07-04"
"CSPB004","CSPB004-01-014-R2 CREASE BLADE HOLDER","CSPB004-01-014-R2","5","","21-04-2022","Amar","PPRAJ","2022-04-21"
"CSPB004","CSPB004-03-750-R1-SEALING WHEEL-126T","CSPB004-03-750-R1","100","","08-03-2022","SACHIN","Chandru","2022-03-08"
"CSPB004","CSPB004-02-1050-00-PUSHER MTG PLATE","CSPB004-02-1050-00","6","","29-03-2022","SACHIN","Chandru","2022-03-29"
"CSPB004","CSPB004-03-090-00 SEALING RUBBER ROLLER","CSPB004-03-090-00","30","","28-02-2022","SACHIN","Chandru","2022-02-28"
"CSPB004","CSPB004-02-260-00 PART PUSHER-LH","CSPB004-02-260-00","10","","02-07-2022","SACHIN","PPRAJ","2022-07-04"
"CSPB004","CSPB004-01-035C-R3 - CUTTER SHAFT","CSPB004-01-035C-R3","4","","21-04-2022","Amar","PPRAJ","2022-04-21"
"CSPB005","CSPB005-01-044-00 SHAFT CUTTER SUPPORT-240","CSPB005-01-044-00","2","","05-07-2022","SACHIN","PPRAJ","2022-07-05"
"CSPB005","CSPB005-01-004-00 CUTTING BLADE-235","CSPB005-01-004-00","25","","30-06-2022","SACHIN","PPRAJ","2022-06-30"
"CSPB005","CSPB005-01-017-00 FEED ROLLER RUBBER ROLLER (DRIVEN)","CSPB005-01-017-00","4","","11-04-2022","SACHIN","Chandru","2022-04-11"
"CSPB005","CSPB005-01-003-00 CUTTER SHAFT- SLVR","CSPB005-01-003-00","2","","05-07-2022","SACHIN","PPRAJ","2022-07-05"
"CSPL2022","01-020-00-END CONNECTOR BLOCK","CSPL2022-01-020-00-END CONNECTOR BLOCK","60","","02-06-2022","Dayanand","PPRAJ","2022-06-02"
"CSPL2022","02-040-00-LOCKING BUSH","CSPL2022-02-040-00-LOCKING BUSH","13","","30-03-2022","Dayanand","PPRAJ","2022-03-30"
"CSPL2022","02-030-00-TAPPER BUSH","CSPL2022-02-030-00-TAPPER BUSH","13","","30-03-2022","Dayanand","PPRAJ","2022-03-30"
"CSPL2022","03-020-00-SENSOR MTG PLATE","CSPL2022-03-020-00-SENSOR MTG PLATE","3","","06-07-2022","Dayanand","PPRAJ","2022-07-06"
"CSPL2022","01-010-00-END CONNECTOR BLOCK","CSPL2022-01-010-00-END CONNECTOR BLOCK","30","","07-03-2022","Dayanand","PPRAJ","2022-03-07"
"CSPL2022","02-010-00-TOP LOCK","CSPL2022-02-010-00-TOP LOCK","13","","30-03-2022","Dayanand","PPRAJ","2022-03-30"
"CSPL2022","03-030-00-PART PRASENT SENSOR BKT","CSPL2022-03-030-00-PART PRASENT SENSOR BKT","1","","06-07-2022","Dayanand","PPRAJ","2022-07-06"
"CSPL2022","04-010-00-MONIFOLD BLOCK","CSPL2022-04-010-00-MONIFOLD BLOCK","1","","07-07-2022","Dayanand","PPRAJ","2022-07-07"
"CSPL2022","02-020-00-TAPPER PLATE","CSPL2022-02-020-00-TAPPER PLATE","13","","30-03-2022","Dayanand","PPRAJ","2022-03-30"
"CSPL2022","03-010-00-SENSOR MTG BKT","CSPL2022-03-010-00-SENSOR MTG BKT","2","","06-07-2022","Dayanand","PPRAJ","2022-07-06"
"HPF1446","01-063-00-WELDING BUSH FOR BASE COVERS","HPF1446-01-063-00","74","","05-10-2021","Sunil","PPRAJ","2021-10-05"
"HPF1446","02-054-R1-MALE Z-PUNCH 1600","SI1504-02-054-R1","1","","16-02-2022","Nitish","PPRAJ","2022-02-16"
"HPF1446","03-053-00-CYLINDER SPACER","HPF1446-03-053-00","4","","16-03-2022","Nitish","PPRAJ","2022-03-16"
"HPF1446","01-060-00-BASE FRONT SIDE COVERS","HPF1446-01-060-00","3","","05-10-2021","Sunil","PPRAJ","2021-10-05"
"HPF1446","04-087-00-WIRE GUIDE ROLLER","HPF1446-04-087-00","2","","24-09-2021","Sunil","PPRAJ","2021-09-24"
"HPF1446","02-057-R2-FORMING FORK-RH-1600R2","HPF1446-02-057-R2","1","","15-03-2022","Nitish","PPRAJ","2022-03-15"
"HPF1446","01-058-00-BASE SIDE FRONT DOOR","HPF1446-01-058-00","1","","05-10-2021","Sunil","PPRAJ","2021-10-05"
"HPF1446","03-050-00-FRONT WIRE GUIDE","HPF1446-03-050-00","1","","24-09-2021","Sunil","PPRAJ","2021-09-24"
"HPF1446","02-053-R1-V TOP TOOL 1600","HPF1446-02-053-R1","1","","15-03-2022","Nitish","PPRAJ","2022-03-15"
"HPF1446","01-017-00-BOTTOM SIDE PLATE LH","HPF1446-01-017-00","1","","05-10-2021","Sunil","PPRAJ","2021-10-05"
"HPF1446","01-064-00-ON AND OFF SWITCH PLATE","HPF1446-01-064-00","1","","05-10-2021","Sunil","PPRAJ","2021-10-05"
"HPF1446","01-061-00-BASE SIDE COVER RH","HPF1446-01-061-00","1","","05-10-2021","Sunil","PPRAJ","2021-10-05"
"HPF1446","02-049-00-V FORMING TOOL 1600 UPDATED","HPF1446-02-049-00","1","","03-01-2022","Nitish","PPRAJ","2022-01-03"
"HPF1446","04-070-00-WIRE GUIDING BUSH","HPF1446-04-070-00","1","","24-09-2021","Sunil","PPRAJ","2021-09-24"
"HPF1446","02-058-R1-Z PUNCH HOLDER 1600","HPF1446-02-058-R1","1","","15-03-2022","Nitish","PPRAJ","2022-03-15"
"HPF1446","01-016-00-BOTTOM SIDE PLATE","HPF1446-01-016-00","1","","05-10-2021","Sunil","PPRAJ","2021-10-05"
"HPF1446","03-051-00-WIRE GUIDE","HPF1446-03-051-00","1","","24-09-2021","Sunil","PPRAJ","2021-09-24"
"HPF1446","02-054-R2-MALE Z-PUNCH 1600","HPF1446-02-054-R2","1","","15-03-2022","Nitish","PPRAJ","2022-03-15"
"HPF1446","01-018-00-BOTTOM CENTRE PLATE","HPF1446-01-018-00","2","","05-10-2021","Sunil","PPRAJ","2021-10-05"
"HPF1446","01-065-00-ON AND OFF SWITCH PLATE","HPF1446-01-065-00","1","","05-10-2021","Sunil","PPRAJ","2021-10-05"
"HPF1446","02-062-R1-TOOL HOLDER SPACER","HPF1446-02-062-R1","2","","09-02-2022","Nitish","PPRAJ","2022-02-09"
"HPF1446","01-062-00-BASE SIDE COVERS LH","HPF1446-01-062-00","1","","05-10-2021","Sunil","PPRAJ","2021-10-05"
"HPF1446","01-059-00-BASE FRONT COVER","HPF1446-01-059-00","1","","05-10-2021","Sunil","PPRAJ","2021-10-05"
"HPF1446","03-052-00-NOTCHER WIRE GUIDE","HPF1446-03-052-00-NOTCHER WIRE GUIDE","3","","24-09-2021","Sunil","PPRAJ","2021-09-24"
"HPF1446","02-056-R2-FORMING FORK-LH-1600","HPF1446-02-056-R2","1","","15-03-2022","Nitish","PPRAJ","2022-03-15"
"HPF1446","01-057-00-BASE FRONT DOOR","HPF1446-01-057-00","1","","05-10-2021","Sunil","PPRAJ","2021-10-05"
"HPF1446","02-052-R1-FEMALE Z PUNCH 1600","HPF1446-02-052-R1","1","","15-03-2022","Nitish","PPRAJ","2022-03-15"
"HPF1446","01-066-00-GUARD","HPF1446-01-066-00","1","","05-10-2021","Sunil","PPRAJ","2021-10-05"
"HPF1447","02-061-R1-WEDGE HOLDER PLATE","HPF1447-02-061-R1","1","","07-10-2021","Amar","PPRAJ","2021-10-07"
"HPF1447","02-045-00-WIRE CLAMPING STICK","HPF1447-02-045-00","1","","11-01-2022","Nitish","PPRAJ","2022-01-11"
"HPF1447","02-056-R1-TOOL HOLDER SPACER","HPF1447-02-056-R1","2","","09-02-2022","Nitish","PPRAJ","2022-02-09"
"HPF1471","04-065-00-BALL RETAINER","HPF1471-04-065-00","4","","01-09-2021","Sunil","PPRAJ","2021-09-01"
"HPF1471","04-041-00-DE-ENAMEL SPINDLE","HPF1471-04-041-00","1","","01-09-2021","Sunil","PPRAJ","2021-09-01"
"HPF1471","02-036-00-WASHER","HPF1471-02-036-00","1","","01-09-2021","Sunil","PPRAJ","2021-09-01"
"HPF1471","01-052-00-BACK PLATE","HPF1471-01-052-00","1","","28-08-2021","Sunil","PPRAJ","2021-08-28"
"HPF1471","02-057-00-SPRING FOR FORMING FORK","HPF1471-02-057-00","5","","22-09-2021","Amar","PPRAJ","2021-09-22"
"HPF1471","04-021-00-CLAMP SUPPORT BRACKET","HPF1471-04-021-00","1","","01-09-2021","Sunil","PPRAJ","2021-09-01"
"HPF1471","03-022-00-WIRE GUIDE","HPF1471-03-022-00","1","","01-09-2021","Sunil","PPRAJ","2021-09-01"
"HPF1471","01-029-00-NUT HOUSING SPACER","HPF1471-01-029-00","1","","01-09-2021","Sunil","PPRAJ","2021-09-01"
"HPF1471","03-02-00-DOVETAIL SLIDE BLOCK","HPF1471-03-02-00","2","","28-08-2021","Sunil","PPRAJ","2021-08-28"
"HPF1471","04-080-00-RAIL MTG PLATE","HPF1471-04-080-00","2","","01-09-2021","Sunil","PPRAJ","2021-09-01"
"HPF1471","03-036-00-NOTCHER-V","HPF1471-03-036-00","1","","01-09-2021","Sunil","PPRAJ","2021-09-01"
"HPF1471","01-053-00-TOP PLATE","HPF1471-01-053-00","1","","01-09-2021","Sunil","PPRAJ","2021-09-01"
"HPF1471","04-010-00-WIPER MTG PLATE-LH","HPF1471-04-010-00","2","","28-08-2021","Sunil","PPRAJ","2021-08-28"
"HPF1471","01-011-00-TENON FOR PRESS FRAME","HPF1471-01-011-00","1","","28-08-2021","Sunil","PPRAJ","2021-08-28"
"HPF1471","02-054-00-FORMING FORK-RH","HPF1471-02-054-00","2","","22-09-2021","Amar","PPRAJ","2021-09-22"
"HPF1471","04-045-00-DRIVING PULLEY","HPF1471-04-045-00","1","","01-09-2021","Sunil","PPRAJ","2021-09-01"
"HPF1471","03-019-00-PIN","HPF1471-03-019-00","1","","01-09-2021","Sunil","PPRAJ","2021-09-01"
"HPF1471","01-026-00-T BLOCK FOR BS SUPPORT BKT","HPF1471-01-026-00","1","","01-09-2021","Sunil","PPRAJ","2021-09-01"
"HPF1471","02-055-R3-FORMING FORK BESTO-LH","HPF1471-02-055-R3","1","","28-01-2022","Nitish","PPRAJ","2022-01-28"
"HPF1471","02-056-00-TOOL HOLDER SPACER","HPF1471-02-056-00","2","","28-08-2021","Sunil","PPRAJ","2021-08-28"
"HPF1471","01-058-00-MOP BOX STOPPER","HPF1471-01-058-00","4","","13-01-2022","Nitish","PPRAJ","2022-01-13"
"HPF1471","04-031-00-BRG RETAINER","HPF1471-04-031-00","1","","01-09-2021","Sunil","PPRAJ","2021-09-01"
"HPF1471","03-033-00-NOTCHING SLEEVE","HPF1471-03-033-00","1","","01-09-2021","Sunil","PPRAJ","2021-09-01"
"HPF1471","01-050-00-12 INCH V-PULLEY","HPF1471-01-050-00","2","","01-09-2021","Sunil","PPRAJ","2021-09-01"
"HPF1471","04-02-00-RAIL BUTTING WEDGE","HPF1471-04-02-00","1","","28-08-2021","Sunil","PPRAJ","2021-08-28"
"HPF1471","04-052-00-LM BLOCK BUTTING PLATE","HPF1471-04-052-00","1","","01-09-2021","Sunil","PPRAJ","2021-09-01"
"HPF1471","03-046-00-CERAMIC TUBE","HPF1471-03-046-00","1","","01-09-2021","Sunil","PPRAJ","2021-09-01"
"HPF1471","02-033-00-PIN HOLDER","HPF1471-02-033-00","1","","01-09-2021","Sunil","PPRAJ","2021-09-01"
"HPF1471","01-044-00-PIN FOR W.L ROLLER","HPF1471-01-044-00","2","","28-08-2021","Sunil","PPRAJ","2021-08-28"
"HPF1471","04-054-00-MOTOR MTG PLT","HPF1471-04-054-00","1","","01-09-2021","Sunil","PPRAJ","2021-09-01"
"HPF1471","03-016-00-BOTTOM WIRE CLAMP","HPF1471-03-016-00","1","","01-09-2021","Sunil","PPRAJ","2021-09-01"
"HPF1471","01-022-00-END SUPPORT HSG","HPF1471-01-022-00","1","","01-09-2021","Sunil","PPRAJ","2021-09-01"
"HPF1471","02-07-00-PUSHER SPRING","HPF1471-02-07-00","5","","28-08-2021","Sunil","PPRAJ","2021-08-28"
"HPF1471","01-191-00- L BRACKET FOR WIRE ENTRY","HPF1471-01-191-00","4","","03-01-2022","Nitish","PPRAJ","2022-01-03"
"HPF1471","04-025-00-WIRE CLAMP","HPF1471-04-025-00","1","","01-09-2021","Sunil","PPRAJ","2021-09-01"
"HPF1471","03-048-00-CUTTER DOOMNUT","HPF1471-03-048-00","1","","01-09-2021","Sunil","PPRAJ","2021-09-01"
"HPF1471","01-047-00-BRG RETAINER","HPF1471-01-047-00","2","","01-09-2021","Sunil","PPRAJ","2021-09-01"
"HPF1471","04-06-00-ENERGY CHAIN MTG PLATE","HPF1471-04-06-00","1","","28-08-2021","Sunil","PPRAJ","2021-08-28"
"HPF1471","02-055-R2-FORMING FORK BESTO-LH","HPF1471-02-055-R2","3","","25-12-2021","Nitish","PPRAJ","2021-12-25"
"HPF1471","04-035-00-D.E BRG HSG SPCR","HPF1471-04-035-00","1","","01-09-2021","Sunil","PPRAJ","2021-09-01"
"HPF1471","03-011-00-Ø20 LM ROD","HPF1471-03-011-00","2","","01-09-2021","Sunil","PPRAJ","2021-09-01"
"HPF1471","02-026-00-TENON","HPF1471-02-026-00","1","","01-09-2021","Sunil","PPRAJ","2021-09-01"
"HPF1471","05-09-00-GUIDE ROLLER SHAFT","HPF1471-05-09-00","1","","28-08-2021","Sunil","PPRAJ","2021-08-28"
"HPF1471","01-041-00-SHAFT FOR WIRE LOCKING ROLLER","HPF1471-01-041-00","2","","28-08-2021","Sunil","PPRAJ","2021-08-28"
"HPF1471","05-010-00-STRAIGHTNER BLOCK","HPF1471-05-010-00","4","","01-09-2021","Sunil","PPRAJ","2021-09-01"
"HPF1471","04-076-00-SPACER","HPF1471-04-076-00","3","","01-09-2021","Sunil","PPRAJ","2021-09-01"
"HPF1471","01-020-00-BEARING HOUSING","HPF1471-01-020-00","1","","01-09-2021","Sunil","PPRAJ","2021-09-01"
"HPF1471","02-01-00-PRESS FRAME","HPF1471-02-01-00","1","","28-08-2021","Sunil","PPRAJ","2021-08-28"
"HPF1471","02-045-00-WIRE CLAMPING STICK","HPF1471-02-045-00","1","","22-09-2021","Amar","PPRAJ","2021-09-22"
"HPF1471","04-27-00-WIRE GUIDE","HPF1471-04-27-00","1","","01-09-2021","Sunil","PPRAJ","2021-09-01"
"HPF1471","03-029-00-TOP CLAMP SPRING","HPF1471-03-029-00","5","","01-09-2021","Sunil","PPRAJ","2021-09-01"
"HPF1471","01-044-00-PIN FOR W.L ROLLER","HPF1471-01-044-00","2","","01-09-2021","Sunil","PPRAJ","2021-09-01"
"HPF1471","04-03-00-PRELOADING WEDGE","HPF1471-04-03-00","1","","28-08-2021","Sunil","PPRAJ","2021-08-28"
"HPF1471","02-060-R2-MALE Z PUNCH BESTO11","HPF1471-02-060-R2","4","","25-12-2021","Nitish","PPRAJ","2021-12-25"
"HPF1471","04-050-00-MOTOR PULLEY LOCKING SPIGOT","HPF1471-04-050-00","1","","01-09-2021","Sunil","PPRAJ","2021-09-01"
"HPF1471","03-043-00-HOOK RETRACTOR SPRING","HPF1471-03-043-00","5","","01-09-2021","Sunil","PPRAJ","2021-09-01"
"HPF1471","02-023-00-SLIDE RETAINER","HPF1471-02-023-00","2","","01-09-2021","Sunil","PPRAJ","2021-09-01"
"HPF1471","05-06-00-ST.SIDE GUIDE","HPF1471-05-06-00","1","","28-08-2021","Sunil","PPRAJ","2021-08-28"
"HPF1471","01-049-00-PULLEY SHAFT","HPF1471-01-049-00","2","","28-08-2021","Sunil","PPRAJ","2021-08-28"
"HPF1471","02-058-R1-FEMALE Z-PUNCH BESTO UPDATED","HPF1471-02-058-R1","2","","07-12-2021","Nitish","PPRAJ","2021-12-07"
"HPF1471","05-016-00-STRAIGHTNER TOP CLAMP-3","HPF1471-05-016-00","2","","01-09-2021","Sunil","PPRAJ","2021-09-01"
"HPF1471","04-081-00-COLLET BRG HSG","HPF1471-04-081-00","2","","01-09-2021","Sunil","PPRAJ","2021-09-01"
"HPF1471","02-044-00-WIRE CLAMP HINGE PIN","HPF1471-02-044-00","1","","01-09-2021","Sunil","PPRAJ","2021-09-01"
"HPF1471","01-054-00-RELIEF PIN","HPF1471-01-054-00","1","","28-08-2021","Sunil","PPRAJ","2021-08-28"
"HPF1471","03-061-00-NOTCHER PIN GUIDE","HPF1471-03-061-00","1","","12-01-2022","Nitish","PPRAJ","2022-01-12"
"HPF1471","02-064-00-V BENDING TOOL","HPF1471-02-064-00","3","","22-09-2021","Amar","PPRAJ","2021-09-22"
"HPF1471","04-068-00-TENON FOR WIRE GUIDE","HPF1471-04-068-00","4","","01-09-2021","Sunil","PPRAJ","2021-09-01"
"HPF1471","03-026-00-WASHER","HPF1471-03-026-00","3","","01-09-2021","Sunil","PPRAJ","2021-09-01"
"HPF1471","01-041-00-SHAFT FOR WIRE LOCKING ROLLER","HPF1471-01-041-00","2","","01-09-2021","Sunil","PPRAJ","2021-09-01"
"HPF1471","03-06-00-MALE DOVETAIL PLATE","HPF1471-03-06-00","1","","28-08-2021","Sunil","PPRAJ","2021-08-28"
"HPF1471","04-082-00-CYL MTG BLOCK","HPF1471-04-082-00","1","","01-09-2021","Sunil","PPRAJ","2021-09-01"
"HPF1471","03-040-00-NOTCHER LOCK WASHER","HPF1471-03-040-00","8","","01-09-2021","Sunil","PPRAJ","2021-09-01"
"HPF1471","01-160-00-GUIDE ROD","HPF1471-01-160-00","1","","01-09-2021","Sunil","PPRAJ","2021-09-01"
"HPF1471","05-03-00-ANGULAR MTG BLOCK","HPF1471-05-03-00","1","","28-08-2021","Sunil","PPRAJ","2021-08-28"
"HPF1471","01-160-00-GUIDE ROD","HPF1471-01-160-00","1","","28-08-2021","Sunil","PPRAJ","2021-08-28"
"HPF1471","03-053-R1-NOTCHING COUPLER","HPF1471-03-053-R1","4","","30-12-2021","Nitish","PPRAJ","2021-12-30"
"HPF1471","04-066-00-WIRE GUIDING BUSH","HPF1471-04-066-00","12","","01-09-2021","Sunil","PPRAJ","2021-09-01"
"HPF1471","04-053-00-TENSIONER PLATE","HPF1471-04-053-00","1","","01-09-2021","Sunil","PPRAJ","2021-09-01"
"HPF1471","02-041-00-CYL MTG BLOCK","HPF1471-02-041-00","1","","01-09-2021","Sunil","PPRAJ","2021-09-01"
"HPF1471","01-055-00-SPRING","HPF1471-01-055-00","5","","28-08-2021","Sunil","PPRAJ","2021-08-28"
"HPF1471","02-058-00-FEMALE Z-PUNCH BESTO","HPF1471-02-058-00","2","","13-11-2021","Nitish","PPRAJ","2021-11-13"
"HPF1471","02-061-00-WEDGE HOLDER PLATE","HPF1471-02-061-00","1","","22-09-2021","Amar","PPRAJ","2021-09-22"
"HPF1471","04-022-00-CLAMP BASE","HPF1471-04-022-00","1","","01-09-2021","Sunil","PPRAJ","2021-09-01"
"HPF1471","03-023-00-CUTTER PIVOT","HPF1471-03-023-00","1","","01-09-2021","Sunil","PPRAJ","2021-09-01"
"HPF1471","01-030-00-BS END SPACER","HPF1471-01-030-00","2","","01-09-2021","Sunil","PPRAJ","2021-09-01"
"HPF1471","03-03-00-LOCKING WEDGE","HPF1471-03-03-00","2","","28-08-2021","Sunil","PPRAJ","2021-08-28"
"HPF1471","04-062-00-QUADRUPLE CUTTER HSG","HPF1471-04-062-00","3","","01-09-2021","Sunil","PPRAJ","2021-09-01"
"HPF1471","03-037-00-NOTCHER LEVER","HPF1471-03-037-00","2","","01-09-2021","Sunil","PPRAJ","2021-09-01"
"HPF1471","01-054-00-RELIEF PIN","HPF1471-01-054-00","2","","01-09-2021","Sunil","PPRAJ","2021-09-01"
"HPF1471","04-011-00-WIPER MTG PLATE-RH","HPF1471-04-011-00","2","","28-08-2021","Sunil","PPRAJ","2021-08-28"
"HPF1471","01-012-00-INNER WEDGE","HPF1471-01-012-00","3","","28-08-2021","Sunil","PPRAJ","2021-08-28"
"HPF1471","01-045-00-BUSH HOLDER","HPF1471-01-045-00","1","","28-08-2021","Sunil","PPRAJ","2021-08-28"
"HPF1471","02-055-00-FORMING FORK-LH","HPF1471-02-055-00","2","","22-09-2021","Amar","PPRAJ","2021-09-22"
"HPF1471","04-A06-00-DE ENAMEL SUCTION  ASSY","HPF471-04-A06-00","1","","01-09-2021","Sunil","PPRAJ","2021-09-01"
"HPF1471","03-020-00-PIN-1","HPF1471-03-020-00","2","","01-09-2021","Sunil","PPRAJ","2021-09-01"
"HPF1471","01-027-00-MOTOR MTG PLATE","HPF1471-01-027-00","1","","01-09-2021","Sunil","PPRAJ","2021-09-01"
"HPF1471","02-057-00-SPRING FOR FORMING FORK","HPF1471-02-057-00","5","","28-08-2021","Sunil","PPRAJ","2021-08-28"
"HPF1471","04-062-R1-QUADRUPLE CUTTER HSG","HPF1471-04-062-R1","2","","29-03-2022","Nitish","PPRAJ","2022-03-29"
"HPF1471","04-032-00-SHAFT SPCR MTR END","HPF1471-04-032-00","1","","01-09-2021","Sunil","PPRAJ","2021-09-01"
"HPF1471","03-034-00-HINGE PIN HOLDER","HPF1471-03-034-00","1","","01-09-2021","Sunil","PPRAJ","2021-09-01"
"HPF1471","01-051-00-MTG PLATE","HPF1471-01-051-00","2","","01-09-2021","Sunil","PPRAJ","2021-09-01"
"HPF1471","04-09-00-SIDE COVER","HPF1471-04-09-00","2","","28-08-2021","Sunil","PPRAJ","2021-08-28"
"HPF1471","01-013-00-OUTER WEDGE","HPF1471-01-013-00","3","","28-08-2021","Sunil","PPRAJ","2021-08-28"
"HPF1471","04-078-00-WIRE GUIDE WASHER","HPF1471-04-078-00","5","","01-09-2021","Sunil","PPRAJ","2021-09-01"
"HPF1471","03-013-00-CYL COUPLER","HPF1471-03-013-00","1","","01-09-2021","Sunil","PPRAJ","2021-09-01"
"HPF1471","02-034-00-HINGE HOLDER","HPF1471-02-034-00","1","","01-09-2021","Sunil","PPRAJ","2021-09-01"
"HPF1471","04-055-00-BELT SETTING PLATE","HPF1471-04-055-00","1","","01-09-2021","Sunil","PPRAJ","2021-09-01"
"HPF1471","03-017-00-FRONT WIRE GUIDE","HPF1471-03-017-00","1","","01-09-2021","Sunil","PPRAJ","2021-09-01"
"HPF1471","01-023-00-BALL SCREW STOPPER","HPF1471-01-023-00","2","","01-09-2021","Sunil","PPRAJ","2021-09-01"
"HPF1471","02-09-00-PIN STOPPER HOLDER","HPF1471-02-09-00","1","","28-08-2021","Sunil","PPRAJ","2021-08-28"
"HPF1471","04-030-00-DE-ENAMEL MTR HSG","HPF1471-04-030-00","1","","01-09-2021","Sunil","PPRAJ","2021-09-01"
"HPF1471","03-09-00-NOTCHING DOOMNUT","HPF1471-03-09-00","1","","01-09-2021","Sunil","PPRAJ","2021-09-01"
"HPF1471","01-048-00-MTG PLATE","HPF1471-01-048-00","2","","01-09-2021","Sunil","PPRAJ","2021-09-01"
"HPF1471","04-07-00-LIMIT SWITCH MTG BLOCK","HPF1471-04-07-00","1","","28-08-2021","Sunil","PPRAJ","2021-08-28"
"HPF1471","04-040-00- DE-ENAMEL HOUSING","HPF1471-04-040-00","1","","01-09-2021","Sunil","PPRAJ","2021-09-01"
"HPF1471","03-012-00-TOP CUTTER MTG PLATE","HPF1471-03-012-00","1","","01-09-2021","Sunil","PPRAJ","2021-09-01"
"HPF1471","02-031-00-CYL MTG PLATE","HPF1471-02-031-00","1","","01-09-2021","Sunil","PPRAJ","2021-09-01"
"HPF1471","05-017-00-ROLLER SPACER","HPF1471-05-017-00","1","","28-08-2021","Sunil","PPRAJ","2021-08-28"
"HPF1471","01-042-00-WIRE LOCK SPRING","HPF1471-01-042-00","10","","28-08-2021","Sunil","PPRAJ","2021-08-28"
"HPF1471","02-059-R1-V-TOP CLAMP BESTO","HPF1471-02-059-R1","2","","07-12-2021","Nitish","PPRAJ","2021-12-07"
"HPF1471","05-011-00-ADJUSTABLE ROLLER HOLDER","HPF1471-05-011-00","12","","01-09-2021","Sunil","PPRAJ","2021-09-01"
"HPF1471","04-042-00-BRG RETAINER","HPF1471-04-042-00","1","","01-09-2021","Sunil","PPRAJ","2021-09-01"
"HPF1471","03-015-00-WIRE CLAMP PIN","HPF1471-03-015-00","4","","01-09-2021","Sunil","PPRAJ","2021-09-01"
"HPF1471","01-021-00-NUT HOUSING","HPF1471-01-021-00","1","","01-09-2021","Sunil","PPRAJ","2021-09-01"
"HPF1471","02-02-00-FRAME SPACER","HPF1471-02-02-00","1","","28-08-2021","Sunil","PPRAJ","2021-08-28"
"HPF1471","02-051-00-TOOL HOLDER BLOCK","HPF1471-02-051-00","3","","22-09-2021","Amar","PPRAJ","2021-09-22"
"HPF1471","04-023-00-CLAMP HOUSING","HPF1471-04-023-00","1","","01-09-2021","Sunil","PPRAJ","2021-09-01"
"HPF1471","03-049-00-LM GUIDE WASHER","HPF1471-03-049-00","2","","01-09-2021","Sunil","PPRAJ","2021-09-01"
"HPF1471","01-045-00-BUSH HOLDER","HPF1471-01-045-00","1","","01-09-2021","Sunil","PPRAJ","2021-09-01"
"HPF1471","04-04-00-LM RAIL JACKING PLATE","HPF1471-04-04-00","2","","28-08-2021","Sunil","PPRAJ","2021-08-28"
"HPF1471","02-064-R2-V BENDING TOOL UPDATED","HPF1471-02-064-R2","2","","25-12-2021","Nitish","PPRAJ","2021-12-25"
"HPF1471","04-063-00-D.E.INSERT HOLDER","HPF1471-04-063-00","4","","01-09-2021","Sunil","PPRAJ","2021-09-01"
"HPF1471","03-044-00-NOTCHING BLADE GUIDE","HPF1471-03-044-00","1","","01-09-2021","Sunil","PPRAJ","2021-09-01"
"HPF1471","02-024-00-SLIDE COUPLER BLOCK","HPF1471-02-024-00","1","","01-09-2021","Sunil","PPRAJ","2021-09-01"
"HPF1471","05-07-00-GUIDE ROLLER MTG PLT","HPF1471-05-07-00","1","","28-08-2021","Sunil","PPRAJ","2021-08-28"
"HPF1471","01-050-00-12 INCH V-PULLEY","HPF1471-01-050-00-12 INCH V-PULLEY","2","","28-08-2021","Sunil","PPRAJ","2021-08-28"
"HPF1471","03-050-00-NOTCHING BLADE BESTO","HPF1471-03-050-00","2","","09-12-2021","Amar","PPRAJ","2021-12-09"
"HPF1471","05-020-00-ST.ROLLER","HPF1471-05-020-00","46","","01-09-2021","Sunil","PPRAJ","2021-09-01"
"HPF1471","04-083-00-COLLET HOLDER SPCR","HPF1471-04-083-00","4","","01-09-2021","Sunil","PPRAJ","2021-09-01"
"HPF1471","02-047-00-PUNCH DOOMNUT","HPF1471-02-047-00","1","","01-09-2021","Sunil","PPRAJ","2021-09-01"
"HPF1471","01-051-00-MTG PLATE","HPF1471-01-051-00","1","","28-08-2021","Sunil","PPRAJ","2021-08-28"
"HPF1471","03-062-00-GUIDE ROD DIA 10MM","HPF1471-03-062-00","1","","12-01-2022","Nitish","PPRAJ","2022-01-12"
"HPF1471","02-04-00-Z PUNCH HOLDER-085","HPF1471-02-04-00","1","","22-09-2021","Amar","PPRAJ","2021-09-22"
"HPF1471","04-069-00-DOOM NUT FOR DE-COLLET","HPF1471-04-069-00","1","","01-09-2021","Sunil","PPRAJ","2021-09-01"
"HPF1471","03-027-00-CUTTER-TOP","HPF1471-03-027-00","2","","01-09-2021","Sunil","PPRAJ","2021-09-01"
"HPF1471","01-042-00-WIRE LOCK SPRING","HPF1471-01-042-00","10","","01-09-2021","Sunil","PPRAJ","2021-09-01"
"HPF1471","03-07-00-BUTTING PLATE","HPF1471-03-07-00","2","","28-08-2021","Sunil","PPRAJ","2021-08-28"
"HPF1471","02-04-R2-Z PUNCH HOLDER-085","HPF1471-02-04-R2","3","","25-12-2021","Nitish","PPRAJ","2021-12-25"
"HPF1471","04-086-00-COLLET CYL COUPLER","HPF1471-04-086-00","1","","01-09-2021","Sunil","PPRAJ","2021-09-01"
"HPF1471","03-041-00-NOTCHING BLADE","HPF1471-03-041-00","2","","01-09-2021","Sunil","PPRAJ","2021-09-01"
"HPF1471","02-021-00-SLIDE BASE","HPF1471-02-021-00","1","","01-09-2021","Sunil","PPRAJ","2021-09-01"
"HPF1471","05-04-00-STRAIGHTNER MTG BLOCK","HPF1471-05-04-00","2","","28-08-2021","Sunil","PPRAJ","2021-08-28"
"HPF1471","01-047-00-BRG RETAINER","HPF1471-01-047-00","2","","28-08-2021","Sunil","PPRAJ","2021-08-28"
"HPF1471","04-064-00-DE CUTTER SPRING","HPF1471-04-064-00","30","","30-12-2021","Nitish","PPRAJ","2021-12-30"
"HPF1471","02-04-R1-Z PUNCH HOLDER-085","HPF1471-02-04-R1","3","","07-12-2021","Nitish","PPRAJ","2021-12-07"
"HPF1471","05-014-00-STRAIGHTENER BTM PLATE","HPF1471-05-014-00","8","","01-09-2021","Sunil","PPRAJ","2021-09-01"
"HPF1471","04-087-00-DE-SUCTION CUP MTG PLATE","HPF1471-04-087-00","1","","01-09-2021","Sunil","PPRAJ","2021-09-01"
"HPF1471","02-042-00-WIRE CLAMP CYL MTG BLOCK","HPF1471-02-042-00","1","","01-09-2021","Sunil","PPRAJ","2021-09-01"
"HPF1471","01-056-00-WIRE JUMP PREVENTER PLATE","HPF1471-01-056-00","2","","28-08-2021","Sunil","PPRAJ","2021-08-28"
"HPF1471","02-059-00-V-TOP CLAMP BESTO","HPF1471-02-059-00","2","","13-11-2021","Nitish","PPRAJ","2021-11-13"
"HPF1471","02-023-R1-SLIDE RETAINER","HPF1471-02-023-R1","8","","03-11-2021","Sunil","PPRAJ","2021-11-03"
"HPF1471","02-062-00-WEDGE-LH","HPF1471-02-062-00","2","","22-09-2021","Amar","PPRAJ","2021-09-22"
"HPF1471","04-073-00-WIRE GUIDE ROLLER","HPF1471-04-073-00","4","","01-09-2021","Sunil","PPRAJ","2021-09-01"
"HPF1471","03-024-00-ROD COUPLER","HPF1471-03-024-00","1","","01-09-2021","Sunil","PPRAJ","2021-09-01"
"HPF1471","01-039-00-SENSOR MTG PLATE","HPF1471-01-039-00","1","","01-09-2021","Sunil","PPRAJ","2021-09-01"
"HPF1471","03-04-00-PIN SIZING SPACER","HPF1471-03-04-00","2","","28-08-2021","Sunil","PPRAJ","2021-08-28"
"HPF1471","04-033-00-SHAFT SPCR BS END","HPF1471-04-033-00","1","","01-09-2021","Sunil","PPRAJ","2021-09-01"
"HPF1471","03-038-00-NOTCHER ROLLER","HPF1471-03-038-00","2","","01-09-2021","Sunil","PPRAJ","2021-09-01"
"HPF1471","01-055-00-SPRING","HPF1471-01-055-00","5","","01-09-2021","Sunil","PPRAJ","2021-09-01"
"HPF1471","05-01-00-STRAIGHTNER L-BASE","HPF1471-05-01-00","1","","28-08-2021","Sunil","PPRAJ","2021-08-28"
"HPF1471","01-015-00-TENON FOR STRTNER BASE","HPF1471-01-015-00","2","","28-08-2021","Sunil","PPRAJ","2021-08-28"
"HPF1471","02-035-00-HINGE PIN","HPF1471-02-035-00","1","","01-09-2021","Sunil","PPRAJ","2021-09-01"
"HPF1471","01-046-00-PRESSURE ROLLER","HPF1471-01-046-00","2","","28-08-2021","Sunil","PPRAJ","2021-08-28"
"HPF1471","02-056-00-TOOL HOLDER SPACER","HPF1471-02-056-00","4","","22-09-2021","Amar","PPRAJ","2021-09-22"
"HPF1471","04-060-00-CUTTER CONE","HPF1471-04-060-00","1","","01-09-2021","Sunil","PPRAJ","2021-09-01"
"HPF1471","03-021-00-CUTTER BASE","HPF1471-03-021-00","1","","01-09-2021","Sunil","PPRAJ","2021-09-01"
"HPF1471","01-028-00-SHAFT SPCR","HPF1471-01-028-00","1","","01-09-2021","Sunil","PPRAJ","2021-09-01"
"HPF1471","04-88-00-SUC CUP CNTR","HPF1471-04-88-00","3","","31-01-2022","Sunil","PPRAJ","2022-01-31"
"HPF1471","03-01-00-DOVETAIL BASE PLATE","HPF1471-03-01-00","1","","28-08-2021","Sunil","PPRAJ","2021-08-28"
"HPF1471","04-047-00-SHAFT SPACER","HPF1471-04-047-00","1","","01-09-2021","Sunil","PPRAJ","2021-09-01"
"HPF1471","03-035-00-NOTCHING HINGE PIN","HPF1471-03-035-00","4","","01-09-2021","Sunil","PPRAJ","2021-09-01"
"HPF1471","01-052-00-BACK PLATE","HPF1471-01-052-00","1","","01-09-2021","Sunil","PPRAJ","2021-09-01"
"HPF1471","04-01-00-SLIDE BASE PLATE","HPF1471-04-01-00","1","","28-08-2021","Sunil","PPRAJ","2021-08-28"
"HPF1471","01-010-00-BASE STRUCTURE","HPF1471-01-010-00","1","","28-08-2021","Sunil","PPRAJ","2021-08-28"
"HPF1471","04-079-00-DAMPING ROLLER MTG PLT","HPF1471-04-079-00","2","","01-09-2021","Sunil","PPRAJ","2021-09-01"
"HPF1471","03-014-00-TOP WIRE CLAMP","HPF1471-03-014-00","1","","01-09-2021","Sunil","PPRAJ","2021-09-01"
"HPF1471","02-053-00-V-TOP CLAMP","HPF1471-02-053-00","2","","22-09-2021","Amar","PPRAJ","2021-09-22"
"HPF1471","04-044-00-TOP SPACER","HPF1471-04-044-00","1","","01-09-2021","Sunil","PPRAJ","2021-09-01"
"HPF1471","03-018-00-BTM WIRE CLMP HOLDER","HPF1471-03-018-00","1","","01-09-2021","Sunil","PPRAJ","2021-09-01"
"HPF1471","01-025-00-MOTOR HSG MTG BLOCK","HPF1471-01-025-00","1","","01-09-2021","Sunil","PPRAJ","2021-09-01"
"HPF1471","02-054-R3-FORMING FORK BESTO-RH","HPF1471-02-054-R3","1","","28-01-2022","Nitish","PPRAJ","2022-01-28"
"HPF1471","02-051-00-TOOL HOLDER BLOCK","HPF1471-02-051-00","1","","28-08-2021","Sunil","PPRAJ","2021-08-28"
"HPF1471","01-057-00-MOP BOX SLIDE STOPPER","HPF1471-01-057-00","4","","13-01-2022","Nitish","PPRAJ","2022-01-13"
"HPF1471","04-046-00-CUTTER SHAFT SPACER","HPF1471-04-046-00","1","","01-09-2021","Sunil","PPRAJ","2021-09-01"
"HPF1471","03-031-00-MAIN FRAME","HPF1471-03-031-00","1","","01-09-2021","Sunil","PPRAJ","2021-09-01"
"HPF1471","01-049-00-PULLEY SHAFT","HPF1471-01-049-00","2","","01-09-2021","Sunil","PPRAJ","2021-09-01"
"HPF1471","04-08-00-LIMIT SWITCH PROFILE","HPF1471-04-08-00","1","","28-08-2021","Sunil","PPRAJ","2021-08-28"
"HPF1471","04-051-00-LIMIT SWITCH PROFILE","HPF1471-04-051-00","1","","01-09-2021","Sunil","PPRAJ","2021-09-01"
"HPF1471","03-045-00-PIN","HPF1471-03-045-00","4","","01-09-2021","Sunil","PPRAJ","2021-09-01"
"HPF1471","02-032-00-PUSHER","HPF1471-02-032-00","1","","01-09-2021","Sunil","PPRAJ","2021-09-01"
"HPF1471","05-018-00-BUTT JOINT PLATE","HPF1471-05-018-00","1","","28-08-2021","Sunil","PPRAJ","2021-08-28"
"HPF1471","01-043-00-BUSH FOR W.L SHAFT","HPF1471-01-043-00","2","","28-08-2021","Sunil","PPRAJ","2021-08-28"
"HPF1471","03-054-00-CONICAL NOTCHING BLADE","HPF1471-03-054-00","10","","08-01-2022","Nitish","PPRAJ","2022-01-08"
"HPF1471","02-064-R1-V BENDING TOOL UPDATED","HPG1471-02-064-R1","3","","07-12-2021","Nitish","PPRAJ","2021-12-07"
"HPF1471","05-013-00-STRAIGHTENER TOP CLAMP-2","HPF1471-05-013-00","4","","01-09-2021","Sunil","PPRAJ","2021-09-01"
"HPF1471","04-043-00-DRIVEN PULLEY","HPF1471-04-043-00","1","","01-09-2021","Sunil","PPRAJ","2021-09-01"
"HPF1471","03-047-00-GUIDE PLATE","HPF1471-03-047-00","2","","01-09-2021","Sunil","PPRAJ","2021-09-01"
"HPF1471","01-024-00-MATCH PAIR BEARING RETAINER","HPF1471-01-024-00","1","","01-09-2021","Sunil","PPRAJ","2021-09-01"
"HPF1471","02-03-00-FRAME SPACER-RH","HPF1471-02-03-00","1","","28-08-2021","Sunil","PPRAJ","2021-08-28"
"HPF1471","01-016-00-L BRACKET PIN GUIDE","HPF1471-01-016-00","1","","03-01-2022","Nitish","PPRAJ","2022-01-03"
"HPF1471","02-052-00-FEMALE Z-PUNCH","HPF1471-02-052-00","1","","22-09-2021","Amar","PPRAJ","2021-09-22"
"HPF1471","04-024-00-CLAMP CYL MTG PLATE","HPF1471-04-024-00","1","","01-09-2021","Sunil","PPRAJ","2021-09-01"
"HPF1471","03-030-00-WIRE SEATSPRING","HPF1471-03-030-00","5","","01-09-2021","Sunil","PPRAJ","2021-09-01"
"HPF1471","01-046-00-PRESSURE ROLLER","HPF1471-01-046-00","2","","01-09-2021","Sunil","PPRAJ","2021-09-01"
"HPF1471","04-05-00-BUTTING BAR","HPF1471-04-05-00","2","","28-08-2021","Sunil","PPRAJ","2021-08-28"
"HPF1471","02-054-R2-FORMING FORK BESTO-RH","HPF1471-02-054-R2","3","","25-12-2021","Nitish","PPRAJ","2021-12-25"
"HPF1471","04-064-00-DE CUTTER SPRING","HPF1471-04-064-00","10","","01-09-2021","Sunil","PPRAJ","2021-09-01"
"HPF1471","03-010-00-CYL MTG PLATE","HPF1471-03-010-00","2","","01-09-2021","Sunil","PPRAJ","2021-09-01"
"HPF1471","02-025-00-SLIDE COUPLER","HPF1471-02-025-00","1","","01-09-2021","Sunil","PPRAJ","2021-09-01"
"HPF1471","05-08-00-GUIDE ROLLER HOLDER","HPF1471-05-08-00","1","","28-08-2021","Sunil","PPRAJ","2021-08-28"
"HPF1471","01-040-00-WIRE LOCKING KNOB","HPF1471-01-040-00","2","","28-08-2021","Sunil","PPRAJ","2021-08-28"
"HPF1471","05-021-00-ST.ROLLER SHAFT","HPF1471-05-021-00","43","","01-09-2021","Sunil","PPRAJ","2021-09-01"
"HPF1471","04-075-00-OUTER SPACER","HPF1471-04-075-00","3","","01-09-2021","Sunil","PPRAJ","2021-09-01"
"HPF1471","02-048-00-WIRE CLAMP DOOMNUT","HPF1471-02-048-00","1","","01-09-2021","Sunil","PPRAJ","2021-09-01"
"HPF1471","02-010-00-PIN STOPPER","HPF1471-02-010-00","1","","28-08-2021","Sunil","PPRAJ","2021-08-28"
"HPF1471","04-064-R1-DE CUTTER SPRING","HPF1471-04-064-R1","20","","13-01-2022","Nitish","PPRAJ","2022-01-13"
"HPF1471","02-06-00-MALE Z PUNCH-085","HPF1471-02-06-00","1","","22-09-2021","Amar","PPRAJ","2021-09-22"
"HPF1471","04-026-00-TENON FOR WIRE CLAMP ASSY","HPF1471-04-026-00","1","","01-09-2021","Sunil","PPRAJ","2021-09-01"
"HPF1471","03-028-00-CUTTER-BOTTOM","HPF1471-03-028-00","10","","01-09-2021","Sunil","PPRAJ","2021-09-01"
"HPF1471","01-043-00-BUSH FOR W.L SHAFT","HPF1471-01-043-00","2","","01-09-2021","Sunil","PPRAJ","2021-09-01"
"HPF1471","03-08-00-RH BLOCK FOR 085","HPF1471-03-08-00","1","","28-08-2021","Sunil","PPRAJ","2021-08-28"
"HPF1471","02-052-R2-FEMALE Z-PUNCH BESTO","HPF1471-02-052-R2","2","","25-12-2021","Nitish","PPRAJ","2021-12-25"
"HPF1471","04-048-00-MOTOR PULLEY LOCKING","HPF1471-04-048-00","1","","01-09-2021","Sunil","PPRAJ","2021-09-01"
"HPF1471","03-042-00-NOTCHER WIRE GUIDE","HPF1471-03-042-00","2","","01-09-2021","Sunil","PPRAJ","2021-09-01"
"HPF1471","02-022-00-TOOL HOLDER SLIDE","HPF1471-02-022-00","1","","01-09-2021","Sunil","PPRAJ","2021-09-01"
"HPF1471","05-05-00-ANGLE SETTING WEDGE","HPF1471-05-05-00","2","","28-08-2021","Sunil","PPRAJ","2021-08-28"
"HPF1471","01-048-00-MTG PLATE","HPF1471-01-048-00","2","","28-08-2021","Sunil","PPRAJ","2021-08-28"
"HPF1471","02-06-R1-MALE Z PUNCH BESTO","HPF1471-02-06-R1","3","","07-12-2021","Nitish","PPRAJ","2021-12-07"
"HPF1471","05-015-00-STRAIGHTENER SPRING","HPF1471-05-015-00","15","","01-09-2021","Sunil","PPRAJ","2021-09-01"
"HPF1471","04-072-00-WIRE GUIDE SHAFT","HPF1471-04-072-00","3","","01-09-2021","Sunil","PPRAJ","2021-09-01"
"HPF1471","02-043-00-WIRE CLAMP HOLDER","HPF1471-02-043-00","1","","01-09-2021","Sunil","PPRAJ","2021-09-01"
"HPF1471","01-053-00-TOP PLATE","HPF1471-01-053-00","1","","28-08-2021","Sunil","PPRAJ","2021-08-28"
"HPF1471","02-060-00-MALE Z PUNCH BESTO","HPF1471-02-060-00","2","","13-11-2021","Nitish","PPRAJ","2021-11-13"
"HPF1471","02-05-00-GUIDE FOR Z PUNCH","HPF1471-02-05-00","1","","24-09-2021","Sunil","PPRAJ","2021-09-24"
"HPF1471","02-063-00-WEDGE-RH","HPF1471-02-063-00","1","","22-09-2021","Amar","PPRAJ","2021-09-22"
"HPF1471","04-074-00-INNER SPACER","HPF1471-04-074-00","3","","01-09-2021","Sunil","PPRAJ","2021-09-01"
"HPF1471","03-025-00-SWING BAR","HPF1471-03-025-00","1","","01-09-2021","Sunil","PPRAJ","2021-09-01"
"HPF1471","01-040-00-WIRE LOCKING KNOB","HPF1471-01-040-00","2","","01-09-2021","Sunil","PPRAJ","2021-09-01"
"HPF1471","03-05-00-LH BLOCK FOR 085","HPF1471-03-05-00","1","","28-08-2021","Sunil","PPRAJ","2021-08-28"
"HPF1471","04-034-00-BALL SCREW STOPPER","HPF1471-04-034-00","1","","01-09-2021","Sunil","PPRAJ","2021-09-01"
"HPF1471","03-039-00-NOTCHER ROLLER HINGE PIN","HPF1471-03-039-00","2","","01-09-2021","Sunil","PPRAJ","2021-09-01"
"HPF1471","01-056-00-WIRE JUMP PREVENTER PLATE","HPF1471-01-056-00","2","","01-09-2021","Sunil","PPRAJ","2021-09-01"
"HPF1471","05-02-00-STRAIGHTNER TENON","HPF1471-05-02-00","3","","28-08-2021","Sunil","PPRAJ","2021-08-28"
"HPF1471","01-039-00-SENSOR MTG PLATE","HPF1471-01-039-00","1","","28-08-2021","Sunil","PPRAJ","2021-08-28"
"HPF1471","03-044-R1-NOTCHING BLADE GUIDE","HPF1471-03-044-R1","2","","30-12-2021","Nitish","PPRAJ","2021-12-30"
"HS1428","05-160-00-COLLET DIA 8.3","HS1428-05-160-00-COLLET DIA 8.3","2","","28-07-2022","Dayanand","PPRAJ","2022-07-28"
"HS1428","03-110-R1-COUPLER PLATE","HS1428-03-110-R1-COUPLER PLATE","1","","09-10-2021","Dayanand","PPRAJ","2021-10-09"
"HS1428","05-140-00-CLAMP","HS1428-05-140-00-CLAMP","2","","25-11-2021","Dayanand","PPRAJ","2021-11-25"
"HS1428","03-120-00-JACKING PLATE","HS1428-03-120-00-JACKING PLATE","1","","09-10-2021","Dayanand","PPRAJ","2021-10-09"
"HS1428","03-040-R1-FIXED V BLOCK","HS1428-03-040-R1-FIXED V BLOCK","1","","09-10-2021","Dayanand","PPRAJ","2021-10-09"
"HS1428","05-150-00-DRABAR SHAFT","HS1428-05-150-00-DRABAR SHAFT","1","","28-07-2022","Dayanand","PPRAJ","2022-07-28"
"HS1428","03-090-R1-PUSHING CONNECTOR","HS1428-03-090-R1-PUSHING CONNECTOR","1","","09-10-2021","Dayanand","PPRAJ","2021-10-09"
"HS1486","05-230-00-SHAFT SPACER","HS1486-05-230-00-SHAFT SPACER","1","","29-01-2022","Dayanand","PPRAJ","2022-01-29"
"HS1486","03-07-00-PAWL","HS1486-03-07-00-PAWL","2","","07-01-2022","Dayanand","PPRAJ","2022-01-07"
"HS1486","05-020-00-BEARING HSG","HS1486-05-020-00-BEARING HSG","1","","19-10-2021","Dayanand","PPRAJ","2021-10-19"
"HS1486","02-090-00-DRABAR SHAFT","HS1486-02-090-00-DRABAR SHAFT","1","","06-01-2022","Dayanand","PPRAJ","2022-01-06"
"HS1486","05-121-00-SUPPORT BLOCK SPACER","HS1486-05-121-00-SUPPORT BLOCK SPACER","1","","19-10-2021","Dayanand","PPRAJ","2021-10-19"
"HS1486","04-31-00-SETTING GAUGE BLOCK 122-SL","HS1486-04-31-00-SETTING GAUGE BLOCK 122-SL","4","","01-04-2022","Dayanand","PPRAJ","2022-04-01"
"HS1486","05-250-00-SENSOR PLATE","HS1486-05-250-00-SENSOR PLATE","2","","20-01-2022","Dayanand","PPRAJ","2022-01-20"
"HS1486","01-020-00-CONVEYOR MTG BRACKET","HS1486-01-020-00-CONVEYOR MTG BRACKET","2","","19-10-2021","Dayanand","PPRAJ","2021-10-19"
"HS1486","02-040-00-EJECTOR SPRING","HS1486-02-040-00-EJECTOR SPRING","5","","06-01-2022","Dayanand","PPRAJ","2022-01-06"
"HS1486","05-100-00-HOUSING BOTTOM PLATE","HS1486-05-100-00-HOUSING BOTTOM PLATE","1","","19-10-2021","Dayanand","PPRAJ","2021-10-19"
"HS1486","02-100-00-SPACER BUSH","HS1486-02-100-00-SPACER BUSH","2","","01-04-2022","Dayanand","PPRAJ","2022-04-01"
"HS1486","05-062-00-GRIPPER","HS1486-05-062-00-GRIPPER","4","","19-10-2021","Dayanand","PPRAJ","2021-10-19"
"HS1486","05-019-00-FLYER SHAFT PULLEY","HS1486-05-019-00-FLYER SHAFT PULLEY","1","","19-10-2021","Dayanand","PPRAJ","2021-10-19"
"HS1486","05-061-00-BOTTOM PLATE","HS1486-05-061-00-BOTTOM PLATE","4","","19-10-2021","Dayanand","PPRAJ","2021-10-19"
"HS1486","05-150-00-CYLINDER COUPLER","HS1486-05-150-00-CYLINDER COUPLER","1","","19-10-2021","Dayanand","PPRAJ","2021-10-19"
"HS1486","03-06-00-V BLOCK","HS1486-03-06-00-V BLOCK","1","","07-01-2022","Dayanand","PPRAJ","2022-01-07"
"HS1486","04-06-00-LOADER MTG BKT","HS1486-04-06-00-LOADER MTG BKT","1","","19-10-2021","Dayanand","PPRAJ","2021-10-19"
"HS1486","03-08-00-PAWL HOLDER","HS1486-03-08-00-PAWL HOLDER","1","","07-01-2022","Dayanand","PPRAJ","2022-01-07"
"HS1486","05-030-00-SHAFT","HS1486-05-030-00-SHAFT","1","","19-10-2021","Dayanand","PPRAJ","2021-10-19"
"HS1486","05-122-00-SUPPORT BLOCK SPACER","HS1486-05-122-00-SUPPORT BLOCK SPACER","1","","19-10-2021","Dayanand","PPRAJ","2021-10-19"
"HS1486","01-030-00-WELDING PLATE","HS1486-01-030-00-WELDING PLATE","2","","19-10-2021","Dayanand","PPRAJ","2021-10-19"
"HS1486","02-010-00-EJECTOR PIN","HS1486-02-010-00-EJECTOR PIN","2","","06-01-2022","Dayanand","PPRAJ","2022-01-06"
"HS1486","05-110-00-CYLINDER MGT PLATE","HS1486-05-110-00-CYLINDER MGT PLATE","1","","19-10-2021","Dayanand","PPRAJ","2021-10-19"
"HS1486","02-110-00-STOPPER PAD","HS1486-02-110-00-STOPPER PAD","2","","01-04-2022","Dayanand","PPRAJ","2022-04-01"
"HS1486","05-070-00-GRIPPER PAD","HS1486-05-070-00-GRIPPER PAD","6","","19-10-2021","Dayanand","PPRAJ","2021-10-19"
"HS1486","05-022-00-RETAINER PLT","HS1486-05-022-00-RETAINER PLT","1","","19-10-2021","Dayanand","PPRAJ","2021-10-19"
"HS1486","05-180-00-BEARING SPACER","HS1486-05-180-00-BEARING SPACER","1","","19-10-2021","Dayanand","PPRAJ","2021-10-19"
"HS1486","05-160-00-COUPLER PLATE","HS1486-05-160-00-COUPLER PLATE","1","","19-10-2021","Dayanand","PPRAJ","2021-10-19"
"HS1486","05-080-00-HOUSING MTG PLATE","HS1486-05-080-00-HOUSING MTG PLATE","1","","19-10-2021","Dayanand","PPRAJ","2021-10-19"
"HS1486","03-09-00-PAWL SPRING","HS1486-03-09-00-PAWL SPRING","2","","07-01-2022","Dayanand","PPRAJ","2022-01-07"
"HS1486","05-170-00-MOTOR MTG PLATE","HS1486-05-170-00-MOTOR MTG PLATE","1","","19-10-2021","Dayanand","PPRAJ","2021-10-19"
"HS1486","05-220-00-ADITIONAL SPACER","HS1486-05-220-00-ADITIONAL SPACER","1","","29-01-2022","Dayanand","PPRAJ","2022-01-29"
"HS1486","05-130-00-STD GUIDE ROD","HS1486-05-130-00-STD GUIDE ROD","4","","19-10-2021","Dayanand","PPRAJ","2021-10-19"
"HS1486","06-010-00-COMP HOLDER","HS1486-06-010-00-COMP HOLDER","2","","02-11-2021","Kiran","PPRAJ","2021-11-02"
"HS1486","02-020-00-BEARING SHAFT","HS1486-02-020-00-BEARING SHAFT","1","","06-01-2022","Dayanand","PPRAJ","2022-01-06"
"HS1486","05-120-00-SUPPORT BLOCK","HS1486-05-120-00-SUPPORT BLOCK","2","","19-10-2021","Dayanand","PPRAJ","2021-10-19"
"HS1486","03-11-00-END STOPPER PIN","HS1486-03-11-00-END STOPPER PIN","2","","01-04-2022","Dayanand","PPRAJ","2022-04-01"
"HS1486","06-030-00-CYLINDER MTG BRACKET","HS1486-06-030-00-CYLINDER MTG BRACKET","1","","19-10-2021","Dayanand","PPRAJ","2021-10-19"
"HS1486","03-160-00-SETTING MANDRAL","HS1486-03-160-00-SETTING MANDRAL","1","","29-06-2022","Dayanand","PPRAJ","2022-06-29"
"HS1486","01-040-00-WELDING PLATE","HS1486-01-040-00-WELDING PLATE","2","","19-10-2021","Dayanand","PPRAJ","2021-10-19"
"HS1486","02-030-00-COLLET","HS1486-02-030-00-COLLET","4","","06-01-2022","Dayanand","PPRAJ","2022-01-06"
"HS1486","05-028-00-FLYER SHAFT PULLEY","HS1486-05-028-00-FLYER SHAFT PULLEY","1","","19-10-2021","Dayanand","PPRAJ","2021-10-19"
"HS1486","05-190-00-FIXED MOUNTING PLATE","HS1486-05-190-00-FIXED MOUNTING PLATE","1","","19-10-2021","Dayanand","PPRAJ","2021-10-19"
"HS1486","05-010-00-GRIPPER CYLINDER MFG PLATE","HS1486-05-010-00-GRIPPER CYLINDER MFG PLATE","1","","19-10-2021","Dayanand","PPRAJ","2021-10-19"
"HS1486","05-090-00-SPACER PLATE","HS1486-05-090-00-SPACER PLATE","2","","19-10-2021","Dayanand","PPRAJ","2021-10-19"
"HS1486","03-05-00-PAWL MTG PLATE","HS1486-03-05-00-PAWL MTG PLATE","1","","07-01-2022","Dayanand","PPRAJ","2022-01-07"
"HS1486","05-041-00-HSG RETAINER","HS1486-05-041-00-HSG RETAINER","2","","19-10-2021","Dayanand","PPRAJ","2021-10-19"
"HS1488","05-030-00-CYLINDER THRUST COUPLER","HS1488-05-030-00-CYLINDER THRUST COUPLER","1","","28-10-2021","Kiran","PPRAJ","2021-10-28"
"HS1488","04-020-00-I BRACKET","HS1488-04-020-00-I BRACKET","1","","28-10-2021","Kiran","PPRAJ","2021-10-28"
"HS1488","04-09-00-PAWL SPRING","HS1488-04-09-00-PAWL SPRING","2","","28-10-2021","Kiran","PPRAJ","2021-10-28"
"HS1488","04-010-00-FIXED V BLOCK","HS1488-04-010-00-FIXED V BLOCK","1","","28-10-2021","Kiran","PPRAJ","2021-10-28"
"HS1488","06-040-00-LOCKING BUSH PART","HS1488-06-040-00-LOCKING BUSH PART","1","","28-10-2021","Kiran","PPRAJ","2021-10-28"
"HS1488","02-120-00-DRIVEN PULLEY","HS1488-02-120-00-DRIVEN PULLEY","1","","28-10-2021","Kiran","PPRAJ","2021-10-28"
"HS1488","01-110-00-BASE MOUNTING PLATE","HS1488-01-110-00-BASE MOUNTING PLATE","2","","03-11-2021","Kiran","PPRAJ","2021-11-03"
"HS1488","05-070-00-BEARING BUTTING SPACER","HS1488-05-070-00-BEARING BUTTING SPACER","2","","28-10-2021","Kiran","PPRAJ","2021-10-28"
"HS1488","05-040-00-COUPLER LOCKING BUSH","HS1488-05-040-00-COUPLER LOCKING BUSH","1","","28-10-2021","Kiran","PPRAJ","2021-10-28"
"HS1488","05-010-00-CYLINDER MTG BRACKET","HS1488-05-010-00-CYLINDER MTG BRACKET","1","","28-10-2021","Kiran","PPRAJ","2021-10-28"
"HS1488","04-030-00-SPACER PLATE","HS1488-04-030-00-SPACER PLATE","1","","28-10-2021","Kiran","PPRAJ","2021-10-28"
"HS1488","04-07-00-PAWL","HS1488-04-07-00-PAWL","2","","28-10-2021","Kiran","PPRAJ","2021-10-28"
"HS1488","02-100-00-SPACER PLATE","HS1488-02-100-00-SPACER PLATE","1","","28-10-2021","Kiran","PPRAJ","2021-10-28"
"HS1488","01-120-00-CABINET MOUNTING BRACKET","HS1488-01-120-00-CABINET MOUNTING BRACKET","2","","03-11-2021","Kiran","PPRAJ","2021-11-03"
"HS1488","06-010-00-MOTOR MTG BRACKET","HS1488-06-010-00-MOTOR MTG BRACKET","1","","28-10-2021","Kiran","PPRAJ","2021-10-28"
"HS1488","05-050-00-CYLINDER ROTATING COUPLER","HS1488-05-050-00-CYLINDER ROTATING COUPLER","1","","28-10-2021","Kiran","PPRAJ","2021-10-28"
"HS1488","05-020-00-SPACER PLATE","HS1488-05-020-00-SPACER PLATE","1","","28-10-2021","Kiran","PPRAJ","2021-10-28"
"HS1488","04-040-00-GUIDE PLATE","HS1488-04-040-00-GUIDE PLATE","2","","28-10-2021","Kiran","PPRAJ","2021-10-28"
"HS1488","04-08-00-PAWL HOLDER","HS1488-04-08-00-PAWL HOLDER","1","","28-10-2021","Kiran","PPRAJ","2021-10-28"
"HS1488","02-110-00-SPACER PLATE","HS1488-02-110-00-SPACER PLATE","1","","28-10-2021","Kiran","PPRAJ","2021-10-28"
"HS1488","06-030-00-DRIVE PULLEY","HS1488-06-030-00-DRIVE PULLEY","1","","28-10-2021","Kiran","PPRAJ","2021-10-28"
"HS1488","05-060-00-SPACER","HS1488-05-060-00-SPACER","2","","28-10-2021","Kiran","PPRAJ","2021-10-28"
"HS1533","01-168-00-BOTTOM TRAY","HS1533-01-168-00-BOTTOM TRAY","1","","25-04-2022","Dayanand","PPRAJ","2022-04-25"
"HS1533","07-280-00- PC SHEET HOLDER PLATE","HS1533-07-280-00- PC SHEET HOLDER PLATE","4","","25-04-2022","Dayanand","PPRAJ","2022-04-25"
"HS1533","07-230-00-DOOR SLIDE PC HOLDER","HS1533-07-230-00-DOOR SLIDE PC HOLDER","1","","25-04-2022","Dayanand","PPRAJ","2022-04-25"
"HS1533","03-310-00-THREAD ROD MTG PLATE","HS1533-03-310-00-THREAD ROD MTG PLATE","1","","09-07-2022","Dayanand","PPRAJ","2022-07-09"
"HS1533","07-080-00-SK MODEL","HS1533-07-080-00-SK MODEL","4","","25-04-2022","Dayanand","PPRAJ","2022-04-25"
"HS1533","07-050-00-CONTROL UNIT BOTTOM SHEET","HS1533-07-050-00-CONTROL UNIT BOTTOM SHEET","1","","25-04-2022","Dayanand","PPRAJ","2022-04-25"
"HS1533","03-290-00-FIXED MTG BRACKET","HS1533-03-290-00-FIXED MTG BRACKET","1","","25-04-2022","Dayanand","PPRAJ","2022-04-25"
"HS1533","03-03-00-INDEXER GUIDE PLT","HS1533-03-03-00-INDEXER GUIDE PLT","2","","25-04-2022","Dayanand","PPRAJ","2022-04-25"
"HS1533","07-290-00-CYLINDER GUIDE PLATE","HS1533-07-290-00-CYLINDER GUIDE PLATE","1","","25-04-2022","Dayanand","PPRAJ","2022-04-25"
"HS1533","07-250-00-SPACER FOR PC SHEET","HS1533-07-250-00-SPACER FOR PC SHEET","4","","25-04-2022","Dayanand","PPRAJ","2022-04-25"
"HS1533","03-320-00-SUPPORT PLATE","HS1533-03-320-00-SUPPORT PLATE","1","","09-07-2022","Dayanand","PPRAJ","2022-07-09"
"HS1533","07-090-00-DIA12 STD GUIDE ROD","HS1533-07-090-00-DIA12 STD GUIDE ROD","2","","25-04-2022","Dayanand","PPRAJ","2022-04-25"
"HS1533","07-060-00-ACRYLIC MOUNTING BRACKET","HS1533-07-060-00-ACRYLIC MOUNTING BRACKET","1","","25-04-2022","Dayanand","PPRAJ","2022-04-25"
"HS1533","06-010-00-V BLOCK","HS1533-06-010-00-V BLOCK","1","","25-04-2022","Dayanand","PPRAJ","2022-04-25"
"HS1533","03-96-00-COLLET","HS1533-03-96-00-COLLET","2","","25-04-2022","Dayanand","PPRAJ","2022-04-25"
"HS1533","06-160-00-SETTING MANDRAL","HS1533-06-160-00-SETTING MANDRAL","1","","25-04-2022","Dayanand","PPRAJ","2022-04-25"
"HS1533","07-270-00-SPACRE FOR CYLINDER BRKT","HS1533-07-270-00-SPACRE FOR CYLINDER BRKT","1","","25-04-2022","Dayanand","PPRAJ","2022-04-25"
"HS1533","03-330-00-JACKING PLATE","HS1533-03-330-00-JACKING PLATE","1","","09-07-2022","Dayanand","PPRAJ","2022-07-09"
"HS1533","07-220-00-COUPLER","HS1533-07-220-00-COUPLER","1","","25-04-2022","Dayanand","PPRAJ","2022-04-25"
"HS1533","03-300-00-JACKING THREAD","HS1533-03-300-00-JACKING THREAD","1","","09-07-2022","Dayanand","PPRAJ","2022-07-09"
"HS1533","07-070-00-CYLINDER MOUNTING BRACKET","HS1533-07-070-00-CYLINDER MOUNTING BRACKET","1","","25-04-2022","Dayanand","PPRAJ","2022-04-25"
"HS1533","06-130-00-SETTING MANDRAL","HS1533-06-130-00-SETTING MANDRAL","1","","25-04-2022","Dayanand","PPRAJ","2022-04-25"
"HS1533","03-190-00-GEAR SAFTY COVER","HS1533-03-190-00-GEAR SAFTY COVER","1","","25-04-2022","Dayanand","PPRAJ","2022-04-25"
"IMSW1405","03-172-R1-SLIDE CYL HOLDER","IMSW1405-03-172-R1","2","","27-05-2022","Nitish","PPRAJ","2022-05-27"
"IMSW1405","03-172-00-SLIDE CYL HOLDER","IMSW1405-03-172-00","1","","16-05-2022","Nitish","PPRAJ","2022-05-16"
"IMSW1405","07-150-00-SPRING HLDR","IMSW1405-07-150-00","16","","11-09-2021","Sunil","PPRAJ","2021-09-11"
"IMSW1405","08-242-00-TEN ARM PLTAE","IMSW1405-08-242-00","2","","18-01-2022","Nitish","PPRAJ","2022-01-18"
"IMSW1405","01-030-00-MANIFOLD BLOCK","IMSW1405-01-030-00","7","","19-11-2021","Amar","PPRAJ","2021-11-19"
"IMSW1405","08-130-00-WASHER FOR SPRING","IMSW1405-08-130-00","2","","11-09-2021","Sunil","PPRAJ","2021-09-11"
"IMSW1405","05-120-00-TENSIONER MTG PILLAR","IMSW1405-05-120-00","4","","11-09-2021","Sunil","PPRAJ","2021-09-11"
"IMSW1405","07-130-00-WIRE HOLDER BACK PLT","IMSW1405-07-130-00","16","","11-09-2021","Sunil","PPRAJ","2021-09-11"
"IMSW1405","08-211-00-ROLLER PLT","IMSW1405-08-211-00","2","","18-01-2022","Nitish","PPRAJ","2022-01-18"
"IMSW1405","06-11-00-TEN D2 ROLLER","IMSW1405-06-11-00","220","","04-01-2022","Sunil","PPRAJ","2022-01-04"
"IMSW1405","08-100-00-VERTICAL TENSIONER ROD","IMSW1405-08-100-00","2","","11-09-2021","Sunil","PPRAJ","2021-09-11"
"IMSW1405","03-192-00-WIRE PULLER COVER","IMSW1405-03-192-00","2","","13-07-2022","Nitish","PPRAJ","2022-07-13"
"IMSW1405","03-165-00-LM GUIDE HOUSING","IMSW1405-03-165-00","4","","17-12-2021","Sunil","PPRAJ","2021-12-17"
"IMSW1405","07-090-00-CHAIN WHEEL SHAFT","IMSW1405-07-090-00","16","","11-09-2021","Sunil","PPRAJ","2021-09-11"
"IMSW1405","03-154-00-BTM WIRE GRIPPER CYL COUPLER","IMSW1405-03-154-00","2","","07-09-2021","Sunil","PPRAJ","2021-09-07"
"IMSW1405","05-140-00-BRKT FOR WIRE GUIDE 2","IMSW1405-05-140-00","4","","18-01-2022","Nitish","PPRAJ","2022-01-18"
"IMSW1405","03-184-00-SLIDE COUPLER HLDR SPACER","IMSW1405-03-184-00","2","","27-05-2022","Nitish","PPRAJ","2022-05-27"
"IMSW1405","08-070-00-WHEEL SUPPORT PLT BACK","IMSW1405-08-070-00","2","","11-09-2021","Sunil","PPRAJ","2021-09-11"
"IMSW1405","02-642-00-VETRICAL SLIDE BACK COVER PLATE","IMSW1405-02-642-00","2","","13-07-2022","Nitish","PPRAJ","2022-07-13"
"IMSW1405","05-A02-00-BOBBIN STAND MOVABLE -2","IMSW1405-05-A02-00","2","","11-09-2021","Sunil","PPRAJ","2021-09-11"
"IMSW1405","07-060-00-MTG PIN FOR CERAMIC ROLLER","IMSW1405-07-060-00","48","","11-09-2021","Sunil","PPRAJ","2021-09-11"
"IMSW1405","02-151-00-CERAMIC ROLLER","IMSW1405-02-151-00","2","","11-12-2021","Sunil","PPRAJ","2021-12-11"
"IMSW1405","03-180-00-PULLER CYL MTG PLT","IMSW1405-03-180-00","2","","27-05-2022","Nitish","PPRAJ","2022-05-27"
"IMSW1405","08-040-00-RUBBER WHEEL","IMSW1405-08-040-00","2","","11-09-2021","Sunil","PPRAJ","2021-09-11"
"IMSW1405","08-20-00-MOTOR PULLEY LOCKING SPIGOT","IMSW1405-08-20-00","2","","11-09-2021","Sunil","PPRAJ","2021-09-11"
"IMSW1405","03-167-R1-DOWEL MTG PLT","IMSW1405-03-167-R1","1","","14-07-2022","Nitish","PPRAJ","2022-07-14"
"IMSW1405","03-050-R1-WIRE GUIDE HSG","IMSW1405-03-050-R1","1","","11-07-2022","Nitish","PPRAJ","2022-07-11"
"IMSW1405","03-168-00-JOB LOCATOR","IMSW1405-03-168-00","2","","21-06-2022","Nitish","PPRAJ","2022-06-21"
"IMSW1405","07-030-00-DANCING ARM PLATE","IMSW1405-07-030-00","16","","11-09-2021","Sunil","PPRAJ","2021-09-11"
"IMSW1405","02-170-00-TOP BEARING HLDR","IMSW1405-02-170-00","2","","11-12-2021","Sunil","PPRAJ","2021-12-11"
"IMSW1405","03-177-00-WIRE PULLER CYL PLT","IMSW1405-03-177-00","2","","27-05-2022","Nitish","PPRAJ","2022-05-27"
"IMSW1405","07-240-00-SENSOR MTG BLK","IMSW1405-07-240-00","16","","11-09-2021","Sunil","PPRAJ","2021-09-11"
"IMSW1405","03-169-00-R COMPONENT HLDR","IMSW1405-03-169-00","2","","23-06-2022","Nitish","PPRAJ","2022-06-23"
"IMSW1405","03-159-00-HELICAL GEAR COVER TOP","IMSW1405-03-159-00","2","","19-11-2021","Amar","PPRAJ","2021-11-19"
"IMSW1405","08-180-00-WIRE SLIDER L PLATE","IMSW1405-08-180-00","2","","11-09-2021","Sunil","PPRAJ","2021-09-11"
"IMSW1405","05-A01-00-BOBBIN STAND MOVABLE -1","IMSW1405-05-A01-00","2","","11-09-2021","Sunil","PPRAJ","2021-09-11"
"IMSW1405","02-101-00-BEARING SPACER","IMSW1405-02-101-00","2","","11-12-2021","Sunil","PPRAJ","2021-12-11"
"IMSW1405","03-174-00-WIRE PULLER MTG PLT","IMSW1405-03-174-00","2","","27-05-2022","Nitish","PPRAJ","2022-05-27"
"IMSW1405","03-169-00-LM BLOCK MTG PLT","IMSW1405-03-169-00","1","","16-05-2022","Nitish","PPRAJ","2022-05-16"
"IMSW1405","07-200-00-FELT   SPRING","IMSW1405-07-200-00","32","","11-09-2021","Sunil","PPRAJ","2021-09-11"
"IMSW1405","02-311-00-LIMIT SWITCH BRKT SPACER -X AXIS","IMSW1405-02-311-00","2","","19-11-2021","Amar","PPRAJ","2021-11-19"
"IMSW1405","08-140-00-VERTICAL TENSIONER FLAT ROLLER","IMSW1405-08-140-00","12","","11-09-2021","Sunil","PPRAJ","2021-09-11"
"IMSW1405","03-166-00-BOTTOM COMPONENT HOLDER","IMSW1405-03-166-00","1","","07-03-2022","Nitish","PPRAJ","2022-03-07"
"IMSW1405","07-131-00-WIRE HOLDER BACK PLT-1","IMSW1405-07-131-00","16","","11-09-2021","Sunil","PPRAJ","2021-09-11"
"IMSW1405","08-240-00-NOZZLE BUTTING BRKT","IMSW1405-08-240-00","2","","18-01-2022","Nitish","PPRAJ","2022-01-18"
"IMSW1405","08-110-00-WASHER","IMSW1405-08-110-00","2","","11-09-2021","Sunil","PPRAJ","2021-09-11"
"IMSW1405","03-191-00-TOP PULLER COVER","IMSW1405-03-191-00","2","","13-07-2022","Nitish","PPRAJ","2022-07-13"
"IMSW1405","05-020-00-BOBBIN PLACING STAND BTM PLT","IMSW1405-05-020-00","8","","11-09-2021","Sunil","PPRAJ","2021-09-11"
"IMSW1405","03-052-00-WIRE GUIDE HSG WITH END INSUL","IMSW1405-03-052-00","1","","11-02-2022","Nitish","PPRAJ","2022-02-11"
"IMSW1405","07-100-00-BEARING SPACER","IMSW1405-07-100-00","16","","11-09-2021","Sunil","PPRAJ","2021-09-11"
"IMSW1405","03-155-00-BOTTOM CYL MTG PLT","IMSW1405-03-155-00","2","","07-09-2021","Sunil","PPRAJ","2021-09-07"
"IMSW1405","05-141-00-L BRKT FOR WIRE GUIDE","IMSW1405-05-141-00","2","","18-01-2022","Nitish","PPRAJ","2022-01-18"
"IMSW1405","03-185-00-BOTTOM WIRE PULLER HLDR","IMSW1405-03-185-00","2","","27-05-2022","Nitish","PPRAJ","2022-05-27"
"IMSW1405","08-080-00-WHEEL SUPPORT PLT","IMSW1405-08-080-00","2","","11-09-2021","Sunil","PPRAJ","2021-09-11"
"IMSW1405","03-194-00-INDEXER GEAR COVER","IMSW1405-03-194-00","2","","13-07-2022","Nitish","PPRAJ","2022-07-13"
"IMSW1405","07-070-00-BRG HOUSING","IMSW1405-07-070-00","16","","11-09-2021","Sunil","PPRAJ","2021-09-11"
"IMSW1405","03-152-00-COUPLER","IMSW1405-03-152-00","4","","07-09-2021","Sunil","PPRAJ","2021-09-07"
"IMSW1405","03-162-00-GRIPPER","IMSW1405-03-162-00","4","","11-12-2021","Sunil","PPRAJ","2021-12-11"
"IMSW1405","03-181-00-WIRE PULLER CYL COUPLER","IMSW1405-03-181-00","2","","27-05-2022","Nitish","PPRAJ","2022-05-27"
"IMSW1405","08-050-00-TENTIONER HSG PLT NEW","IMSW1405-08-050-00","2","","11-09-2021","Sunil","PPRAJ","2021-09-11"
"IMSW1405","08-210-00-FLAT ROLLER HOLDER","IMSW1405-08-210-00","2","","11-09-2021","Sunil","PPRAJ","2021-09-11"
"IMSW1405","03-040-R1-JOB LOCATOR AVENTOSE","IMSW1405-03-040-R1","2","","11-07-2022","Nitish","PPRAJ","2022-07-11"
"IMSW1405","07-040-00-SPRING HOLDER KNOB","IMSW1405-07-040-00","32","","11-09-2021","Sunil","PPRAJ","2021-09-11"
"IMSW1405","02-180-00-FORK FOR ROLLER","IMSW1405-02-180-00","2","","11-12-2021","Sunil","PPRAJ","2021-12-11"
"IMSW1405","03-178-00-WIRE PULLER CYL COUPLER","IMSW1405-03-178-00","2","","27-05-2022","Nitish","PPRAJ","2022-05-27"
"IMSW1405","03-091-00-HOMING SENSOR","IMSW1405-03-091-00","5","","15-11-2021","Nitish","PPRAJ","2021-11-15"
"IMSW1405","07-270-00-SPRING JACKING PLATE","IMSW1405-07-270-00","16","","11-09-2021","Sunil","PPRAJ","2021-09-11"
"IMSW1405","03-160-00-HELICAL GEAR COVER BOTTOM","IMSW1405-03-160-00","2","","19-11-2021","Amar","PPRAJ","2021-11-19"
"IMSW1405","08-190-00-NOZZEL","IMSW1405-08-190-00","2","","11-09-2021","Sunil","PPRAJ","2021-09-11"
"IMSW1405","07-010-00-TENSIONER PLATE MTG BKT","IMSW1405-07-010-00","16","","11-09-2021","Sunil","PPRAJ","2021-09-11"
"IMSW1405","02-102-00-SPACER","IMSW1405-02-102-00","4","","11-12-2021","Sunil","PPRAJ","2021-12-11"
"IMSW1405","03-175-00-WIRE PULLER SPRT BLOCK","IMSW1405-03-175-00","2","","27-05-2022","Nitish","PPRAJ","2022-05-27"
"IMSW1405","03-170-00-SLIDE COUPLER HOLDER","IMSW1405-03-170-00","1","","16-05-2022","Nitish","PPRAJ","2022-05-16"
"IMSW1405","07-220-00-TEN SPRING.","IMSW1405-07-220-00","16","","11-09-2021","Sunil","PPRAJ","2021-09-11"
"IMSW1405","08-243-00-RUBBER WHEEL","IMSW1405-08-243-00","1","","19-01-2022","Nitish","PPRAJ","2022-01-19"
"IMSW1405","03-157-00-CLAMPING PLATE","IMSW1405-03-157-00","8","","19-11-2021","Amar","PPRAJ","2021-11-19"
"IMSW1405","08-160-00-SPACER FOR BEARING","IMSW1405-08-160-00","12","","11-09-2021","Sunil","PPRAJ","2021-09-11"
"IMSW1405","03-171-00-SLIDE CYL COUPLER","IMSW1405-03-171-00","1","","16-05-2022","Nitish","PPRAJ","2022-05-16"
"IMSW1405","07-140-00-WIRE HOLDER PLT","IMSW1405-07-140-00","16","","11-09-2021","Sunil","PPRAJ","2021-09-11"
"IMSW1405","08-241-00-L BRKT SUPPORT","IMSW1405-08-241-00","2","","18-01-2022","Nitish","PPRAJ","2022-01-18"
"IMSW1405","08-120-00-LM BUSH HSG NEW-2","IMSW1405-08-120-00","2","","11-09-2021","Sunil","PPRAJ","2021-09-11"
"IMSW1405","03-195-00-BOTTOM PULLER COVER","IMSW1405-03-195-00","2","","13-07-2022","Nitish","PPRAJ","2022-07-13"
"IMSW1405","05-100-00-BOBBIN PLACING STAND BTM PLT","IMSW1405-05-100-00","8","","11-09-2021","Sunil","PPRAJ","2021-09-11"
"IMSW1405","07-120-00-SPACER & GUIDE PIN","IMSW1405-07-120-00","32","","11-09-2021","Sunil","PPRAJ","2021-09-11"
"IMSW1405","03-156-00-SPACER","IMSW1405-03-156-00","4","","07-09-2021","Sunil","PPRAJ","2021-09-07"
"IMSW1405","05-142-00-TOP CERAMIC BUSH HOLDER","IMSW1405-05-142-00","2","","18-01-2022","Nitish","PPRAJ","2022-01-18"
"IMSW1405","08-090-00-TEN  SPRING","IMSW1405-08-090-00","2","","11-09-2021","Sunil","PPRAJ","2021-09-11"
"IMSW1405","03-193-00-TOP COVERING PLATE","IMSW1405-03-193-00","2","","13-07-2022","Nitish","PPRAJ","2022-07-13"
"IMSW1405","07-080-00-BEARING SPACER","IMSW1405-07-080-00","16","","11-09-2021","Sunil","PPRAJ","2021-09-11"
"IMSW1405","03-153-00-WIRE GRIPPER CYL COUPLER","IMSW1405-03-153-00","2","","07-09-2021","Sunil","PPRAJ","2021-09-07"
"IMSW1405","02-161-00-TOP NOZZLE","IMSW1405-02-161-00","4","","18-01-2022","Nitish","PPRAJ","2022-01-18"
"IMSW1405","03-182-00-WIRE PULLER COUPLER HLDR","IMSW1405-03-182-00","2","","27-05-2022","Nitish","PPRAJ","2022-05-27"
"IMSW1405","08-060-00-WHEEL HOLDER SPACER","IMSW1405-08-060-00","2","","11-09-2021","Sunil","PPRAJ","2021-09-11"
"IMSW1405","02-641-00-VERTICAL SLIDE COVER PLATE","IMSW1405-02-641-00","4","","13-07-2022","Nitish","PPRAJ","2022-07-13"
"IMSW1405","08-220-00-FRONT ROLLER HOLDER ASSY","IMSW1405-08-220-00","2","","11-09-2021","Sunil","PPRAJ","2021-09-11"
"IMSW1405","03-185-R1-BOTTOM WIRE PULLER HLDR","IMSW1405-03-185-R1","2","","11-07-2022","Nitish","PPRAJ","2022-07-11"
"IMSW1405","07-271-00-BOBBIN LOCATOR","IMSW1405-07-271-00","32","","30-06-2022","Amar","PPRAJ","2022-06-30"
"IMSW1405","07-050-00-TENSIONER PLT MTG ROD","IMSW1405-07-050-00","16","","11-09-2021","Sunil","PPRAJ","2021-09-11"
"IMSW1405","02-181-00-FORK FOR ROLLER - LH","IMSW1405-02-181-00","2","","11-12-2021","Sunil","PPRAJ","2021-12-11"
"IMSW1405","03-179-00-LM GUIDE SPRT BKT","IMSW1405-03-179-00","2","","27-05-2022","Nitish","PPRAJ","2022-05-27"
"IMSW1405","08-030-00-WHEEL HOLDER","IMSW1405-08-030-00","2","","11-09-2021","Sunil","PPRAJ","2021-09-11"
"IMSW1405","05-130-00-SPACER PAD","IMSW1405-05-130-00","4","","19-11-2021","Amar","PPRAJ","2021-11-19"
"IMSW1405","08-200-00-DOUBLE ROLLER HOLDER NEW","IMSW1405-08-200-00","2","","11-09-2021","Sunil","PPRAJ","2021-09-11"
"IMSW1405","07-020-00-TENSIONER PLATE","IMSW1405-07-020-00","16","","11-09-2021","Sunil","PPRAJ","2021-09-11"
"IMSW1405","03-187-00-PIN FOR ROUTING","IMSW1405-03-187-00","20","","05-07-2022","Nitish","PPRAJ","2022-07-05"
"IMSW1405","02-160-00-TOP NOZZLE","IMSW1405-02-160-00","2","","11-12-2021","Sunil","PPRAJ","2021-12-11"
"IMSW1405","03-176-00-TOP WIRE PULLER HLDR","IMSW1405-03-176-00","2","","27-05-2022","Nitish","PPRAJ","2022-05-27"
"IMSW1405","03-167-00-DOWEL MTG PLT","IMSW1405-03-167-00","1","","16-05-2022","Nitish","PPRAJ","2022-05-16"
"IMSW1405","07-230-00-SENSOR LEVER","IMSW1405-07-230-00","16","","11-09-2021","Sunil","PPRAJ","2021-09-11"
"IMSW1405","03-158-00-INDEXER COVER","IMSW1405-03-158-00","2","","19-11-2021","Amar","PPRAJ","2021-11-19"
"IMSW1405","08-170-00-ROLLER BRG HOLDER SHAFT","IMSW1405-08-170-00","12","","11-09-2021","Sunil","PPRAJ","2021-09-11"
"M1010","07-020-00-BRACKET MOUNTING PILLAR-2","M1010-07-020-00","1","","14-01-2022","Karumbaiah","PPRAJ","2022-01-14"
"M1010","12-020-00-ECT HOLDER-2","M1010-12-020-00","2","","14-01-2022","Karumbaiah","PPRAJ","2022-01-14"
"M1010","07-160-00-V TRAY","M1010-07-160-00","1","","14-01-2022","Karumbaiah","PPRAJ","2022-01-14"
"M1010","07-130-00-T-SLOT BRACKET","M1010-07-130-00","1","","14-01-2022","Karumbaiah","PPRAJ","2022-01-14"
"M1010","07-100-00-VERTICAL ADJUSTMENT SCREW ROD","M1010-07-100-00","2","","14-01-2022","Karumbaiah","PPRAJ","2022-01-14"
"M1010","07-070-00-DOVE TAIL SLIDE","M1010-07-070-00","1","","14-01-2022","Karumbaiah","PPRAJ","2022-01-14"
"M1010","07-030-00-CHUTE MOUNTING BRACKET PLATE","M1010-07-030-00","2","","14-01-2022","Karumbaiah","PPRAJ","2022-01-14"
"M1010","12-030-00-DOVE TAIL SLIDE","M1010-12-030-00","1","","14-01-2022","Karumbaiah","PPRAJ","2022-01-14"
"M1010","07-170-R1-V TRAY BRKT","M1010-07-170-R1","2","","14-01-2022","Karumbaiah","PPRAJ","2022-01-14"
"M1010","07-140-00-TUBE HOLDER-1","M1010-07-140-00","3","","14-01-2022","Karumbaiah","PPRAJ","2022-01-14"
"M1010","07-110-00-MOUNTING BLOCK","M1010-07-110-00","1","","14-01-2022","Karumbaiah","PPRAJ","2022-01-14"
"M1010","07-080-00-GIB","M1010-07-080-00","2","","14-01-2022","Karumbaiah","PPRAJ","2022-01-14"
"M1010","07-040-00-SIEBU TUBE HOLDER","M1010-07-040-00","2","","14-01-2022","Karumbaiah","PPRAJ","2022-01-14"
"M1010","12-040-R1-ECT EXTENDED MTG PLATE","M1010-12-040-R1","1","","14-01-2022","Karumbaiah","PPRAJ","2022-01-14"
"M1010","07-010-00-BRACKET MOUNTING PILLAR-1","M1010-07-010-00","1","","14-01-2022","Karumbaiah","PPRAJ","2022-01-14"
"M1010","12-010-00-ECT HOLDER-1","M1010-12-010-00","2","","14-01-2022","Karumbaiah","PPRAJ","2022-01-14"
"M1010","07-150-00-TUBE HOLDER-4","M1010-07-150-00","1","","14-01-2022","Karumbaiah","PPRAJ","2022-01-14"
"M1010","07-120-00-TUBE HOLDER CLAMP","M1010-07-120-00","1","","14-01-2022","Karumbaiah","PPRAJ","2022-01-14"
"M1010","07-090-R1-VERTICAL ADJ PLATE","M1010-07-090-R1","2","","14-01-2022","Karumbaiah","PPRAJ","2022-01-14"
"M1010","07-050-00-GUIDE STRIP","M1010-07-050-00","1","","14-01-2022","Karumbaiah","PPRAJ","2022-01-14"
"M1018","09-360-00 STUD-SPHERICAL WASHER","M1018-09-360-00","5","","12-04-2022","Karumbaiah","PPRAJ","2022-04-12"
"M1018","08-180-00 SPACER-Y PRELOAD SHAFT","M1018-08-180-00","1","","17-03-2022","Karumbaiah","PPRAJ","2022-03-17"
"M1018","03-150-00 DRIVEN PULLEY-X-3M-200T","M1018-03-150-00","2","","17-03-2022","Karumbaiah","PPRAJ","2022-03-17"
"M1018","01-190-00 X-MECH STOP-ROD-BACK","M1018-01-190-00","1","","15-03-2022","Karumbaiah","PPRAJ","2022-03-15"
"M1018","09-230-00 CWt-INSERT-M10","M1018-09-230-00","5","","12-03-2022","Karumbaiah","PPRAJ","2022-03-12"
"M1018","09-350-00 SPACER","M1018-09-350-00","1","","17-03-2022","Karumbaiah","PPRAJ","2022-03-17"
"M1018","05-210-00 STUD-SWIVEL BASE","M1018-05-210-00","4","","17-03-2022","Karumbaiah","PPRAJ","2022-03-17"
"M1018","05-350-00 LOCK NUT-M16x1.5","M1018-05-350-00","5","","15-03-2022","Karumbaiah","PPRAJ","2022-03-15"
"M1018","12-140-00 SADDLE COVER-RH","M1018-12-140-00","1","","12-04-2022","Karumbaiah","PPRAJ","2022-04-12"
"M1018","07-060-R1 Y-AXIS Probe fixture-small","M1018-07-060-R1","1","","17-03-2022","Karumbaiah","PPRAJ","2022-03-17"
"M1018","08-150-00 Y-DRIVEN SHAFT F-DRIVE","M1018-08-150-00","1","","17-03-2022","Karumbaiah","PPRAJ","2022-03-17"
"M1018","03-120-00 X-PRELOADING BRG SHAFT","M1018-03-120-00","1","","17-03-2022","Karumbaiah","PPRAJ","2022-03-17"
"M1018","01-040-00 CENTERING CUP-X-ROD","M1018-01-040-00","2","","15-03-2022","Karumbaiah","PPRAJ","2022-03-15"
"M1018","07-050-00 Y-Tension Rod-2","M1018-07-050-00","1","","12-03-2022","Karumbaiah","PPRAJ","2022-03-12"
"M1018","09-280-00 C-Wt SAFETY WIRE CRIMP","M1018-09-280-00","2","","17-03-2022","Karumbaiah","PPRAJ","2022-03-17"
"M1018","05-170-00 BRKT-2 - Z CABLE CARRIER","M1018-05-170-00","1","","17-03-2022","Karumbaiah","PPRAJ","2022-03-17"
"M1018","05-200-00 STUD-M16xY-TOP-BOT","M1018-05-200-00","4","","15-03-2022","Karumbaiah","PPRAJ","2022-03-15"
"M1018","09-160-00 C-Wt-FRAME","M1018-09-160-00","1","","18-03-2022","Karumbaiah","PPRAJ","2022-03-18"
"M1018","06-100-00 Z-MOTOR BRACKET","M1018-06-100-00","1","","17-03-2022","Karumbaiah","PPRAJ","2022-03-17"
"M1018","08-070-00 BEARING SPACER","M1018-08-070-00","1","","17-03-2022","Karumbaiah","PPRAJ","2022-03-17"
"M1018","03-090-00 SPACER-X MOT MTG BRKT","M1018-03-090-00","1","","17-03-2022","Karumbaiah","PPRAJ","2022-03-17"
"M1018","07-015-00 Y Al ARM-1200MM-1.9m","M1018-07-015-00","1","","12-03-2022","Karumbaiah","PPRAJ","2022-03-12"
"M1018","09-220-00 Z-CABLE CARRIER SUP PLATE","M1018-09-220-00","1","","17-03-2022","Karumbaiah","PPRAJ","2022-03-17"
"M1018","05-120-00 Y READER HEAD BRACKET-T1","M1018-05-120-00","1","","17-03-2022","Karumbaiah","PPRAJ","2022-03-17"
"M1018","02-130-00 X LIMIT SW BRKT","M1018-02-130-00","1","","15-03-2022","Karumbaiah","PPRAJ","2022-03-15"
"M1018","06-070-00 Z-PRELOADING BRG BLOCK","M1018-06-070-00","1","","17-03-2022","Karumbaiah","PPRAJ","2022-03-17"
"M1018","08-030-00 DRIVEN PULLEY-Y-Z AXIS-3M-147T","M1018-08-030-00","4","","17-03-2022","Karumbaiah","PPRAJ","2022-03-17"
"M1018","03-050-R1 X-TRANS-BRG HOUSING","M1018-03-050-R1","1","","17-03-2022","Karumbaiah","PPRAJ","2022-03-17"
"M1018","05-030-00 RING PIECE-RH","M1018-05-030-00","1","","12-03-2022","Karumbaiah","PPRAJ","2022-03-12"
"M1018","09-080-R2 LEAD-CWt","M1018-09-080-R2","1","","17-03-2022","Karumbaiah","PPRAJ","2022-03-17"
"M1018","05-070-00 C-Wt BOLT ANCHOR PIN","M1018-05-070-00","2","","17-03-2022","Karumbaiah","PPRAJ","2022-03-17"
"M1018","02-060-00 X-AXIS READER HEAD BRKT","M1018-02-060-00","1","","15-03-2022","Karumbaiah","PPRAJ","2022-03-15"
"M1018","06-040-00 Z-TRANSMISSION BASE PLATE","M1018-06-040-00","1","","17-03-2022","Karumbaiah","PPRAJ","2022-03-17"
"M1018","07-130-00 Al ROD- 6DIA","M1018-07-130-00","1","","17-03-2022","Karumbaiah","PPRAJ","2022-03-17"
"M1018","03-010-00 X-MOTOR HOUSING","M1018-03-010-00","1","","17-03-2022","Karumbaiah","PPRAJ","2022-03-17"
"M1018","02-010-00 CARRIAGE X AXIS R1","M1018-02-010-00","1","","12-03-2022","Karumbaiah","PPRAJ","2022-03-12"
"M1018","06-030-00 Y-Z-MOTOR PULLEY-3M-21T","M1018-06-030-00","6","","21-03-2022","Karumbaiah","PPRAJ","2022-03-21"
"M1018","09-040-R1 C-Wt PULLEY SHAFT","M1018-09-040-R1","2","","17-03-2022","Karumbaiah","PPRAJ","2022-03-17"
"M1018","04-170-00 WR CONTACT PLATE","M1018-04-170-00","1","","17-03-2022","Karumbaiah","PPRAJ","2022-03-17"
"M1018","02-030-00 STUD-M16x1.5-X-CAR","M1018-02-030-00","2","","15-03-2022","Karumbaiah","PPRAJ","2022-03-15"
"M1018","05-280-RDR Hd FLAT BRKT-RG22","M1018-05-280-00","1","","17-03-2022","Karumbaiah","PPRAJ","2022-03-17"
"M1018","01-200-R1 X-CABLE TRAY","M1018-01-200-R1","1","","23-06-2022","Karumbaiah","PPRAJ","2022-06-23"
"M1018","08-030-R1 Y-Z-DRIVEN PULLEY-PJ","M1018-08-030-R1","2","","20-06-2022","Karumbaiah","PPRAJ","2022-06-20"
"M1018","08-190-00 PRE LOADING ROLLER-Y-DRIVE","M1018-08-190-00","5","","17-03-2022","Karumbaiah","PPRAJ","2022-03-17"
"M1018","04-040-00 Base Plate-Z-Column","M1018-04-040-00","1","","17-03-2022","Karumbaiah","PPRAJ","2022-03-17"
"M1018","01-210-00 X-CABLE TRAY SUPPORT","M1018-01-210-00","2","","15-03-2022","Karumbaiah","PPRAJ","2022-03-15"
"M1018","09-340-00 CAVITY BLOCK-C-Wt","M1018-09-340-00","1","","12-03-2022","Karumbaiah","PPRAJ","2022-03-12"
"M1018","12-060-00 COVER-X-CAR-FRONT","M1018-12-060-00","1","","17-03-2022","Karumbaiah","PPRAJ","2022-03-17"
"M1018","05-230-00 SLACK ADJ BOLT-CWt","M1018-05-230-00","2","","17-03-2022","Karumbaiah","PPRAJ","2022-03-17"
"M1018","04-120-00 HEX-STUD-TOP COVER","M1018-04-120-00","33","","15-03-2022","Karumbaiah","PPRAJ","2022-03-15"
"M1018","03-020-R1 X-MOT PULLEY-6-PJ","M1018-03-020-R1","1","","20-06-2022","Karumbaiah","PPRAJ","2022-06-20"
"M1018","12-150-00 SADDLE COVER-LH","M1018-12-150-00","1","","12-04-2022","Karumbaiah","PPRAJ","2022-04-12"
"M1018","07-070-00 Y-ARM BACK COVER","M1018-07-070-00","1","","17-03-2022","Karumbaiah","PPRAJ","2022-03-17"
"M1018","01-050-00 COLUMN FOR X GRANITE","M1018-01-050-00","20","","12-03-2022","Karumbaiah","PPRAJ","2022-03-12"
"M1018","08-160-00 Y-PRELOADING BRG BLOCK","M1018-08-160-00","1","","17-03-2022","Karumbaiah","PPRAJ","2022-03-17"
"M1018","03-130-00 SPACER-X DRIVEN SHAFT","M1018-03-130-00","1","","17-03-2022","Karumbaiah","PPRAJ","2022-03-17"
"M1018","01-130-00 X-TRANSMISSION ROD","M1018-01-130-00","1","","15-03-2022","Karumbaiah","PPRAJ","2022-03-15"
"M1018","07-055-00 Y-Tension Rod-2","M1018-07-055-00","1","","12-03-2022","Karumbaiah","PPRAJ","2022-03-12"
"M1018","09-170-00 C-Wt FRAME COVER","M1018-09-170-00","1","","30-03-2022","Karumbaiah","PPRAJ","2022-03-30"
"M1018","09-290-00 C-Wt BOLT CROSS PIN-8DIA","M1018-09-290-00","1","","17-03-2022","Karumbaiah","PPRAJ","2022-03-17"
"M1018","05-180-00 BRKT-1 Z CABLE CARRIER","M1018-05-180-00","1","","17-03-2022","Karumbaiah","PPRAJ","2022-03-17"
"M1018","05-240-00 STUD-M16x1.0-SADDLE-LONG","M1018-05-240-00","8","","15-03-2022","Karumbaiah","PPRAJ","2022-03-15"
"M1018","06-120-00 Z-SPACER-OUTER","M1018-06-120-00","1","","17-03-2022","Karumbaiah","PPRAJ","2022-03-17"
"M1018","08-080-00 END CAP-Y AXIS BRG","M1018-08-080-00","1","","17-03-2022","Karumbaiah","PPRAJ","2022-03-17"
"M1018","03-100-00 X-PRELOADING BRG BLOCK","M1018-03-100-00","1","","17-03-2022","Karumbaiah","PPRAJ","2022-03-17"
"M1018","01-020-R1 ROD END HOUSING FRONT","M1018-01-020-R1","1","","15-03-2022","Karumbaiah","PPRAJ","2022-03-15"
"M1018","07-040-00 Y-Tension Rod-1","M1018-07-040-00","1","","12-03-2022","Karumbaiah","PPRAJ","2022-03-12"
"M1018","09-250-R1 CWt-ADD ON LEAD Wt","M1018-09-250-R1","3","","17-03-2022","Karumbaiah","PPRAJ","2022-03-17"
"M1018","05-140-00 Z READER HEAD MTG BRKT","M1018-05-140-00","1","","17-03-2022","Karumbaiah","PPRAJ","2022-03-17"
"M1018","02-140-00 LOCK NUT-M20x1_5","M1018-02-140-00","10","","15-03-2022","Karumbaiah","PPRAJ","2022-03-15"
"M1018","09-010-R1 BASE-CWt FRAME","M1018-09-010-R1","1","","18-03-2022","Karumbaiah","PPRAJ","2022-03-18"
"M1018","06-080-00 Z-PRELOADING BRG SHAFT","M1018-06-080-00","1","","17-03-2022","Karumbaiah","PPRAJ","2022-03-17"
"M1018","08-050-00 Y-DRIVE BEARING HOUSING","M1018-08-050-00","1","","17-03-2022","Karumbaiah","PPRAJ","2022-03-17"
"M1018","03-070-00 X-TRANSMISSION BASE PLATE","M1018-03-070-00","1","","17-03-2022","Karumbaiah","PPRAJ","2022-03-17"
"M1018","05-340-00 RING PIECE SPACER - RH","M1018-05-340-00","1","","12-03-2022","Karumbaiah","PPRAJ","2022-03-12"
"M1018","09-090-R2 C-Wt WIRE CRIMP","M1018-09-090-R2","2","","17-03-2022","Karumbaiah","PPRAJ","2022-03-17"
"M1018","05-080-00 C-Wt BOLT CROSS PIN","M1018-05-080-00","2","","17-03-2022","Karumbaiah","PPRAJ","2022-03-17"
"M1018","02-070-00 X-AXIS READER HEAD PLATE","M1018-02-070-00","1","","15-03-2022","Karumbaiah","PPRAJ","2022-03-15"
"M1018","05-120-R2 Y READER HEAD BRACKET-T1","M1018-05-120-R2","1","","19-07-2022","Karumbaiah","PPRAJ","2022-07-19"
"M1018","06-050-00 Z-DRIVE BEARING HOUSING","M1018-06-050-00","1","","17-03-2022","Karumbaiah","PPRAJ","2022-03-17"
"M1018","07-140-00 CLAMP-Y TRANS ROD","M1018-07-140-00","2","","17-03-2022","Karumbaiah","PPRAJ","2022-03-17"
"M1018","03-020-00 X-MOTOR PULLEY-3M-30T","M1018-03-020-00","3","","17-03-2022","Karumbaiah","PPRAJ","2022-03-17"
"M1018","05-010-R1 SADDLE-RIBBED","M1018-05-010-R1","1","","12-03-2022","Karumbaiah","PPRAJ","2022-03-12"
"M1018","09-050-R2 C-Wt PULLEY","M1018-09-050-R2","2","","17-03-2022","Karumbaiah","PPRAJ","2022-03-17"
"M1018","05-050-00 C-Wt WIRE BOLT","M1018-05-050-00","2","","17-03-2022","Karumbaiah","PPRAJ","2022-03-17"
"M1018","02-040-00 STUD-M20x1.5-X-CAR","M1018-02-040-00","3","","15-03-2022","Karumbaiah","PPRAJ","2022-03-15"
"M1018","05-320-00 C-Wt-SAFETY PLATE","M1018-05-320-00","1","","17-03-2022","Karumbaiah","PPRAJ","2022-03-17"
"M1018","01-220-R1 X-CABLE TRAY COVER","M1018-01-220-R1","1","","23-06-2022","Karumbaiah","PPRAJ","2022-06-23"
"M1018","08-210-00 Y-PRELOADING BOLT","M1018-08-210-00","4","","17-03-2022","Karumbaiah","PPRAJ","2022-03-17"
"M1018","04-050-00 Clamp-Z Trans Rod","M1018-04-050-00","2","","17-03-2022","Karumbaiah","PPRAJ","2022-03-17"
"M1018","01-240-00 MECH STOP PLATE","M1018-01-240-00","2","","15-03-2022","Karumbaiah","PPRAJ","2022-03-15"
"M1018","13-050-00 COLUMN-WORK TABLE","M1018-13-050-00","10","","12-03-2022","Karumbaiah","PPRAJ","2022-03-12"
"M1018","01-260-00 COLUMN FOR ZEISS 550","M1018-01-260-00","4","","30-03-2022","Karumbaiah","PPRAJ","2022-03-30"
"M1018","12-070-00 COVER-X-CAR-LEFT","M1018-12-070-00","1","","17-03-2022","Karumbaiah","PPRAJ","2022-03-17"
"M1018","05-260-00 Y LIMIT SW BRKT","M1018-05-260-00","2","","17-03-2022","Karumbaiah","PPRAJ","2022-03-17"
"M1018","11-010-R1 PNEUMATIC PANEL","M1018-11-010-R1","1","","15-03-2022","Karumbaiah","PPRAJ","2022-03-15"
"M1018","03-150-R1 X-DRIVEN PULLEY-6-PJ","M1018-03-150-R1","1","","20-06-2022","Karumbaiah","PPRAJ","2022-06-20"
"M1018","07-080-00 Y-ARM BACK PLATE","M1018-07-080-00","1","","17-03-2022","Karumbaiah","PPRAJ","2022-03-17"
"M1018","02-020-00 Mech-Stopper-Z","M1018-02-020-00","1","","17-03-2022","Karumbaiah","PPRAJ","2022-03-17"
"M1018","01-160-00 LEVELLING PAD","M1018-01-160-00","30","","12-03-2022","Karumbaiah","PPRAJ","2022-03-12"
"M1018","08-170-00 Y-PRELOADING BRG SHAFT","M1018-08-170-00","1","","17-03-2022","Karumbaiah","PPRAJ","2022-03-17"
"M1018","03-140-00 X-PRELOADING BOLT","M1018-03-140-00","2","","17-03-2022","Karumbaiah","PPRAJ","2022-03-17"
"M1018","01-180-00 WASHER-X-ROD","M1018-01-180-00","2","","15-03-2022","Karumbaiah","PPRAJ","2022-03-15"
"M1018","09-130-R1 C-Wt PIVOT BUSH","M1018-09-130-R1","2","","12-03-2022","Karumbaiah","PPRAJ","2022-03-12"
"M1018","09-190-00 COVER-TOP PLATE","M1018-09-190-00","1","","30-03-2022","Karumbaiah","PPRAJ","2022-03-30"
"M1018","09-300-00 C-Wt SAFETY WIRE HOOK","M1018-09-300-00","1","","17-03-2022","Karumbaiah","PPRAJ","2022-03-17"
"M1018","05-190-00 BRKT-Z LIMIT SWITCH","M1018-05-190-00","1","","17-03-2022","Karumbaiah","PPRAJ","2022-03-17"
"M1018","05-310-00 LOCK NUT-M16x1.0","M1018-05-310-00","35","","15-03-2022","Karumbaiah","PPRAJ","2022-03-15"
"M1018","06-130-00 Z-SPACER-INNER","M1018-06-130-00","1","","17-03-2022","Karumbaiah","PPRAJ","2022-03-17"
"M1018","08-110-00 Y-MOTOR BRACKET","M1018-08-110-00","1","","17-03-2022","Karumbaiah","PPRAJ","2022-03-17"
"M1018","03-110-00 X-DRIVEN SHAFT","M1018-03-110-00","1","","17-03-2022","Karumbaiah","PPRAJ","2022-03-17"
"M1018","01-030-R1 ROD END HOUSING-Rear","M1018-01-030-R1","1","","15-03-2022","Karumbaiah","PPRAJ","2022-03-15"
"M1018","07-045-00 Y-Tension Rod-1","M1018-07-045-00","1","","12-03-2022","Karumbaiah","PPRAJ","2022-03-12"
"M1018","09-270-R1 SAFETY WIRE BOLT-C-Wt","M1018-09-270-R1","1","","17-03-2022","Karumbaiah","PPRAJ","2022-03-17"
"M1018","05-150-00 Z READER HEAD IM BRKT","M1018-05-150-00","1","","17-03-2022","Karumbaiah","PPRAJ","2022-03-17"
"M1018","05-040-00 STUD-M16x1.0-SADDLE","M1018-05-040-00","12","","15-03-2022","Karumbaiah","PPRAJ","2022-03-15"
"M1018","09-020-R2 TOP PLATE-C-Wt FRAME","M1018-09-020-R2","1","","18-03-2022","Karumbaiah","PPRAJ","2022-03-18"
"M1018","06-090-00 SPACER-Z PRELOAD SHAFT","M1018-06-090-00","1","","17-03-2022","Karumbaiah","PPRAJ","2022-03-17"
"M1018","08-060-00 SPACER-Y DRIVEN SHAFT","M1018-08-060-00","1","","17-03-2022","Karumbaiah","PPRAJ","2022-03-17"
"M1018","03-080-00 SPACER PLATE -X TRANSMISSION","M1018-03-080-00","1","","17-03-2022","Karumbaiah","PPRAJ","2022-03-17"
"M1018","07-010-00 Y Al ARM-1000MM-1.7m","M1018-07-010-00","1","","12-03-2022","Karumbaiah","PPRAJ","2022-03-12"
"M1018","15-010-00-COUPLER","M1018-15-010-00","1","","18-06-2022","Amar","PPRAJ","2022-06-18"
"M1018","09-210-00 Z-CABLE CARRIER CLAMP","M1018-09-210-00","1","","17-03-2022","Karumbaiah","PPRAJ","2022-03-17"
"M1018","05-110-00 RDR HD L-BRKT- RG22","M1018-05-110-00","1","","17-03-2022","Karumbaiah","PPRAJ","2022-03-17"
"M1018","02-090-00 X-CABLE CARRIER BRKT-MOVING","M1018-02-090-00","1","","15-03-2022","Karumbaiah","PPRAJ","2022-03-15"
"M1018","06-060-00 Z-DRIVEN SHAFT","M1018-06-060-00","1","","17-03-2022","Karumbaiah","PPRAJ","2022-03-17"
"M1018","08-020-R2 Y-Transmission Base Plate","M1018-08-020-R2","1","","17-03-2022","Karumbaiah","PPRAJ","2022-03-17"
"M1018","03-030-00 X-MOTOR MTG BRKT","M1018-03-030-00","1","","17-03-2022","Karumbaiah","PPRAJ","2022-03-17"
"M1018","05-020-00 RING PIECE-LH","M1018-05-020-00","1","","12-03-2022","Karumbaiah","PPRAJ","2022-03-12"
"M1018","09-060-R1 C-Wt PULLEY BRACKET","M1018-09-060-R1","2","","17-03-2022","Karumbaiah","PPRAJ","2022-03-17"
"M1018","05-060-00 C-Wt WIRE CRIMP ON SADDLE-Saddle","M1018-05-060-00","2","","17-03-2022","Karumbaiah","PPRAJ","2022-03-17"
"M1018","02-050-00 STUD-M20x1.5-X-CAR-SIDE","M1018-02-050-00","4","","15-03-2022","Karumbaiah","PPRAJ","2022-03-15"
"M1018","10-300-00 AIR BRG LOCKING PIN","M1018-10-300-00","1","","12-04-2022","Karumbaiah","PPRAJ","2022-04-12"
"M1018","05-330-00 SAFETY WIRE CRIMP","M1018-05-330-00","1","","17-03-2022","Karumbaiah","PPRAJ","2022-03-17"
"M1018","02-090-R1 X-CABLE CARRIER BRKT-MOVING","M1018-02-090-R1","1","","23-06-2022","Karumbaiah","PPRAJ","2022-06-23"
"M1018","07-090-00 Y-ARM FRONT PLATE","M1018-07-090-00","1","","17-03-2022","Karumbaiah","PPRAJ","2022-03-17"
"M1018","02-080-00 Z-MECH. STOP PLATE","M1018-02-080-00","1","","17-03-2022","Karumbaiah","PPRAJ","2022-03-17"
"M1018","01-170-00 LEVELLING STUD","M1018-01-170-00","30","","12-03-2022","Karumbaiah","PPRAJ","2022-03-12"
"M1018","09-030-00 WASHER-CWt PULLEY SHAFT","M1018-09-030-00","2","","17-03-2022","Karumbaiah","PPRAJ","2022-03-17"
"M1018","04-060-R2 TOP PLATE-Z COLUMN","M1018-04-060-R2","1","","17-03-2022","Karumbaiah","PPRAJ","2022-03-17"
"M1018","01-250-00 X-MECH STOP-ROD-FRONT","M1018-01-250-00","1","","15-03-2022","Karumbaiah","PPRAJ","2022-03-15"
"M1018","01-270-00-LEVELING PAD","M1018-01-270-00","1","","30-03-2022","Karumbaiah","PPRAJ","2022-03-30"
"M1018","12-080-00 COVER-X-CAR-REAR","M1018-12-080-00","1","","17-03-2022","Karumbaiah","PPRAJ","2022-03-17"
"M1018","05-270-00 PROX TARGET PLATE","M1018-05-270-00","25","","17-03-2022","Karumbaiah","PPRAJ","2022-03-17"
"M1018","06-030-R1 Y-Z MOT PULLEY-PJ","M1018-06-030-R1","2","","20-06-2022","Karumbaiah","PPRAJ","2022-06-20"
"M1036","BM-648636-GRINDING ARBOR FOR QUENCH PLUGS","M1036-BM-648636","1","","11-05-2022","Amar","PPRAJ","2022-05-11"
"M1036","AM-962168-WASHER FOR QUENCH PLUG GRINDING ARBOR","M1036-AM-962168","7","","11-05-2022","Amar","PPRAJ","2022-05-11"
"M1036","AM-962169-NUT FOR QUENCH PLUG GRINDING ARBOR","M1036-AM-962169","1","","11-05-2022","Amar","PPRAJ","2022-05-11"
"M1037","06-120-00-PUSHER PLATE","M1037-06-120-00","9","","16-05-2022","Karumbaiah","PPRAJ","2022-05-16"
"M1037","06-260-00-PUSHER LEVER-CM 271628","M1037-06-260-00","12","","16-05-2022","Karumbaiah","PPRAJ","2022-05-16"
"M1037","06-160-00-SPRING PLATE-BM 276641","M1037-06-160-00","21","","16-05-2022","Karumbaiah","PPRAJ","2022-05-16"
"M1037","06-130-00-WEAR PLATE-AM 918634","M1037-06-130-00","24","","16-05-2022","Karumbaiah","PPRAJ","2022-05-16"
"M1037","06-240-00-GUIDE PLATE FOR STONE 8MM","M1037-06-240-00","5","","16-05-2022","Karumbaiah","PPRAJ","2022-05-16"
"M1037","06-140-00-FRONT PLATE-CM 271617","M1037-06-140-00","21","","16-05-2022","Karumbaiah","PPRAJ","2022-05-16"
"M1037","06-110-00-GUIDE PLATE FOR STONE 12MM","M1037-06-110-00","3","","16-05-2022","Karumbaiah","PPRAJ","2022-05-16"
"M1037","06-250-00-PUSHER PLATE 8MM","M1037-06-250-00","12","","16-05-2022","Karumbaiah","PPRAJ","2022-05-16"
"M1037","06-150-00-PUSHER LEVER-CM 271628","M1037-06-150-00","9","","16-05-2022","Karumbaiah","PPRAJ","2022-05-16"
"M1053","06-140-00-FRONT PLATE-CM 271617","M1053-06-140-00","18","","28-06-2022","Karumbaiah","PPRAJ","2022-06-28"
"M1053","06-110-00-GUIDE PLATE FOR STONE 12MM","M1053-06-110-00","6","","28-06-2022","Karumbaiah","PPRAJ","2022-06-28"
"M1053","06-200-00-CLEVIS MOUNT BRACKET AM 563035","M1053-06-200-00","36","","18-06-2022","Karumbaiah","PPRAJ","2022-06-18"
"M1053","06-060-00-SUPPORT CYLINDER MOUNTING BKT- BM 383124","M1053-06-060-00","6","","18-06-2022","Karumbaiah","PPRAJ","2022-06-18"
"M1053","06-150-00-PUSHER LEVER-CM 271628","M1053-06-150-00","18","","28-06-2022","Karumbaiah","PPRAJ","2022-06-28"
"M1053","06-030-00-GIB BM 499509","M1053-06-030-00","2","","18-06-2022","Karumbaiah","PPRAJ","2022-06-18"
"M1053","06-120-00-PUSHER PLATE","M1053-06-120-00","18","","28-06-2022","Karumbaiah","PPRAJ","2022-06-28"
"M1053","06-070-00-CLAMPING BRKT-AM 867986","M1053-06-070-00","4","","18-06-2022","Karumbaiah","PPRAJ","2022-06-18"
"M1053","06-160-00-SPRING PLATE-BM 276641","M1053-06-160-00","10","","28-06-2022","Karumbaiah","PPRAJ","2022-06-28"
"M1053","06-040-00-BASE SLIDE MOUNT - EM374650","M1053-06-040-00","2","","18-06-2022","Karumbaiah","PPRAJ","2022-06-18"
"M1053","06-130-00-WEAR PLATE-AM 918634","M1053-06-130-00","18","","28-06-2022","Karumbaiah","PPRAJ","2022-06-28"
"M1053","06-090-00-PIVOT DOWEL PIN","M1053-06-090-00","18","","18-06-2022","Karumbaiah","PPRAJ","2022-06-18"
"M1053","06-050-00-SLIDE MOUNTING PLATE-EM 373612","M1053-06-050-00","2","","18-06-2022","Karumbaiah","PPRAJ","2022-06-18"
"M1061","01-190-00 FOLLOWER ARM TENSION SPRING","M1061-01-190-00","1","","23-07-2022","Amar","PPRAJ","2022-07-23"
"M1061","21-690-00 CURTAIN SPRING","M1061-21-690-00","1","","23-07-2022","Amar","PPRAJ","2022-07-23"
"M1061","01-130-R1 SPRING PLUG AM-74948","M1061-01-130-R1","2","","23-07-2022","Amar","PPRAJ","2022-07-23"
"M1061","01-140-00 SPRING PLUG RING","M1061-01-140-00","2","","23-07-2022","Amar","PPRAJ","2022-07-23"
"M819","07-150-R1- ADJUSTABLE PLATE RH RL","M819-07-150-R1","1","","05-04-2022","Amar","PPRAJ","2022-04-05"
"M819","07-420-00-LM BUSH MTG PLATE RL & LR","M819-07-420-00","8","","05-04-2022","Amar","PPRAJ","2022-04-05"
"M820","10-200-R1- ADJUSTABLE PLATE  LH LR","M820-10-200-R1","1","","05-04-2022","Amar","PPRAJ","2022-04-05"
"M892","05-070-00 TRFM MTG INNER BKT","M892-05-070-00","16","","07-10-2021","Karumbaiah","PPRAJ","2021-10-07"
"M892","01-110-00 HONE HEAD GUARD","M892-01-110-00","1","","24-08-2021","Karumbaiah","PPRAJ","2021-08-24"
"M892","01-080-00 EXIT CONVEYOR OIL GUARD","M892-01-080-00","1","","24-08-2021","Karumbaiah","PPRAJ","2021-08-24"
"M892","01-120-00 EXIT INTERMIDIATE OIL TRAY","M892-01-120-00","1","","24-08-2021","Karumbaiah","PPRAJ","2021-08-24"
"M892","01-090-00 MOTOR OIL COVER PLATE","M892-01-090-00","1","","24-08-2021","Karumbaiah","PPRAJ","2021-08-24"
"M892","01-100-00 EXIT FLIPPER OIL TRAY","M892-01-100-00","1","","24-08-2021","Karumbaiah","PPRAJ","2021-08-24"
"M923","18-900-00-REJECT CHUTE SENSOR MTG BRKT","M923-18-900-00","2","","21-12-2021","SACHIN","Chandru","2021-12-21"
"M923","17-440-00-ECCENTRIC BUSH-902","M923-17-440-00","5","","30-08-2021","SACHIN","Chandru","2021-08-30"
"M923","17-450-00-ECCENTRIC BUSH-H127702","M923-17-450-00","4","","03-09-2021","SACHIN","Chandru","2021-09-03"
"M923","18-910-00-REJECT CHUTE SENSOR MTG BRKT-2","M923-18-910-00","2","","21-12-2021","SACHIN","Chandru","2021-12-21"
"M923","03-040-R1-DRIVE ROLL.","M923-03-040-R1","2","","17-06-2022","Amar","PPRAJ","2022-06-17"
"M923","17-460-00-ECCENTRIC BUSH-HM133401","M923-17-460-00","4","","03-09-2021","SACHIN","Chandru","2021-09-03"
"M926","02-130-R1 Y PULLEY DRIVEN 6 PJ Ø95","M926-02-130-R1","1","","23-09-2021","Karumbaiah","PPRAJ","2021-09-23"
"M933","01-420-00 INSPECTION LIGHT OUTER BKT","M933-01-420-00","1","","19-08-2021","Karumbaiah","PPRAJ","2021-08-19"
"M933","07-390-00  GRADUATION SCALE","M933-07-390-00","1","","15-12-2021","Karumbaiah","PPRAJ","2021-12-15"
"M933","01-430-00 INSPECTION LIGHT INNER BKT","M933-01-430-00","1","","19-08-2021","Karumbaiah","PPRAJ","2021-08-19"
"M933","07-400-00 POINTER","M933-07-400-00","1","","15-12-2021","Karumbaiah","PPRAJ","2021-12-15"
"M933","08-240-00-STONE CENTERING GAUGE HOLDER","M933-08-240-00","1","","23-08-2021","Amar","PPRAJ","2021-08-23"
"M933","01-440-00 LIGHT HOLDER","M933-01-440-00","1","","19-08-2021","Karumbaiah","PPRAJ","2021-08-19"
"M933","08-250-00-CENTERING GAUGE PIN","M933-08-250-00","1","","23-08-2021","Amar","PPRAJ","2021-08-23"
"M946","01-210-00 PROBE HOLDER","M946-01-210-00","1","","26-08-2021","Karumbaiah","PPRAJ","2021-08-26"
"M946","01-220-00 INTERMEDIATE BLOCK","M946-01-220-00","1","","26-08-2021","Karumbaiah","PPRAJ","2021-08-26"
"M963","CM-311459","M963-CM-311459","1","","01-09-2021","Amar","PPRAJ","2021-09-01"
"M976","01-160-00 MOTOR BRACKET","M976-01-160-00","1","","24-11-2021","Karumbaiah","PPRAJ","2021-11-24"
"M976","01-110-00 HEIGHT STAND CONE","M976-01-110-00","6","","13-09-2021","Karumbaiah","PPRAJ","2021-09-14"
"M976","01-190-00 BEARING LOCKNUT","M976-01-190-00","5","","02-12-2021","Karumbaiah","PPRAJ","2021-12-02"
"M976","01-080-00 POINTER 15DIA","M976-01-080-00","1","","13-09-2021","Karumbaiah","PPRAJ","2021-09-14"
"M976","01-050-00 SPRING RETURNMICRO CENTER 3","M976-01-050-00","1","","13-09-2021","Karumbaiah","PPRAJ","2021-09-14"
"M976","01-180-00 MOTOR BRACKET 2","M976-01-180-00","2","","30-11-2021","Karumbaiah","PPRAJ","2021-11-30"
"M976","01-130-00 SCREW 4X10","M976-01-130-00","12","","19-10-2021","Karumbaiah","PPRAJ","2021-10-19"
"M976","01-210-00 RUBBER BLOCK CONNCT","M976-01-210-00","1","","15-04-2022","Karumbaiah","PPRAJ","2022-04-15"
"M976","01-010-00 BASE 1","M976-01-010-00","1","","11-10-2021","Karumbaiah","PPRAJ","2021-10-11"
"M976","01-120-00 HEIGHT STAND","M976-01-120-00","6","","13-09-2021","Karumbaiah","PPRAJ","2021-09-14"
"M976","01-200-00 END STOPPER","M976-01-200-00","2","","02-12-2021","Karumbaiah","PPRAJ","2021-12-02"
"M976","01-090-00 POINTER 50DIA","M976-01-090-00","2","","13-09-2021","Karumbaiah","PPRAJ","2021-09-14"
"M976","01-060-00 MICRO CENTER 3 SPRING RETURN CAP","M976-01-060-00","2","","13-09-2021","Karumbaiah","PPRAJ","2021-09-14"
"M976","01-030-00 MICRO CENTER 1","M976-01-030-00","1","","13-09-2021","Karumbaiah","PPRAJ","2021-09-14"
"M976","01-140-00 SCREW 4X16","M976-01-140-00","12","","19-10-2021","Karumbaiah","PPRAJ","2021-10-19"
"M976","01-100-00 RETURN SPRING","M976-01-100-00","2","","13-09-2021","Karumbaiah","PPRAJ","2021-09-14"
"M976","01-070-00 POINTER 60DIA SPRING RETURN","M976-01-070-00","1","","13-09-2021","Karumbaiah","PPRAJ","2021-09-14"
"M976","01-040-00 FIXED END MICRO CENTER 2","M976-01-040-00","1","","13-09-2021","Karumbaiah","PPRAJ","2021-09-14"
"M976","01-150-00 SCREW 4X12","M976-01-150-00","12","","19-10-2021","Karumbaiah","PPRAJ","2021-10-19"
"M976","01-170-00-LEVELING PAD","M976-01-170-00-LEVELING PAD","3","","29-11-2021","Karumbaiah","PPRAJ","2021-11-29"
"M982","07-170-00 EJECTOR ROD COLLAR","M982-07-170-00","2","","01-09-2021","Pavithra","PPRAJ","2021-09-01"
"M982","03-260-R1-LOCKING SCREW AM-38681","M982-03-260-R1","8","","01-09-2021","Pavithra","PPRAJ","2021-09-01"
"M982","10-170-00-FIXED PLATE","M982-10-170-00","1","","02-11-2021","Karumbaiah","PPRAJ","2021-11-02"
"M982","02-400-00-STONE LENGTH GUAGE","M982-02-400-00","2","","07-03-2022","Pavithra","PPRAJ","2022-03-07"
"M982","03-370-00-VERTICAL SCREW COUPLER","M982-03-370-00","2","","17-09-2021","Amar","PPRAJ","2021-09-17"
"M982","04-130-00-GUIDE PLATE-RH","M982-04-130-00","2","","01-09-2021","Pavithra","PPRAJ","2021-09-01"
"M982","01-080-00-DRIVE ROLL MOTOR BELT TAKE UP BRKT","M982-01-080-00","2","","01-09-2021","Pavithra","PPRAJ","2021-09-01"
"M982","06-170-00 GUIDE BLOCK","M982-06-170-00","2","","02-11-2021","Amar","PPRAJ","2021-11-02"
"M982","07-260-00-SENSOR MTG BUSH PART DETECT","M982-07-260-00","0","","30-04-2022","Amar","PPRAJ","2022-04-30"
"M982","02-160-00-HONE HEAD HOUSING PLATE","M982-02-160-00","4","","15-09-2021","Pavithra","PPRAJ","2021-09-15"
"M982","05-130-00-SPRING RETAINER","M982-05-130-00","2","","01-09-2021","Pavithra","PPRAJ","2021-09-01"
"M982","03-080-00- HOR ADJ BRACKET","M982-03-080-00","2","","01-09-2021","Pavithra","PPRAJ","2021-09-01"
"M982","02-420-00-HON HD RPM SENSOR MTG PLT","M982-02-420-00","6","","09-12-2021","Amar","PPRAJ","2021-12-09"
"M982","06-390-00-RIGHT TACK SUPPORT STRIP","M982-06-390-00","1","","02-11-2021","Amar","PPRAJ","2021-11-02"
"M982","04-105-00-LEAD SCREW ADAPTER","M982-04-105-00","4","","11-11-2021","Amar","PPRAJ","2021-11-11"
"M982","10-040-00 INLET CJHUTE BOTTOM PLATE","M982-10-040-00","1","","02-11-2021","Karumbaiah","PPRAJ","2021-11-02"
"M982","04-090-00- DRIVE ROLL ADJ SCREW","M982-04-090-00","4","","01-09-2021","Pavithra","PPRAJ","2021-09-01"
"M982","01-050-00-GUIDE STRIP A FRAME","M982-01-050-00","2","","01-09-2021","Pavithra","PPRAJ","2021-09-01"
"M982","06-120-00 LEFT TRACK","M982-06-120-00","1","","02-11-2021","Amar","PPRAJ","2021-11-02"
"M982","02-410-00-HON HD HOLDER PLATE","M982-02-410-00","2","","30-04-2022","Amar","PPRAJ","2022-04-30"
"M982","02-100-00-HONE HEAD HOUSING","M982-02-100-00","4","","15-09-2021","Pavithra","PPRAJ","2021-09-15"
"M982","05-100-00-HSG ADJ BLOCK","M982-05-100-00","2","","01-09-2021","Pavithra","PPRAJ","2021-09-01"
"M982","03-050-00-HONING HEAD SWIVEL BASE-TOP","M982-03-050-00","2","","01-09-2021","Pavithra","PPRAJ","2021-09-01"
"M982","07-250-00-SENSOR MTG BRKT","M982-07-250-00","26","","06-12-2021","Amar","PPRAJ","2021-12-06"
"M982","06-340-00 DISC BUSH","M982-06-340-00","2","","02-11-2021","Amar","PPRAJ","2021-11-02"
"M982","02-320-00 STONE HOLDER-2(L=6.35-25.4mm)","M982-02-320-00","4","","15-09-2021","Pavithra","PPRAJ","2021-09-15"
"M982","07-130-00 EJECTOR ROD CLEVIS","M982-07-130-00","2","","01-09-2021","Pavithra","PPRAJ","2021-09-01"
"M982","03-230-00-CLAMPING BUSH ENERPAC M8-HON HD","M982-03-230-00","4","","01-09-2021","Pavithra","PPRAJ","2021-09-01"
"M982","10-010-00 BASE FRAME","M982-10-010-00","1","","02-11-2021","Karumbaiah","PPRAJ","2021-11-02"
"M982","04-060-00-REAR END CAP","M982-04-060-00","4","","01-09-2021","Pavithra","PPRAJ","2021-09-01"
"M982","01-010-00-BASE FRAME CONE-FAB","M982-01-010-00","2","","01-09-2021","Pavithra","PPRAJ","2021-09-01"
"M982","02-150-00-HON HD CLOSURE INNER AM-62115","M982-02-150-00","4","","22-11-2021","Amar","PPRAJ","2021-11-22"
"M982","10-530-00 FIXED EXIT CHUTE RARE BKT","M982-10-530-00","1","","02-11-2021","Karumbaiah","PPRAJ","2021-11-02"
"M982","06-060-00 CHUTE LEFT BRKT-1","M982-06-060-00","2","","02-11-2021","Amar","PPRAJ","2021-11-02"
"M982","02-070-00- ECC BLOCK","M982-02-070-00","2","","14-09-2021","Pavithra","PPRAJ","2021-09-15"
"M982","05-070-R1-GUIDE STRIP","M982-05-070-R1","6","","01-09-2021","Pavithra","PPRAJ","2021-09-01"
"M982","03-020-00-SLIDE MTG BASE PLATE","M982-03-020-00","2","","01-09-2021","Pavithra","PPRAJ","2021-09-01"
"M982","01-190-00-MOTOR CLAMP MTG BASE CONE","M982-01-190-00","2","","29-01-2022","Amar","PPRAJ","2022-01-29"
"M982","06-290-00 PNEU CYL BRACKET","M982-06-290-00","2","","02-11-2021","Amar","PPRAJ","2021-11-02"
"M982","02-260-00-HOUSING FRONT CAP","M982-02-260-00","1","","15-09-2021","Pavithra","PPRAJ","2021-09-15"
"M982","07-090-00 CONE EJECTOR-PART-2","M982-07-090-00","1","","01-09-2021","Pavithra","PPRAJ","2021-09-01"
"M982","03-200-00-MOTOR MTG BRKT","M982-03-200-00","2","","01-09-2021","Pavithra","PPRAJ","2021-09-01"
"M982","01-210-00 DOOR LOCK BRACKET","M982-01-210-00","2","","24-03-2022","Karumbaiah","PPRAJ","2022-03-24"
"M982","04-010-00-A FRAME WITH KEY","M982-04-010-00","2","","01-09-2021","Pavithra","PPRAJ","2021-09-01"
"M982","10-430-R1-DELRIN PAD INLET LIFT STN L-R","M982-10-430-R1","1","","02-11-2021","Karumbaiah","PPRAJ","2021-11-02"
"M982","06-020-00 CHUTE FRONT-LEFT","M982-06-020-00","1","","02-11-2021","Amar","PPRAJ","2021-11-02"
"M982","02-190-R1 POINTER & REED CALMPING PLATE -LR","M982-02-190-R1","3","","14-03-2022","Karumbaiah","PPRAJ","2022-03-14"
"M982","02-040-00-HOUSING COVER-1","M982-02-040-00","1","","14-09-2021","Pavithra","PPRAJ","2021-09-15"
"M982","05-040-00-FRONT END CAP","M982-05-040-00","2","","01-09-2021","Pavithra","PPRAJ","2021-09-01"
"M982","01-160-00-TRUNNION MTG BRKT","M982-01-160-00","2","","01-09-2021","Pavithra","PPRAJ","2021-09-01"
"M982","06-260-R1-CHUTE BACKING PLATE 2 OF 2","M982-06-260-R1","2","","02-11-2021","Amar","PPRAJ","2021-11-02"
"M982","10-535-00-LIFT STN OIL TRAY LR","M982-10-535-00","1","","05-04-2022","Amar","PPRAJ","2022-04-05"
"M982","02-230-00 TEE PLATE BM-358258","M982-02-230-00","4","","15-09-2021","Pavithra","PPRAJ","2021-09-15"
"M982","07-030-00 EJECTOR SHAFT","M982-07-030-00","2","","01-09-2021","Pavithra","PPRAJ","2021-09-01"
"M982","03-150-00-ADJ SCREW MOVING BLOCK","M982-03-150-00","2","","01-09-2021","Pavithra","PPRAJ","2021-09-01"
"M982","08-210-00-CENTERING GAUGE PIN","M982-08-210-00","4","","09-12-2021","Amar","PPRAJ","2021-12-09"
"M982","09-010-00 CONE SUPPORT BRACKET","M982-09-010-00","2","","01-09-2021","Pavithra","PPRAJ","2021-09-01"
"M982","03-320-00-BEARING HSG MOTOR MTG","M982-03-320-00","2","","01-09-2021","Pavithra","PPRAJ","2021-09-01"
"M982","10-260-00 LIFT SIDE FIXED BRKT","M982-10-260-00","1","","02-11-2021","Karumbaiah","PPRAJ","2021-11-02"
"M982","03-190-R1- MOTOR BRKT PLATE","M982-03-190-R1","1","","02-11-2021","Amar","PPRAJ","2021-11-02"
"M982","05-140-R1-PLUNGER","M982-05-140-R1","2","","13-04-2022","Amar","PPRAJ","2022-04-13"
"M982","02-010-00  HON HD HOUSING (CYL HSG)","M982-02-010-00","1","","14-09-2021","Pavithra","PPRAJ","2021-09-15"
"M982","04-250-00-DRIVE ROLL SHAFT SPACER","M982-04-250-00","8","","01-09-2021","Pavithra","PPRAJ","2021-09-01"
"M982","01-120-00-DRIVE ROLL MOT PULLEY 5M-57 T","M982-01-120-00","2","","01-09-2021","Pavithra","PPRAJ","2021-09-01"
"M982","03-015-00-M5025 x 600 SLIDE","M982-03-015-00","4","","09-11-2021","Amar","PPRAJ","2021-11-09"
"M982","06-230-00 BOLT ROD EYE","M982-06-230-00","2","","02-11-2021","Amar","PPRAJ","2021-11-02"
"M982","02-200-00 POINTER-2","M982-02-200-00","2","","15-09-2021","Pavithra","PPRAJ","2021-09-15"
"M982","05-170-00-SPINDLE SHAFT SPACER","M982-05-170-00","2","","01-09-2021","Pavithra","PPRAJ","2021-09-01"
"M982","03-120-00-CONN BLOCK VERT CYL","M982-03-120-00","2","","01-09-2021","Pavithra","PPRAJ","2021-09-01"
"M982","01-176-00-ITV VALVE MTG BRKT","M982-01-176-00-","5","","09-12-2021","Amar","PPRAJ","2021-12-09"
"M982","07-190-00 EJECTOR SLEEVE","M982-07-190-00","2","","01-09-2021","Pavithra","PPRAJ","2021-09-01"
"M982","03-280-00-SHOCK ABSORBER MTG BLOCK TOP","M982-03-280-00","2","","01-09-2021","Pavithra","PPRAJ","2021-09-01"
"M982","04-040-00-DRIVE ROLL SPINDLE","M982-04-040-00","4","","11-02-2022","Karumbaiah","PPRAJ","2022-02-11"
"M982","10-200-R1- ADJUSTABLE PLATE RHLR","M982-10-200-R1","2","","02-11-2021","Karumbaiah","PPRAJ","2021-11-02"
"M982","04-140-00-GUIDE PLATE-LH","M982-04-140-00","2","","01-09-2021","Pavithra","PPRAJ","2021-09-01"
"M982","01-090-00-ROD BUSH MOTOR BRKT","M982-01-090-00","8","","01-09-2021","Pavithra","PPRAJ","2021-09-01"
"M982","06-180-00 BACKWARD CONE STOP","M982-06-180-00","2","","02-11-2021","Amar","PPRAJ","2021-11-02"
"M982","02-170-00- REED CLAMPING PLATE AM-62120","M982-02-170-00","4","","15-09-2021","Pavithra","PPRAJ","2021-09-15"
"M982","05-140-00-PLUNGER","M982-05-140-00","2","","01-09-2021","Pavithra","PPRAJ","2021-09-01"
"M982","03-090-00-VERT CYL MTG PLATE","M982-03-090-00","2","","01-09-2021","Pavithra","PPRAJ","2021-09-01"
"M982","02-430-00-RPM SENSING PLATE","M982-02-430-00","2","","09-12-2021","Amar","PPRAJ","2021-12-09"
"M982","06-400-00 CHUTE FILLER PLATE Ø114","M982-06-400-00","1","","02-11-2021","Amar","PPRAJ","2021-11-02"
"M982","10-050-00 INLET CHUTE BACK","M982-10-050-00","1","","02-11-2021","Karumbaiah","PPRAJ","2021-11-02"
"M982","03-350-00-VERT PILLER ADJ SCREW MTG BLOCK","M982-03-350-00","2","","17-09-2021","Amar","PPRAJ","2021-09-17"
"M982","04-100-00-DRV ROLL ADJ SCREW BRKT","M982-04-100-00","4","","01-09-2021","Pavithra","PPRAJ","2021-09-01"
"M982","01-060-00-DRIVE ROLL MOT SUPPORT ROD","M982-01-060-00","2","","01-09-2021","Pavithra","PPRAJ","2021-09-01"
"M982","06-140-00 ADJ ARM RIGHT-2","M982-06-140-00","4","","02-11-2021","Amar","PPRAJ","2021-11-02"
"M982","02-110-00-HON HEAD HSG SPACER","M982-02-110-00","4","","15-09-2021","Pavithra","PPRAJ","2021-09-15"
"M982","05-110-00-SPINDLE HSG ADJ SCREW","M982-05-110-00","2","","01-09-2021","Pavithra","PPRAJ","2021-09-01"
"M982","03-060-00-SCREW ADJUSTER BLOCK","M982-03-060-00","2","","01-09-2021","Pavithra","PPRAJ","2021-09-01"
"M982","02-330-00 WOODRUFF KEY","M982-02-330-00","4","","10-11-2021","Amar","PPRAJ","2021-11-10"
"M982","06-350-00 DISC BUSH","M982-06-350-00","2","","02-11-2021","Amar","PPRAJ","2021-11-02"
"M982","02-380-00-ANGLE GAUGE FIXING BRKT","M982-02-380-00","2","","15-09-2021","Pavithra","PPRAJ","2021-09-15"
"M982","07-140-00 EJECTOR ROD GUIDE BLOCK","M982-07-140-00","1","","01-09-2021","Pavithra","PPRAJ","2021-09-01"
"M982","03-240-00-ANGLE ADJ PIN","M982-03-240-00","2","","01-09-2021","Pavithra","PPRAJ","2021-09-01"
"M982","10-020-00 BASE PLATE","M982-10-020-00","1","","02-11-2021","Karumbaiah","PPRAJ","2021-11-02"
"M982","04-070-00-DRIVE ROLL PULLEY-SPINDLE","M982-04-070-00","4","","01-09-2021","Pavithra","PPRAJ","2021-09-01"
"M982","01-020-00-TOP BASE PLATE - CONE","M982-01-020-00","2","","01-09-2021","Pavithra","PPRAJ","2021-09-01"
"M982","06-190 -00 PACKMAN BRACKET-1","M982-06-190 -00","1","","06-11-2021","Amar","PPRAJ","2021-11-06"
"M982","10-540-00 DELRIN BOT SUPPORT STRIP L-R","M982-10-540-00","1","","02-11-2021","Karumbaiah","PPRAJ","2021-11-02"
"M982","06-090-00 CHUTE RIGHT BRKT-2","M982-06-090-00","2","","02-11-2021","Amar","PPRAJ","2021-11-02"
"M982","02-080-00- BUSH-HON HEAD SHAFT","M982-02-080-00","2","","15-09-2021","Pavithra","PPRAJ","2021-09-15"
"M982","05-080-00-CLAMPING PIN","M982-05-080-00","2","","01-09-2021","Pavithra","PPRAJ","2021-09-01"
"M982","03-030-00-HOR SLIDE MTG BASE PLATE","M982-03-030-00","2","","01-09-2021","Pavithra","PPRAJ","2021-09-01"
"M982","07-230-00-SENSOR PLATE MTGPLATE","M982-07-230-00","2","","06-12-2021","Amar","PPRAJ","2021-12-06"
"M982","06-310-00 PROXIMITY MTG PLATE","M982-06-310-00","2","","02-11-2021","Amar","PPRAJ","2021-11-02"
"M982","02-270-00-HONE HEAD REED PLATE","M982-02-270-00","4","","15-09-2021","Pavithra","PPRAJ","2021-09-15"
"M982","07-110-00 EJECTOR","M982-07-110-00","1","","01-09-2021","Pavithra","PPRAJ","2021-09-01"
"M982","03-210-00-HON HD MOTOR PULLEY","M982-03-210-00","4","","01-09-2021","Pavithra","PPRAJ","2021-09-01"
"M982","04-020-00-DRIVE ROLL HSG","M982-04-020-00","4","","01-09-2021","Pavithra","PPRAJ","2021-09-01"
"M982","02-120-00  ECCENTRIC SHAFT BM-101033 & CM-148934","M982-02-120-00","2","","22-11-2021","Amar","PPRAJ","2021-11-22"
"M982","10-450-00-INLET ADJ CHUTE SPT DELRIN BKT","M982-10-450-00","1","","02-11-2021","Karumbaiah","PPRAJ","2021-11-02"
"M982","06-030-00 CHUTE FRONT-RIGHT","M982-06-030-00","1","","02-11-2021","Amar","PPRAJ","2021-11-02"
"M982","02-050-00-HOUSING COVER 2","M982-02-050-00","1","","14-09-2021","Pavithra","PPRAJ","2021-09-15"
"M982","05-050-00-REAR END CAP","M982-05-050-00","2","","01-09-2021","Pavithra","PPRAJ","2021-09-01"
"M982","01-170-00-BELT TEN HAND LEVER MTG PLATE","M982-01-170-00","4","","01-09-2021","Pavithra","PPRAJ","2021-09-01"
"M982","06-270-00 GUIDE BLOCK-PACKMAN","M982-06-270-00","2","","02-11-2021","Amar","PPRAJ","2021-11-02"
"M982","02-240-00-CYL BASE CM150415","M982-02-240-00","2","","15-09-2021","Pavithra","PPRAJ","2021-09-15"
"M982","07-040-00 EJECTOR ARM","M982-07-040-00","1","","01-09-2021","Pavithra","PPRAJ","2021-09-01"
"M982","03-160-00-VERT SLIDE MTG BLOCK","M982-03-160-00","2","","01-09-2021","Pavithra","PPRAJ","2021-09-01"
"M982","12-010-00 HYDRAULIC UNIT STAND","M982-12-010-00","2","","01-09-2021","Pavithra","PPRAJ","2021-09-01"
"M982","03-330-00- MOTOR SHAFT SLEEVE","M982-03-330-00","4","","01-09-2021","Pavithra","PPRAJ","2021-09-01"
"M982","10-270-00 ADJUSTABLE BRKT-1","M982-10-270-00","1","","02-11-2021","Karumbaiah","PPRAJ","2021-11-02"
"M982","03-380-00-MOT PLT STOP BRKT BM-358044","M982-03-380-00","1","","02-11-2021","Amar","PPRAJ","2021-11-02"
"M982","02-020-00 HON HD HOUSING (ECC SHAFT HSG)","M982-02-020-00","1","","14-09-2021","Pavithra","PPRAJ","2021-09-15"
"M982","05-010-R1-BACK SUPPORT SPINDLE HSG","M982-05-010-R1","2","","01-09-2021","Pavithra","PPRAJ","2021-09-01"
"M982","01-130-00-PULLEY LOCKING SPIGOT","M982-01-130-00","2","","01-09-2021","Pavithra","PPRAJ","2021-09-01"
"M982","03-016-00-V5025-305-V-EG-SL-SP WITH TURCITE","M982-03-016-00","4","","09-11-2021","Amar","PPRAJ","2021-11-09"
"M982","06-240-00 BOLT-CYL MOUNT","M982-06-240-00","2","","02-11-2021","Amar","PPRAJ","2021-11-02"
"M982","02-210-00 STONE HOLDER-3(L=25.4-50.8mm)EM-263639","M982-02-210-00","4","","15-09-2021","Pavithra","PPRAJ","2021-09-15"
"M982","07-010-00 TILT EJECTOR ARM BRKT","M982-07-010-00","2","","01-09-2021","Pavithra","PPRAJ","2021-09-01"
"M982","03-130-00-SCREW MTG BLOCK","M982-03-130-00","2","","01-09-2021","Pavithra","PPRAJ","2021-09-01"
"M982","07-210-00-UNIVERSAL JOINT FIXING BRKT","M982-07-210-00","2","","01-09-2021","Pavithra","PPRAJ","2021-09-01"
"M982","03-290-00- SLIDE  BLOCK MTG PLATE","M982-03-290-00","2","","01-09-2021","Pavithra","PPRAJ","2021-09-01"
"M982","10-210-00 INLET CHUTE BAC-2","M982-10-210-00","1","","02-11-2021","Karumbaiah","PPRAJ","2021-11-02"
"M982","04-220-00-SENSOR PLATE SPACER","M982-04-220-00","4","","01-09-2021","Pavithra","PPRAJ","2021-09-01"
"M982","01-100-00-MOTOR MTG BRKT","M982-01-100-00","2","","01-09-2021","Pavithra","PPRAJ","2021-09-01"
"M982","08-120-R1-DRIVE ROLL (FOR NP635070)","M982-08-120-R1","2","","28-01-2022","Amar","PPRAJ","2022-01-28"
"M982","06-200-00 PACKMAN DISC","M982-06-200-00","2","","02-11-2021","Amar","PPRAJ","2021-11-02"
"M982","02-180-00 ECC BLOCK TAPER JIB","M982-02-180-00","4","","15-09-2021","Pavithra","PPRAJ","2021-09-15"
"M982","05-150-00-ADJ SCREW MTG  BLOCK","M982-05-150-00","2","","01-09-2021","Pavithra","PPRAJ","2021-09-01"
"M982","03-100-00-VERT CYL COUPLER","M982-03-100-00","2","","01-09-2021","Pavithra","PPRAJ","2021-09-01"
"M982","10-060-00 INLET CHUTE FRONT","M982-10-060-00","1","","02-11-2021","Karumbaiah","PPRAJ","2021-11-02"
"M982","01-200-00-MANIFOLD DRIVE ROLL","M982-01-200-00","2","","07-03-2022","Pavithra","PPRAJ","2022-03-07"
"M982","03-360-00-VERT PILLER ADJ SCREW","M982-03-360-00","2","","17-09-2021","Amar","PPRAJ","2021-09-17"
"M982","04-110-00- KEY A FRAME","M982-04-110-00","12","","01-09-2021","Pavithra","PPRAJ","2021-09-01"
"M982","01-070-00-BUSH-HINGE ROD","M982-01-070-00","4","","01-09-2021","Pavithra","PPRAJ","2021-09-01"
"M982","06-150-00- RIGHT TRACK-1","M982-06-150-00","1","","02-11-2021","Amar","PPRAJ","2021-11-02"
"M982","07-240-R1-SENSOR MTG PLATE","M982-07-240-R1","0","","30-04-2022","Amar","PPRAJ","2022-04-30"
"M982","02-130-00-HON HD SHAFT PULLEY","M982-02-130-00","4","","15-09-2021","Pavithra","PPRAJ","2021-09-15"
"M982","05-120-00-RETAINER PIN","M982-05-120-00","2","","01-09-2021","Pavithra","PPRAJ","2021-09-01"
"M982","03-070-00- HON HD ADJ SCREW","M982-03-070-00","2","","01-09-2021","Pavithra","PPRAJ","2021-09-01"
"M982","03-270-00  GRADUATION SCALE","M982-03-270-00","1","","10-11-2021","Amar","PPRAJ","2021-11-10"
"M982","06-360-R1 CONE CHUTE FIXING BRKT-HOR","M982-06-360-R1","1","","02-11-2021","Amar","PPRAJ","2021-11-02"
"M982","02-390-00-ANGLE ADJUSTING KNOB","M982-02-390-00","4","","15-09-2021","Pavithra","PPRAJ","2021-09-15"
"M982","07-150-00 EJECTOR ROD GUIDE BLOCK PIN","M982-07-150-00","6","","01-09-2021","Pavithra","PPRAJ","2021-09-01"
"M982","03-250-00-PULLEY LOCKING SPIGOT HON HD","M982-03-250-00","4","","01-09-2021","Pavithra","PPRAJ","2021-09-01"
"M982","10-030-00 CHUTE MTG PLATE","M982-10-030-00","1","","02-11-2021","Karumbaiah","PPRAJ","2021-11-02"
"M982","07-216-00-SPACER FOR EJE LIFTER","M982-07-216-00","2","","21-03-2022","Amar","PPRAJ","2022-03-21"
"M982","04-080-00-DRIVE ROLL HSG KEY","M982-04-080-00","6","","01-09-2021","Pavithra","PPRAJ","2021-09-01"
"M982","01-040-00-GUIDE STRIP VERT PILLER","M982-01-040-00","2","","01-09-2021","Pavithra","PPRAJ","2021-09-01"
"M982","11-080-R1-HYD MANIFOLD-MAIN DISTRIBUTOR","M982-11-080-R1","2","","23-11-2021","Amar","PPRAJ","2021-11-23"
"M982","06-300-R1 STOPPER","M982-06-300-R1","8","","06-11-2021","Amar","PPRAJ","2021-11-06"
"M982","06-110-00 ADJUSTING ARM LEFT-2","M982-06-110-00","4","","02-11-2021","Amar","PPRAJ","2021-11-02"
"M982","01-220-00-MACHINE MTG PAD","M982-01-220-00","16","","29-04-2022","Karumbaiah","PPRAJ","2022-04-29"
"M982","02-090-00-GIB PARALLEL","M982-02-090-00","4","","15-09-2021","Pavithra","PPRAJ","2021-09-15"
"M982","05-090-00-CLAMPING BUSH","M982-05-090-00","2","","01-09-2021","Pavithra","PPRAJ","2021-09-01"
"M982","03-040-00-HONING HEAD SWIVEL BASE PLATE","M982-03-040-00","2","","01-09-2021","Pavithra","PPRAJ","2021-09-01"
"M982","07-240-00-SENSOR MTG PLATE","M982-07-240-00","2","","06-12-2021","Amar","PPRAJ","2021-12-06"
"M982","06-320-00 BACK CHUTE BRACKET","M982-06-320-00","1","","02-11-2021","Amar","PPRAJ","2021-11-02"
"M982","02-280-00- REED MOUNTING PLATE-2 AM-62114","M982-02-280-00","2","","15-09-2021","Pavithra","PPRAJ","2021-09-15"
"M982","07-120-00- EJECTOR ROD CLEVIS BRACKET","M982-07-120-00","1","","01-09-2021","Pavithra","PPRAJ","2021-09-01"
"M982","03-220-00-CLAMPING  BUSH ENERPAC M8","M982-03-220-00","8","","01-09-2021","Pavithra","PPRAJ","2021-09-01"
"M982","02-031-00-STONE HOLDER SHAFT FIXTURE","M982-02-031-00","1","","10-12-2021","Amar","PPRAJ","2021-12-10"
"M982","04-050-00- FRONT END CAP","M982-04-050-00","4","","01-09-2021","Pavithra","PPRAJ","2021-09-01"
"M982","02-140-00-HON HD CLOSURE AM-62125","M982-02-140-00","4","","22-11-2021","Amar","PPRAJ","2021-11-22"
"M982","10-520-00 FIXED EXIT CHUTE FRONT R-L","M982-10-520-00","1","","02-11-2021","Karumbaiah","PPRAJ","2021-11-02"
"M982","07-180-R1 EJECTOR ROD COLLAR SCREW","M982-07-180-R1","3","","02-11-2021","Amar","PPRAJ","2021-11-02"
"M982","06-040-00 HOLDER-CHUTE LEFT","M982-06-040-00","8","","02-11-2021","Amar","PPRAJ","2021-11-02"
"M982","02-060-00-ECCENTRIC BLOCK GIB SCREW","M982-02-060-00","2","","14-09-2021","Pavithra","PPRAJ","2021-09-15"
"M982","05-060-R1-ENERPAC MTG BLOCK","M982-05-060-R1","2","","01-09-2021","Pavithra","PPRAJ","2021-09-01"
"M982","03-010-00-HON HEAD COLUMN-CONE","M982-03-010-00","1","","01-09-2021","Pavithra","PPRAJ","2021-09-01"
"M982","03-295-00-SQUARE BUSH Ø16","M982-03-295-00","2","","02-02-2022","Amar","PPRAJ","2022-02-02"
"M982","06-280-R1-CHUTE BACKING PLATE","M982-06-280-R1","2","","02-11-2021","Amar","PPRAJ","2021-11-02"
"M982","08-100-00 DRIVE ROLL (FOR M88048)","M982-08-100-00","2","","15-03-2022","Amar","PPRAJ","2022-03-15"
"M982","02-250-00- ADVU 50 CYLINDER ADAPTOR","M982-02-250-00","4","","15-09-2021","Pavithra","PPRAJ","2021-09-15"
"M982","07-080-00 CONE EJECTOR","M982-07-080-00","1","","01-09-2021","Pavithra","PPRAJ","2021-09-01"
"M982","03-240-R1-ANGLE ADJ PIN","M982-03-240-R1","4","","16-02-2022","Karumbaiah","PPRAJ","2022-02-16"
"M982","03-180-00- MOT PLATE HINGE PIN","M982-03-180-00","4","","01-09-2021","Pavithra","PPRAJ","2021-09-01"
"M982","03-340-00-BRG SPACER INNER RING","M982-03-340-00","4","","01-09-2021","Pavithra","PPRAJ","2021-09-01"
"M982","10-280-00 ADJUSTABLE BRKT","M982-10-280-00","1","","02-11-2021","Karumbaiah","PPRAJ","2021-11-02"
"M982","06-010-R1- BACK CHUTE","M982-06-010-R1","1","","02-11-2021","Amar","PPRAJ","2021-11-02"
"M982","10-015-00-LIFT CYL MTG PILLER LH  LR","M982-10-015-00","2","","29-03-2022","Amar","PPRAJ","2022-03-29"
"M982","02-030-R1-STONE HOLDER SHAFT","M982-02-030-R1","4","","14-09-2021","Pavithra","PPRAJ","2021-09-15"
"M982","05-020-00 BACK-UP SPINDLE SHAFT","M982-05-020-00","1","","01-09-2021","Pavithra","PPRAJ","2021-09-01"
"M982","01-140-00-GUIDE ROD WASHER","M982-01-140-00","4","","01-09-2021","Pavithra","PPRAJ","2021-09-01"
"M982","06-250-00 BOLT-DISC MOUNT","M982-06-250-00","2","","02-11-2021","Amar","PPRAJ","2021-11-02"
"M982","02-220-00 STONE HOLDER PLATE BM-361957","M982-02-220-00","4","","15-09-2021","Pavithra","PPRAJ","2021-09-15"
"M982","07-020-00 EJECTOR HSG END CAP","M982-07-020-00","4","","01-09-2021","Pavithra","PPRAJ","2021-09-01"
"M982","03-140-00- VERTICAL ADJ SCREW","M982-03-140-00","2","","01-09-2021","Pavithra","PPRAJ","2021-09-01"
"M982","08-200-R1-STONE CENTERING GAUGE HOLDER","M982-08-200-R1","2","","09-12-2021","Amar","PPRAJ","2021-12-09"
"M982","07-220-00-BUTTON FOR EJECTOR ARM","M982-07-220-00","4","","01-09-2021","Pavithra","PPRAJ","2021-09-01"
"M982","03-310-00- LOCK NUT M36x1_5","M982-03-310-00","10","","01-09-2021","Pavithra","PPRAJ","2021-09-01"
"M982","10-250-00 MACHINE SIDE FIXED BRKT","M982-10-250-00","1","","02-11-2021","Karumbaiah","PPRAJ","2021-11-02"
"M982","03-170-R1- MOTOR MTG BASE PLATE","M982-03-170-R1","1","","02-11-2021","Amar","PPRAJ","2021-11-02"
"M982","01-225-00-CONE SHADOW BOARD","M982-01-225-00","2","","03-05-2022","Amar","PPRAJ","2022-05-03"
"M982","04-230-00-DRIVE ROLL RPM SENSOR BRKT","M982-04-230-00","14","","01-09-2021","Pavithra","PPRAJ","2021-09-01"
"M982","01-110-00-MOTOR BRKT GUIDE STRIP","M982-01-110-00","2","","01-09-2021","Pavithra","PPRAJ","2021-09-01"
"M982","06-210-00 CHUTE BACKING PLATE 1 OF 2","M982-06-210-00","1","","02-11-2021","Amar","PPRAJ","2021-11-02"
"M982","02-190-00 POINTER & REED CALMPING PLATE","M982-02-190-00","10","","15-09-2021","Pavithra","PPRAJ","2021-09-15"
"M982","05-160-00 SPRING BACKUP SPINDLE","M982-05-160-00","4","","01-09-2021","Pavithra","PPRAJ","2021-09-01"
"M982","03-110-00-CONNECTING PLATE-COUPLER","M982-03-110-00","2","","01-09-2021","Pavithra","PPRAJ","2021-09-01"
"M982","01-175-00-DIGI PR SWITCH MTG BRKT","M982-01-175-00","5","","09-12-2021","Amar","PPRAJ","2021-12-09"
"M983","10-280-00-ADJUSTABLE BRKT","M983-10-280-00","1","","02-11-2021","Karumbaiah","PPRAJ","2021-11-02"
"M983","13-050-00- DRIVE ROLL CONTER PLATE","M983-13-050-00","1","","02-03-2022","Karumbaiah","PPRAJ","2022-03-02"
"M983","10-330-R1-SS BLOCK","M983-10-330-R1","2","","30-03-2022","Karumbaiah","PPRAJ","2022-03-30"
"M983","03-270-00  GRADUATION SCALE LH","M983-03-270-00","1","","10-11-2021","Amar","PPRAJ","2021-11-10"
"M983","06-150-R1 RIGHT TRACK-1-RL","M983-06-150-R1","1","","02-11-2021","Amar","PPRAJ","2021-11-02"
"M983","10-250-00-MACHINE SIDE FIXED BRKT","M983-10-250-00","1","","02-11-2021","Karumbaiah","PPRAJ","2021-11-02"
"M983","02-340-00- CYL BASE CM150415","M983-02-340-00","2","","16-09-2021","Pavithra","PPRAJ","2021-09-16"
"M983","06-060-00 CHUTE LEFT BRKT-1 -RL","M983-06-060-00","2","","02-11-2021","Amar","PPRAJ","2021-11-02"
"M983","10-200-R1- ADJUSTABLE PLATE RH","M983-10-200-R1","2","","02-11-2021","Karumbaiah","PPRAJ","2021-11-02"
"M983","02-310-00-REED CLAMP MTG BAR","M983-02-310-00","1","","16-09-2021","Pavithra","PPRAJ","2021-09-16"
"M983","06-010-R1- BACK CHUTE -RL","M983-06-010-R1","1","","02-11-2021","Amar","PPRAJ","2021-11-02"
"M983","06-365-00 CONE CHUTE FIXING BRKT-HOR","M983-06-365-00","1","","02-11-2021","Amar","PPRAJ","2021-11-02"
"M983","10-060-R1-INLET CHUTE ADJUSTABLE CHUTE","M983-10-060-R1","1","","02-11-2021","Karumbaiah","PPRAJ","2021-11-02"
"M983","02-260-00  HON HD HOUSING (CYL HSG)","M983-02-260-00","1","","16-09-2021","Pavithra","PPRAJ","2021-09-16"
"M983","07-040-00 EJECTOR ARM-RL","M983-07-040-00","1","","02-09-2021","Amar","PPRAJ","2021-09-02"
"M983","10-530-00 FIXED EXIT CHUTE RARE BKT","M983-10-530-00","1","","02-11-2021","Karumbaiah","PPRAJ","2021-11-02"
"M983","10-025-00-LIFT CYL MTG PILLER RH  RL","M983-10-025-00","2","","29-03-2022","Amar","PPRAJ","2022-03-29"
"M983","03-170-R1- MOTOR MTG BASE PLATE -LH","M983-03-170-R1","1","","02-11-2021","Amar","PPRAJ","2021-11-02"
"M983","10-460-00-DELRIN PAD ADJ MTG PLATE","M983-10-460-00","4","","02-11-2021","Karumbaiah","PPRAJ","2021-11-02"
"M983","06-280-R1- CHUTE BACKING PLATE-RL","M983-06-280-R1","2","","02-11-2021","Amar","PPRAJ","2021-11-02"
"M983","10-030-00-INLET CHUTE MTG BRKT","M983-10-030-00","1","","02-11-2021","Karumbaiah","PPRAJ","2021-11-02"
"M983","10-300-00-EXIT BASE PLATE","M983-10-300-00","2","","02-11-2021","Karumbaiah","PPRAJ","2021-11-02"
"M983","13-060-00- DRIVE ROLL CONTER PLATE -1","M983-13-060-00","1","","02-03-2022","Karumbaiah","PPRAJ","2022-03-02"
"M983","06-190 -00 PACKMAN BRACKET-1-RL","M983-06-190-00","1","","02-11-2021","Amar","PPRAJ","2021-11-02"
"M983","10-260-00-LIFT SIDE FIXED BRKT","M983-10-260-00","1","","02-11-2021","Karumbaiah","PPRAJ","2021-11-02"
"M983","07-230-00-SENSOR PLATE MTGPLATE","M983-07-230-00","1","","02-03-2022","Karumbaiah","PPRAJ","2022-03-02"
"M983","02-325-00-HON HD HOLDER PLATE","M983-02-325-00","2","","30-04-2022","Amar","PPRAJ","2022-04-30"
"M983","06-090-00 CHUTE RIGHT BRKT-2-RL","M983-06-090-00","2","","02-11-2021","Amar","PPRAJ","2021-11-02"
"M983","10-210-00-INLET CHUTE-2","M983-10-210-00","1","","02-11-2021","Karumbaiah","PPRAJ","2021-11-02"
"M983","02-320-00-HONE HEAD REED PLATE","M983-02-320-00","2","","16-09-2021","Pavithra","PPRAJ","2021-09-16"
"M983","06-020-00 CHUTE FRONT-LEFT -RL","M983-06-020-00","1","","02-11-2021","Amar","PPRAJ","2021-11-02"
"M983","06-370-00 CONE CHUTE FIXING BRKT VERT-RL","M983-06-370-00","1","","02-11-2021","Amar","PPRAJ","2021-11-02"
"M983","10-070-00 LIFT CYL MTG BRKT","M983-10-070-00","4","","02-11-2021","Karumbaiah","PPRAJ","2021-11-02"
"M983","07-170-00 EJECTOR ROD COLLAR  LH","M983-07-170-00","1","","24-03-2022","Amar","PPRAJ","2022-03-24"
"M983","02-270-00 HON HD HOUSING (ECC SHAFT HSG)","M983-02-270-00","1","","16-09-2021","Pavithra","PPRAJ","2021-09-16"
"M983","07-090-00 CONE EJECTOR-PART-2-RL","M983-07-090-00","1","","02-09-2021","Amar","PPRAJ","2021-09-02"
"M983","10-540-00 DELRIN BOT SUPPORT STRIP","M983-10-540-00","2","","02-11-2021","Karumbaiah","PPRAJ","2021-11-02"
"M983","03-190-R1- MOTOR BRKT PLATE-LH","M983-03-190-R1","1","","02-11-2021","Amar","PPRAJ","2021-11-02"
"M983","10-545-00-LIFT STN OIL TRAY RL","M983-10-545-00","1","","05-04-2022","Amar","PPRAJ","2022-04-05"
"M983","10-470-00- RIGHT TRACK-1 -R-L","M983-10-470-00","1","","02-11-2021","Karumbaiah","PPRAJ","2021-11-02"
"M983","06-320-00 BACK CHUTE BRACKET-RL","M983-06-320-00","1","","02-11-2021","Amar","PPRAJ","2021-11-02"
"M983","10-040-00-INLET CHUTE BOTTOM","M983-10-040-00","1","","02-11-2021","Karumbaiah","PPRAJ","2021-11-02"
"M983","10-330-00-SS BLOCK","M983-10-330-00","1","","02-11-2021","Karumbaiah","PPRAJ","2021-11-02"
"M983","06-210-00 CHUTE BACKING PLATE 1 OF 2 -RL","M983-06-210-00","1","","02-11-2021","Amar","PPRAJ","2021-11-02"
"M983","10-010-00-BASE FRAME","M983-10-010-00","1","","02-11-2021","Karumbaiah","PPRAJ","2021-11-02"
"M983","10-270-00-ADJUSTABLE BRKT-1","M983-10-270-00","1","","02-11-2021","Karumbaiah","PPRAJ","2021-11-02"
"M983","13-030-00-JACKING STOPPER","M893-13-030-00","3","","02-03-2022","Karumbaiah","PPRAJ","2022-03-02"
"M983","06-120-R1- LEFT TRACK-RL","M983-06-120-R1","2","","02-11-2021","Amar","PPRAJ","2021-11-02"
"M983","10-220-00-FLIP SHEET","M983-10-220-00","2","","02-11-2021","Karumbaiah","PPRAJ","2021-11-02"
"M983","02-330-00-HOUSING FRONT CAP","M983-02-330-00","1","","16-09-2021","Pavithra","PPRAJ","2021-09-16"
"M983","06-030-00 CHUTE FRONT-RIGHT-RL","M983-06-030-00","1","","02-11-2021","Amar","PPRAJ","2021-11-02"
"M983","06-390-00-RIGHT TACK SUPPORT STRIP-RL","M983-06-390-00","1","","02-11-2021","Amar","PPRAJ","2021-11-02"
"M983","10-170-00-FIXWD SHEET","M983-10-170-00","1","","02-11-2021","Karumbaiah","PPRAJ","2021-11-02"
"M983","02-300-00-HOUSING COVER-1","M983-02-300-00","1","","16-09-2021","Pavithra","PPRAJ","2021-09-16"
"M983","07-110-00 EJECTOR-RL","M983-07-110-00","1","","02-09-2021","Amar","PPRAJ","2021-09-02"
"M983","03-380-00-MOT PLT STOP BRKT-LH","M983-03-380-00","1","","02-11-2021","Amar","PPRAJ","2021-11-02"
"M983","06-360-00 CHUTE BACKING PLATE Ø114 -RL","M983-06-360-00","1","","02-11-2021","Amar","PPRAJ","2021-11-02"
"M983","10-050-00-INLET CHUT BACK CHUTE","M983-10-050-00","1","","02-11-2021","Karumbaiah","PPRAJ","2021-11-02"
"M983","03-010-00-HON HEAD COLUMN LH","M983-03-010-00","1","","02-09-2021","Amar","PPRAJ","2021-09-02"
"M983","10-520-00 FIXED EXIT CHUTE FRONT","M983-10-520-00","1","","02-11-2021","Karumbaiah","PPRAJ","2021-11-02"
"M983","02-190-R1 POINTER & REED CALMPING PLATE -R1","M983-02-190-R1","4","","18-02-2022","Karumbaiah","PPRAJ","2022-02-18"
"M983","10-450-00-INLET ADJ CHUTE SPT DELRIN BKT","M983-10-450-00","2","","02-11-2021","Karumbaiah","PPRAJ","2021-11-02"
"M983","06-260-R1-CHUTE BACKING PLATE 2 OF 2 -RL","M983-06-260-R1","2","","02-11-2021","Amar","PPRAJ","2021-11-02"
"M983","10-020-00-LIFT STATION BASE PLATE","M983-10-020-00","1","","02-11-2021","Karumbaiah","PPRAJ","2021-11-02"
"M984","04-520-00-STOP WHEEL BRG HSG","M984-04-520-00","2","","15-02-2022","Karumbaiah","PPRAJ","2022-02-15"
"M984","07-540-00-GUIDE ROD LOCKING BRKT LHLR","M984-07-540-00","4","","02-11-2021","Karumbaiah","PPRAJ","2021-11-02"
"M984","04-020-00 EXIT CHUTE BACK-1","M984-04-020-00","1","","02-11-2021","Amar","PPRAJ","2021-11-02"
"M984","07-030-00 INLET CHUTE FIXING  BRKT","M984-07-030-00","1","","02-11-2021","Karumbaiah","PPRAJ","2021-11-02"
"M984","07-250-00-INLET PART FLIP SHEET","M984-07-250-00","2","","02-11-2021","Karumbaiah","PPRAJ","2021-11-02"
"M984","07-510-00-GUIDE ROD ADJ PLATELR","M984-07-510-00","48","","02-11-2021","Karumbaiah","PPRAJ","2021-11-02"
"M984","04-410-00- EJECTOR MID RANGE PART SIZE RH","M984-04-410-00","1","","02-11-2021","Amar","PPRAJ","2021-11-02"
"M984","07-220-00 DEMAG FIXED PLATE","M984-07-220-00","2","","02-11-2021","Karumbaiah","PPRAJ","2021-11-02"
"M984","04-180-00 VER ADJ BLOCK BM-92847","M984-04-180-00","1","","15-02-2022","Karumbaiah","PPRAJ","2022-02-15"
"M984","06-150-00- BRACKET FIXING PLATE LH","M984-06-150-00","1","","31-08-2021","Amar","PPRAJ","2021-08-31"
"M984","07-430-00-DELRIN PAD","M984-07-430-00","1","","02-11-2021","Karumbaiah","PPRAJ","2021-11-02"
"M984","04-330-R1 OUTLET CHUTE BOTTOM","M984-04-330-R1","1","","02-11-2021","Amar","PPRAJ","2021-11-02"
"M984","07-190-00 DEMAG FRONT CHUTE","M984-07-190-00","1","","02-11-2021","Karumbaiah","PPRAJ","2021-11-02"
"M984","07-400-00-SENSOR MTG PLATE LIFT STNLR","M984-07-400-00","4","","02-11-2021","Karumbaiah","PPRAJ","2021-11-02"
"M984","07-570-00 LIFT STATION OIL TRAY","M984-07-570-00","1","","20-12-2021","Karumbaiah","PPRAJ","2021-12-20"
"M984","04-240-00-EJECTOR LARGE PART-RH","M984-04-240-00","1","","02-11-2021","Amar","PPRAJ","2021-11-02"
